评论者主页,评论者昵称,评论者性别,评论者所在地,评论者微博数,评论者关注数,评论者粉丝数,评论内容,评论获赞数,评论发布时间
https://weibo.cn//u/2738508907,F素面朝天,女,浙江,2,211,170,温州比湖北一些地级市还要多，但是好像关注点都在湖北，温州的附一附二缺物资好几天了..不知道有没有好转，希望社会各界多给温州一些关注..,22,2020-01-29 09:57
https://weibo.cn//u/7039569694,乖乖妮豆,女,江苏,18,93,3,相信祖国一定会渡过难关！！,4,2020-01-29 09:35
https://weibo.cn//u/2049776750,一个大妍妍呀,女,其他,195,20,342,武汉真是好样的,1,2020-01-29 08:55
https://weibo.cn//u/2829976742,不知道柠檬草的味道,女,湖北,27,451,205,武汉周边的小城市增长很快，医疗有限，例如孝感，望上级重视起来！,3,2020-01-29 08:41
https://weibo.cn//u/2169518317,音乐阳光天涯,男,上海,535,691,143,赶紧把病毒疫情控制住，赶紧让患者有病床安心看病。赶紧把市民老百姓需要的口罩酒精等，以及生活物资准备充足，不要涨价。 请多做有实际作用的事。,3,2020-01-29 06:50
https://weibo.cn//u/3889965721,巴卫199553,女,其他,35,49,43,[玫瑰][玫瑰][玫瑰]赣医一附院接受社会爱心捐赠，期待爱心人士与我院院办胡主任联系。         “赣医一附院人”正以“立德立行  仁心仁术”的历史使命和责任担当筑起抗击疫情的钢铁长城！！！赣州也16例了，看看赣州吧,3,2020-01-29 03:53
