链接,标题,播放数量,弹幕数量,发布日期,点赞数量,硬币数量,收藏数量,转发数量,评论数量
2,80楼日杂洗白  不用看了,,,,,,,,
2,这标题要严肃点，不要用轮番好吗,,,,,,,,
2,历史的教训是人弱被人欺，国弱被群欺,,,,,,,,
2,放心 2040年怎么都会打的╮(￣▽￣)╭,,,,,,,,
2,84楼的，你口里说着民主，但拉黑我，不让我发言？,,,,,,,,
2,什么电影名称,,,,,,,,
2,彼此玩文字狱。。。—.—,,,,,,,,
2,以后长大了去当兵。好好保护我们的祖国,,,,,,,,
2,勿忘国耻,,,,,,,,
2,五月八月？,,,,,,,,
2,标题可以是中国人都可以来看看，这样柔和,,,,,,,,
2,抗日片还放天空之城，感觉就像愤青一样,,,,,,,,
2,那只狗狗真是忠犬，唉,,,,,,,,
2,那个小男孩挺帅的，看着…有点儿眼熟。是不是有个电视剧叫《格格要出嫁》，里面的小皇帝挺像那个小男孩的……(但是，我估计应该可能不是吧。年岁好像不太对？),,,,,,,,
2,五月八月小时候电影院看的 当时看完吓死了庆幸自己没生在那个年代,,,,,,,,
2,看着是真难过,,,,,,,,
2,可恶啊,,,,,,,,
2,刚刚♂,,,,,,,,
2,一直不敢看这种啊,,,,,,,,
2,我们应该警惕的，不只是小鬼子，还有那些狗汉奸，无论敌人还是民族败类再敢兴风作浪都得枪毙,,,,,,,,
2,不是仇日 是本来就讨厌日本鬼子。,,,,,,,,
2,个人认为，历史我们务必要铭记在心。但是还抱有扭曲的仇视心态甚至种族灭绝思想就大可不必了，我们能做到的，就是时刻保持警惕，勿忘国耻，凭当下我们的军事实力能单手捏死日本，这就是对先烈最大的安慰，过去我们被侵略，现在我们掌握着压倒性的优势，这就够了,,,,,,,,
10,弹幕里的日杂赶紧回去杀父母，不然对不起你的大和魂,,,,,,,,
4,这标题是让我最烦的,,,,,,,,
3,仇什么日啊让日本鬼子再过来三光一波随便杀随便拿仇日干咩啊《滑稽》,,,,,,,,
3,这标题真像百度下面的推荐骗流量的,,,,,,,,
7,我只是想看看，你们会不会拿键盘去打日本人。,,,,,,,,
7,此刻我不禁推了推我的眼镜，擦去眼前的迷雾，默默地把b站缓存下来的日本动漫一个一个都删除掉。。。。妈的手机空间又爆满了。～(￣▽￣～),,,,,,,,
8,好气，想杀个日本人解解气,,,,,,,,
1,反动蒋介石政府误国害民,,,,,,,,
1,其实blibili评论区要比腾讯的评论区好得多。,,,,,,,,
1,逃避耻辱的人都是懦夫,,,,,,,,
1,196楼的，有本事把隐私设置关了呀，我跟你好好谈谈人生好不好，中国人讲究以礼待人，但对于你这种闲的胃疼的人，我陪你好好聊聊天,,,,,,,,
1,女孩子都是双马尾？,,,,,,,,
1,196楼那个货你可以啊 @仇家太多了不好透漏 屏蔽骂完屏蔽我  够huang协军的,,,,,,,,
1,196楼的辣 ji  骂人屏蔽很符合你sz的性格╮(￣▽￣)╭,,,,,,,,
1,勿忘历史,,,,,,,,
1,忘不了的这是刻在骨头血液里的……,,,,,,,,
1,冲这个视频关注了,,,,,,,,
1,不是，虽然我也蛮喜欢天空之城的，但是放这里不合适吧。,,,,,,,,
1,中日历史上共有五次战争，除了元朝东渡企图灭亡日本外，那次不是日本先打过来的？谁有本事让日本人放弃丰臣秀吉制定的以朝鲜为跳板，入侵东北，进而蚕食中国的战略国策？它们已经实施过一次了，而且还加了一条琉球台湾这条海上侵略线，这次战争就是侵华战争，也就是我们进行的伟大的抗日战争，还有那个福泽谕吉，表面上是教育家，实际上是真正意义上的军  国主义理论家，它之前的佐藤信渊等人的侵华言论只能算个人行为，因为它们没有侵华思想写成书，也没有在报刊上发行此类思想,,,,,,,,
1,把我拉黑，居然还好意思说我不让你说,,,,,,,,
1,心情沉重,,,,,,,,
1,五月八月,,,,,,,,
1,小学看过，老片子了，那时候的叶童还很漂亮,,,,,,,,
1,有没有easy girl 骂人小粉红呀～,,,,,,,,
1,勿忘！！！勿忘！！！远不止南京大屠杀！也远不止30万！铭记耻辱奋发图强！时刻警惕忘战必危！,,,,,,,,
1,小时候对日本的敌人形象也是因为这部电影树立起来的,,,,,,,,
1,仇日可敬，辱日有理，抱歉，我是中国人。,,,,,,,,
1,弹幕里有人说欠日本一次千万级别的大屠杀。那请问，你与它们还有什么区别？一味地仇视日本，想着以牙还牙的想法是不可取的，但我们也不应忘却国仇家恨。向前看，努力发展，珍惜来之不易的和平，让自己的祖国足够强大，强大到能够睥睨天下，这才是我们作为祖国的新动力和真正爱国的人应该做的事。请理性爱国，而不是随随便便就想挑起战争与屠杀的碍国。,,,,,,,,
1,我寻思你也是个中国人，在这么沉重的电影前加个这么欢快的片头，长心了吗？更别提这道德绑架一般的推荐名了。,,,,,,,,
1,日寇杀人45种残酷手段，农民大肠被抽出钉地上，强逼往前爬……http://t.cn/AiNjCqIW日军占领中国后的十种主要杀人方法！http://t.cn/AiNjCqIY 中国的下一场战争———黑鬼的五胡乱华！！！http://t.cn/AiCdoXB9第三次世界大战——最血腥的宗教战争和种族大战！！！http://t.cn/AiCRGZ1zhttp://t.cn/AiCRGZ1P ,,,,,,,,
1,中国抗日第一将领是孙立人，缅甸战场上下令，所有日本俘虏凡是进过中国一律杀掉，就冲这一条没有第二个人超过他,,,,,,,,
1,你们没资格去原谅日本,,,,,,,,
13,没有人说不看不是中国人，你们高潮什么？？你们语文老师的棺材都要爆炸了，中国人都应该看的电影，和不看不是中国人的区别那么大你们瞎吗？阅读理解有问题就不要说你读过书，小学生都比你们强，还有精，日，狗，我祝你们原地爆炸死于强，奸,,,,,,,,
2,现在南京有多少人买本子车？不能多说等下又要有人来说所谓的大道理所谓的道德来了。,,,,,,,,
2,不看，滚，叫日本人看去,,,,,,,,
5,仇恨日本佬的变态，限制他们拥有可以发动侵略的武力是政治正确。除非日本国解体成为新国家，不然日本永远都是污点国家。,,,,,,,,
5,文化不同，但人性都有共同的阴暗面，没必要强调民族仇恨，我们也不是没当过刽子手，知道自己也不是什么无辜的东西就好，愿意相信善，但对待恶也不需要手软,,,,,,,,
6,日本垃圾民族只会剽窃和抄袭,,,,,,,,
7,虽然知道多半要被扣上帽子撕，但我还是想说，在这样的时代去渲染名族仇恨有意思吗？对于历史我们应该做的是借鉴，为了让悲剧不再重演，而不是沉浸其中。刻意宣传渲染民族仇恨怎么说都不是维护和平的表现。安倍参拜靖国神社国内舆论骂声一片，然而每年这么多抗日电影和这种行为有何区别？而且要说正视历史，如果你去看过腾冲**墓园的长满青苔的石碑，再对比每座城市解放战争烈士纪念碑，你就会知道什么是正视历史了。至于战争中的问题(屠杀之类的)，我只能说希望你能以客观的角度去看待。过去的不应该忘记，但更不应该去渲染仇恨。人是往前看的，记住过去的事是我们能够更好的前进发展。,,,,,,,,
10,勿忘国耻毕竟是一句大空话。勿忘什么呢？是落后就要挨打的教训，被敌人蹂躏的耻辱，而不是纠结于一个国家对一个国家的仇恨。谈到日本的广岛长崎，其实我心里面就像面对南京大屠杀一样感到唏嘘的，谁不是战争的受害者呢？那个战争年代，论得上谁对谁错吗？,,,,,,,,
4,这些亲日的人难道日本人是你祖宗不成，你们也是日杂不成,,,,,,,,
0,国仇家恨，男儿勿忘。振兴中华，复我国威，报我国耻,,,,,,,,
0,知道了，爱国可耻,,,,,,,,
0,童年阴影,,,,,,,,
0,招核男儿，平成废宅，中国崛起之势不可挡,,,,,,,,
0,幼儿园时候老师带着我们去电影院看的，女主父写了一首诗，春眠不觉晓，处处闻啼鸟。夜来风雨声，花（杀）落（人）知多少。还有看到姐妹两人在河里洗澡姐姐看到了疑是她母亲的尸体飘了过来,,,,,,,,
0,很小的时候在电影频道看的，就记得女主是叶童和电影名，可以说是童年阴影了。哎，失去亲人，连存活都难的年代真的太可怕太可怕了,,,,,,,,
0,小日本,,,,,,,,
0,这个是历史真事改编的,,,,,,,,
