链接,标题,播放数量,弹幕数量,发布日期,点赞数量,硬币数量,收藏数量,转发数量,评论数量
3,今天是侵华日军南京大屠杀纪念日，沉痛悼念在那场悲剧中死难的三十万同胞。网上一直有外国人说，现在的日本人早已不是当年犯下罪行的日本人，为什么还要现在的日本人道歉？关于这一看法，我认为，正是因为当代日本人不是二战日本人，所以他们只需要道歉。正是因为他们不用负责，所以我们仅仅要求一个道歉。正因为他们不用负责，所以我们不会以受害者的身份要求复仇。铭记历史，牢记初心，不忘使命。中日矛盾客观存在，但是只是众多矛盾中的一个次要方面。当今中国国力远高于日本，相对的，日本不过是蛮夷之邦撮尔小国。中日矛盾跟源于中美矛盾。只要中国在西太地区成功崛起，日本首相自然而然会跪在南京忏悔。需要指出的是，铭记历史的目的绝不是铭记仇恨助长仇恨。东亚地区作为世界上经济最发达，科技最先进，高素质人口密度最密集的三大地区之一，一旦由某大国完成整合，那么东亚怪物房将成为决定人类命运的支配性力量。中国的崛起，其成功的部分标志就是整合东亚。当然，即使目前看来任重而道远，但是方向是明确的，道路是现实的，手段是多样的。看问题抓住主要矛盾，中日的矛盾，应当留在中美矛盾之后解决。毛主席说，要把朋友搞的多多的，敌人搞的少少的。如果日本可以成为助力中国发展的积极因素，那么就可以去利用日本。待到中国超越美国，再跟日本人秋后算账，为时不晚。,,,,,,,,
3,我们今天的美好生活来之不易 也希望他们的灵魂可以安息 但现在的中国 已经不是一百年前积贫积弱的中国🇨🇳了 我们，永远等你们回家！,,,,,,,,
3,看到头像灰了 然后想起来今天是12月13号...,,,,,,,,
3,82年了，他们，只想要一个道歉……,,,,,,,,
3,默哀，向遇难同胞表示同情，向那些南京大屠杀参与者和不断扭曲历史的日本右翼表示鄙视,,,,,,,,
3,大家去南京玩一定要去纪念馆看一看，很沉重很有教育意义。 勿忘国耻，振兴中华！,,,,,,,,
3,勿忘国耻，珍爱和平！,,,,,,,,
3,逝者安息，勿忘国耻,,,,,,,,
3,勿忘国耻🕯️🕯️🕯️,,,,,,,,
3,这是永远不能也不会忘记的日子！（头像已灰）,,,,,,,,
11,勿忘国耻,,,,,,,,
2,嗯洗日军的瑙贪也多,,,,,,,,
2,日本还是没有道歉,,,,,,,,
2,不会原谅！,,,,,,,,
2,看到共青团发东西第一反应点了推荐，看到1才后知后觉赶紧取消了,,,,,,,,
2,日本人就是要我们绝种，婴儿都不放过活活烧死，小孩子身体从中间劈成两半，孕妇肚子用刺刀刨开把婴儿笑着挑出来…还有拿中国人做实验，给日本人洗地说原谅的，被虐杀惨死的不是你们心不疼.哪来的脸说那话…别以为现在日本人有多好和他们没关系，当面笑嘻嘻背后刺你一刀的事不是没有。,,,,,,,,
2,我们这代人没有资格谈原谅，请向我们的先烈道歉，看他们会不原谅！,,,,,,,,
2,不小心点了个赞 万分抱歉,,,,,,,,
2,我们没有资格替先辈原谅日本人，永不原谅，永不忘却,,,,,,,,
2,怎么敢忘。夜里幽梦，可想念祖辈的模样。是言笑晏晏还是战战兢兢。是穿红着绿儿孙满堂还是开肠破肚横死尸场。你敢做梦吗？梦里，有没有人哭爹喊娘。梦里，有没有人在翻身反抗。梦里，有没有人被枭首悬在栏上。梦里，有没有婴孩停了啼哭一声不响。你敢做梦吗？梦里，会有人缠着你不放。梦里，你手里可没有枪。梦里，可有人告诉你，不能否认，你们曾在中华大地上用中华同胞的血泪恨剜出了两个字，国殇。,,,,,,,,
2,看哭了,,,,,,,,
2,第一次见到没人点赞的视频……,,,,,,,,
2,德国敢于承认错误，而日本政府还要去纪念侵略中国的战犯，还在教科书上淡化侵略历史，如果日本政府承认错误的态度能做到德国的一半我们也不至于厌恶他们，不过我们纪念九一八 纪念南京大屠杀死难者，不是为了报仇消灭日本，而是为了铭记历史，缅怀先烈，珍惜和平，开创未来，只有国家强大了，才能不被欺负，才能繁荣富强，我们珍惜和平，不侵略他国，但我们也不惧怕战争，如今的中国已经不再是任人欺负的样子了，虽然我们珍惜和平，但如有来犯之敌，虽远必诛，就算我喜欢日漫，但我分得清大是大非，这不冲突，因为这是真正的理性爱国。我希望大家能够做到。,,,,,,,,
2,看着幸存者爷爷奶奶们的照片上的灯一盏接着一盏熄灭我就绷不住了，我们没有亲身体会过这么丧尽天良，惨无人道的屠杀，我们根本就没资格替先人们去原谅日本侵略者，永远没资格,,,,,,,,
2,友好归友好，历史归历史——《黑太阳731》,,,,,,,,
2,牢记历史 勿忘国耻未雪 居安思危,,,,,,,,
2,我的老太太也是幸存者！她100岁啦，现在很健康，希望她一直好好的活下去。,,,,,,,,
2,愿世间永无战争，愿万世永享和平！,,,,,,,,
2,小时候无知，总认为课堂上课本上那些描述战争的文字是没有意义的，只会带来仇恨和矛盾。直到慢慢长大了，情感越来越丰富了，才知道了国家从小教育我们勿忘国耻是为了什么。那些在战争中死去的人，他们之前可能只是在工作，学习，在和其他小朋友们一块玩耍，可却在这一天之后失去了生命，他们明明什么都没有做，明明什么错都没犯，仅仅只是普通的生活而已，却遭受到了这本不属于他们的极其痛苦的经历。,,,,,,,,
2,强推纪录片《二十二》,,,,,,,,
2,等日本的一个道歉！等一个靖国神社的拆除！,,,,,,,,
2,82年了，日本还未道歉，他们已经快没有时间等待了。,,,,,,,,
2,如今和平年代，不能开口闭口打打杀杀报复，不过中国人民会把这份耻辱国仇家恨深埋在内心最深处…不敢忘不能忘，就像一根大刺狠狠扎在中华民族身上，至今未曾拔出……,,,,,,,,
2,"正是先辈们一个人吃三个人的苦，才有中国，正是华夏人民一个人流三个人的汗，才有了未来，我中华崛起不可阻挡<img alt=""[小电视_笑]"" src=""//i0.hdslb.com/bfs/emote/f80d384875183dfe2e24be13011c595c0210d273.png@100w_100h.webp""/>",,,,,,,,
2,勿忘国耻，振兴中华!!!,,,,,,,,
2,眼泪不经流下,,,,,,,,
2,勿忘国耻！老兵，受害者，在等着一个道歉，而日本在等着时间流逝，让当初的受害者，见证者一个个逝去,,,,,,,,
2,看团团头像,,,,,,,,
2,勿忘国耻，不能让日本人掩埋这段悲伤的历史,,,,,,,,
2,勿忘国耻，振兴中华以直报怨，血债终还。,,,,,,,,
2,看到团团的头像变成灰色，突然忍不住了,,,,,,,,
2,他们还在等，等日本的一个道歉没有人能替先人去选择原谅没有经历过那个时代的变迁就没资格说出原谅的话语逝者安息勿忘国耻,,,,,,,,
2,今年从高中升入大学，每年这一天都要看南京大屠杀遇难同胞纪念的视频，现在大学校园里却没有组织这样的活动，只有表面的转个说说或者朋友圈，这样继续下去，是记不住国耻的。希望引起重视。我看完这个视频真的很难受，愿死者安息，愿惨案不再发生。,,,,,,,,
2,这面墙是中国原谅倭人的最后机会，当这面墙熄灭，倭人再也没有机会博取中国之原谅。,,,,,,,,
2,空一座城，等三十万亡魂点一盏灯，祭朗朗乾坤怀一颗心，求人间安稳哀一个国，念我千古华夏人勿忘国耻，吾辈自强！,,,,,,,,
2,随着时间流逝当年唯一给历史做证据的老人们会一个个去世，右翼巴不得他们。。。，身为中国人一定不要忘记这一天，12.13日本侵略者罪行,,,,,,,,
2,南京某大学大一学生，今早力学课之前听到了警报声，全班同学不约而同，全体起立默哀到结束，第一次感觉离这个总被提及事件那么近。希望世界和平。我们要铭记历史，要奋发图强，国家才不会落后。最后，愿那30万南京人在天国永安他们的魂灵。,,,,,,,,
2,“如果这是30万把扇子的话，可能更适合我，我以前看过一把扇子全是文字，合上以后是一把空白的扇子，它只有在这个折的地方才会有信息......”,,,,,,,,
2,点了个赞然后把赞取消了，勿忘国耻,,,,,,,,
2,昭昭前事 惕惕后人 永矢弗谖 祈愿和平历史不忘 苦难耻辱 吾辈自强 复兴中华！,,,,,,,,
2,勿忘国耻，科技报国！,,,,,,,,
2,那是万家灯火，忽然就熄灭了真的...看到纪念碑上刻的名字的时候，才想到他们也曾经以各种身份生存过历史记住的只是数字，而这些数字背后到底有怎样一个人世间的姓名却被岁月的车轮倾轧。,,,,,,,,
2,愿世界和平，曾经的悲剧不再重演；愿祖国昌盛，往日的噩梦不再降临；愿逝者安息，长眠的故土永远宁静；愿我辈自强，奋进的路途知耻后勇。,,,,,,,,
2,没人愿意为这样的视频点赞看一次难受一次,,,,,,,,
2,看到了很多评论都“说铭记历史，不要传递仇恨”“这是 日本 军 国 主 义的错，和日 本 人 民无关”“侵 华 的 日 本 老 兵都要死光了，南 京 大 屠 杀和他们后辈无关”。铭记历史没毛病，但仇也不能忘！在日本拆掉 靖 国 神 社之前，我们没有资格也没有权利替前辈死难者们选择原谅。这不是破坏和平！这是身为一个中国人不应该忘记的刻在骨子里的恨！日军在中国所犯下的罪行不止南京大 屠 杀，不管当时的侵 华 日军都死光了没有，但是杀人偿命，父债子偿！在国际上称作第二次中日战争（Second Sino-Japanese War）、 日本侵华战争（Japanese War of aggression against China）。抗战时间从1931年9月18日 九 一 八 事 变开始算起，至1945年结束，共十四年抗战，中 国 抗 战直接人口损失可累计之估计数为2062万人，合可累计之战争直接伤残人口，军民伤亡最低限为3480万人；同时，还有估计认为，中 国 抗 战直接伤亡人口合计可能在4100万上，合战时失踪被俘等项数字，战 争直接给中国造成的死 亡、伤 残及 失踪等项人口损失共计超过4500万人；而从人口损失的角度看，抗 日 战 争时期中国人口损失总数应在5000万人以上。抗 战牺牲的那些先烈们，英灵不灭都在天上看着呢！这些人是我们的爷爷、父兄，牢记仇恨并不是什么羞耻的事！我们不是畜牲，我们不会大屠 杀，但我们必让日本付出代价，这不是82年，820年就能忘记的，这是刻在骨子恨，融在血脉的仇！只要身为中国人都要牢记的仇恨！中国抗 战直接伤亡人口合计可能在4100万上，不是你轻轻巧巧上下嘴皮子一动就原谅了的。,,,,,,,,
2,看看日本现在那些杀人犯，道歉的时候说的话都是给别人添了麻烦，你这是给别人添麻烦吗？那是血淋淋的一条人命啊！我看日本不道歉就是因为他根本没觉得这是人命，他觉得他就是所谓的添了麻烦。徐涛老师上课说，骂人最狠的一句话就是说一个人失败的原因是因为他是他，我也想说，日本成不了大器的原因就是因为他是日本，一个有小礼无大义的民族。,,,,,,,,
2,就我注意到团团的头像变色了吗？,,,,,,,,
2,82年前的今天，南京城破六朝古都就此化作人间炼狱……—  —  —  —  —  —  —  —  —         祭此非我苦难的开端亦非你罪恶的终点当车轮滚滚向前身后的记忆却不应消散需谨记：对历史闭上眼睛者看不到未来“南京”铭我华夏之殇凝我炎黄之魂“南京”当为我辈明心之鉴亦作国人警醒之钟永矢弗谖，祈愿和平,,,,,,,,
2,我小破站今天首页也是黑白的另外，还想说，调侃历史的某主播，以及在抗战遗址穿日军军装拍照的，你们枉为人，枉为中国人。尤其是穿日军军装拍照的,,,,,,,,
2,发现所有团团头像都成黑白了,,,,,,,,
2,君不见， 汉终军，弱冠系虏请长缨。君不见，班定远，绝域轻骑催战云。男儿应是重危行，岂让儒冠误此生。况乃国威若累卵，羽檄争驰无少停。弃我昔时笔，著我战时矜。一呼同志於十万，高唱战歌齐从军。齐从军，净胡尘，誓扫倭奴不顾身。忍情轻断思家念，慷慨捧出报国心。盎然含笑赴沙场，大旗招展日无光。气吹太白入盎月，力挽长夫射天狼。阿部魂归黄土岭，长田命丧聚义厅。昆仑关下积尸滿，缅甸血战鬼神惊。太行山上红旗展，南海琼崖掠铁鹰。台儿庄外凶寇灭，天下传扬百团名!中华铁军施威武，八方义士皆响应。万裏神州燃烽火，四亿人民尽化兵!核击广岛扫妖气，轰炸扶桑为犁庭。军旗天皇府上扬，九州四国北海靖!采石一载复金陵，冀鲁吉黑次第平。破波楼船出辽海，蔽天铁乌扑东京!一夜捣碎偻奴穴，太平洋水尽赤色，富士山头扬汉旗，樱花树下醉胡妾。归来夹道石人看，朵朵鲜花掷马前，门榍生辉笑白发，闾裏欢腾骄红颜。国史明标第一功，中华从此号长雄，尚留余感惩不义，要使环球人类同沐大汉风!,,,,,,,,
2,我调整心态，呼吸，节奏渐渐的平缓,,,,,,,,
2,勿忘国耻，生于忧患死于安乐,,,,,,,,
2,勿忘国耻 振兴中华！！！！！默哀,,,,,,,,
2,对不起你们，也谢谢你们,,,,,,,,
2,亚太再平衡到贸易战，什么时候和平过了？说这是和平年代的是不是傻？美国就是日本请过来的目的就是遏制你和平崛起，佛系青年请出门右转去日本，谈和平先跟小日本说去谢谢,,,,,,,,
2,牢记历史、勿忘国耻、祭奠亡灵。,,,,,,,,
2,唯能战方能止战，不忘国耻，振兴中华,,,,,,,,
2,牢记历史，勿忘国耻,,,,,,,,
2,愿逝者安息和平永存！,,,,,,,,
2,二战为什么日本是最后一个投降的法西斯国家。我在网上看到了有人提出了这以下几点是不是真？第一点日本是一个四面环海的岛国有地理优势确实不好打，而德军没有天险。第二点美国的先欧后亚政策是先集中兵力消灭德国。第三点日本对军队的洗脑超过德国，德国到了后期有很多人开始投降了，而日军还没有几个投降的。第四点意大利拖后腿，如果意大利保持中立，盟军不可能从南线进攻，德军可以把意大利的部队调到其他战线上去。第五点在中国战场上的国民党军队在战争后期不但没有什么进展，反而拖后腿，而共产党军队虽然作战顽强，但却没有得到美国的任何援助。还有第六点就是德军内部的情况也不容乐观，720事件之后希特勒除死了大批经验丰富的高级军官，剩下的军官他也不怎么相信了，真正到了一个人瞎指挥的地步，放了很多低级错误，让德军阻击盟军部队的行动难上加难，而日军方面虽然东条内阁下台之后，精英部队的高级军官并没有受到什么损失。可不可以做一些视频说一下？,,,,,,,,
2,我们没有资格去原谅他们我们只能做的是不让它在发生,,,,,,,,
2,他们都是实实在在独立的个体啊……昨天的身影 在眼前昨天的欢笑 响耳边数字太冰冷了但当我每每想要了解任何一个遇难同胞时总忍不住流泪太悲痛了这是一个民族永远的疼痛……勿忘国耻吾辈自强,,,,,,,,
2,"吓死我了，没一个人点赞，弄得我都不好意思马上撤回<img alt=""[囧]"" class=""small"" src=""//i0.hdslb.com/bfs/emote/12e41d357a9807cc80ef1e1ed258127fcc791424.png@100w_100h.webp""/>",,,,,,,,
2,我虽然喜欢看日漫，但我不会忘记国耻,,,,,,,,
2,勿忘国耻 警钟长鸣,,,,,,,,
2,1:纪念活动是正确的2:把对于军国主义的仇恨扩大到对一个民族的仇恨是军国主义的行为3:日本对侵略缺乏反思是因为目前社会性质决定的，政治经济军事文化都被美国抓着，对这事的看法难道能自己说的算？,,,,,,,,
2,头像细节,,,,,,,,
2,"每当提起这些事，总有人不自觉的把自己变成日本人，然后想方设法地为日本当年的罪行开脱，甚至主动替日本道歉<img alt=""[吃瓜]"" class=""small"" src=""//i0.hdslb.com/bfs/emote/4191ce3c44c2b3df8fd97c33f85d3ab15f4f3c84.png@100w_100h.webp""/>",,,,,,,,
2,落后就“会”挨打，而不是落后就要挨打。无论什么时候侵略，屠杀都是一件万夫所指，罪大恶极的事情。容不得任何辩白。,,,,,,,,
2,前不久看外国人写的南京大屠杀的书，一直耿耿于怀。日本人在杀南京人的时候无所不用其极，他们不仅是想要诛灭我族，更是把虐待这个词发挥淋漓尽致，曾经相信人心本善的我也开始改变想法。自由来自约束，民主来自安定，和平来之不易，铭记历史，我们不能代替那些受害的人们去原谅谁，我们只能默默强大，强大到有一天，能够让日本人正视历史了，铭记历史了，或许便是对遇害者的慰藉吧。,,,,,,,,
2,别在把用“日本人民”和“日本军国主义”、“日本政府”把日本二战时的罪行强行切割了，第一，二战时期日本明确公开反战的进步人士基本被杀了，女性家属送去慰安所了；第二，二战时你口中的日本人民捐钱捐物捐人，他们是全民参战；第三“东京大轰炸”不是没人知道，世界史上也有记录，很多人知道，“东京大轰炸”是因为“珍珠港”事件和“南京大屠杀”无关。,,,,,,,,
2,抱歉，借一下楼，大家去国家公祭网敲个钟，点个蜡烛吧！http://www.cngongji.cn/,,,,,,,,
2,你的头像怎么灰了？,,,,,,,,
2,勿忘国耻，牢记历史,,,,,,,,
2,铭记历史，勿忘国耻,,,,,,,,
2,我看团团的视频一般都是先点个赞，但是看了这个视频我把赞给取消了,,,,,,,,
2,灰色旗帜好评。勿忘国耻，振兴中华!!,,,,,,,,
2,永远不要忘了我们是从那个落后挨打的农业国，一步一步走到今天这个工业强国。我们比任何国家任何民族都明白战争的残酷，牢记历史不是为了记住仇恨，而是避免再次重蹈覆辙。,,,,,,,,
2,如果，每一个人都是一根蜡烛，在过去，有那么一段时间……在弹指之间熄灭了30万根蜡烛。这一道裂痕，永远是我们所有国人心中之殇。或许在和平年代，我们乐意接受现在的日本文化，但是！日本曾经的历史行径，绝不接受！最大的希望，就是日本佬赶紧承认错误，历史已成定局，再掩盖也没有用，想让这段历史从世界上抹去，除非中国人绝了！,,,,,,,,
2,1937年12月13日绝不止300000铭史以记，昭冤天下国殇大祭，奠我烈英斯军国者，斯右席者论史为妄，戕残吾族狂言三月，蚕吾河山中土九州，义士愤起舍家许国，清倭为志身灭神存，十有四年炭土焦木，珍宝俱窃鬼雄无计，待日归乡今国盛隆，斯尔无忘泱泱八荒，疆残氓罹巍巍昆仑，静土何求青天赤易，举国同抗万万同胞，劝铭无忘铭功业兮，铭耻屈兮万万烈灵，盛世如锦国强民安，可为君期但教小儿，无忘家祭今昌华夏，尔功不磨后记斯苦，奋而直追今虽盛景，匪安乐时族林于世，华夏延承虽功入史，当继驰进斯国祭典，铭史无忘,,,,,,,,
2,团团的头像暗了......,,,,,,,,
2,团团头像都灰色了，跟这个视频肯定有关,,,,,,,,
2,"<img class=""jump-img"" src=""https://i0.hdslb.com/bfs/activity-plat/static/20201110/4c8b2dbaded282e67c9a31daa4297c3c/AeQJlYP7e.png""/><a class=""comment-jump-url"" data-report=""0"" href=""//www.bilibili.com/video/av32505380"" target=""_blank"">为什么原子弹没有攻击东京，都说东京热，但是真正有多热你能想象吗，河水沸腾人体自燃，比原子弹还惨，【思维实验室】第二期火攻东京</a>",,,,,,,,
2,逝者安息，和平永存,,,,,,,,
2,如果没有看到B站首页变成黑白色，如果没有看到这个视频，可能我只知道今天是TGA2019，感谢b站，让我铭记历史，纪念在南京大屠杀中死去的同胞们。,,,,,,,,
2,当一艘船沉入海底，当一个人成了谜，你不知道，他们为何离去，那声再见竟是他最后一句，竟是结局。,,,,,,,,
2,日本人和我们中国在地缘政治上是注定的对手，而且畏威不畏德，想要让他们真真正正地道歉只有拿出压倒性的真理去说服他们,,,,,,,,
2,"这个视频的点赞数量不可见了<img alt=""[笑哭]"" class=""small"" src=""//i0.hdslb.com/bfs/emote/c3043ba94babf824dea03ce500d0e73763bf4f40.png@100w_100h.webp""/>刚刚1.5万",,,,,,,,
2,82年前南京被日本鬼子无情血洗，无数同胞牺牲于此，三十多万亡魂无家可归。82年后，中国强于日本，让世界看到真实的历史，让三十万亡魂安息故土。82年了，中国强大了，中国人强大了，先辈们却看不到如今的国泰民安。想告诉遇难的同胞们：山河犹在，国泰民安。,,,,,,,,
2,语言无法形容心中的痛，历史让我们共同铭记。,,,,,,,,
2,团团头像很细节,,,,,,,,
2,鸡鸣寺啼着鲜血，玄武湖目睹这浩劫。紫金山无奈地凝望，中山陵泛着泪光。请记住，这是耻辱。,,,,,,,,
2,强盗国家biss,,,,,,,,
2,bilibili今天的首页变成了黑白，虽然只要后台工程师给网页改下参数就行了，可是，我觉得b站这个小破站真的是一个有温度的地方,,,,,,,,
2,第六次公祭日，记录下历史兴衰，30万同胞永驻，中国仍然存在。,,,,,,,,
2,团团头像变了。。。,,,,,,,,
2,"皮皮团头像都黑白了<img alt=""[2233娘_委屈]"" src=""//i0.hdslb.com/bfs/emote/d9d0bf9d358af8d5761093ec66d4e3f60d963a63.png@100w_100h.webp""/>",,,,,,,,
2,我们没有资格替先辈遗忘，也没有资格替先辈仇恨敌人的后代，我们要做的是勿忘国耻，做到无人可以再欺辱我们民族，无人能抹去作恶的事实。,,,,,,,,
2,别的仇恨可能随时间而淡去，但国仇不会，放下仇恨？凭什么。我觉得当代我辈能做的只是暂且不提，共同发展，共建和平，因为我们的国家曾经历战火，所以我们更应该深知和平的可贵。我不提不代表我忘了，我不敢忘它也不准忘！我坚信，总有一天它会低头道歉并真正反思当初所犯之罪；我坚信，总有一天它再也不敢参拜战犯挑动我的神经和情感；我坚信，总有一天！我辈看不见还有儿辈，儿辈看不见还有孙辈，子子孙孙无穷无尽……,,,,,,,,
2,"头像灰色好评<img alt=""[支持]"" class=""small"" src=""//i0.hdslb.com/bfs/emote/3c210366a5585706c09d4c686a9d942b39feeb50.png@100w_100h.webp""/>",,,,,,,,
2,我没有资格替先烈们原谅日本侵略者，我想我们全体中国人都没有这个资格替先烈原谅他们。如今繁荣昌盛的共和国江山是从甲午战争到抗日战争数千万先烈用生命换来的，正如天安门广场英雄纪念碑所刻的“中国人民英雄永垂不朽”一样。这数千万先烈将与天地同寿，与日月同庚，他们的故事将在我们口中代代相传！,,,,,,,,
2,勿忘国耻 逝者安息,,,,,,,,
2,逝者安息,,,,,,,,
2,牢记使命，勿忘国耻！,,,,,,,,
2,昭昭前事   惕惕后人   永矢弗谖   祈愿和平,,,,,,,,
2,中华人民共和国万岁,,,,,,,,
2,永不原谅日本的罪行！是我作为中国人的基本底线,,,,,,,,
2,不敢忘，不会忘，不能忘,,,,,,,,
2,勿忘刺痛记忆，永续和平追求！,,,,,,,,
2,"我看到我外公了<img alt=""[大哭]"" class=""small"" src=""//i0.hdslb.com/bfs/emote/2caafee2e5db4db72104650d87810cc2c123fc86.png@100w_100h.webp""/><img alt=""[大哭]"" class=""small"" src=""//i0.hdslb.com/bfs/emote/2caafee2e5db4db72104650d87810cc2c123fc86.png@100w_100h.webp""/>",,,,,,,,
2,勿忘国耻，振兴中华！,,,,,,,,
2,天地有神表，万物生华章。栖霞山红枫，莫愁湖海棠。玄武眺牛首，乌衣登阅江。六朝十余都，其势何辉煌。闲散樱花落，忽闻存危亡。城破山河碎，秦淮梅无芳。悲萧雨花祭，两眼独彷徨。哀笛长江水，终是成国殇。逝水易春秋，已历重九霜。往事付红尘，故伤犹难忘。,,,,,,,,
2,踏平日本的那一天就是我释怀的那一天~,,,,,,,,
2,这段历史不容被忘记；这段历史不容被否认和篡改。铭记历史，勿忘国耻，振兴中华。,,,,,,,,
2,牢记历史振兴中华,,,,,,,,
2,铭记历史 警钟长鸣！！！,,,,,,,,
2,勿忘国耻，努力奋斗,,,,,,,,
2,中华人民共和国万岁!,,,,,,,,
2,勿忘国耻，振兴中华,,,,,,,,
