链接,标题,播放数量,弹幕数量,发布日期,点赞数量,硬币数量,收藏数量,转发数量,评论数量
7,中国人需要自律，中国动漫需要崛起。我是一个梦想为漫画家的人，原本是出于对动漫的热爱想成为漫画家，后来看过了死神火影海贼王发现中国的动漫行业十分惨淡，励志要去创作改变中国动漫的局势。去年我英事件更是让我坚定了这份决心，我发现了一个极其严重的问题，中国人正在被日本次元萌文化洗脑。起初人们开始喜欢说日语，喜欢模仿人物，渐渐的日本的次元萌，宅，污，腐文化开始渗透中国青少年成年人的内心，人们开始幻想次元恋爱，把日漫人物当做自己的信仰和情侣，直到我英事件，一部分中国人在批判在骂堀越耕平和我英，而一部分的中国人却在为我英辩护，说出作者是反人类反中国思维和我英人物有什么关系，依旧在把绿谷出久当做自己的次元恋爱信仰男神，把恃强凌弱，校园暴力的爆豪胜己当做自己的次元恋爱信仰男神。当时的我无比的振奋，震惊，无奈，悲哀。振奋了我的目标和梦想，震惊于对一部分中国人为以侵华细菌部队为想法取名原木的《我英》辩护，无奈于自己什么都做不了，悲伤于中国人开始丢掉了自己的中国心，改变了自己的中国信仰，隐隐约约成为了日本次元文化的俘虏，和中国的叛徒,,,,,,,,
2,无论对方的笑出于什么意思，我看着只有愤怒,,,,,,,,
1,"牢记历史，但不拿历史扯淡弹幕上说血战血偿，核弹。。。的人，和视频上不尊重历史的无知日本人有何区别？你了解历史？视频上的人不尊重历史，不了解历史，你就化作喷子，谩骂他人？你尊重了历史？战争能叫仇？哪个国家不想要更大的国土？哪个国家不希望人民过得更好？难道在你们眼里，中国就是高尚的？盲目爱国！将心比心，设身处地想想，假设你也受到了广岛原子弹，你会好过吗？还骂什么混蛋，日本狗？最可气的是有人评论谩骂他国，作者不但不删评，还一个劲夸“好样的”？是新时代变迁让人的心变污浊了吗？<img alt=""[热词系列_爱了爱了]"" src=""//i0.hdslb.com/bfs/emote/2a165b555ba20391316366c664ed7891883dc5aa.png@100w_100h.webp""/><img alt=""[热词系列_爱了爱了]"" src=""//i0.hdslb.com/bfs/emote/2a165b555ba20391316366c664ed7891883dc5aa.png@100w_100h.webp""/>",,,,,,,,
2,永远不可能原谅！731部队做的人体实验，3500万同胞和南京大屠杀的30万同胞，都是血淋淋的残痛！当时日本人就是魔鬼中的魔鬼！铭记历史，吾辈自强！！！,,,,,,,,
1,"你应该问问他们知不知道广岛和长崎那俩小炸弹<img alt=""[妙啊]"" class=""small"" src=""//i0.hdslb.com/bfs/emote/b4cb77159d58614a9b787b91b1cd22a81f383535.png@100w_100h.webp""/>问问他们还想要俩不",,,,,,,,
1,大部分日本人不知道是因为日本右翼吧,,,,,,,,
1,日本鬼子就是这样的😅,,,,,,,,
1,不记得了？原子弹记得吗？,,,,,,,,
1,够了，我越听越气，东洋四岛什么时候沉啊！,,,,,,,,
1,唉。我觉得我点进来就是自取其辱在他们看来再正常不过。,,,,,,,,
2,"呵呵<img alt=""[疑惑]"" class=""small"" src=""//i0.hdslb.com/bfs/emote/b7840db4b1f9f4726b7cb23c0972720c1698d661.png@100w_100h.webp""/>",,,,,,,,
1,"这视频看得让人觉得太阳穴砰砰跳<img alt=""[吐]"" class=""small"" src=""//i0.hdslb.com/bfs/emote/06946bfe71ac48a6078a0b662181bb5cad09decc.png@100w_100h.webp""/><img alt=""[生气]"" class=""small"" src=""//i0.hdslb.com/bfs/emote/3195714219c4b582a4fb02033dd1519913d0246d.png@100w_100h.webp""/>",,,,,,,,
1,"希望可以通过titok等中国软件多向rb等国家宣传这些历史！知识！<img alt=""[拥抱]"" class=""small"" src=""//i0.hdslb.com/bfs/emote/41780a4254750cdaaccb20735730a36044e98ef3.png@100w_100h.webp""/>",,,,,,,,
1,B站可不是精日神厕啊,,,,,,,,
1,原子弹下无冤魂,,,,,,,,
1,犯了错事鞠大躬,,,,,,,,
1,日本狗迟早要没,,,,,,,,
1,我来当第2333个评论。,,,,,,,,
2,看到其他国家的人这么愚蠢我就放心了,,,,,,,,
1,我也听说过小男孩和胖子，但我认为那都是假的，因为从来没看过两地民众受害的报道，没有证据哈哈哈哈，小日本少骗人了，这是我的言论只有,,,,,,,,
1,弹幕里的戾气很重啊！我觉得视频日本人这个表现很正常！日本这个民族就是你把他打一顿在扇他几个耳光他反而会笑眯眯表现的跟孙子一样！然后背地里暗暗的学习你哪天给你一刀！所以以后真打起来了！先给日本丢几个核弹就老实了！以后没事丢几个，没事丢几个！他们就会和舔狗一样！,,,,,,,,
1,其实这种采访大可不必，不需要它们记住，我们的子孙后代不要忘记就是了！,,,,,,,,
1,这个有什么好笑的？日本人都会把屠杀，死亡这种严肃的事情当成一个笑话来看待吗？真是可怕又变态,,,,,,,,
1,精日的真多,,,,,,,,
1,中国总有一天会跟你们好好算账的,,,,,,,,
1,故乡的蘑菇云又开了,,,,,,,,
1,日本是这样子有些县和市教科书是有区别的，就是不一样的。不像咱们祖国哪怕是少数民族教科书都是全国通一的,,,,,,,,
1,哈哈哈哈哈哈哈哈哈哈哈哈哈哈，快笑啊，快笑啊，广岛长崎上的蘑菇多好看！,,,,,,,,
1,勿忘国耻！,,,,,,,,
1,中日这道隔阂感觉永远消除不了，只要是中国人留着中国人的血就不可能会忘记，刻在DNA里的东西...早晚有一天会解决,,,,,,,,
1,我觉得记不得，觉得好笑没什么关系再来几次让他们记忆深刻点就好了。,,,,,,,,
1,右翼该死，日本还是有左翼的就是没啥影响力,,,,,,,,
1,"日本南京屠杀，成为了美国投下原子弹的借口，我记得网上流传的说法就是这样<img alt=""[思考]"" class=""small"" src=""//i0.hdslb.com/bfs/emote/cfa9b7e89e4bfe04bbcd34ccb1b0df37f4fa905c.png@100w_100h.webp""/>",,,,,,,,
1,右翼对教育的管控真的是让人心寒…,,,,,,,,
1,更多的，应该是无知吧，包括我们😁,,,,,,,,
1,收藏了，以后看书没有动力的时候会时常拿出来看一看，事实上我现在已经迫不及待的想去看书了，我想看的效果一定非常好,,,,,,,,
1,不愧是日本，以后有你们哭的！,,,,,,,,
1,这也要吸引流量？,,,,,,,,
1,哈哈哈哈原子弹真爽,,,,,,,,
1,出了国才发现，大多数外国人对于历史其实并不在乎。,,,,,,,,
1,"建议采访一下，驻日美军，四岛问题<img alt=""[doge]"" class=""small"" src=""//i0.hdslb.com/bfs/emote/bba7c12aa51fed0199c241465560dfc2714c593e.png@100w_100h.webp""/>这样估计脸都绿了<img alt=""[doge]"" class=""small"" src=""//i0.hdslb.com/bfs/emote/bba7c12aa51fed0199c241465560dfc2714c593e.png@100w_100h.webp""/>",,,,,,,,
1,果然右翼还是不少。。,,,,,,,,
1,看完只能说采访有问题，你这是要探讨日本人有多了解南京大屠杀，还是要探究日本人对大屠杀的看法？问了个啥呀都，就这弹幕还带节奏，你把你自己代入想一下,,,,,,,,
2,错了  不是中日战争！是日本侵华战争！,,,,,,,,
1,一劳永逸，物理定律。万世太平，质能方程。山川异域，不共戴天。🙂,,,,,,,,
1,"我学物化生的我也不知道二战啥时候南京大屠杀啥时候<img alt=""[笑哭]"" class=""small"" src=""//i0.hdslb.com/bfs/emote/c3043ba94babf824dea03ce500d0e73763bf4f40.png@100w_100h.webp""/>只知道一些内容",,,,,,,,
1,你应该说轰炸日本的原子弹他们就想起来了,,,,,,,,
1,现在所说的侵华战争，在日本从小就教育他们是日中战争，而不是侵华,,,,,,,,
1,我希望我有生之年，能坐在东京的废墟上抽华子,,,,,,,,
1,可恨的不是这些民众，而是日本的教育，把历史抹去，不被自己的国民知道,,,,,,,,
1,"恶劣的大和民族，对历史没有尊重所以可以再来两个原子弹嘛<img alt=""[笑]"" class=""small"" src=""//i0.hdslb.com/bfs/emote/81edf17314cea3b48674312b4364df44d5c01f17.png@100w_100h.webp""/>嬉皮笑脸的真恶心",,,,,,,,
1,我就想知道，当年日本打的男人都快没有了。为了自己国家以后不会没有男力，有没有抱走，拐走，抢走孩童？,,,,,,,,
1,中国有两句古话我想送给日本人第一句，好多人讲以德报怨，但是后半句肯定好多人不知道，以德报怨，何以报德？以直报怨，以德报德(就应该用适当代价回报恶行，用善行回报善行)中华民族从来都不是欺负软弱的民族，也绝不会任由人欺负第二句以血还血以牙还牙。,,,,,,,,
1,日本人简直不是个人啊！！！,,,,,,,,
1,真想再给你们一颗大伊万,,,,,,,,
1,就这种态度，怎么可能不让人愤恨,,,,,,,,
1,什么叫尴尬不知道的笑呀？你特么说到活埋别人的历史的时候应该笑吗？我就问你。,,,,,,,,
1,这视频推送有啥意思?需要看他们怎么说?难道他们说上一辈太可恶了、错了什么的，我们就能原谅他们?,,,,,,,,
2,日本人估计当几百年前历史书看了，还以为事早过了,,,,,,,,
1,对于他们不知道也蛮正常，毕竟没有知道的途径,,,,,,,,
1,为什么可以带着微笑谈论这种事情？？？,,,,,,,,
1,"感觉日本的教科书上对侵华战争都是很清淡的描写…………啊…还笑，再笑把你头打歪<img alt=""[笑]"" class=""small"" src=""//i0.hdslb.com/bfs/emote/81edf17314cea3b48674312b4364df44d5c01f17.png@100w_100h.webp""/>",,,,,,,,
1,他们嫌小男孩和胖子还有李梅烧烤太少了。,,,,,,,,
1,原子弹下无冤魂,,,,,,,,
1,原子弹的滋味怎么样？啊？你给我笑着说出来啊。,,,,,,,,
1,南京三十万同胞 东北百万冤魂 四川数十万烈士会让你们在梦里记住的,,,,,,,,
1,是个中国人不会忘  不是不报时候未到，时辰一到 报应就到,,,,,,,,
1,wdnmd哈皮,,,,,,,,
1,他们怎么怎么看待跟我没关系的，我只知道这个愁有一天是一定要报回来的，要求不多，灭国流行,,,,,,,,
1,没人比我更懂原子弹爆炸,,,,,,,,
1,真正的友好不是不愿提起不愿去了解，更不是美化和躲避,,,,,,,,
1,在这个特殊的日子里，勿忘国耻！,,,,,,,,
1,这么反人类的事还笑的出来，可见得他们的精神世界是多么的贫乏,,,,,,,,
1,日本站看这视频,,,,,,,,
1,"<img alt=""[doge]"" class=""small"" src=""//i0.hdslb.com/bfs/emote/bba7c12aa51fed0199c241465560dfc2714c593e.png@100w_100h.webp""/>觉得不爽的同志，要么你们就真的去日本揍日本人，要么就乖乖干自己的工作吧，有的人分不清敌我，把戾气往自己人身上撒，希望对待日本人时你们也能有对待自己人的这股戾气。",,,,,,,,
1,推荐一下日本的NNN 纪录片]【南京大屠杀 ——侵华老兵的证言】,,,,,,,,
1,不是很多人，是所有人记得,,,,,,,,
1,"所以在镜像的世界里谁会拿到自己的答案呢<img alt=""[锦鲤]"" class=""small"" src=""//i0.hdslb.com/bfs/emote/643d6c19c8164ffd89e3e9cdf093cf5d773d979c.png@100w_100h.webp""/>",,,,,,,,
1,"看样子有必要再认识几个东京“熟人”了<img alt=""[鼓掌]"" class=""small"" src=""//i0.hdslb.com/bfs/emote/895d1fc616b4b6c830cf96012880818c0e1de00d.png@100w_100h.webp""/>",,,,,,,,
1,对我也不知道 一个叫李梅的烧烤师傅在东京举办的篝火晚会,,,,,,,,
1,现在问这些日本人他们当然不知道甚至觉得与他们无关,,,,,,,,
1,日本为他的恶行付出了巨大代价，人类历史唯一遭受核打击的国家，唯一首都被烧平的国家，唯一宪法由敌国将领制定的国家…但这些代价无一是中国给予的，那时的中国积贫积弱破败不堪，拼死抵抗已是全部，再无还击的手段，所以他们并不畏惧中国，所以教科书可以轻易改变。日本人惧威而不怀德，他们没有道德底线，只有疼痛的底线，跟马戏团的动物一样，剧痛是最好的应激反应剂，驯兽师的鞭子就是日本人的为之跪拜的信仰。所以如果有一天，日本人胆敢再次进犯，希望中国新账旧账一起算，给他们尝一尝中国的铁鞭。,,,,,,,,
1,连评论发都发不出来，真是可悲，看她笑的那么开心我却不能评论,,,,,,,,
1,建议采访中国人嗷,,,,,,,,
1,"很有必要多种几棵蘑菇好好记一记。<img alt=""[doge]"" class=""small"" src=""//i0.hdslb.com/bfs/emote/bba7c12aa51fed0199c241465560dfc2714c593e.png@100w_100h.webp""/>",,,,,,,,
1,本子教科书里估计就有俩原子弹,,,,,,,,
1,山川异域 不共戴天,,,,,,,,
1,妈的,,,,,,,,
1,我是永远忘不了,,,,,,,,
1,作为一个中国人，我觉得他们的回答没毛病，我们在我们的教育下长大，他们在他们的教育下长大，有他们的立场，他们这样说话我感到愤怒、但是表示理解。所以我觉得最好的方法就是把日本彻底击败占领统治，让他们在我们的教育思想下长大，和我们一样仇视他们的先辈，这样就没问题了,,,,,,,,
1,"终于有一日，五星红旗将在富士山上飘扬<img alt=""[微笑]"" class=""small"" src=""//i0.hdslb.com/bfs/emote/685612eadc33f6bc233776c6241813385844f182.png@100w_100h.webp""/>",,,,,,,,
1,下次等我们给它们来个深刻印象,,,,,,,,
1,善恶终有报天道好轮回，侵略者终将被侵略。正义还是邪恶，反正侵略者跟正义没关系,,,,,,,,
1,天天问这没币用的，彻底跟日本断绝关系再说，用脑子想也知道人家不会教学生这些。,,,,,,,,
1,记者：那你听说过长崎原子弹吗？我：听说过的记者：有什么感想？我：响不错，挺亮的,,,,,,,,
1,"你知道广岛核爆吗？抱歉忘了，以及东京是不是美国的州啊<img alt=""[中国绊爱_点赞]"" src=""//i0.hdslb.com/bfs/emote/9248de5d87737a34f88204156ad0401814cda8e0.png@100w_100h.webp""/>",,,,,,,,
1,弹幕小将高潮个毛，就日本子那些憨批年轻人。你们哪点不完爆他们，相信自己实力。好好学习工作，日本省也不是不可能。,,,,,,,,
1,很正常，错就错在日本教育，导致了日本人都没有这种觉悟,,,,,,,,
1,"日本政府永远都不会承认他们杀了多少中国人，也不会印在他们教科书上让学生得知<img alt=""[生气]"" class=""small"" src=""//i0.hdslb.com/bfs/emote/3195714219c4b582a4fb02033dd1519913d0246d.png@100w_100h.webp""/>",,,,,,,,
1,"日本右翼分子强行扭曲历史，使得后代几乎学不到正真的历史<img alt=""[哈欠]"" class=""small"" src=""//i0.hdslb.com/bfs/emote/888d877729cbec444ddbd1cf4c9af155a7a06086.png@100w_100h.webp""/>",,,,,,,,
1,"仇确实是世仇，不分军队和平民，但是这仇我估计也报不了。别看老在打嘴仗，中国目前总体上是亲日的，去年考研政治还整了个中日人民世代友好，我拿到题就把这选项叉了，结果是对的<img alt=""[笑哭]"" class=""small"" src=""//i0.hdslb.com/bfs/emote/c3043ba94babf824dea03ce500d0e73763bf4f40.png@100w_100h.webp""/>而且目前的世界局势也不太可能出现以前那种大规模的战争，都是有核国家，即使中美开战也会控制在一定范围之内",,,,,,,,
1,应该问问他们原子弹什么时候响的知道吗,,,,,,,,
1,"要是日本在教科书上写自己的罪证才是真的蠢吧<img alt=""[尴尬]"" class=""small"" src=""//i0.hdslb.com/bfs/emote/cb321684ed5ce6eacdc2699092ab8fe7679e4fda.png@100w_100h.webp""/>",,,,,,,,
1,很多日番都有所谓的反战思想，但是看多了会发现，他们的反战是多么的做作，而我理解他们之所以这样，不是因为意识到自己错了，而是意识到在打不过别人的时候才会反战,,,,,,,,
1,他们记不记得我不管，我记得就行,,,,,,,,
1,好家伙，还东京大屠杀，说说算了，解放军是人民的军队，不是法西斯的军队，也不是美国军队那种政治工具，解放军是一个个鲜活的人。而打仗必定死人的，我们珍视每一位战士的生命，所以我们从不轻易言战，谨记国耻，目的不是滋长仇恨，而是敦促自己变强，是为了有朝一日让一切有潜在可能成为敌人的团体不敢有非分之想,,,,,,,,
1,不是，想问下为啥弹幕都那么暴躁，别人学生不记得或者不知道不是很正常嘛。。我们高中的时候有学历史其实现在也忘了很多了。。。毕竟没有刻意去记。现在问我哪个历史事件名字内容我可能都答不上来,,,,,,,,
1,我无法替逝去的同胞原谅他们,,,,,,,,
1,"广岛长崎，我听说过哦~<img alt=""[抠鼻]"" class=""small"" src=""//i0.hdslb.com/bfs/emote/cb89184c97e3f6d50acfd7961c313ce50360d70f.png@100w_100h.webp""/>",,,,,,,,
1,"<img alt=""[怪我咯]"" class=""small"" src=""//i0.hdslb.com/bfs/emote/07cc6077f7f7d75b8d2c722dd9d9828a9fb9e46d.png@100w_100h.webp""/>任何国家，教科书除了教育培养还有一个种功能！你们好好想想吧<img alt=""[思考]"" class=""small"" src=""//i0.hdslb.com/bfs/emote/cfa9b7e89e4bfe04bbcd34ccb1b0df37f4fa905c.png@100w_100h.webp""/>",,,,,,,,
1,这个开头好啊 直接把字幕盖住了,,,,,,,,
1,很正常，他们不清楚。因为坏事是他们先辈做的，伤不在他们身心，苦是我们先辈吃的，伤在我们身心。谁伤谁记得清。干了坏事的想逃避，想忘记，不想让后代知道,,,,,,,,
1,给那些小的点两颗大伊万，劲大,,,,,,,,
1,铭记历史，永世不忘国耻，正视现实，面向未来,,,,,,,,
1,小男孩好可爱，嘭的一下，就裂开了呀，哈哈哈哈哈哈哈哈哈哈嗝，死了好多哈哈哈哈～，小鬼子，哈哈哈哈哈哈哈,,,,,,,,
1,原子弹下无冤魂,,,,,,,,
1,"当初美国丢原子弹，怎么不多丢几个呢<img alt=""[疑惑]"" class=""small"" src=""//i0.hdslb.com/bfs/emote/b7840db4b1f9f4726b7cb23c0972720c1698d661.png@100w_100h.webp""/>",,,,,,,,
1,篡改教科书是篡改历史的重要手段,,,,,,,,
1,政治导向已经非常明显，而且为以后的再战埋下种子，中日战争的爆发无法避免，只望中华强盛，必胜日寇。,,,,,,,,
1,装睡的人叫不醒,,,,,,,,
1,就最后一个说的还像句人话,,,,,,,,
1,他们不想承认不想为自己买单！,,,,,,,,
1,三分人样没学会，七分兽性是根深蒂固。,,,,,,,,
1,"建议换一个记者:你听过广岛原子弹吗<img alt=""[doge]"" class=""small"" src=""//i0.hdslb.com/bfs/emote/bba7c12aa51fed0199c241465560dfc2714c593e.png@100w_100h.webp""/>",,,,,,,,
1,日本鬼子＊＊＊,,,,,,,,
1,"日本這個國家就是一個精神變態的國家罷了 從他們各種重口味文學藝術電影電視就能看出來了 正經人能拍出來這種東西？還有他們發達的醫療水平 都是當年731在東北做實驗拿到的數據 我巴不得日本人死絕<img alt=""[微笑]"" class=""small"" src=""//i0.hdslb.com/bfs/emote/685612eadc33f6bc233776c6241813385844f182.png@100w_100h.webp""/>",,,,,,,,
1,快进到朱日和,,,,,,,,
1,连历史都不敢去正视，啥时候也给他们来个东京,,,,,,,,
1,这种街拍他们不笑才怪，换作国人也不一定会很严肃,,,,,,,,
1,"看评论看得我想笑<img alt=""[吃瓜]"" class=""small"" src=""//i0.hdslb.com/bfs/emote/4191ce3c44c2b3df8fd97c33f85d3ab15f4f3c84.png@100w_100h.webp""/>",,,,,,,,
1,"我也要笑着和它讲小男孩<img alt=""[呲牙]"" class=""small"" src=""//i0.hdslb.com/bfs/emote/b5a5898491944a4268360f2e7a84623149672eb6.png@100w_100h.webp""/>",,,,,,,,
1,这种态度意味着仇恨有可能再次延续,,,,,,,,
1,他妈的要是中日再次开战的话一定要让小日本子灭种，一个不留,,,,,,,,
1,问问他们家里女人怎么去慰问美军的，他们肯定知道,,,,,,,,
1,怪这些学生普通人也没用，这是政府刻意去淡化这段历史的，我们看到他们的笑只会觉得愤怒和他们那种无知，但是你又能怎么办呢？只有强大到他们无法忽视，至少在政府层面，日本的首相也要看中国的脸色，只要想到这点，总有一天日本要面对他们的罪行,,,,,,,,
1,直接问知道为啥挨原子弹吗,,,,,,,,
1,圆脸有一期视频中就提到，老师上课时卖力地讲解犹太人所遭受的种族清洗，却不知道抗日战争中中国军民的死亡人数，比犹太人还高了一个数量级,,,,,,,,
1,中国人永远不会忘记,,,,,,,,
1,他们不是应该说自己是英雄，同时还是受害者吗？,,,,,,,,
1,越南人说明朝血腥镇压越南是怎么回事,,,,,,,,
1,哈哈哈哈哈哈，想到广岛原子弹我就想笑不知道为什么，哈哈哈哈哈哈哈哈哈哈哈,,,,,,,,
1,"建议下次采访知不知道广岛长崎原子弹<img alt=""[doge]"" class=""small"" src=""//i0.hdslb.com/bfs/emote/bba7c12aa51fed0199c241465560dfc2714c593e.png@100w_100h.webp""/>",,,,,,,,
3,麻了，评论区被盲目和平思想与日本外宣感染的比想象中的多。不过五年前乃至更早以前，这种视频的评论区下面大多是所谓“讲和平”的或是顾左右而言他的，甚至为侵略战争洗白的占主流，现在虽然仍可以见到这些毒草，但已不占主流了，也算是一种进步吧,,,,,,,,
3,有人说要再投几个原子弹，还有人赞成。np。        我不信你们还有什么好辩解的，一些非常理非道德的事用一句中国……就能忽悠过去。真的把我ex到了。,,,,,,,,
2,我们到的辈，一个不同的时代 ，他们受伤 ，他们愤怒 ，他们反抗 ！我们的父辈 ，一个不同的起点 ，他们努力 ，他们坚持 ，他们发展！我们的父辈 ，一个全新的时代 ，他们老去 ，我们富强 ，他们欣慰 ！而现在 ，他们已经不再老去 。他们在天上俯视着我们 ，他们笑的像一朵鲜花，但是后来又将眉头一皱 :他们看到了日宣，他们看到了穿和服的中国人 ，他们看到了穿着曾经日本海军水手服上衣的中国人，他们看到了出口成日语的中国人 。此时的他们心里骂道 :老天爷 ，我怎能有这样的后代 ？！一个年轻人在一位高龄老人面前脱口出日屁 ，老人很愤怒，上去给了它一巴掌 。她做了寡妇已经几十年了 。。。。。。,,,,,,,,
2,日本的文化就是变态披着体面的外衣。,,,,,,,,
2,果然日本人长的都丑,,,,,,,,
2,0202年了，还有人希望来国战的？要不谁对日本有意见的自己去日本弄死几个算了，我们好好过日子就行了,,,,,,,,
0,看样子要把原子弹炸广岛视频投到日本视频网站,,,,,,,,
1,我们要强调的不是数字，是生命，还能笑出声来，话说难听点，不愧是那种人的后种,,,,,,,,
1,有些人会感到沉重或者歉意，但我们不要求你（后代）怎么怎么样，但是还能笑出来的（知道这件事的）真的有点……（不想骂人）如果我杀了你的先祖还是那么多人，我相信随便问一个人都不会笑出来吧。,,,,,,,,
0,倭寇的本性难移,,,,,,,,
1,"咱中国认恨日本人归恨日本人，但咱们不能这么没素质啊<img alt=""[OK]"" class=""small"" src=""//i0.hdslb.com/bfs/emote/4683fd9ffc925fa6423110979d7dcac5eda297f4.png@100w_100h.webp""/>",,,,,,,,
1,这个up主断章取义！中间那两个带着pingpong earrings的女孩其实说法挺客观的，都怪up断章取义！,,,,,,,,
0,哈哈哈，以后在打仗可就不是几万当量了，哈哈哈哈哈哈，要么几百万彻底抹掉，要么小型化精准毁灭，哈哈哈哈不行了，好想笑,,,,,,,,
0,然而可笑的抗日神剧流到日本，会让人家怎么看,,,,,,,,
0,那问一问他们知不知道广岛和长崎挨过原子弹，如果知道再问一问知不知道为什么挨,,,,,,,,
0,我很好奇，如果我带几本中国历史书过去，顺便翻译成日文给日本人看会怎样呢,,,,,,,,
1,指望日本人道歉？算了吧，日本人根本就不承认这事。华夏子孙们，永远记住历史。,,,,,,,,
