链接,标题,播放数量,弹幕数量,发布日期,点赞数量,硬币数量,收藏数量,转发数量,评论数量
4,"明明都是人，却要杀人。好吧，我错了，他们不是人。有些平民孩子女人连武器都没有。你们杀他们，真给武士道丢人<img alt=""[无语]"" class=""small"" src=""//i0.hdslb.com/bfs/emote/44667b7d9349957e903b1b62cb91fb9b13720f04.png@100w_100h.webp""/>",,,,,,,,
4,我们有什么资格去原谅？,,,,,,,,
4,同是法西斯主义的受害者，以色列俨然成为了国际上的代表，甚至纵容其侵略，而在二战中东亚地区做出重大贡献的我们却经常被选择性忽视，想让日本承认其罪行，停止军国主义复辟，我们在国际上的发声是微弱的，虽然这些年我们发展起来了，但想让日本认识其民族曾经犯下的错误，还先烈一个抵御法西斯侵略名分，还得要我们拥有自己的话语权，当我们足够强大的时候，这段鞭策我们发展的历史价值才会得意体现,,,,,,,,
4,不要犯极左极右的错。我相信大中华会越来越伟大！,,,,,,,,
4,为遇难同胞默哀,,,,,,,,
4,"有谁注意到团团的头像…<img alt=""[委屈]"" class=""small"" src=""//i0.hdslb.com/bfs/emote/d2f26cbdd6c96960320af03f5514c5b524990840.png@100w_100h.webp""/>",,,,,,,,
4,牢记历史，勿忘国耻,,,,,,,,
4,现代人没资格为逝世的老一辈烈士和人民同胞做评价，甚至说原谅日本简直是无稽之谈。我们做到的而是维护和平，爱好和平，和振兴中华。,,,,,,,,
4,今天重看了血战钢锯岭，和抗日神剧里面不同的是，日本鬼子个个都堪称敢死队员，我觉得即便到今天我们也需要警惕日本军国主义死灰复燃，时刻提防恶狗脱缰,,,,,,,,
4,我们没有资格代替先辈原谅日本侵略者,,,,,,,,
4,我们失去的是同胞们的生命，而他们却连一句道歉都没有，我们又凭什么原谅,,,,,,,,
4,灯终有一天会全部熄灭的，灯全熄灭的时候就是真的死无对证的时候他们一直在等恶魔的道歉恶魔一直在矢口否认。恶魔现在最希望的正是，我们一直以来最害怕的时候——他们全部逝去勿忘国耻，吾辈自强！我们没有理由，也不够资格替先辈原谅侵略者今天，南京绝对会很堵因为有30多万亡灵要回家勿忘国耻，吾辈自强！勿忘国耻，吾辈自强！勿忘国耻，吾辈自强！,,,,,,,,
4,不是不原谅，是我们没有资格替先烈和无辜的人们原谅日本,,,,,,,,
4,我们没有资格原谅，因为我们并不在那个时代。我们能做的只是祈愿遇难者安息 祈愿和平不要忘记这段历史，也要让更多境外的人知道。二战中的中国，不光是中国还有世界各国都有这种屠杀，抢掠。都有无辜的平民死去。现在我们要做的是珍惜和平。维护和平，扼杀战争，而不是煽动民族情绪挑战引战！,,,,,,,,
4,忘不了呀，谁家族中没有这相似的故事啊……当年姥姥给我讲舅姥爷的故事，现如今姥姥也不在了，故事总是会一代一代传承下去的，这是刻在我们血脉中的伤痛啊。,,,,,,,,
4,勿忘国耻,,,,,,,,
4,忽忘国耻,,,,,,,,
4,http://www.cngongji.cn/m/如果大家有时间，希望大家去公祭网敲敲钟，献上花圈，点上一支蜡烛。今天，三十万南京人要回家！转,,,,,,,,
4,懦夫畏死终需死，志士求仁几得仁。铭记历史，砥砺前行。,,,,,,,,
4,那一年纷乱如麻，愿你们来世拥有锦绣年华,,,,,,,,
4,勿忘啊勿忘,,,,,,,,
5,看到很多人把关注点放在日本如何上，想发表一点点意见，私以为牢记南京大屠杀的目的并不是让我们以及我们的后代记住仇恨，仇恨的连锁只会带来更多的悲剧。勿忘国耻的目的应该是记住战争的残酷和无人性，记住居安思危，让历史不重演的根本方法是保证自己足够强,,,,,,,,
5,在这个日子里也不知说什么好，但是翻了下评论，基本每条评论下面都会有一两个说日本平民是无辜的，但是何为无辜，政府领导是他们选出来的，二战时期日本下发侵略中华也是得到8成民众的支持，当时侵华战争日本可是赌国运的把所有资源都拿出来了，到现在绝大部分日本人还死不承认这段历史，那你们还拿什么底气说出日本平民是无辜的，这个日本平民又是指哪些人呢，恐怕自己都搞不清楚,,,,,,,,
5,勿忘国耻，振兴中华！,,,,,,,,
3,"2020了，依然不会忘记，永远不能忘记的国耻，30多万的同胞啊，可恶的小日本。勿忘国耻！振兴中华！<img alt=""[大哭]"" class=""small"" src=""//i0.hdslb.com/bfs/emote/2caafee2e5db4db72104650d87810cc2c123fc86.png@100w_100h.webp""/>",,,,,,,,
3,勿忘国耻,,,,,,,,
3,不原谅，不仇恨，不忘记。,,,,,,,,
3,来了！为在南京大屠杀中遇难的30万同胞默哀！致敬！,,,,,,,,
3,勿忘国耻铭记历史,,,,,,,,
3,今天2020年12月13日,,,,,,,,
3,三十万故魂犹未昭，八十三年金陵寒雪。为丈夫者，家国耻与恨，生而死之不能忘。吊殇难之而哀悼，悲怆之而举国黯然。——南京国难83周年,,,,,,,,
3,深切哀悼,,,,,,,,
3,2020年12月13日，不能忘记,,,,,,,,
3,"三十万人啊，欢迎回家<img alt=""[大哭]"" class=""small"" src=""//i0.hdslb.com/bfs/emote/2caafee2e5db4db72104650d87810cc2c123fc86.png@100w_100h.webp""/>",,,,,,,,
3,"今天南京的路上很堵，因为有三十万人要回家<img alt=""[大哭]"" class=""small"" src=""//i0.hdslb.com/bfs/emote/2caafee2e5db4db72104650d87810cc2c123fc86.png@100w_100h.webp""/><img alt=""[大哭]"" class=""small"" src=""//i0.hdslb.com/bfs/emote/2caafee2e5db4db72104650d87810cc2c123fc86.png@100w_100h.webp""/><img alt=""[大哭]"" class=""small"" src=""//i0.hdslb.com/bfs/emote/2caafee2e5db4db72104650d87810cc2c123fc86.png@100w_100h.webp""/>",,,,,,,,
3,默哀。勿忘历史,,,,,,,,
3,我们没有资格替遭受苦难的先辈和已经逝去的先烈原谅他们，这个痛点与世长存！,,,,,,,,
3,默哀,,,,,,,,
3,默哀,,,,,,,,
3,默哀,,,,,,,,
3,默哀,,,,,,,,
3,今天又要发了，勿忘国耻,,,,,,,,
3,我们没有资格去原谅当年屠杀我们的日本人,,,,,,,,
3,不要尽念叨着勿忘国耻，更要记住，振兴中华！,,,,,,,,
3,我不敢去谈什么原谅，甚至我都难以冷静地去谈所谓的empathy共情。我没有这个资格去对着过去的人，过去的事指指点点。我唯一能做的，是努力去减少这些苦难，是努力去救赎万千挣扎中的人。我们也许可以选择理性来避开这些惨痛，但我想不能忘记一切抽象的理性最后必须回归真真切切的现实。,,,,,,,,
3,"在南京在凇泸...破碎的可是上千上万个家庭，死的是上千上万个哥哥，让我们用什么原谅他们<img alt=""[大哭]"" class=""small"" src=""//i0.hdslb.com/bfs/emote/2caafee2e5db4db72104650d87810cc2c123fc86.png@100w_100h.webp""/>",,,,,,,,
3,"我看今天谁敢白嫖!!!!!<img alt=""[打call]"" class=""small"" src=""//i0.hdslb.com/bfs/emote/431432c43da3ee5aab5b0e4f8931953e649e9975.png@100w_100h.webp""/><img alt=""[打call]"" class=""small"" src=""//i0.hdslb.com/bfs/emote/431432c43da3ee5aab5b0e4f8931953e649e9975.png@100w_100h.webp""/>",,,,,,,,
3,"可恶的日本鬼子和二鬼子<img alt=""[生气]"" class=""small"" src=""//i0.hdslb.com/bfs/emote/3195714219c4b582a4fb02033dd1519913d0246d.png@100w_100h.webp""/>",,,,,,,,
3,当年我爷爷走南闯北，去过北京，东北，杭州，上海，经过商，当过兵，当过兵好几年，当年抗日，我爷爷说就一个字窝囊，日本鬼子有飞机轰炸，我们要白白挨炸，有的时候，得牺牲几个人才可以杀个日本人，后来和部队走散了，山东省又在日本人手里，只好往后方走，走到了山西，后来加入了共产党，和红军一起革命，后来山东收复了，日本人跑了，汉奸全毙了，解放战争打完了，回了家，家里人还以为战死了，跟着国民党，除了跑，投降，连一次胜仗都没打过，死了几十万人，上海也没守住，几个月，东北三省几十万平方土地没几个兵开枪，跟了红军，百团大战，不是日本人打咱，也不用窝战壕里等日本鬼子，这次是咱打日本人。,,,,,,,,
3,南京人冒个泡,,,,,,,,
3,德国和日本的区别一下子就体现出来了，德国曾经在集中营打骂，虐待犹太人的士兵全都被送进了监狱，而日本居然还去祭拜，而且死不承认罪行......,,,,,,,,
3,无论如何？我都不会跪下。我身后有30万灵魂不息即使浑身伤痕，即使手中只剩一把刀我也仍然站立着，站在我的子民身后，刀尖永远永远也只会对准侵略者因为我知道到最后，失败的一定是他们,,,,,,,,
3,愿逝者安息！,,,,,,,,
3,铭记历史，每次升国旗的时候好好想想那面国旗为什么是血红色的，那血红的颜色是怎么来的，世界至今也并不和平，我们只是幸运的生在一个强大起来了的和平国家。,,,,,,,,
3,忘记过去就意味着背叛！,,,,,,,,
3,位卑未敢忘忧国，哪怕无人知我。,,,,,,,,
3,请你们务必要记住勿忘国耻！振兴中华！不要把后面那句忘了。,,,,,,,,
3,不能忘，不可原谅，更不能打破这和平,,,,,,,,
3,不管你们说什么都可以，但是永远不要去说原谅，你不配，你没资格,,,,,,,,
3,连一句道歉都没有，这就是“武士道精神”？,,,,,,,,
3,我就是狭隘民族主义，只对日本,,,,,,,,
3,"其实吧，作为晚辈的我们没有资格去评判这场历史。<img alt=""[捂脸]"" class=""small"" src=""//i0.hdslb.com/bfs/emote/6921bb43f0c634870b92f4a8ad41dada94a5296d.png@100w_100h.webp""/>我们唯一有资格的就是记住这个耻辱，防止历史的重演，并且让他们承认，让他们自己打自己的脸，<img alt=""[生气]"" class=""small"" src=""//i0.hdslb.com/bfs/emote/3195714219c4b582a4fb02033dd1519913d0246d.png@100w_100h.webp""/>所以为祖国效力才是我们晚辈应该做，<img alt=""[打call]"" class=""small"" src=""//i0.hdslb.com/bfs/emote/431432c43da3ee5aab5b0e4f8931953e649e9975.png@100w_100h.webp""/>而不是坐在屏幕前，什么事都不做，手机或电脑上，去评判这种历史。<img alt=""[生气]"" class=""small"" src=""//i0.hdslb.com/bfs/emote/3195714219c4b582a4fb02033dd1519913d0246d.png@100w_100h.webp""/>",,,,,,,,
3,当然，没有人记得300000个名字，也许是300001个名字，也许是300002个。多一个人，就多一个悲剧。我不相信亡灵，不相信来生。所有逝者倒在血与污泥之中。所有悲愤化作对胜利的渴望。南京不会死 因为她必须活着，去见证中国未来的道路。,,,,,,,,
3,今年7月去参观的南京大屠杀纪念馆，进馆前有工作人员广播不断强调，万人坑禁止拍照，我在进馆前手机就静音了，可是还是有一些游客拿出手机谈论拍照。真的很让人气愤，死者为大，请参观的游客尊重那些不幸的逝者。,,,,,,,,
3,我们要勿忘国耻而不是勿忘复仇,,,,,,,,
3,那些说血债血偿的😢我们要做的是保卫和平谋求发展好吗,,,,,,,,
3,怎么说我发表一下我的拙见：日本直到今天都没有道歉是事实，一直拜着靖国神社也很恶心，因为各个国家都要从自身的利益出发，日本的课本里面几乎没有关于南京大屠杀的描写，所以可以说大部分现代日本人对于南京大屠杀了解甚少，或者是几乎不知，这点要说他们的右翼政府的教育管理打心底里就不想让现在日本人觉得他们当年有做过这种错事，一直在逃避，就算有日本人知晓关于南京大屠杀的一分一毫，他们也会装作不知道觉得这件事情跟他们没有关系他们没有错，而事实正好与他们所想相反。不扯什么平民无罪论，既然日军当年能那么猖狂地在中国横行，当时的日本人民肯定也是冒足了劲儿的想要攻打中华（）马上就2020年了，勿忘国耻，振兴中华。我们要做的是铭记历史，铭记国耻，铭记这场惨剧，而不是一直记着永远的对日本的仇恨，但日本人一天不道歉，我们就一天不原谅。现在主流指向和平发展，不管在什么公众场合发表一些偏激的言论都是不对的，更有甚者在洗地。而现在的我们要做的就是努力学习，来振兴中华。,,,,,,,,
3,"很喜欢日本的文化和日本人 但是每次想到南京大屠杀这些事 就会很矛盾。。有的时候补番都会想起这些。。虽然我知道以前发动侵略的日本帝国主义和现在的日本人不在一个概念上。。但似似毕竟都是日本。。难道是我的想法太极端了嘛  蒸的不知道该怎么正确看待这件事<img alt=""[蛆音娘_扶额]"" src=""//i0.hdslb.com/bfs/emote/a4d8f95baaa24821fd591a7dbeee1b869e760f59.png@100w_100h.webp""/>",,,,,,,,
3,看到评论里说原谅的，你有什么资格说，有什么资格替他们原谅。要是你被一群人任意欺凌，甚至想置你于死地，却有人劝你原谅他们，你会甘心吗？,,,,,,,,
3,今年来南京读书，在警报拉响的那一刻，突然真正意识到脚下的每一寸土地都有可能染过鲜血。,,,,,,,,
3,1.日本都在等我们忘记，巴不得我们都忘记，等这些证人逝世，好彻底否认历史歪曲历史，好美化侵略，在让日本一代代淡化否定这一-段历史，需要警惕!绝不能忘记! ! !2.现在的历史观点把当时的日本老百姓和侵略者分开，是为了团结更多人，方便我们的现实外交关系，但不意味着这些老百姓真的无辜!并不是真的手上没沾血!并不是他们没助纣为虐!有些人喜欢日本有些文化没错，但说话讲点良心，不是什么错误都能原谅的，尤其是别人死不承认甚至歪曲时，甚至还沉浸招核时代的美梦里时，况且，你也没资格原谅!,,,,,,,,
3,原谅么？起码我们这代人说不出口！我们只能记住。如果和平，我们尊重和平的人，如果战争，我想每一个人都不要怯懦,,,,,,,,
3,我们不是当年的受害者，也不是当年那些幸存者所以我们没有资格替他们原谅当年的刽子手！,,,,,,,,
3,我们不想踏平东京，只想要一个道歉就够了……日本政府蒙蔽人民的反动行为还想继续多久呢？,,,,,,,,
3,？散播什么极端言论了，又没让人去做些什么，这只是了解历史吧,,,,,,,,
3,历史要铭记 至于原谅？ 谁有资格原谅？用国庆时的一句话 战旗为什么美如画 英雄的鲜血染红了它 国旗为什么是红的 那是几千万同胞用生命换来的 谁有资格替那几千万死在日本人手上的  同胞说原谅？,,,,,,,,
3,"下面推荐就是安倍问好的视频，真是讽刺<img alt=""[吐]"" class=""small"" src=""//i0.hdslb.com/bfs/emote/06946bfe71ac48a6078a0b662181bb5cad09decc.png@100w_100h.webp""/>",,,,,,,,
3,"中国人民与日本人民是一致的,只有一个敌人,就是日本帝国主义与中国民族败类。--毛主席",,,,,,,,
3,我们后辈没有资格替先辈原谅,,,,,,,,
3,https://m.baidu.com/s?from=1012852y&amp;word=%E4%BB%8A%E5%A4%A9%E7%9A%84%E5%8D%97%E4%BA%AC%E5%9F%8E%EF%BC%8C%E5%9C%A8%E7%AD%89%E4%B8%89%E5%8D%81%E4%B8%87%E4%BA%A1%E9%AD%82%E5%9B%9E%E5%AE%B6,,,,,,,,
3,我不管你是日本人也好，还是什么其他的也好，你支持军国主义，对不起，我们不认识,,,,,,,,
3,"卑微原画报道，负责了小时候回忆的那部分<img alt=""[小电视_笑]"" src=""//i0.hdslb.com/bfs/emote/f80d384875183dfe2e24be13011c595c0210d273.png@100w_100h.webp""/>感谢策划对我的拖稿不杀之恩",,,,,,,,
3,我本来不想说话。但看到弹幕里，我就知道。还有很多的中国年轻人。根本没有看懂这个动画。中国年轻人的仇恨太廉价。,,,,,,,,
3,"日本的罪行<img class=""jump-img"" src=""https://i0.hdslb.com/bfs/activity-plat/static/20201110/4c8b2dbaded282e67c9a31daa4297c3c/AeQJlYP7e.png""/><a class=""comment-jump-url"" data-report=""0"" href=""//www.bilibili.com/video/av8423512"" target=""_blank"">海岛的故事（中文字幕）</a>",,,,,,,,
3,为什么要用日漫风做动画？这眼睛这鼻子这下巴就连旗袍都掩盖不了的风格.......,,,,,,,,
3,打了很多字，又删了很多字。觉得还不如一句话来得痛快:狗日的日本鬼子(╯●皿●)╯┻━┻,,,,,,,,
3,我真的搞不懂现在有些人会觉得爱国好像很羞耻很“老土”说不出口，我看这个视频哭了一会儿，夜宵凉了。今天看到一句话说今天南京一定很挤，因为有80万人要回家，突然觉得很伤很伤，伤到骨子里了。今天本来胃有点疼，看到这个心脏开始疼了。我们在温暖的屋里，他们在冰冷的地底,,,,,,,,
3,把我看哭了，真的好难受，明明我们现在生活的已经很好了，虽然还仍有不足，但我们一直在进步，不是吗？为什么还有人还在说着中国的不好呢，多少先辈用鲜血换来我们现在的盛世，而那怕是现在，仍还有着无数人为我们负重前行，我们那还有资格去要求别人为我们肩负起更多?大屠杀中那些已经走远的人们啊，你们看到了吗，中国!这头东方巨龙，早已腾飞啊！！（愿我高中毕业后能在应用气象上为国家献上我那微弱的一份力，加油吧）,,,,,,,,
3,今天的南京很拥挤   因为有30 万人要回家,,,,,,,,
3,我们可以不原谅，但是你不能不道歉！,,,,,,,,
3,回复 @MIR_E :日本人没错。错的事日本鬼子。那些法西斯主义的人啊。当年，也有日本人知道了中国的真相，他们也想家，为了和平，甚至投靠中国。还有私下在日本宣传爱和平不战争支持中国共产党。错的，一直都是法西斯主义的日本鬼子啊……,,,,,,,,
3,我们没有人能够替死者说原谅！勿忘国耻，牢记历史！同胞安息♥,,,,,,,,
3,"我看到还有人说什么原子弹下日本婴儿非常的无辜，说他们什么也没做。我在想那我们中国人的婴儿，在日本人的屠刀下就不无辜了？难道他们就做了什么伤天害理的事？就该这样？<img alt=""[生气]"" class=""small"" src=""//i0.hdslb.com/bfs/emote/3195714219c4b582a4fb02033dd1519913d0246d.png@100w_100h.webp""/>",,,,,,,,
3,你记得吗，三十万这个数字不是三十，三百如果！把你身边人的细数有一天他们全部在你身边倒下那样的恨，请问你能原谅吗…,,,,,,,,
3,祭抗战死难之生命，悼血与火侵染之地。哀黎庶无辜灾难殷殷，思捐躯洒血浩气干云。敬诚勇牺牲不屈抗争，志九州崛起奋发图强。祀我国殇，国行公祭。暴行暴虐，共御外侮。昭昭前事，惕惕后人。                                    —国家公祭网,,,,,,,,
3,每12秒就死掉一个人，12秒啊！心痛,,,,,,,,
3,还有人说B站不爱国的。京阿尼烧了就只有番剧区变灰。公祭日首页都灰了。,,,,,,,,
3,"那年乱世如麻，愿你们来世锦绣繁华。第1下看到这个弹幕的时候我哭了<img alt=""[大哭]"" class=""small"" src=""//i0.hdslb.com/bfs/emote/2caafee2e5db4db72104650d87810cc2c123fc86.png@100w_100h.webp""/>",,,,,,,,
3,这么多年我都不换这个有点蠢的头像，也算有意义,,,,,,,,
3,好好提升自己素质，报效祖国，才是正确对待态度，而不是嘴里嚷嚷着我要复仇，然后一边在现实生活是个废物,,,,,,,,
3,那些老人们一直在等待着日本的一句对不起，而日本的一些人却盼着他们尽早死去......,,,,,,,,
3,我太爷爷当年被抓去当伪军。他们那里有不成文的规定，打八路军时，往天上放枪。真的蛮感动的,,,,,,,,
3,我根本不在乎他们道不道歉！！我不在乎！这是国耻！更是国恨！！我不在乎他们道不道歉认不认错！因为我绝不会原谅！我就是要抱着这样的恨，和对先辈的感激传给我的下一代，繁荣和苦难都是民族的灵魂的构成，民族不能没有灵魂！所以更不可以忘了恨！记住这些并不是为了报复加害者，最重要的是让我们的孩子们明白一个道理，这个世界上，弱者没有选择权，只有我们强大了，我们才有权利做要不要践踏他人的选择题，弱小只能被践踏，没有选择！,,,,,,,,
3,"今天又看了遍金陵十三钗，哭死<img alt=""[大哭]"" class=""small"" src=""//i0.hdslb.com/bfs/emote/2caafee2e5db4db72104650d87810cc2c123fc86.png@100w_100h.webp""/>",,,,,,,,
3,没有道歉，就无法原谅，历史太惨痛了，应该铭记,,,,,,,,
3,我这个人玻璃心，不敢看，但我从未忘记国耻、国难等国家大事，点个赞走了。,,,,,,,,
3,“国之大事，在祀与戎。”——《左传•成公十三年》,,,,,,,,
3,我们的目的不是加剧仇恨而是勿忘国耻，振兴中华，这段历史我们不能忘，也绝不该忘记,,,,,,,,
3,啥时候道歉了，把靖国神社拆了，承认自己的错误了，在说原谅不原谅的事,,,,,,,,
3,愿世界永远和平。,,,,,,,,
3,勿忘,,,,,,,,
3,"希望越来越多的中国人能看到之前去南京大屠杀纪念馆的时候，发现他们根本就不是来纪念烈士的……而是过来游玩的<img alt=""[捂脸]"" class=""small"" src=""//i0.hdslb.com/bfs/emote/6921bb43f0c634870b92f4a8ad41dada94a5296d.png@100w_100h.webp""/>",,,,,,,,
3,居然是乐正兄妹！！！,,,,,,,,
3,如何看待当今日本极力掩盖南京大屠杀等侵略史？(1)日本对于这场战争的反省态度:不断地跑到靖国神社去参拜战犯，不断美化历史上的那些战争罪犯，还在篡改侵华历史，否定侵华暴行，篡改教科书等一系列问题上，不断向战争受害国挑衅。(2)日本否认侵华历史，具有多方面的原因:一是由于战后美国对日本的袒护，对日本军国主义肃清的不彻底。二是日本岛国文化的狭隘性，使他们没有承担战争责任的胸怀和勇气。三是战后东亚的国际环境没有形成要求日本政府反省的强大压力。(3)我们记住历史的目的:是要唤醒人类的良知，以求不让类似的悲剧重演，对今天，日本军国主义的死灰复燃，重新抬头，我们必须保持高度警惕，同时我们应该发扬团结奋斗的抗战精神肩负起民族复兴的大任，勿忘国耻，振兴中华！,,,,,,,,
3,我们没资格原谅他们，我们能做的只有勿忘国耻，振兴中华，珍惜和平,,,,,,,,
3,"不需要日本道歉，一个骨子里都是侵略二字，有几分可信？信不过！等着对手公开道歉不如自己发展，让所有人都能听见中国声音，永远牢记日本犯下的罪行，不让悲剧再次发生。想掩盖自己的龌龊？没门！想都别想！极少数日本人那叫日本友人，剩下的又有几个承认过上一辈犯下的错误？还不是间接为侵略者服务，那些睿智评论洗白的真是服了。不做评价，都懂。         还有，真的很佩服那个年代人的勇气。也再次愿那些无辜的人得以安息。<img alt=""[大哭]"" class=""small"" src=""//i0.hdslb.com/bfs/emote/2caafee2e5db4db72104650d87810cc2c123fc86.png@100w_100h.webp""/><img alt=""[大哭]"" class=""small"" src=""//i0.hdslb.com/bfs/emote/2caafee2e5db4db72104650d87810cc2c123fc86.png@100w_100h.webp""/><img alt=""[大哭]"" class=""small"" src=""//i0.hdslb.com/bfs/emote/2caafee2e5db4db72104650d87810cc2c123fc86.png@100w_100h.webp""/>",,,,,,,,
3,我不敢去纪念馆，不忍看。,,,,,,,,
3,空一座城，等三十万亡魂。点一盏灯，祭朗朗乾坤。怀一颗心，求人间安稳。哀一个国，念我华夏故人。——转自微博,,,,,,,,
3,"中国不会亡中国不会亡远征军健儿浴血拼杀上战场枪,在我们肩上血,在我们胸膛庄严的军旗在炮火中飘扬宁死不后退宁死不投降日寇强敌不敢挡,不敢挡!中国不会亡中国不会亡远征军健儿浴血拼杀上战场枪,在我们肩上血,在我们胸膛到缅甸去吧,走上国际的战场宁死不后退宁死不投降日寇强敌不敢挡,不敢挡",,,,,,,,
3,历史可以被原谅，但那些不尊重历史的混蛋绝不可原谅！！！,,,,,,,,
3,不止南京。就我们那个小地方，都有一个万人塚，上面画着百姓被铁链穿过肩胛骨，一串人就这样赶下海。我每次看着海都会想着那时候，海里究竟沉了多少尸体,,,,,,,,
3,很久没哭过了，真的,,,,,,,,
3,"不承认历史罪刑的日本人是中国人及支持中日友好的日本人的共同敌人""。这与人民和政府无关的。",,,,,,,,
3,战争没有任何一个日本人是对的，哪怕只有一小部分的人知道错，去忏悔。那只是一小部分罢了。我们终希望他们可以有一天出来道歉，承认那段历史,,,,,,,,
3,愿中国青年都摆脱冷气，只是向上走，不必听自暴自弃者流的话。能做事的做事，能发声的发声。有一分热，发一分光，就令萤火一般，也可以在黑暗里发一点光，不必等候炬火。——鲁迅,,,,,,,,
3,今天间操我们学校正常跑操，没有降半旗没有默哀没有演讲，校领导连提都没提今天是什么日子……918的时候也是……心凉半截,,,,,,,,
3,永远不会原谅日本,,,,,,,,
3,难怪江苏台是灰色图标,,,,,,,,
3,公祭日团团头像黑白了！！！勿忘国耻！,,,,,,,,
3,无论哪种形式的战争，都不可能靠嘴巴跟口水打赢，一切都要靠实力说话。,,,,,,,,
3,"愿这盛世的阳光足够闪耀，足以照亮他们回家的方向。<img alt=""[小电视_哭泣]"" src=""//i0.hdslb.com/bfs/emote/938bdf98df945576ae88e2a22931db07ded9e663.png@100w_100h.webp""/>",,,,,,,,
