链接,标题,播放数量,弹幕数量,发布日期,点赞数量,硬币数量,收藏数量,转发数量,评论数量
3,"侵略者和日本上层是有罪的，是我们应该仇恨的，也不能把这份恨施加给所有日本国民。大部分平民和我们一样痛恨战争，并且希望早点结束啊。当然某些脑子不好使的平民就算了吧<img alt=""[无语]"" class=""small"" src=""//i0.hdslb.com/bfs/emote/44667b7d9349957e903b1b62cb91fb9b13720f04.png@100w_100h.webp""/>",,,,,,,,
3,记住历史，与其自己人在国内纠结什么日本人道不道歉，更该记住落后就要挨打，哪天我们真的有觉得的实力了，他们自然屁颠屁颠过来道歉了，反过来你骂上天也不会有什么卵用,,,,,,,,
3,日本人民是人，我国人民就不是人了？作为中国人，就要为中国的核心利益做主，不然全是汉奸。日本人民也不是无辜的，那些抖机灵搞区分的，先把中国居民身份证删了,,,,,,,,
3,建议日漫痴好好看看,,,,,,,,
3,“友好归友好历史归历史”——选自电影《黑太阳》,,,,,,,,
3,差评手机版B站没有灰屏，明明网页版都灰屏了,,,,,,,,
3,扯来扯去有啥用，日本人的行为跟红警里打矿车，星际里打农民的人差不多。我从不想日本人的大屠杀有多少，我只会想当时tm的为啥没多扔两核弹去日本。我情愿当时的中国能打到日本本土，至少你给我一拳我得打回去，这样或许会好受一些。,,,,,,,,
1,不能点赞吗,,,,,,,,
1,今天我来了,,,,,,,,
1,勿忘国耻，铭记历史,,,,,,,,
1,2020-12-13人在国外读书，在疫情和冬天的交织下瑟瑟发抖，但是来这纪念83年前的日子时，却有一种内心淡淡的温暖。我们中国已经不是那时的中国了,,,,,,,,
1,对不起 刚刚手贱点了一下赞 取消了,,,,,,,,
1,为逝去的三千五百万亡魂默哀，为蒸蒸日上的华夏自豪。,,,,,,,,
1,日本人根本从未道歉过，最可恨的是跟别的国家都道歉了单单越过中国，谈何原谅……,,,,,,,,
1,不是什么东西都能随便放下的，原谅日本人？现世没有任何一个晚辈有这个资格，战争期间全民皆兵，当时的日本可没有什么平民,,,,,,,,
1,我们要硬起来，那些欺善怕恶的魔鬼才会被打倒,,,,,,,,
1,民族血耻，吾辈永不敢忘。,,,,,,,,
1,这是每年都有么？,,,,,,,,
1,血海深仇，没齿难忘！,,,,,,,,
1,那什么，12月13我生日。。。,,,,,,,,
1,"我的个天呐。。。这里面明明没有一个人说要原谅日本啊，满评论的都说不能原谅日本，<img alt=""[无语]"" class=""small"" src=""//i0.hdslb.com/bfs/emote/44667b7d9349957e903b1b62cb91fb9b13720f04.png@100w_100h.webp""/>",,,,,,,,
1,"请不要替前人原谅日本人  因为你不配这句话我也会记在心里 <img alt=""[微笑]"" class=""small"" src=""//i0.hdslb.com/bfs/emote/685612eadc33f6bc233776c6241813385844f182.png@100w_100h.webp""/><img alt=""[微笑]"" class=""small"" src=""//i0.hdslb.com/bfs/emote/685612eadc33f6bc233776c6241813385844f182.png@100w_100h.webp""/>",,,,,,,,
1,可悲的是在小区里，就我和隔壁一些经常聊天的老爷爷老奶奶在默哀，一些家长和小朋友还在那里嘻嘻闹闹。10点了，可能防空声音小，但是我时十点自觉，不是要听你什么报警声音。,,,,,,,,
1,所以，后辈们永远没有资格替先烈们原谅侵华日本！,,,,,,,,
1,勿忘国耻，振兴中华！,,,,,,,,
1,"我刚开始还没意识到为什么没有赞，看完后突然想到了赶紧取消了……<img alt=""[大哭]"" class=""small"" src=""//i0.hdslb.com/bfs/emote/2caafee2e5db4db72104650d87810cc2c123fc86.png@100w_100h.webp""/>真的，这种没有宣告的集体行为（不点赞）真的震撼到我了，我们是有民族力的！勿忘国耻振兴中华！🇨🇳🇨🇳🇨🇳🇨🇳🇨🇳🇨🇳🇨🇳🇨🇳🇨🇳🇨🇳",,,,,,,,
1,鸣笛，并不是演的，我们这边高速路一样,,,,,,,,
1,日本，请你记住你当初为什么被炸报应是有的我们不会原谅你永远不会,,,,,,,,
1,勿忘国耻，没有人能代表牺牲的几千万同胞说原谅,,,,,,,,
1,"南京日报出来挨打<img alt=""[doge]"" class=""small"" src=""//i0.hdslb.com/bfs/emote/bba7c12aa51fed0199c241465560dfc2714c593e.png@100w_100h.webp""/>",,,,,,,,
1,让我想起扬州十日，也应该建立一个受害者纪念馆来着,,,,,,,,
1,"<img alt=""[大哭]"" class=""small"" src=""//i0.hdslb.com/bfs/emote/2caafee2e5db4db72104650d87810cc2c123fc86.png@100w_100h.webp""/>",,,,,,,,
1,对不起，封面乍一看还以为南京被轰炸了,,,,,,,,
1,这不是演，我现在看到这个视频，隔着屏幕都泪目，是个中国人都会有感触。,,,,,,,,
1,"为什么我是第一个赞<img alt=""[热词系列_知识增加]"" src=""//i0.hdslb.com/bfs/emote/7496ff01fbac5304aa807732f1531d5986a0dfc3.png@100w_100h.webp""/>",,,,,,,,
1,这座巨大的城市在哭泣。,,,,,,,,
1,难过,,,,,,,,
1,这不应是南京城的纪念，更应是整个国家民族的记忆，忘记历史就是背叛，九一八，卢沟桥，南京沦陷，国耻日，国祭日，哪一“节点”个都不能因为所谓的现实的需要被淡化，知耻后勇，生于忧患，居安思危才是一个强大的民族！,,,,,,,,
1,爸爸：“儿子，我们玩个游戏好吗？待会有人假装把爸爸抓走，你要躲在这里，如果天黑前你能不哭不闹，我回来一定给你奖励…” 后来，几个穿黄军装的人把爸爸带走，再也没回来。【83】年了，儿子经常想象爸爸会突然出现在他面前，给他奖励。 但儿子知道这不可能了：因为那年，是1937年，那个地方，叫南京,,,,,,,,
1,九世犹可以复仇乎？虽百世可也。,,,,,,,,
1,这种仇恨，没有人有资格让我们“忘记过去”，牢记国耻，中国才能越来越强大。,,,,,,,,
1,历史永远铭记，血海深仇每个中华儿女永不忘记，逝者安息，生者铭记！！！,,,,,,,,
1,铭记历史 勿忘国耻,,,,,,,,
1,公祭仪式不是为了仇恨……更像是立誓。意在告诉全世界。“这样的事情，我记得，而且没有下次了！”,,,,,,,,
1,希望各位也不要忘记那些保卫祖国的国军将士们,,,,,,,,
1,12月13号是我生日。,,,,,,,,
1,"二次元是不是不能守护了？<img alt=""[笑哭]"" class=""small"" src=""//i0.hdslb.com/bfs/emote/c3043ba94babf824dea03ce500d0e73763bf4f40.png@100w_100h.webp""/>",,,,,,,,
1,我看过有日本人在南京耀武扬威。在金钱利益面前，很难维持的,,,,,,,,
1,中国近代史就是一部民族的悲壮史，铭记历史，吸取教训，珍惜和平。,,,,,,,,
1,愿战争永不发生，无辜的人不用再为物权而牺牲。,,,,,,,,
1,勿忘国耻，警钟长鸣。,,,,,,,,
1,后辈们你们没有资格替先人原谅日本,,,,,,,,
1,泪目,,,,,,,,
1,"然后只有你在录视频<img alt=""[doge]"" class=""small"" src=""//i0.hdslb.com/bfs/emote/bba7c12aa51fed0199c241465560dfc2714c593e.png@100w_100h.webp""/>",,,,,,,,
1,像是整个城市在哭泣,,,,,,,,
1,"我加一句<img alt=""[吃瓜]"" class=""small"" src=""//i0.hdslb.com/bfs/emote/4191ce3c44c2b3df8fd97c33f85d3ab15f4f3c84.png@100w_100h.webp""/>五千年前， 我们和古埃及人一样面对洪水四千年前， 我们和古巴比伦人一样玩青铜器。三千年前， 我们和古希腊人一样思考哲学两千年前， 我们和罗马人一样四处征伐一千年前我们和阿拉伯人一样无比富足现在我们和美利坚一较长短五千年了 我们一直在世界的牌桌上而牌桌对面的人却换了一轮又一轮",,,,,,,,
1,南京那天很堵，因为有30万人要回家,,,,,,,,
1,这有什么用？,,,,,,,,
1,其实不太明白为什么日军几十个人能押着几万个人。,,,,,,,,
1,"11月14日的时候我们也拉响警报了，是在课间操，结束后是历史课，老师为我们为什么拉警报，抓出来一堆没听课没被书的<img alt=""[捂脸]"" class=""small"" src=""//i0.hdslb.com/bfs/emote/6921bb43f0c634870b92f4a8ad41dada94a5296d.png@100w_100h.webp""/><img alt=""[捂脸]"" class=""small"" src=""//i0.hdslb.com/bfs/emote/6921bb43f0c634870b92f4a8ad41dada94a5296d.png@100w_100h.webp""/><img alt=""[捂脸]"" class=""small"" src=""//i0.hdslb.com/bfs/emote/6921bb43f0c634870b92f4a8ad41dada94a5296d.png@100w_100h.webp""/><img alt=""[笑哭]"" class=""small"" src=""//i0.hdslb.com/bfs/emote/c3043ba94babf824dea03ce500d0e73763bf4f40.png@100w_100h.webp""/><img alt=""[笑哭]"" class=""small"" src=""//i0.hdslb.com/bfs/emote/c3043ba94babf824dea03ce500d0e73763bf4f40.png@100w_100h.webp""/><img alt=""[笑哭]"" class=""small"" src=""//i0.hdslb.com/bfs/emote/c3043ba94babf824dea03ce500d0e73763bf4f40.png@100w_100h.webp""/>",,,,,,,,
1,别点赞啊啊啊，永远不要在这类视频上点赞,,,,,,,,
1,勿忘国耻！！！！,,,,,,,,
1,那个图书馆好像是南信大，我的学校,,,,,,,,
1,"当南京警报想起的时候，我的头皮一阵发麻<img alt=""[战双帕弥什_作战预备]"" src=""//i0.hdslb.com/bfs/emote/82d3b0c747cff3e8523cfd10e0e58c03dac885a3.png@100w_100h.webp""/>",,,,,,,,
1,等等，你们不给视频点赞？,,,,,,,,
1,血汗深仇 永世不忘,,,,,,,,
1,牢记历史，有机会一定要把种花家的蘑菇弹扔掉几百颗在那只瘟鹤家的窝里！,,,,,,,,
1,看得我眼水直滚，勿忘国耻！,,,,,,,,
1,距离这样一场屠杀发生也才不过几十年……铭记💔💔,,,,,,,,
1,犯我中华者虽远必诛！,,,,,,,,
1,不原谅日本，但是也不盲目仇恨日本,,,,,,,,
1,抱歉，看了下面的评论手贱点了赞，已取消,,,,,,,,
1,铭记历史，勿忘国耻,,,,,,,,
1,牢记历史，勿忘国耻！,,,,,,,,
1,我卡bug了？我是第一个赞？？？,,,,,,,,
1,我在想，当时在场的日本人会是什么心情,,,,,,,,
1,希望人们不会因为时间长久了而麻木，不要把这当做是一件麻烦事，这是每个人的责任。,,,,,,,,
1,南京人一年可以364天吊儿郎当，但12月13号绝对不可以,,,,,,,,
1,"别的不敢说，在这里评论点赞的人真是爱国的。听说为了纪念南京大屠杀，小破站就直接变灰了，而且好像只有小破站变灰了<img alt=""[囧]"" class=""small"" src=""//i0.hdslb.com/bfs/emote/12e41d357a9807cc80ef1e1ed258127fcc791424.png@100w_100h.webp""/><img alt=""[囧]"" class=""small"" src=""//i0.hdslb.com/bfs/emote/12e41d357a9807cc80ef1e1ed258127fcc791424.png@100w_100h.webp""/>",,,,,,,,
1,想哭，想起去南京纪念馆的情景，感觉跟自己死去了一样…触目惊心，愤怒，恐惧，无力感交织在一起…一定要好好爱我们的国，好好建设我们的家，要自强自立，要强大，不要再给人践踏伤害的机会！,,,,,,,,
1,只要每次想到先辈们受的苦难我就对日本这个国家和人民完全没有好感,,,,,,,,
1,大家别点赞，这玩笑咱别开。,,,,,,,,
1,我就一句话，今人没资格替惨死的前人原谅日本！,,,,,,,,
1,我们活着的人没资格原谅当年日本的行为,,,,,,,,
1,"勿忘国耻为本，可恨的是军阀以及某些参政人希望能保持理性的去看待这件事，就像视频里在南京生活的人一样，不会因为你是日本人，因为发生过南京大屠杀而去仇视每一个日本民众，虽然我恨日本，却不是我肆意妄为的借口。日本曾经的行为不可否认不能原谅，我们后辈也不具有原谅的资格，只希望能理智的去对待。三观不正的人除外。<img class=""jump-img"" src=""https://i0.hdslb.com/bfs/activity-plat/static/20201110/4c8b2dbaded282e67c9a31daa4297c3c/AeQJlYP7e.png""/><a class=""comment-jump-url"" data-report=""1"" href=""//www.bilibili.com/video/av21652467"" target=""_blank"">社会实验：当日本人在南京街头求助，路人们的反应让人惊讶！</a>",,,,,,,,
1,30万同胞，手无寸铁，男女老幼，孕妇老人，皆被屠杀，血债累累，日本一日不向我国忏悔，我必视日本为永世之敌！不共戴天！,,,,,,,,
1,对不起，我点赞了，发现没有赞，我知道我错了。,,,,,,,,
1,此仇此恨，定不莫忘。,,,,,,,,
2,对于某些人，我就问一句。有些东西是道歉就能弥补的吗？,,,,,,,,
1,一个国家走向强大之路的信号,,,,,,,,
1,120万播放，0点赞，本来看完视频嗓子里哽着，看到这眼泪就下来了，120万人无言的默契，来表达同一份悼念,,,,,,,,
1,抗日战争也就才过多久，有些人就已经失忆了,,,,,,,,
1,即使过了一百年 一千年 一万年，只要中国还在，就不能忘记国耻,,,,,,,,
1,我家就在沈阳918纪念馆附近,,,,,,,,
1,南京是我一辈子都不想去的地方。反正就是不想去。,,,,,,,,
1,#南京***#为什么***会给和谐啊,,,,,,,,
1,30万南京魂，回家了～,,,,,,,,
1,勿忘国耻，死者安息～🙏🙏🙏🙏🙏🙏,,,,,,,,
1,"有点赞但不会显示数字，点赞的意思现在比较广泛，不是以前那么单一，有推荐、顶起、认同等的意思<img alt=""[害羞]"" class=""small"" src=""//i0.hdslb.com/bfs/emote/9d2ec4e1fbd6cb1b4d12d2bbbdd124ccb83ddfda.png@100w_100h.webp""/><img alt=""[吃瓜]"" class=""small"" src=""//i0.hdslb.com/bfs/emote/4191ce3c44c2b3df8fd97c33f85d3ab15f4f3c84.png@100w_100h.webp""/>不必纠结",,,,,,,,
1,看着视频我挺难过的，虽然我不是南京人，但我是中国人,,,,,,,,
1,问题来了...谁拍的呢O_o,,,,,,,,
1,感觉B站里的上海人多，上海人在我的映像里有相当一部分人不反感日本甚至很亲近日本！,,,,,,,,
1,人家都没道歉，原谅个屁啊,,,,,,,,
1,只有扛过镰锤旗的日本人有资格被原谅。,,,,,,,,
1,你好乐山也被炸过但是说法不一可以肯定的是，当时要炸的本来不是乐山，而是炸错了。,,,,,,,,
1,勿忘国耻，以史为鉴,,,,,,,,
1,我在……谢谢学校到我们经历一次,,,,,,,,
1,勿忘国耻，牢记历史,,,,,,,,
1,哭了,,,,,,,,
1,中国现在还不够强，远远不够，有人说国家总是谈判谈判，说是强国怎么不真刀真枪的打……因为中国面对的是一群发展国家在经济，军事，文化上的入侵和围追堵截，我们需要很强，强到能够主宰世界，到时候连本带利一起慢慢算（反正我是这样想的，钢筋别来）,,,,,,,,
1,看着南京曾经 一刀刀刻在我们灵魂深处的痛 即使隔着岁月长河 不能忘记国耻 和屈辱,,,,,,,,
1,春秋无义战,,,,,,,,
1,1937年民国政府首都南京被日本军队屠城，死者失踪者约为45万,,,,,,,,
1,早晚有一天会对他们国家做同样的事,,,,,,,,
1,若是仇恨可以模糊，乃至遗忘，那么心无法原谅自己。,,,,,,,,
1,我们可以放下历史，但我们不会忘记它,,,,,,,,
1,还要这样所有人都停下？,,,,,,,,
1,空一座城，等30万的魂,,,,,,,,
1,不原谅,,,,,,,,
1,为神马就一个赞？！被做了什么手脚！,,,,,,,,
1,我以后对自己的孩子上的第一节课，就是日本侵华。铭记历史。永不忘记,,,,,,,,
1,"918的时候我按喇叭把车电瓶按亏电了。。找人搭的火才继续开走<img alt=""[笑哭]"" class=""small"" src=""//i0.hdslb.com/bfs/emote/c3043ba94babf824dea03ce500d0e73763bf4f40.png@100w_100h.webp""/>勿忘国耻！",,,,,,,,
1,刚在这之前我看到了类似的视频下面确实各种吹来留学的黑人的他们是真正龙的传人？我这次选择默默的看的然后再看到这个视频不知道为什么长叹一口气心里莫名的忧伤,,,,,,,,
1,建议警察叔叔查处那些在评论区里不尊重祖国和遇难同胞的“CS”的ip严惩这群吃里扒外的dx,,,,,,,,
1,我在南京的一所普通大学，早上响起防空警报时正是上下课的高峰期，我永远都会记得那一分钟。所有人都停下了脚步，仿佛时间静止了,,,,,,,,
1,"之前去南京刚进纪念馆看到那个雕塑眼泪都下来了，他们受了太多苦了<img alt=""[大哭]"" class=""small"" src=""//i0.hdslb.com/bfs/emote/2caafee2e5db4db72104650d87810cc2c123fc86.png@100w_100h.webp""/>",,,,,,,,
1,当天在南京的日本人瑟瑟发抖,,,,,,,,
1,铭记历史，勿忘国耻,,,,,,,,
1,"手里的ps4,我想扔进垃圾桶，日本货，哎，看了ps5,4k 120hz真香",,,,,,,,
1,一个国家最不能忽视的就是教育与国防，前者决定这个国家百年内能走到什么地步，后者则决定这个国家能否撑过百年。——《黎明之剑》想想过去的侵华战争和现在的香港废青，真是有道理。,,,,,,,,
1,勿忘国耻振兴中华,,,,,,,,
1,我没有资格替老战士们原谅当年的日本人，但我会原谅所有正视历史，愿意中日友好的当代日本人，其他的，通通当鬼子处理，就算是给洗脑的也一视同仁，国家政策必须得有人买单，哪怕它是错的。个人对日本文化的喜爱和对平民的怜悯在国家安危面前一文不值，要不哪天日本想反杀了还搁这儿圣母呢,,,,,,,,
1,"第一次觉得汽车鸣笛声这么悦耳<img alt=""[委屈]"" class=""small"" src=""//i0.hdslb.com/bfs/emote/d2f26cbdd6c96960320af03f5514c5b524990840.png@100w_100h.webp""/>",,,,,,,,
1,默哀,,,,,,,,
1,抗日战争可不止南京一处遭难，一寸山河一寸血，日寇的铁蹄基本踏遍了我们祖国复地，永远不要忘记！,,,,,,,,
1,🕯️,,,,,,,,
1,80多万观看，没有一个赞，很感动，勿忘国耻,,,,,,,,
1,抗日战争期间中国起码有几千万的人去世，想想这数字多么恐怖,,,,,,,,
1,化悲愤为力量,,,,,,,,
1,铭记历史，勿忘国耻！,,,,,,,,
1,"我是第一个点赞的<img alt=""[嫌弃]"" class=""small"" src=""//i0.hdslb.com/bfs/emote/de4c0783aaa60ec03de0a2b90858927bfad7154b.png@100w_100h.webp""/>",,,,,,,,
1,勿忘昔日之国耻!!!重振中华之雄威!!!,,,,,,,,
1,今天的南京很挤，因为30万冤魂要回家,,,,,,,,
1,战火为何而燃，秋叶为何而落，天性不可夺，吾辈心中亦有惑。怒拳为谁握？护国安邦惩奸恶，道法自然除心魔。战无休而惑不息，吾辈何以为战？,,,,,,,,
1,"其他人都在默哀，然而up主你在干嘛<img alt=""[滑稽]"" class=""small"" src=""//i0.hdslb.com/bfs/emote/d15121545a99ac46774f1f4465b895fe2d1411c3.png@100w_100h.webp""/>",,,,,,,,
1,勿忘国耻，吾辈自强,,,,,,,,
1,勿忘国耻 爱我中华,,,,,,,,
1,我陕西的 正考试呢警报一响所有人都站起来了,,,,,,,,
1,逝者安息🙏🏻🙏🏻🙏🏻,,,,,,,,
1,牛逼，不约而同不点赞？,,,,,,,,
1,当警报声响起，我仿佛回到了1937年城破时的南京,,,,,,,,
1,真的寒心。连这个评论里还很多年轻人给日本洗的,,,,,,,,
1,大家都很默契的没有点赞。,,,,,,,,
1,看这个视频我都快哭了,,,,,,,,
1,就是突然间只想哭,,,,,,,,
1,天下虽安，忘战必危。从来就没有什么天佑中华，只有事在人为。帝国主义有亡我之心不死，吾辈自当勒勉，持书仗剑耀中华。,,,,,,,,
1,北京一年也没有一次警报,,,,,,,,
1,勿忘国耻，振兴中华,,,,,,,,
1,珍爱和平🙏🏻🙏🏻🙏🏻,,,,,,,,
1,"有的时候看见日本被抓小辫子，被世界毒打了一顿，表面没什么，但实际内心暗笑，爽的很。当时学历史时，日本想要称霸世界，结果惹怒了好几个国家，被请吃了几颗核弹，我就说这个心态。虽然感觉说出这个心态可能会有喷子，但是就是觉得很好。<img alt=""[笑哭]"" class=""small"" src=""//i0.hdslb.com/bfs/emote/c3043ba94babf824dea03ce500d0e73763bf4f40.png@100w_100h.webp""/>。。。。。最后，为南京大屠杀默哀。",,,,,,,,
1,我就在南京上大学，上课的时候听到防空警报我们都默哀，在南京两三年了，虽然南京也有一堆毛病，但是却能从很多地方感受到老城的历史痕迹，也会产生在其他城市中感受不到的情怀。我在死难者纪念馆当过志愿者，里面气氛是很沉重的，我好几次都差点哭出来。但是我发现很多老人是很哀伤的，个别年轻人主要是情侣竟然有说有笑，还有带熊孩子进来闹腾的，虽然可能是好心但是不建议太小的孩子带进来。现在有的人生活好了可能就对以前的事不那么在乎了，可是受伤的不是我们，我们没有资格去原谅，何况日本一直否认历史。现在好像很和平，但是日本那么多人绝不可能甘心缩在一个小岛上，背后还有其他国家，帝国主义亡我之心不死，所以勿忘国耻。,,,,,,,,
1,我给南京丢脸了，我在家打游戏 没默哀,,,,,,,,
1,日本这个民族真的真的真的，不共戴天,,,,,,,,
1,不由自主地流泪了！不忘国耻，振兴中华！,,,,,,,,
1,我是第一个赞？,,,,,,,,
1,原谅他们是上帝的事，我们只用把他们送去见上帝,,,,,,,,
1,不要点赞！不要点赞！不要点赞！,,,,,,,,
1,南京在教室里上着课的时候响起了警报全体同学和老师都自发停下动作起立默哀只想说这个视频为的应是启示我们铭记历史激励我们爱国为国，振兴中华而奋斗学生，民警，工作者，都在自己的角色中敬职敬责爱国，敬业每个人都很熟悉了与其无意义地与别人争辩，不如做好自己的事勿忘国耻，振兴中华,,,,,,,,
1,默哀,,,,,,,,
1,不管怎么样我们和日本就是有世仇，,,,,,,,,
1,看了好多“理性人”的评论，我实在是忍不了了，想说两句。在看了这种视频的下面，大家发泄一下，骂两句解解气，我认为是无可厚非，只要是个中国人看了这个视频都生气，大家在网上骂两句日本人，不妨碍大家在现实生活中努力奋斗，积极发展。我就看不惯有有些人觉得自己高人一等，觉得自己比别人理智，比别人看的远，认为别人骂两句日本人就是键盘侠，就是不理智的人。我就想说大家都不是傻子，都知道就目前来说，中国确实不能和日本打仗之类的，大家也都是比较恨当年日本人所做出的罪恶行径而已，有些人非得跳出来说不能骂日本，不要有仇恨心理，显得自己很睿智一样，其实就是个“睿智”。我就想说当时中国面临的是亡国灭种的危机，说句不好听的话，要是没有挺过去，你现在就是日本人的狗，可能当狗都不是条安乐狗。现在说什么要铭记历史，不要有仇恨心理。你咋这么胸襟宽广呢？要知道日本从唐朝开始就不断入侵中国，亡我之心不死，一直到现在都是敌视中国的态度。当年日本人杀害qiang  jian我们的先辈和同胞，手段多么残忍，我们的先辈是不是无辜的？这么大的仇恨说忘记就忘记？那是不是以后你媳妇让人qiang jian了，你也能原谅呗，并且你跟你的后人说不要记仇，好好过自己的就行呗。诚然现在的中国确实还报不了仇，但是我们自己得记得这笔账，当有一天，中国强大了，就得翻翻账本了。我相信会有那一天的。,,,,,,,,
1,东北这边九一八也鸣笛，但是不像这样隆重，该干的事还继续干,,,,,,,,
1,其实很简单，日本政府什么时候来南京大屠杀纪念馆下跪道歉，并且赔偿巨款或者技术，这么道歉或许可以减缓仇恨。喊原谅就算了，如果日本人真有良知，那就来道歉不要嘴上说说，毕竟是把“斯密马赛”挂嘴上的民族。比勿忘国耻更重要的是提高强国意识，在世界上硬气点，从个人到国家。,,,,,,,,
1,记住你的耻辱，不雄起就灭亡,,,,,,,,
1,"这应该全国举行而不只是南京<img alt=""[大哭]"" class=""small"" src=""//i0.hdslb.com/bfs/emote/2caafee2e5db4db72104650d87810cc2c123fc86.png@100w_100h.webp""/>",,,,,,,,
1,现在的日本也有很多日本人知道这个事情，并不是帮日本开脱奥，我有几个日本朋友，他们还问过我这个是不是真的，我和他们讲了事情经过，他们和我说:对不起，真的很对不起！现在的日本是有一些有良知的人，但是我绝不会介意再往日本扔两颗原子弹！,,,,,,,,
1,我刚刚从日本回来，还是咋们大中华好！,,,,,,,,
1,有一说一日本被原子弹轰实属活该,,,,,,,,
1,今天南京拉起了警报，默哀一分钟，勿忘国耻,,,,,,,,
1,祝日本早日再收小男孩一枚,,,,,,,,
1,真希望这一次，你们这些口口声声“勿忘国耻”的人，真的，别再忘了,,,,,,,,
1,德国敢于承认错误，而日本政府还要去纪念侵略中国的战犯，还在教科书上淡化侵略历史，如果日本政府承认错误的态度能做到德国的一半我们也不至于厌恶他们，不过我们纪念九一八 纪念南京大屠杀死难者，不是为了报仇消灭日本，而是为了铭记历史，缅怀先烈，珍惜和平，开创未来，只有国家强大了，才能不被欺负，才能繁荣富强，我们珍惜和平，不侵略他国，但我们也不惧怕战争，毕竟不能好了伤疤忘了疼，就算我喜欢日漫，但我分得清大是大非好吧，这不冲突，这才是真正的理性爱国,,,,,,,,
1,最可笑的就是评论里面说这是一个和平的年代，承平已久，把人的意志都消磨的干干净净，罢了。,,,,,,,,
1,勿忘国耻 振兴中华！！,,,,,,,,
1,"<img class=""jump-img"" src=""https://i0.hdslb.com/bfs/activity-plat/static/20201110/4c8b2dbaded282e67c9a31daa4297c3c/AeQJlYP7e.png""/><a class=""comment-jump-url"" data-report=""2"" href=""//www.bilibili.com/video/av60920569"" target=""_blank"">南京地铁 治不了洋人，还治不了你？？？</a>。。。南京这样的地方出现这种事。那两个人的处罚结果就那么不痛不痒？还来宣传爱国教育？？我都替南京遇难的先辈害臊。。你们也有资格替他们默哀？？",,,,,,,,
