链接,标题,播放数量,弹幕数量,发布日期,点赞数量,硬币数量,收藏数量,转发数量,评论数量
16,我很仇恨当时日本政府，也很愤怒国家的懦弱腐败。但是我不会仇恨百姓，百姓都是受害者而已。现在国家强大了很骄傲。不过日本政府的右翼嘴脸和**思想很反感。当然日本普通百姓还是不错的。我哥在日本就是房东只租给中国人，而且我哥问她，她也说我们以前错了。所以请仇恨日本政府而不是日本普通百姓。不过谁打过来积极参军才是爱国，仇视不喜欢，警示和强大才是关键。,,,,,,,,
14,牢记国耻，也应该珍爱和平。无数先烈的血，换来的和平，你们一群喷子动不动打过来打过去，好战的样子不知道跟谁学的。多读点书，提高自己的知识水平，21世纪的国际竞争更多的靠脑子，不是靠你吹牛皮。,,,,,,,,
9,感觉评论里有好多日杂,,,,,,,,
9,仇恨是煽动的最理想燃料，侵华战争是埋在中国和日本民族之间的一颗定时炸弹，并且在某一天必将爆炸,,,,,,,,
9,评论里日杂真多,,,,,,,,
9,如鲠在喉，如芒在背，我身为堂堂七尺男儿，此等国耻何时能报？真的想想就潸然泪下又怒火中烧！,,,,,,,,
9,小时候只是懵懵懂懂接受爷爷奶奶的思想，初中学了历史就是真的恨了，长大以后，电影不敢看，纪念馆不敢去，但是讨厌日本的心情永远不会少。电影只看过一部，金陵十三钗是永远的噩梦。,,,,,,,,
9,一个人的血，是不够偿返债务的,,,,,,,,
9,( ´_ゝ｀)不要以为战争离我们很遥远，只有国家强大才能拥有和平，比如现在的伊拉克。勿忘国耻，别让历史的悲剧重演。,,,,,,,,
9,"虽然我胃不好，平时看历史书这种图片都会不舒服，这个视频看了之后我也吐了几回，虽然我喜欢日本动漫但是这个视频，我刷了十遍不止，我只是想说一句，动漫你随便喜欢，但是，勿忘国耻<img alt=""[小电视_笑]"" src=""//i0.hdslb.com/bfs/emote/f80d384875183dfe2e24be13011c595c0210d273.png@100w_100h.webp""/>",,,,,,,,
9,"<a data-usercard-mid=""105491279"" href=""//space.bilibili.com/105491279"" target=""_blank"">@日本国驻华大使馆 </a>",,,,,,,,
9,讽刺的是我是从在南京纪念馆倭军服拍照的视频来的(笑)，看来人果然是最健忘的动物。,,,,,,,,
9,被某湾湾网友折服 什么叫大陆看不惯我们与日本交好 真是有趣咯日本跟你交好哦搞笑不卖你就不错了就知道舔日本爹爹,,,,,,,,
9,哎！的确得警惕日本，35a售出日本口中的直升机舰正式可以当航母用了！量子计算机也在制造！演算核弹也不远了！加强日本本来就有大推力火箭技术！这是战败国？过几年会不会拥有核潜艇？海军陆战？拭目以待吧……,,,,,,,,
9,我还是更愿意将南京那个纪念馆称呼为南京大///屠//杀//遇///难同胞纪念馆，平常有些人会直接称为南京大///屠///杀///纪念馆，总是感觉是在纪念屠///杀而不是受难同胞们，自从意识到这点之后我就再也没有为了方便去缩写他，而是坚持用全称，无论是书面语还是口头上。身边的人若是也是这样称呼的话，我都是尽可能的去纠正他的错误，而不是去忽略错误。,,,,,,,,
9,如果他们和德国一样的态度或许就不会那么僵但是可惜，没有如果,,,,,,,,
9,我爱日漫！但是涉及到祖国的时候什么也不好使！,,,,,,,,
9,原本想保持理智观看的，可是……我选择放弃理智，说内心的话：你们真是伟大，拒不承认，毫无人性。敬：钩鱼的狗杂，日杂和日本政府、部分日本企业。,,,,,,,,
9,建议共青团关闭评论区。太多人开小号了，举报不过来。,,,,,,,,
9,别给我说什么日本人有什么什么优点，我只知道这个种族没有忏悔的勇气和良心。这个足够我鄙视它们。,,,,,,,,
9,"08年四川地震日本不是幸灾乐祸吗，三年后福岛不是出事了吗？福岛核事故是仅凭人力所能造成的吗？俗话不是说""人在做，天在看""，""不是不报，时候未到""吗？",,,,,,,,
9,别洗了！没点b数是不？政府犯了罪就得全国受着，要怪只能怪他们是日本人。他们的平民最无辜也比不上死去的中国人！,,,,,,,,
9,"请让现在的日本人正视历史 再让我客观看待他们 <img alt=""[小电视_差评]"" src=""//i0.hdslb.com/bfs/emote/38456e3bde2839b00b536a8be13934fa57c8e298.png@100w_100h.webp""/>",,,,,,,,
9,喜欢战争，是没有脑子。但是忘掉战争，是没有良心!,,,,,,,,
9,八十年前，日本输掉了战争。现如今，日本不该输掉良知,,,,,,,,
10,日本有各种理由不道歉，中国也有各种实证打你脸!,,,,,,,,
9,那些说包容原谅的圣母真该看看,,,,,,,,
9,说实话b站有段时间看到很多洗日本的评论和人，很生气，我……勿忘国耻，勿忘国殇，爱我中华。,,,,,,,,
9,非常喜欢历史，但是一学到近代历史，心里就抗拒的要命，初中上课听着老师讲日本侵华恶行，拼命忍住眼泪，那种心情，太压抑了。课后同学们说，想的太多了吧，都过去了。过去了吗？没有，在我的心里，永远都没有，国耻能忘，那也不配为这个国家的人，学着那段历史，太无力了啊，最刻骨铭心的话，是老师语重心长的说：落后就要挨打啊。有多悲痛而今就有多自豪，我的祖国现在是越来越强大，强大到已经不会被人随意欺负了。,,,,,,,,
9,纵使一串串数字后的零再多，也没有一具残缺不堪的尸体来的震撼。,,,,,,,,
9,不知道网上为什么有那么多日精替日本人说话，搞不懂,,,,,,,,
9,http://www.cngongji.cn/m/如果大家有时间，希望大家去公祭网敲敲钟，献上花圈，点上一支蜡烛。今天，三十万南京人要回家,,,,,,,,
9,南京大屠杀，30万人,,,,,,,,
9,日本只要还不道歉，我们就会一直拿出证据！,,,,,,,,
11,还有为日本的玩意说话的你是吃日本人饭长大的吧,,,,,,,,
11,天然的死敌，它们不灭绝，我们永世不得安宁。这个国家的地理位置和自然环境就决定了它们想要长久发展就必须进行对外扩张（侵略）。而它们的民族文化又造就了它们丧心病狂的国民性格。不说北边的冻土带和一样“鸟不拉屎”的朝鲜半岛，我们的国家不论是从地理位置还是资源环境都是它们最“优质”的进攻对象。再加上这个国家丧心病狂的国民性格。只要有任何机会，它们就一定会用最残忍最灭绝人性的方法最彻底的“消灭”我们。这也是从古至今这个国家一直“孜孜不倦”的对我们不停的进行入侵、抢掠、骚扰，并对我们的国民进行屠杀的原因。不论是不是所谓的“军国主义”也不谈什么所谓的“左派右派”，这就是它们整个民族的“生存策略”。在整个民族整个国家的生存和发展面前，谈它们的国家有没有“好人”就是一个笑话。,,,,,,,,
11,不是我偏激，而是他们从未正视；不是我迁怒，而是三十万亡魂不安！,,,,,,,,
11,记得去年我去参观南京大屠杀纪念馆，当时进了万人坑的遗址展厅，很多人是拿着相机入馆的，但我总觉得不妥，展厅内特别黑，从展厅出来以后实在忍不住蹲在地上哭了…我不是畏惧被残害的同胞的遗骨，我只是为了数十年前懦弱的旧中国感到悲哀，以及为了那些无辜牺牲的同胞和英雄感到心酸…所幸现在我们的祖国已经越来越强大了，果真，落后就要挨打。只希望等我长大以后也可以为祖国的强大做出自己的一份贡献，同时，铭记历史不意味着仇恨，但也不意味着纵容，日本有罪，法西斯有罪。,,,,,,,,
11,历史是一座坟墓，它埋葬了过去的一切，也清清楚楚的刻在了墓碑上，仅仅如此。坟墓的意义何在？在于每个来过的人，每个不同人带给坟墓不同的意义。那么，你会怎么做？路过？沉思？愤慨？咒骂？我不知道你们每个人是怎么想的。 但过去在我们脚下承载我们，墓碑知道。,,,,,,,,
11,忘记战争，是没良心，鼓吹战争，是没脑子。,,,,,,,,
11,动漫这东西看不了一辈子 我和我身边的朋友都渐渐的退坑了 慢慢的不看动漫了 高中看的多 大学基本不看了 这个月只看了骨王   当初高中看了骨王一很喜欢 才看的2 现在打开b站看动物 看抖音 看搞笑 说实话一直在动漫世界活着的人 我是想不通的,,,,,,,,
11,人就是那样。坏事做多了，但凡给一点甜头，就把伤害自己的事儿忘得一干二净，记吃不记打。就像之前看的一篇文章，父母给自己做了十几年的饭，不知道感激，一朝离家出走，有个老大娘看着可怜，给了一碗馄饨，就感动的像再生父母一样，要双膝下跪，真是个小睿智。,,,,,,,,
11,我们老师曾经讲过这样一个事例，有一个人仇恨日本，他叫一群人把中日合资制作成的车砸了。他以为他这样是爱国，但是他的举动也给中国造成了极大的损失。这一事例说明了什么。人不可以偏激。不可否认日本的确十分可恶，南京大屠杀的仇恨令国人永世难忘。可是一味地去抵制它、仇恨它是没有任何用处的。就目前来讲，我们能做的是勿忘国耻，担负起历史的重任，牢记复兴中华这一伟大使命，朝着目标前进。而不是在网络上发表偏激的鼓动战争的宣言。而日本的动画片、漫画，其本质是一种文化侵略，他们企图用这些来腐蚀我们新一代人的思想，可怜现实中有不少人被蒙蔽。面对这些，除了拒绝，我个人想不出更好的解决方法。前段时间先烈纪念日玉与某中国明星生日的事情我想也是人尽皆知吧。除了日漫，这类人何尝不也是一种悲哀？只能说文化侵略这种东西太可怕了，而有些人心甘情愿进入这一局还傻傻不自知。我觉得评论区有句话说的特别对，“那是日本人的糖衣炸弹，我们要吃掉糖衣，把炸弹丢回去。”总之，暂时性的把仇恨埋在心底并不代表着原谅。这段历史所存在的目的是让我们记住它，把它当做行动上的动力，而不是让我们被仇恨蒙蔽双眼。,,,,,,,,
11,什么放下仇恨记住历史，我记住nm的历史哟？日本为什么服美国，因为美国征服了日本的领土，屠杀了他们的人民。中国一日不做这种事情，日本就一天不知道痛，他们就会记不住，故意地去遗忘，逃避他们在大半个世纪前做的事情。,,,,,,,,
13,卑劣的日本人，不是国民素质高吗，为什么不道歉！为什么不道歉！为什么不道歉！垃圾民族，狗生日本！,,,,,,,,
8,中日再战，就是复仇,,,,,,,,
8,老哥们理智啊，天天叫 嚣着要和日本开战的你们和那些狂热的军 国主义分子有什么区别吗？,,,,,,,,
8,无论男女 都不应该喜欢日本 所谓的直男癌在他们身上简直小巫见大巫 他们的民族就是压抑女性的民族,,,,,,,,
8,我恨的是日本政府不承认这段历史。而且他们还企图篡改历史。他们对我们的一点都没有要忏悔要认错的意思。如果他们在这些方面做的好。敢于面对历史。承认错误。深刻反省。哪来有这么多人骂他们？？大家也会做到安安分分的自己铭记着这些历史。侵略我们的日本人可恨吗。可恨。现在不承认的日本人更可恨。我也知道有些日本人跟那些不认错的不一样。但是连他们的政府有些都不承认。更加别提除了真正知道历史的日本人以外那些不知道的怎么想的怎么说的。家里有老人的都知道一提起侵略的日本人。呵。虽然现在是和平年代。但不妨碍我们去了解那段历史。日本政府和日本人去了解那段历史。那是他们祖先做过的。甚至有些被他们认为是英雄的人所做之事。我只想要他们能好好了解那些年的历史。而不是去否认去企图篡改。这些只是我的想法。不喜勿喷。(｡･ω･｡),,,,,,,,
8,想想那些二战日祖们的兽形，不但给中国人民和亚洲人民留下巨大伤害，和历史的伤很。也给日本人留下了一个永远洗不脱罪恶。也给全人类留下了日本兽性。这样的祖宗还要拜吗？,,,,,,,,
8,"这视频做得好，至少打了马赛克南京""事件""那些图我从小学看到现在，因为没打马赛克给我造成了很严重的心理阴影，讲真要小孩铭记历史不是要你惧怕历史，你们这些""大人”看了没什么，我们这些小孩子和心理承受能力脆弱的看了可能会惧怕和厌恶这段历史(内有屏蔽词所以换了个叫法)",,,,,,,,
8,第一次知道b站可以删减播放量，不知道为什么只要提及日本的东西都这样对待(´･_･`),,,,,,,,
8,现在的问题是，我们传承了历史的数据，却没能传承情感的沉重。现在的年轻人面对这段历史的态度是——没错，我们知道，但那又怎么了？战争原本就是要死人的，干嘛老要别人道歉啊？（以上为某亲日群中堂而皇之的言论）。如果情感没有得到传承，单纯只是数据的背诵，那么这样的历史铭记本身还有什么意义？,,,,,,,,
8,勿忘国耻，伤口可以愈合，疤痕不会消失，某些中国身日本心的精神大和民族，请你离开中国,,,,,,,,
8,我敢说我是一个热爱祖国的人！平常我非常喜欢日本文化，但是我也很喜欢历史，包括世界史更包括中国史，我绝对不会忘记在一百年以前中国遭受的虐待和耻辱！铭记历史，勿忘国耻，振兴中华。b站的同胞们，我们一起加油！,,,,,,,,
8,我承认我喜欢日漫，但这绝不能影响我对国家的热爱以及对这等罪行的痛恨，虽然我只是一个渺小的个体，但我也要自强不息，为中国梦奋斗，希望有那么一天，世界都会因为中国而颤抖,,,,,,,,
8,"对日本宣战，显然不可能了，我们只有自己更加强大起来，不能再让日本人欺负，不能让日本人再来钻我们的空子，赚小钱钱，把自己的小日子过好，那么国家也会一天天好起来，其他的，就是师夷长技以制夷。。。。。。<img alt=""[正经人_哭]"" src=""//i0.hdslb.com/bfs/emote/b9882f0679b4ae24624660412464f1f88bda48fe.png@100w_100h.webp""/>真的很难过，再看前几天发出来的**份子，怎么好意思生活在和平年代做出那么丧病的举动，真想把这些人埋了",,,,,,,,
8,我就喜欢这种视频的评论区，拿来扩充黑名单,,,,,,,,
8,那些以为自己三观正的 因为日本不承认罪行 才一遍又一遍的发证据打脸 而不是加深仇恨你的明白？为啥没人天天说的德国 人家承认并且改正 日本呢？,,,,,,,,
8,日本的恐怖不在于他曾经做过什么，也不是他如今未做什么，而在于他未来想做什么。就如同每个中国人都有一个实现中华民族伟大复兴的中国梦一样，每个日本人也都有一个建立 大 东 亚 共 荣圈实现大 日本帝 国的日本梦。唯一不同的就是日本将这个梦隐藏在心中忍辱负重七十多年。这也是为什么日本一直不愿为二战道歉的原因所在，因为一旦道歉就相当于承认自己的梦想不过是虚幻的泡影。,,,,,,,,
8,为什么要对那些死不悔改的人忘记仇恨？所谓的大国风度吗？,,,,,,,,
8,中国人在b站说**会被自己人骂，这是什么鬼？被洗脑了？,,,,,,,,
8,现在有很多人还是在把〔南京大屠杀遇难同胞纪念馆〕读成〔南京大屠杀纪念馆〕！！我们需要纪念的是我们的同胞！！！！！记住了！！！,,,,,,,,
8,动漫宅、追星族、美剧粉等各种群体，兴趣爱好只是人生的一部分，大是大非多数人都分得清，就不劳少数人来代表了,,,,,,,,
8,他们会说视频是伪造的，不然怎么不早点拿出来,,,,,,,,
8,请不要因为现在的和平而忘记了那屈辱的历史  和残酷的战争   现在的和平只是表面的和平   战争从未离开过我们   因为战争已经转型了   信息战   间谍战  经济战   军武革新竞争   新技术开发   能源战  等等   请不要忘记战争  他们每时每刻都发生在我们身边   这不是危言耸听  这些现代战争的任何一环失败了  我们将面临武装战争  那将又是一场血与火的洗礼   硝烟又会笼罩这片神舟大地  这不是鼓动战争  而是想让更多人知道战争并不遥远   和平来之不易  但战争还未结束,,,,,,,,
8,承认自己有罪并且悔改做出实际行为的日本人也仅仅是有被原谅的资格了而已，因为真正能够提到原谅的只有那时的受害者，所以我想说，别提什么原谅不原谅，你没资格提着话，你算老几？说的就是你们**。承认错误的日本人虽然有但依旧少之又少，而能上到新闻的又有多少呢？日本年轻人先不提他们是否承认，怕是都没有在心里理解到过去有发生过这事吧，你**还说人家善良，怕不是冷漠吧,,,,,,,,
8,这就是中国曾经遭受的苦难，这是血淋淋的事实！,,,,,,,,
8,怕不是去靖国神社参拜的日本人都是傻子吧？参拜了那么久不知道他们在参拜谁？骗谁呢？无论如何都有个介绍在旁边吧？日本人有觉得把战犯放进去不妥的么？没有,,,,,,,,
8,日本有罪，毋庸置疑,,,,,,,,
8,日本有罪，无法忘记政府和人民都脱离不了关系不接受反驳！,,,,,,,,
8,中国人是永远不会忘记这段用生命与鲜血谱写的历史的日本任何想歪曲，否认，篡改历史的行为都是愚蠢可笑的那些穿日军军服照相的就该送进监狱，再监狱里重新接受九年义务教育只不过里面代替体育课的不是数语外，而是劳动改造,,,,,,,,
8,我们可以不原谅，因为我们没有资格替先辈们原谅。我们不能不坚强，因为祖国的未来在我们这一代人的肩上，感谢先辈们对我们的教诲，感恩今天来之不易的生活。🙏,,,,,,,,
8,如果说现在的日本无罪的话，好吧，请把靖国神厕里的几个鬼排位请出去，正面回应当年的罪行，不要再在教科书里搞事情，那么可以认为这个国度已经深刻反省，可以原谅，可惜他们做不到，是我们刻意煽动仇恨吗？不，恰恰是他们自己不肯先放下,,,,,,,,
8,为什么现在的日本政府跟条狗一样的，跟着美国有什么好处，为什么不承认当初做的这些丧尽天良的事，安倍晋三和他的那些团伙都是实实在在的狗啊！看的怪难受的。,,,,,,,,
8,不要在这种视频前抢前排好嘛,,,,,,,,
8,日杂滚出去 轮得到你来原谅？,,,,,,,,
8,！你有资格替受害的人民决定吗？你经历过当年残酷的虐杀吗？你经历过家里的女性被各种侮辱吗？经历过最后绑在一起用机枪扫射吗？他们几乎都是一家人被迫害而死，他们对日本人的仇恨不是简单几句话就可以放下的，所以不要自以为是的说什么放下仇恨。🙃而且越来越多的人已经忘记了当年的伤疤，该去日本旅游的还是一堆，甚至为了动漫去学日语，我不反对看日本的东西，当做消遣也可以打发时间。我只想说:各位好自为之。（我绝不会改变这种想法，杠精免开尊口谢谢。）,,,,,,,,
8,我觉得吧，日漫有问题，它确实是糖衣炮弹，它有一种潜移默化的影响，就像你看歌颂老大哥的电影你会对1老大哥有好感一样，美国大片也是，这也是为什么有那么多双标帝了，他们已经被潜移默化洗脑了，潜意识里认为美国就是好，共产主义就是差，就是怕我国有很多人不爱学习却爱看资本主义电影，这样很容易被带节奏的。。。,,,,,,,,
8,世仇，没办法原谅,,,,,,,,
8,讽刺的是现在历史教科书里关于南京大屠杀的记载轻描淡写 寥寥数笔就带过了,,,,,,,,
8,看得我实在有一些不是滋味，两颗原子弹怎能解恨？,,,,,,,,
17,日本固然有罪，而我们不应该变成他们。,,,,,,,,
10,安倍是狗,,,,,,,,
10,从历史中吸取的教训，就是不能给日本政府和大部分人民好脸色，要时刻提防着他们，对他们是笑里藏刀，能捅一刀是一刀，对自己是要求严格，艰苦奋斗，停止内战，一致对外，铲除利益熏心者，这是我见解的一部分。,,,,,,,,
10,"哪天茎国神厕能开放让世界人民如厕，哪天对日本的仇恨值降低↓<img alt=""[蛆音娘_吃瓜群众]"" src=""//i0.hdslb.com/bfs/emote/5d0d6cc54b508d30b4f50b6b5f7b7e1e259d84ea.png@100w_100h.webp""/>",,,,,,,,
10,看评论一直在说理性爱国，确实评论得很有理性。但是说真的这种视频看多了，我头皮真的发麻，小时候看我姐的历史书看得我恨不得把他们全杀了，我老家那边以前也遭过炮弹，有些东西我真是理性不起来。特别是这方面，我真的宁做小粉红，不当苟日杂。,,,,,,,,
10,坐等精（）日撕逼，我不是针对谁，谁洗二战日本，谁就是中国人民的敌人,,,,,,,,
10,还是那句话，说二次元和政治没有关系。国家不强大，你在战火中追你的番吧。那滋味是不是和你先在维护日本的滋味一样?,,,,,,,,
10,不要说什么要参与抗战的人原谅才可以原谅日本，这句话是日青和日精专用的。。。如果真的这样德国的道歉又算什么，更何况直到现在中国的抗日先辈和被日军侵犯的老奶奶们都在通过法律表达诉求，可是又得到了什么，不要从网上看到了一句话就觉得很有道理，即使是先烈们没在了，还有他们的子孙,,,,,,,,
10,我们班有几个男生几个女生，向往日本到死，上政治课讲到党的时候在下面唏嘘，放南京大屠杀纪录片的时候说关我屁事，更过分的是上学期一个人还穿了日文写的＂无zf主义＂的衣服，不论哪个老师说dang好，他们都要笑，真可恨我自己是女生，真想上去撕了这帮人渣,,,,,,,,
10,我认为这种视频不是用来让网友们在这里说日本多么多么可恶，对日本多么多么痛恨，因为我们也没有经历过，体会不到当时的艰辛。也不是让你们在这里表达不会原谅日本，我们也没有资格替保卫祖国的英雄原谅他们。而是提醒我们:铭记历史，勿忘国耻，振兴中华。这句话不仅仅是在这评论区的几个字，也要在现实生活中去实践，去用自己的努力来报效祖国。,,,,,,,,
10,日本无罪是天下最大的笑话，你们有些还给日本人洗白，贱不贱,,,,,,,,
10,讲真，我可以做到记住历史，但我绝对忘不了仇恨，面子话别说，我就是厌恶日本人😒😒（我玻璃心，不接受反驳，否则我会嘤嘤嘤！）,,,,,,,,
12,这种事情道歉有什么用，鬼子的道歉一文不值，这是民族的深仇大恨，永远记住。等到大仇得报之日，我们再好好告慰英灵。,,,,,,,,
12,jing日和fen青不要互相扣帽子了，看得我心累。两边都不是好东西你凭什么代表这么多受害者原谅日本？你又凭什么说我看日漫就是精神鸦片不爱国？有的人还真喜欢代表别人啊,,,,,,,,
12,欣赏现在日本的文化，但是对过往的不承认和不道歉真的令人无法原谅,,,,,,,,
12,穿和服就不爱国了？你国天天拿日本混淆民众视线，培养奴才小粉红，二次元是我的信仰关你什么事？我就是喜欢日本关你什么事？过去的都已经过去了，向前看不好吗？碍国贼，中日友好万岁！！睿站二刺螈如是说到,,,,,,,,
7,向所有头顶青天白日，斧头镰刀，帽子扣，铁血十八星旗的英雄致敬,,,,,,,,
7,铭记历史，绝对不能再让人踏入国土，杀我百姓,,,,,,,,
7,我们要的有那么多？我们只想要日本人正视历史，给当年的人们一个道歉,,,,,,,,
7,痛恨他们的暴行和敢做不敢当,,,,,,,,
7,勿忘国耻，振兴中华！！,,,,,,,,
7,战争永远是残酷的痛苦的，我们要牢记历史，同时也要知道我们的和平是怎么来的，珍惜这来之不易的和平。,,,,,,,,
7,这只是能稍微让你接受的视频发出来，更可恨的很多,,,,,,,,
7,视频播放量被人为减少了,,,,,,,,
7,喜欢乒乓球的人，ta不说，你不知道ta喜欢乒乓球；喜欢网络小说的人，ta不说，你不知道ta喜欢网络小说；喜欢健身的人，ta不说，也会在各种场合拼命暗示你ta在健身；喜欢日本动漫的人，ta不说，你看一眼头像就都知道了。,,,,,,,,
7,推特上说的 这些基本都是韩国慰安妇 顺带一提慰安妇中也有一些是日本女人 那时候日本也是不把女人当人看,,,,,,,,
7,现在**的事闹得挺大的，其实我在想，要是**和精美在一起吵架该是什么个牌面？**：我大和民族牛逼！精美：我是你爹！**：我民族素质高！精美：我是你爹！**：我有躬匠精神！精美：我是你爹！想想这画面都觉得可怕（滑稽）,,,,,,,,
7,日本人永远需要中国人民警惕，对日本的惩罚也还远远不够,,,,,,,,
