链接,标题,播放数量,弹幕数量,发布日期,点赞数量,硬币数量,收藏数量,转发数量,评论数量
2,忘记意味着背叛,,,,,,,,
2,归根结得还是要自己强大起来，不然历史还会重演。还有国与国之间只有利益没有朋友。,,,,,,,,
2,“哎，你说，我们现在做的事，以后，会不会有人记得？”,,,,,,,,
2,勿忘国耻,,,,,,,,
2,我们每年都不忘敲警钟、进行南京大屠杀悼念，曾经的遇难应该也会安息些了【除了那些军国分子】，但振兴中华不只是喊在口号上的。如果真的悼念同胞，就应该把它融入我们的生活的一部分。热爱生活，热爱自己的职业。好好学习，好好工作，将悲愤转化为力量，幸福快乐地生活下去，为祖国做些什么啊。用另一种方式，替他们好好活下去。,,,,,,,,
2,梁启超曰：少年智则国智，少年富则国富；少年强则国强，少年独立则国独立；少年自由则国自由；少年进步则国进步；少年胜于欧洲，则国胜于欧洲；少年雄于地球，则国雄于地球。红日初升，其道大光。河出伏流，一泻汪洋。潜龙腾渊，鳞爪飞扬。乳虎啸谷，百兽震惶。鹰隼试翼，风尘翕张。奇花初胎，矞矞（yù）皇皇。干将发硎（xíng），有作其芒。天戴其苍，地履其黄。纵有千古，横有八荒。前途似海，来日方长。美哉！我少年中国，与天不老！壮哉！我中国少年，与国无疆！,,,,,,,,
2,"绝不原谅，那群灭绝人性的日本畜牲<img alt=""[生气]"" class=""small"" src=""//i0.hdslb.com/bfs/emote/3195714219c4b582a4fb02033dd1519913d0246d.png@100w_100h.webp""/>",,,,,,,,
2,日本，守小礼缺大德,,,,,,,,
2,归家路上火通明三十万魂尽归来,,,,,,,,
2,这是一段沉痛的历史，我永不遗忘，却不敢回首。我真是怯懦。,,,,,,,,
2,凡抗日者，地不分南北，人无分老幼，皆是英雄！（各位可去南岳忠烈祠）,,,,,,,,
2,“我在南京的大街小巷走了20年，常常没由来的感到心口钝痛，后来明了，是因为这座城的厚重气质。她本该是烟雨江南的绝景，却背负了一段历史太多的悲惨——” ,,,,,,,,
2,不太敢点进去看。因为知道，所以不忘，不敢忘记。,,,,,,,,
2,我太爷爷到死都没忘了那帮畜生。,,,,,,,,
2,愿世界再无侵略与战争,,,,,,,,
2,我们这一代能做的，就是背负上一代的愿望、在和平的年代好好享受他们所不敢想的美好生活，但这并不代表我们会忘记他们，曾经的耻辱我们依然会铭记在心，勿忘国耻，砥砺前行。是我们每位爱国的年轻人应该做的。就是继续让祖国繁荣下去，用行动证明给远在天国的他们看，我们的祖国已经日渐强大起来，再也不会被欺负了!!!！！！奥利给！！！！！,,,,,,,,
2,"巍巍金陵,滔滔大江,钟山花雨,千秋芬芳。一九三七,祸从天降,一二一三,古城沦丧。侵华倭寇,掳掠烧杀,尸横遍野,血染长江。三十余万,生灵涂炭,炼狱六周,哀哉国殇。举世震惊,九州同悼,雪松纪年,寒梅怒放。亘古浩劫,文明罹难,百年悲叹,警钟鸣响。积贫积弱,山河蒙羞,内忧外患,国破家亡。民族觉醒,独立解放,改革振兴,国运日昌。前事不忘,后事之师,殷忧启圣,多难兴邦。八十二载,青史昭彰,生生不息,山高水长。二零一九,国家公祭,中外人士,齐聚广场。白花致哀,庄严肃穆,丹忱抒写,和平诗章。大道之行,天下为公,大德曰生,和气致祥。和平发展,时代主题,民族复兴,世代梦想。龙盘虎踞,彝训鼎铭,继往开来,永志不忘",,,,,,,,
2,我希望日本人不要忘记，中国其实是你爸，你们国家的人还是中国的人,,,,,,,,
2,我老奶奶在世时，虽然体弱病多，但是一见到我问她以前的事，   就表现的特别激动。说把人挂在树上打，当靶子。,,,,,,,,
2,今天南京城一定很堵吧，毕竟有30万人要回家,,,,,,,,
2,"今天南京一定很堵，因为有三十万同胞要回家<img alt=""[大哭]"" class=""small"" src=""//i0.hdslb.com/bfs/emote/2caafee2e5db4db72104650d87810cc2c123fc86.png@100w_100h.webp""/><img alt=""[大哭]"" class=""small"" src=""//i0.hdslb.com/bfs/emote/2caafee2e5db4db72104650d87810cc2c123fc86.png@100w_100h.webp""/>",,,,,,,,
2,君不见， 汉终军，弱冠系虏请长缨。君不见，班定远，绝域轻骑催战云。男儿应是重危行，岂让儒冠误此生。况乃国威若累卵，羽檄争驰无少停。弃我昔时笔，著我战时矜。一呼同志於十万，高唱战歌齐从军。齐从军，净胡尘，誓扫倭奴不顾身。忍情轻断思家念，慷慨捧出报国心。盎然含笑赴沙场，大旗招展日无光。气吹太白入盎月，力挽长夫射天狼。阿部魂归黄土岭，长田命丧聚义厅。昆仑关下积尸滿，缅甸血战鬼神惊。太行山上红旗展，南海琼崖掠铁鹰。台儿庄外凶寇灭，天下传扬百团名!中华铁军施威武，八方义士皆响应。万裏神州燃烽火，四亿人民尽化兵!核击广岛扫妖气，轰炸扶桑为犁庭。军旗天皇府上扬，九州四国北海靖!采石一载复金陵，冀鲁吉黑次第平。破波楼船出辽海，蔽天铁乌扑东京!一夜捣碎偻奴穴，太平洋水尽赤色，富士山头扬汉旗，樱花树下醉胡妾。归来夹道石人看，朵朵鲜花掷马前，门榍生辉笑白发，闾裏欢腾骄红颜。国史明标第一功，中华从此号长雄，尚留余感惩不义，要使环球人类同沐大汉风!,,,,,,,,
2,不要还没认清历史，就开始选择原谅,,,,,,,,
2,总有人把善良当懦弱，把宽容当原谅，把强颜欢笑当没心没肺，把悲剧当喜剧，把痛苦当蒙骗………不能忘啊，同胞们。                      不能忘啊。,,,,,,,,
2,中华人民共和国万岁，世界人民大团结万岁。,,,,,,,,
2,哭的稀里哗啦勿忘国耻,,,,,,,,
2,今天的南京很热闹。,,,,,,,,
2,我们真的没有资格替死难者原谅,,,,,,,,
2,勿忘国耻，振兴中华,,,,,,,,
2,“春燕归，巢于林木”——《资政通鉴》,,,,,,,,
2,日本人可以友好相处，但绝不能原谅日本这一个体以及所以的右翼分子！,,,,,,,,
2,自20世纪80年代初至今，日本有4次审定发行的教科书明显的篡改历史、肆无忌惮的美化侵略战争:1982年第一次审定“侵略华北”成了“进入华北”；把日军“对中国的全面侵略”改成“全面进攻”；1986年第二次审定只字不提日本曾侵略过别的国家；2001年第三次审定将南京大屠杀修改为“南京事件”；2005年第四次审定篡改历史的错误仍比比皆是。,,,,,,,,
2,没资格原谅你们，能原谅你们的人都被杀了，所以我只负责送你去见他们,,,,,,,,
2,今天给班里的学生看了这个，虽然他们才上一年级，他们也只是当做一部动画片看的。但是我认为只要从小灌输，早晚他们都会懂得。,,,,,,,,
2,“国家给我们这段历史是为了让我们勿忘国耻振兴中华，而不是每天活在仇恨中。”,,,,,,,,
2,原谅你们是死难同胞的事情，我们想做的，只是送你们去叫他们而已，禽兽们，到了那儿，记得先跪下来！,,,,,,,,
2,日本政府故意把这段历史从国民记忆里抹去知道这些历史的日本人不敢发声 跟政府作对没有好下场日本政府必须承认历史 而不是修改历史,,,,,,,,
2,有些人的善良，掩盖不住他们这个民族的所有。恨也罢，原谅也罢。有资格人已经远去，但我们却始终记得………要真想怎样？道歉不必，那些人去见他们就好！,,,,,,,,
2,"谁把太阳丢我眼里了？<img alt=""[大哭]"" class=""small"" src=""//i0.hdslb.com/bfs/emote/2caafee2e5db4db72104650d87810cc2c123fc86.png@100w_100h.webp""/>",,,,,,,,
2,自盘古开天，三皇定国，五帝开疆，凡国遇大事，男必在祀与戎泯躯祭国，即燹骨成丘、溢血成河，亦不可辱国之土，丧国之疆。士披肝沥胆，将寄身刀锋，帅槊血满袖，王利刃辉光！吾不分老幼尊卑，不分先后贵贱，必同心竭力，倾黄河之水，决东海之波，征胡虏之地，剿倭奴之穴，讨欺吾之寇，伐蛮夷之戮，遂沧海横流，儿立身无愧，任尸覆边野，唯精魂可依！,,,,,,,,
2,我是搬家到南京这边来上学的，今天早晨在南京响起警鸣之前，主任还在主席台上说：我们现在是过上好日子了，但是在那个时期，我们的祖辈，我们的烈士，为了自己的家庭，为了自己的国家，勇敢站了出来，那是耻辱的一天，甚至我们在座的各位同学的亲人，可能都是三十万人中的一人。我们今天感觉不到那种痛苦，是因为前人替我们承受了，而我们并不能代替他们原谅，我们现在能做的不是开战，而是勿忘国耻，以另一种方式成为国家栋梁，努力让我们的烈士和亲人用鲜血和生命所换来的祖国变得更加强大，让烈士们知道，他们所做的都是值得的……勿忘国耻,,,,,,,,
2,"来吧，鼓动霓虹国的共产主义革命，支持霓虹国共产党把日本建设成一个社会主义国家<img alt=""[偷笑]"" class=""small"" src=""//i0.hdslb.com/bfs/emote/6c49d226e76c42cd8002abc47b3112bc5a92f66a.png@100w_100h.webp""/>",,,,,,,,
2,说平民无辜的，我希望你真的去了解那一段历史，在经济危机和日本军国主义的渗透下，这场战争在日本国内已经全民皆兵，日本平民以成为人体炸弹去控制鱼雷方向为荣，日本女子甚至以成为慰安妇为荣，雪崩时没有一片雪花是无辜的，我没法直视你，我怕你的先辈也曾提着屠刀站在这片土地，我没法原谅你，真的，和平谁都希望，但我们真的没资格替祖先原谅。,,,,,,,,
2,日本历史类书籍对南京大屠杀的描写。只是：“日军所做的一些事情对中国造成难以预计的影响”，那本书上，中日战争密密麻麻的一页字，只有这么一句，我同位还特意找了，真的就只轻描淡写的提了一句（只是我们看的那本书）,,,,,,,,
2,http://www.cngongji.cn/m/,,,,,,,,
2,我不会随意憎恨一些日本人们，但是我们永远都不会原谅你们祖先在中国的恶行，原谅你们，那只是上帝的事情，如果未来有一天你们也被血洗了，就不要祈祷了，成功的话我们的先祖就不会白白牺牲了。,,,,,,,,
2,我所在的北方在今天也是下了很大的雪，很静，感觉像在为已故的人默哀。,,,,,,,,
2,黑太阳南京大屠杀黑太阳731这是真正描写日本鬼子罪行的电影，不要被现在那些抗日剧中的描写日本人善良一面所迷惑。过于提现敌人的善良只会让你自己感到卑微。当年庆祝南京陷落的标语出现在日本大街小巷。可背后的是无数国人的死亡。我们没有资格原谅，但我们能记住这段历史。,,,,,,,,
2,http://www.cngongji.cn/m/如果大家有时间，希望大家去公祭网敲敲钟，献上花圈，点上一支蜡烛。今天，三十万南京人要回家！转,,,,,,,,
2,今天团团的头像是暗的。勿忘国耻。默哀,,,,,,,,
2,勿忘国耻,,,,,,,,
2,伤不在我们身上，我们那里有资格去说原谅？,,,,,,,,
2,原不原谅这些人，是上帝的事，而我们的事情就是送他们见上帝！,,,,,,,,
2,你們發現沒有……團團頭像變成灰色了……,,,,,,,,
2,背负守护的誓言必以现成，在哪最坏的时代我们一无所有我们巍然矗立……………,,,,,,,,
2,在下软弱，不敢看结局X﹏X,,,,,,,,
2,大家别忘了勿忘国耻下一句啊啊啊！振兴中华！！！,,,,,,,,
2,世界有两种爱国主义，一种是中国人民般的爱国主义，另一种是日本侵略者和希特勒式的爱国主义。我们应该拥护哪一种爱国主义，一目了然。--毛主席。赠予“法西斯政府有罪但法西斯士兵无罪”论的支持者。,,,,,,,,
2,原谅他们不是我们要考虑的，我们要做的就是送这些侵略者下地狱,,,,,,,,
2,每年这个时候我都会看关于南京保卫战的文献资料，南京城一步一步落入低手，最后三十万军民成为案上鱼肉，真的很痛心,,,,,,,,
2,不记得在哪里看过了，说是那个时候日本人是以送那些平民回家还是怎么样的理由把他们骗去屠杀的，就现在我在用的历史书上都还有插图，是日本的报纸，内容是两个日本将领在南京大屠杀的时候比赛百人斩的记录，当时就觉得很变态，完全就是些心理扭曲的疯子，已经不可以被称作是人了。如果说日本原子弹下的平民是无辜的，那么我们被屠杀的平民不也无辜吗？在当时的日本，现在的日本，厌战，会反思错误，道歉的人又有多少？,,,,,,,,
2,"勿忘历史，吾辈自强！<img alt=""[2233娘_喝水]"" src=""//i0.hdslb.com/bfs/emote/695bf5429472049b52c1e0de586f8a2511195a23.png@100w_100h.webp""/>",,,,,,,,
2,昨日先烈们守护了我们家园，今日我们将守护历史。,,,,,,,,
2,经历过苦难的老人前辈们 2019年还生活在这个世界上呢？ 有些人是太幼稚还是太坏呢？原谅？原谅也不是你有资格说的。,,,,,,,,
2,核弹之下无冤魂，现在的日本仍然是狼，军国主义阴魂不散，我们要提高警惕，勿忘国耻，感谢这个和平的时代，感谢祖国母亲，感谢PLA,,,,,,,,
2,那些说原谅的 如果当时死的是你 是你的家人 你还会原谅吗,,,,,,,,
2,强强者生存。弱弱者败退。国强才不会被人欺负。国弱被人欺负的不要不要。这就是弱肉强食，适者生存的世界。如果你不强就没法在这个世界生存。但是有些人就不争气。侮辱国家。买洋货。买日赀。做间谍。出卖国家。无所谓了，和我无关。反正人终有一死。如果想不被外国人欺负，我们就要团结。团结就是力量。如果非要铭记那段历史的话，那就是不要忘记那30万的南京同胞。那就不要忘记。日本鬼是怎么来屠杀我们中国人的。所以不为了在被他们欺负。我们国家变得更强了。牢记初心。勿忘国耻。忽忘历史。勿忘老一辈。忽忘八路军勿忘毛泽东。如果没有这些老一辈拼来的一切就没有现在的我们过得那么好。虽然说人总有一死。但是他们没有体验这个世界的美好。甚至根本没有体验过来这个世界的美好。甚至有些小孩。没有完全成长成人。甚至没有发育。就被日本鬼子畜生杀了。,,,,,,,,
2,这份屈辱会印在我血液里，也会跟着我走完此生。顺境感恩先人付出，逆境谨记逝者苦难。我辈当自强，少年强则无敌于天下！,,,,,,,,
2,看到弹幕里有说南京保卫战为什么会输的简单说下：首先中日工业实力不用说，一个农业大国另一个已经工业化，中国海军的主力舰打不过日本的三流军舰（如出云号），空军也是，飞机数量也不如对方，丧失了制海权和制空权陆军就相当被动，就算都是德械师教导总队那样的部队在人家绝对强大的火力下也不过是飞蛾扑火，更不用说陆军的火力也和人家差一大截。这一点淞沪会战就已经体现出来了（我无锡人，祖籍本来在上海淞沪会战时逃过来的）15万国军面对日本海陆空三军的合力绞杀本身就注定了南京难以守住（南京基本上无险可守，某种意义上这也是为啥在南京建都的普遍都短命王朝，明朝不算）后来撤退发生了混乱这一切的一切（唐生智出来挨打）感兴趣的自己查资料这里就不说了。小学的时候读过一本关于南京大屠杀的书，愤怒、恐惧和强烈的恨意充斥着心里，以至于去过无数次南京却始终不敢去纪念馆。今年夏季我还是去了那里，穿过万人坑的遗址出来有一种到地狱里走了一圈的感觉。难以想象1937年的南京是在何等的绝望之下。我绝不原谅曾经的日本人，军人和百姓都是罪人，肯出来忏悔的另当别论。今天的日本人，如果你知道了这段历史能够正视它，如果你愿意为和平而努力我们依然可以友好往来。我们中国真的非常宽容，但同时永远要警惕，这些个万恶的资本主义没一个好东西！美国佬和他的儿子们都是混蛋！猴子是社会主义中的败类！愿伟大的柯尔特保佑美国，愿伟大的奥本海默保佑日本。,,,,,,,,
2,今天是国家公祭日，就算你要洗日本，也别在今天，勿忘国耻，牢记历史，才是今天我们该做的，别自己找不痛快来找骂，你骂不过大部分有血性的纯种中国人,,,,,,,,
2,那年乱世如麻，愿你们来世拥有锦绣年华。,,,,,,,,
2,我们未曾忘记。铭记不是为了憎恨，而是警醒。,,,,,,,,
2,不管是国民党战士还是共产党战士，他们为了国家民族，献出了生命,,,,,,,,
2,勿忘国耻，振兴中华，希望祖国越来越强大，这种事再不会发生,,,,,,,,
2,铭记历史，吾辈自强,,,,,,,,
2,今天看到江苏卫视台标也是灰色的，勿忘国耻！,,,,,,,,
2,昔日你遭受万般苦难屈辱过活，今日我替你铭记刻骨苦难踏上征程。,,,,,,,,
2,原谅它们是上帝的事，我们要做的就是送它们去见上帝,,,,,,,,
2,这三十万只是代表，实际整个抗日战争期间虽然没有准确数字，但所有统计我国死亡人数的资料中最少的都有一千万，其中八成是平民。这是最少的直接死于战火，不是伤亡是死亡，其他的统计更多,,,,,,,,
2,12月13日缅怀先烈，而且今天是我的生日。。。,,,,,,,,
2,"🇯🇵都没道歉，有些人就抢着原谅了。慷他人之慨，真是天打雷劈呀<img alt=""[微笑]"" class=""small"" src=""//i0.hdslb.com/bfs/emote/685612eadc33f6bc233776c6241813385844f182.png@100w_100h.webp""/>",,,,,,,,
2,姥爷，您在天上看到了么，现在的中国，老百姓吃的起肉，也不会有人饿死了！国家强大了，我们有枪，有炮，有东风快递，再也不用数着四发子弹，父亲是军人，到孙子辈，精神也在继续传承，虽然日本还没有承认错误，但我会接过您的哨位，继续用微薄的力量，守护国家，建设国家，我们不会再让中国的国门被打破，被侵略了！如果以后我有孩子，我希望也送他去当兵！继续先辈的精神，去守护祖国,,,,,,,,
2,南京大屠杀  每次听到的时候心里面就会很难受,,,,,,,,
2,"听我爸爸说小日本差点就打到我们村了才投降不然就没我了，该死的小日本<img alt=""[无语]"" class=""small"" src=""//i0.hdslb.com/bfs/emote/44667b7d9349957e903b1b62cb91fb9b13720f04.png@100w_100h.webp""/>",,,,,,,,
2,三岛倭奴，国仇永世。勿忘国耻，振兴中华！,,,,,,,,
2,请那些随随便便一个键盘就可以轻轻松松敲除“别记仇”的话的中国人看看自己还是不是中国人，你们没资格为我们的先辈原谅他们，你们更没资格生活在这片国土！如果说要喜欢日本是各有各的喜欢的文化优点，要怪就那些恶心的人！是那天的也好，是如今还不知悔改的也好，是如果随随便便说那些恶心的不配为国人的人也好，你们即使道歉你得不到我们的原谅！,,,,,,,,
2,虽然父祖已经逐渐逝去虽然中华民族已经重新崛起并放眼世界虽然伤痛在时光中已慢慢沉淀但我们不会也不可能忘记不可能忘记你们曾经在这片土地做过什么以及我们为什么会遭受这样的苦难这道民族的伤疤由过去的血仇凝结而成但它为现在和未来带来的，并非无休止的世仇而是永远的警醒，将永远驱使中华民族，为了悲剧永不重演而努力进取，建设祖国龙的后裔，炎黄自强不息的子孙，以及所有在红太阳永恒照耀的沃土上世代生息的各民族同胞敬告合众国的第五十一州2019.12.13RIP,,,,,,,,
2,致各位“理智者”：日本侵略者是中国人民和日本人民的共同的敌人是没错，但是这些人目前身居日本高位，它们对底层的强大反作用和同化力也不能忽视，更何况大和民族从文化上就强调“服从”，甚至出现了武士道这种病态文化，对于这种新情况，显然不能用伟人名言一笔带过，希望各位不要掉进本本主义的泥潭，也希望各位披着红衣挖墙脚的人能消停会，万里长城不是蚍蜉能撞倒的。,,,,,,,,
2,世界上最可笑的是我们代替他人去原谅别人，而被原谅者却从未道歉,,,,,,,,
2,"为什么人这么少，想了一下，可能因为今天是上课时间<img alt=""[捂脸]"" class=""small"" src=""//i0.hdslb.com/bfs/emote/6921bb43f0c634870b92f4a8ad41dada94a5296d.png@100w_100h.webp""/>。当钟声敲响，悲伤弥漫。永远永远永远不要忘了遇难者，千万千万千万要记得这段历史。当战场的硝烟散去，揭开的是没有硝烟的战争。中美贸易战、西方媒体以及对中国的打压，我们不能放松警惕，牢记历史，勿忘国耻，努力奋斗，振兴中华。或许我们个人的力量是渺小的，但团结的力量是强大的，为了祖国、为了自己、为了后人尽一份绵薄之力吧。但是在牢记民族仇恨的同时，也不能被仇恨蒙蔽双眼，不要以砸车、谩骂喜欢日本文化的人、歧视日本文化来宣泄自己的愤怒，日本文化并非一无是处。我们应当做愤（奋斗）青，而不是“愤青”，应当为国家在社会尽自己的一份力，而不是成为所谓的“键盘侠”。还有“天地不公，以万物为刍狗”的那个是不是走错片场了。<img alt=""[无语]"" class=""small"" src=""//i0.hdslb.com/bfs/emote/44667b7d9349957e903b1b62cb91fb9b13720f04.png@100w_100h.webp""/>",,,,,,,,
2,一切发动非正义战争，挑起非正义战争，的人，皆为罪孽之人！,,,,,,,,
2,有人问我，今天是什么日子。我脱口而出，12月13日。他说，我问的是什么日子。。。。什么日子呢。。。想了想，今天。。。。是。。。三十万同胞回家的日子啊。。。。南京大屠杀遇难者纪念日，三十万！整整三十万同胞！被日寇杀掉了！！！！有人说，我们为什么不忘？是啊，为什么呢？我们不忘，为什么？为什么？因为不敢啊！！！每次一旦有这种想法，我就会听到哀嚎，整整三十万无辜的灵魂，三十万含冤的灵魂！三十万。。。三十万的同胞啊！！！！他们在哭啊！他们在喊啊！他们。。。都是无辜人啊。。。。三十万，男女老少都有，那丧尽天良的小鬼子。。。我们，不敢忘啊！！！！！勿忘国耻，振兴中华。铭记历史，勿忘！勿忘！,,,,,,,,
2,"一句话，你们所原谅的日本人当年是多么支持日本政府<img alt=""[无语]"" class=""small"" src=""//i0.hdslb.com/bfs/emote/44667b7d9349957e903b1b62cb91fb9b13720f04.png@100w_100h.webp""/>",,,,,,,,
2,隔壁德国已经把反纳粹写入了法律，日本却篡改教科书，死不道歉。大屠杀受害者一个个离世，至死没有得到道歉。日本政府就是腊鸡,,,,,,,,
2,我今年过世的老太爷，同乡七人被抓到炮楼，要求拿500斤粮食赎，战乱年代的粮食何其珍贵，最后就回来三个人，我老太爷手脚也落下了问题。尊重历史，热爱和平，忘战必危，好战必亡，若敢再犯，亡国灭种。,,,,,,,,
2,自盘古开天，三皇定国，五帝开疆凡国之大事，男当在祀与戎泯躯祭国即燹骨成丘，溢血江河，亦不可辱国之土，丧国之疆士披肝沥胆，将寄身刀锋，帅槊血满袖，王利刃辉光吾等无长幼尊卑，无先后贵贱必同心竭力，倾黄河之水，决东海之波，征胡虏之地，剿倭寇之穴，讨欺吾之寇，伐蛮夷之戮遂沧海横流，儿立身无愧任尸覆遍野，惟精魂可依                与君共勉,,,,,,,,
2,许多人只注意广岛，却很少有人了解南京。,,,,,,,,
2,作为一个00后，我也看哭了，和班主任商量了一下，把视频转发到了班级群里，我只是一个普通人，没办法让那300000人活下来，但他们的愿望应该是让祖国更加昌盛，我能做的只有一个：为中华之崛起而读书,,,,,,,,
2,现虽处和平，但更应该居安思危，而不是调侃战争，调侃生命，战争不是游戏，死去的人不会重生，我们没有权利去替先人做决定，三十万人民的生命也不能因为日漫就可以释怀的，我们可以喜欢动漫，但不能因为动漫忘记民族之耻，国家之恨。勿忘国耻，缅怀先烈！,,,,,,,,
2,抱歉因为近视无法参军，但是若有战，召必应,,,,,,,,
2,中华儿女同日哭，金陵城下万人骨,,,,,,,,
2,忘记历史就意味着背叛否认罪责就意味着重犯,,,,,,,,
2,"空一座城，等三十万亡魂。点一盏灯，忌八十年乾坤。怀一颗心，求人世间安稳。哀一个国，念我千古华夏人。<img alt=""[大哭]"" class=""small"" src=""//i0.hdslb.com/bfs/emote/2caafee2e5db4db72104650d87810cc2c123fc86.png@100w_100h.webp""/>",,,,,,,,
2,我不恨你们，但并不代表我已经原谅了你们,,,,,,,,
