链接,标题,播放数量,弹幕数量,发布日期,点赞数量,硬币数量,收藏数量,转发数量,评论数量
1,"原不原谅是我们先人的事情,另外希望大家勿忘国耻，而不是仇恨,不要把他们先人干的事情安到他们后辈脑袋上,虽说原谅是不可能的,我们如果不自强，还会有这样的事情发生，落后就挨打，这些视频不是为了煽动，也不是为了怂恿你们报复，是为了警示我们一定要自强，最后向这3万亡魂敬礼。",,,,,,,,
1,"在南京上学，听到了防空警报，那时的人们是多么的不幸，日本人的罪恶行径决不能忘记！同时也感慨到国家的强大有多么重要，现在的我们真的是幸运的<img alt=""[大哭]"" class=""small"" src=""//i0.hdslb.com/bfs/emote/2caafee2e5db4db72104650d87810cc2c123fc86.png@100w_100h.webp""/>",,,,,,,,
1,"“中国人民与日本人民是一致的，只有一个敌人，就是日本帝国主义与中国民族败类。” 今天看到一堆小朋友刷这句话的(特别是一个2级小号，无脑复制黏贴，不知道他居心何在)，建议先了解毛泽东是在什么情况下写出这句话的，提示个关键词：“延安日本工农学校”。了解完了你再想想，在国家公祭日的场合，无脑刷这句题词合适么？  你说的日本人民相当一部分也算隐性军国主义者不要试图用老毛的话断章取义来洗白某些日本人民 他们既然对战犯后代当政可以容忍 就随时可以变成再度侵华的饿狼也只有真正彻底的反战和和平主义的日本人民才是中国人民的朋友，可惜这种人虽然不算少 但是在日本绝对不算多数。<a data-usercard-mid=""477747189"" href=""//space.bilibili.com/477747189"" target=""_blank"">@GCZYABC </a>    请问是什么用心？每个热评你都要复制黏贴这句话？无脑ky带节奏也要分清场合  <a data-view=""7888134"" href=""//www.bilibili.com/video/av7888134/"" target=""_blank"">av7888134</a>民意调查有40%多的日本人因为中国的历史教科书反华，这些人也是你口中的百姓？<img alt=""[无语]"" class=""small"" src=""//i0.hdslb.com/bfs/emote/44667b7d9349957e903b1b62cb91fb9b13720f04.png@100w_100h.webp""/>",,,,,,,,
1,当年大屠杀的幸存者们一个个离去，小日本这是在拖,,,,,,,,
1,愿祖国繁荣昌盛，万代不衰！,,,,,,,,
1,勿忘国耻 逝者安息,,,,,,,,
1,"their people！their land！their blood!!!!<img alt=""[阴险]"" class=""small"" src=""//i0.hdslb.com/bfs/emote/ba8d5f8e7d136d59aab52c40fd3b8a43419eb03c.png@100w_100h.webp""/><img alt=""[阴险]"" class=""small"" src=""//i0.hdslb.com/bfs/emote/ba8d5f8e7d136d59aab52c40fd3b8a43419eb03c.png@100w_100h.webp""/><img alt=""[阴险]"" class=""small"" src=""//i0.hdslb.com/bfs/emote/ba8d5f8e7d136d59aab52c40fd3b8a43419eb03c.png@100w_100h.webp""/><img alt=""[阴险]"" class=""small"" src=""//i0.hdslb.com/bfs/emote/ba8d5f8e7d136d59aab52c40fd3b8a43419eb03c.png@100w_100h.webp""/><img alt=""[阴险]"" class=""small"" src=""//i0.hdslb.com/bfs/emote/ba8d5f8e7d136d59aab52c40fd3b8a43419eb03c.png@100w_100h.webp""/>",,,,,,,,
1,相机撤退蒋介石，一苇渡江唐生智,,,,,,,,
1,不止是日本人，年让右翼分子活到今天的，美国的“功劳”不可少！,,,,,,,,
1,"泪目了<img alt=""[委屈]"" class=""small"" src=""//i0.hdslb.com/bfs/emote/d2f26cbdd6c96960320af03f5514c5b524990840.png@100w_100h.webp""/>",,,,,,,,
1,日本军民当年基本上是疯子!现在基本上是软蛋!造成现在这样的半殖民地半封建社会那是小日本它自作孽!,,,,,,,,
1,愿逝者安息,,,,,,,,
1,放现在说是西方国家，放以前叫西方列强。请大家不要忘记,,,,,,,,
1,刚刚看到了一个铭记历史，不要传递仇恨的。我赞同铭记历史，但仇恨也要牢记！这不是什么破坏和平之类高大上的东西！这是身为一个中国人🇨🇳不应该忘记的刻在骨子里的恨！南京大屠杀等等日本畜牲们做的事你真的有了解过吗，我不管当时的畜牲日本人死完了吗，但是，杀人偿命，父债子偿！抗日牺牲的那些英雄们，都在天上看着呢！所以我想，牢记仇恨并不是什么羞耻的，不对的！我们不是畜牲，我们做不出屠杀那种丧心病狂的事，但是，我们中国人，势必会让日本付出代价，这不是一年，十年，一百年就能忘记的，这是刻在骨子，融在血液的只要身为中国人都要牢记的仇！,,,,,,,,
1,铭记历史砥砺前行,,,,,,,,
1,细节，团团头像是灰的,,,,,,,,
1,"先别在那说什么我们没有资格说原谅这种话, 等施暴者道歉的时候再说或者更合适..",,,,,,,,
1,作为南京人 真的对侵华日军恨得透彻，三十万人 被折磨强奸杀害 烧杀抢掠天都是黑的，从大屠杀同胞纪念馆出来气得眼泪一直流，那些图片 报导 还有万人坑 触目惊心，太憋屈太恨了，真的勿忘国耻 虽说复仇是不可能的 但这份仇恨会永远铭记在心,,,,,,,,
1,勿忘国耻  振兴中华,,,,,,,,
1,这个地方曾经充满了我的朋友与亲人的欢声笑语，不过再也不会了。记住我的话，同志，总有一天形势会逆转，我们将要让他们偿还血债，用他们的人民，他们的土地，他们的鲜血……,,,,,,,,
1,自我国诞始，至今已有七十峥嵘。吾等命运，自新中国灭磐重生那一刻起便已然注定。那充斥着漆黑扭曲却又猩红嗅臭的仇恨，从东瀛行那屠戮无辜民众的残忍行径为始；它一刀、一刀的刻蚀在被这片土地养育地华夏民族的骨肉血液当中！！！这仿似活物一般的仇恨，无情的将骨血相连的华夏子孙撕扯，刺骨的黑色阴霾宛若幕布一般将我们包裹在内。但我们欣然接受。因为我们没有资格避开，更没有资格去拒绝！！！有的人，一次次的想要将这等不可饶恕的罪恶区别；有的人试图将他们淡化、想要一代代的滤除，就像筛网一样试图把这一切给剔除！敢问，对方这么做了吗？他们…行动了吗？当我站在尖沙咀的行人街道上时，那些躲在面具之后的同胞们让我笃定了什么才是所谓少部分；一张薄薄的黑布，它就可以肆无忌惮的将自己伪装成虚假的勇士。那，一个名为无辜的巨幕是否就可以成为遮天蔽日的灯下免罪了呢？可笑的是，我们遍布全身的血痂与那狰狞的伤口，却不能让人们看到我们悲惨的真实。祖先告诉我们，人之初性本善；但同时也告诉了我们，以德报德、以怨报怨。以牙还牙，以眼还眼！！！双标记得被雷劈的时候自己躲一边去，别连累其他人！！！,,,,,,,,
1,牢记历史，勿忘国耻,,,,,,,,
1,铭记历史，不是为了延续仇恨，而是唤起，对和平的向往与坚守。我们不能忘，也不敢忘！惟愿国家富强，和平之花永远绽放！,,,,,,,,
1,愿世界没有战争与杀戮，愿所有人都能回家。,,,,,,,,
1,自强不息！,,,,,,,,
1,九世犹可以复仇乎，虽百世可也。但是我们不能等百世，时间久了，心就会生出惰性。这事，不能再拖了。,,,,,,,,
1,勿忘国耻，振兴中华。爱中国,,,,,,,,
1,祖国万岁，不忘国耻。,,,,,,,,
1,那些还在这儿抖机灵的人 见一个举报一个嗷,,,,,,,,
1,勿忘国耻，铭记历史，振兴中华。,,,,,,,,
1,生于不醒梦之中，蜂鸟要如何与风战斗幸福转瞬即逝，痛失挚爱无所适从善意滴水穿石，延续希望有始有终“待我回家”“带我回家”“代我回家”所幸生在种花之家 长于成于江山如画。,,,,,,,,
1,只愿阿中一切安好,,,,,,,,
1,勿忘国耻，吾辈自强！,,,,,,,,
1,空一座城，等三十万亡魂。点一盏灯，忌八十年乾坤。怀一颗心，求人世间安稳。哀一个国，祭我千古华夏人,,,,,,,,
1,团团好细心啊，头像都换成灰色了。唉，愿逝者安息……,,,,,,,,
1,"团团把头像设成黑白了<img alt=""[大哭]"" class=""small"" src=""//i0.hdslb.com/bfs/emote/2caafee2e5db4db72104650d87810cc2c123fc86.png@100w_100h.webp""/>",,,,,,,,
1,勿忘国耻！,,,,,,,,
1,勿忘国耻,,,,,,,,
1,所以说，我们不可以要求有些前辈不要对日本不友好，他们可能是经历过战争的，亲眼见过自己的父母被日本人杀害的。这样怎么可能给日本好脸色。确实，时代不同了，但是这种话只有他们自己能说，我们绝对没有资格在他们面前说。,,,,,,,,
1,有时间，我一定要去南京去看看，去看看我们那30w同胞，看看我们的国殇。永远记住！共勉！,,,,,,,,
1,忘记历史就意味着背叛，否认罪责就意味着重犯。我们不应因一个民族中有少数军国主义分子发起侵略战争就仇视这个民族，战争的罪责在少数军国主义分子而不在人民，但人们任何时候都不应忘记侵略者所犯下的严重罪行。一切罔顾侵略战争历史的态度，一切美化侵略战争性质的言论，不论说了多少遍，不论说得多么冠冕堂皇，都是对人类和平和正义的危害。对这些错误言行，爱好和平与正义的人们必须高度警惕、坚决反对。                     ——习同志南京公祭日讲话,,,,,,,,
1,头像变成灰色了,,,,,,,,
1,铭记历史，不是为了延续仇恨，而是希望爱好和平的人以史为鉴、面向未来。仇恨只会滋生更多的仇恨，1战就是留下了这么个种子，是2战爆发的原因之一。为了不让悲剧上演，我们首先得自强，然后才有能力捍卫和平。,,,,,,,,
1,勿忘国耻，警钟长鸣缅怀先烈，吾辈自强,,,,,,,,
1,勿忘国耻，振兴中华.,,,,,,,,
1,铭记历史，勿忘国耻,,,,,,,,
1,http://www.cngongji.cn/m/如果大家有时间，希望大家去公祭网敲敲钟，献上花圈，点上一支蜡烛。今天，三十万南京人要回家！转,,,,,,,,
1,一个民族对另一个民族的亏欠，愿再无战争。,,,,,,,,
1,振兴中华，吾辈自强,,,,,,,,
1,"非要把日本民众和日本军国主义分开?看看我收藏的视频，日本人，得了吧，今天还认为侵略是对的<img alt=""[吐]"" class=""small"" src=""//i0.hdslb.com/bfs/emote/06946bfe71ac48a6078a0b662181bb5cad09decc.png@100w_100h.webp""/>",,,,,,,,
1,什么时候铭记历史，珍惜和平=替前人原谅了?什么逻辑?,,,,,,,,
1,强大自己，不受欺负,,,,,,,,
1,南京大屠杀纪念馆值得去一次。铭记历史,,,,,,,,
1,勿忘历史,,,,,,,,
1,"可恨！这些老人直到死去也没有等来日本的谢罪<img alt=""[生气]"" class=""small"" src=""//i0.hdslb.com/bfs/emote/3195714219c4b582a4fb02033dd1519913d0246d.png@100w_100h.webp""/><img alt=""[生气]"" class=""small"" src=""//i0.hdslb.com/bfs/emote/3195714219c4b582a4fb02033dd1519913d0246d.png@100w_100h.webp""/><img alt=""[生气]"" class=""small"" src=""//i0.hdslb.com/bfs/emote/3195714219c4b582a4fb02033dd1519913d0246d.png@100w_100h.webp""/>活着的历史渐渐远去，我们要做这份记忆的传承者",,,,,,,,
1,勿忘国耻，当年犯下的罪行不可能因为时间就消失。,,,,,,,,
1,勿忘国耻砥砺前行,,,,,,,,
1,不忘历史，更要自强！！！只有真的强，这样的悲剧就再也不会重演,,,,,,,,
1,勿忘国耻,,,,,,,,
1,勿忘国耻,,,,,,,,
1,致敬,,,,,,,,
1,我一直就有一个想法，设计一个游戏，在这个关卡里，你只有一条命，在日军的层层追杀中活下来的，将成为南京大屠杀的幸存者，抵抗后被杀的，将成为遇难者，从幸存者和遇难者的视角去解读这个灾难性的南京惨案,,,,,,,,
1,"逝者安息……安息<img alt=""[大哭]"" class=""small"" src=""//i0.hdslb.com/bfs/emote/2caafee2e5db4db72104650d87810cc2c123fc86.png@100w_100h.webp""/>",,,,,,,,
1,我觉得我们从来没有替先辈去原谅他们，只不过我们憎恨的从来都是那个时代的敌人，现在出生在和平年代的孩子们，以及平凡生活的人，他们又何罪之有？我们是铭记历史，不忘过去，而不是把仇恨强加于现在的平民,,,,,,,,
1,朝阳还是一如既往地升起，但是遇难者们却再也回不来了,,,,,,,,
1,各位乘客，由于公祭日安保需要，南京地铁云锦路站将于12月13号7点至12点临时关闭，给您带来不便敬请谅解。,,,,,,,,
1,值得注意的是，已经有大量外国网军渗透到各大社交媒体，其中就包括B站。各位，为日本军国主义洗白的，和盲目拉动民族仇恨的，很可能都不是中国人，他们的目的就是为了从内部分化我们。我们一定要警惕，一定要团结，争论会有对立，但民族立场是统一的，切忌盲目树敌，将我们的同志推向对立面。铭记历史与呼吁和平不冲突！互相盖帽子、设立对立面就是敌人分化我们内部的主要手段。,,,,,,,,
1,铭记历史，而非仇恨,,,,,,,,
1,人民无罪。但并不是所有人都可以称得上“人民”。,,,,,,,,
1,我们后人没有资格去原谅！,,,,,,,,
1,牢记历史,,,,,,,,
1,勿忘国耻，振兴中华！,,,,,,,,
1,勿忘国耻，警钟长鸣,,,,,,,,
1,勿忘国耻 牢记历史 振兴中华！,,,,,,,,
1,原遇难同胞安息，后入因为你们才能去看清党的领导的好，以及外国侵略者的残暴。,,,,,,,,
1,南京大屠杀遇害者纪念日，从来都是告诫后人要防范于未然。在这个和平稳定的年代你可以肆意书写着对日的理智，因为没人能拿你怎么样，也可以狂暴的宣泄你的仇恨，因为你并不需要拿上刀枪。可是一定不要忘记告诉后代，防范，防范，防范。因为一旦有战争的时候，他们不会因为你的友好或者仇恨有任何变化，都是杀。,,,,,,,,
1,“这里曾经都是人，现在欢笑声不再了……但是请记住，同志……总有一天事情会发生转机。我们会把战火带给他们的土地，他们的人民，他们的血……”维克多·雷泽诺夫，1942年，斯大林格勒,,,,,,,,
1,王师北定中原日，家祭无忘告乃翁。,,,,,,,,
1,我只希望有生之年不再看到中华大地上仍有精日，尤其是南京,,,,,,,,
1,大家去国家公祭网敲个钟，献束花，点个蜡烛吧！虽然无法到现场。http://www.cngongji.cn/,,,,,,,,
1,说是一些日本平民与日本军国主义分子无关，然而中国在钓鱼岛争端时派救援人员赶往地震后的日本，还有救援物资，黄岩岛争端时发出物资到菲律宾救灾，911后派反恐专家赴美合作，日本插手东海南海时仍高呼中日合作中日友好，中国地震时日本幸灾乐祸,,,,,,,,
1,每一年，总有那让人印象深刻的五天。这五天当中，有的代表胜利的喜悦，有的代表丧病的惨剧，但都提醒着我们:勿忘国耻。这五天分别是:7.7，8.15，9.3，9.18，12.13。,,,,,,,,
1,"团团的头像变黑了<img alt=""[大哭]"" class=""small"" src=""//i0.hdslb.com/bfs/emote/2caafee2e5db4db72104650d87810cc2c123fc86.png@100w_100h.webp""/>。勿忘国耻，振兴中华！！！",,,,,,,,
1,日本一天不承认南京大屠杀，日本就还是当年那个日本，只是中国如今强大了忌惮而已。,,,,,,,,
1,铭记历史，勿忘国耻,,,,,,,,
1,珍爱和平，自强不息,,,,,,,,
1,当照片墙上的灯一盏盏熄灭，见证者正逐渐凋零，但这段悲痛的历史不容忘却！愿逝者安息，和平永存……制作：@江苏共青团、@南京师范大学团委,,,,,,,,
1,牢记历史！！！,,,,,,,,
1,盛世繁华凝望铁蹄蹂躏，无能为力救下过去刀口下的亡魂是我们最大的悲哀,,,,,,,,
1,中国自古以来都是以仁义和平对待日本，然而日本一强大就侵略中国，有的国家民族你对他仁义他还你仁义，有的国家不管你对他如何，他该侵略你还侵略你。,,,,,,,,
1,勿忘国耻牢记历史为中华之崛起读书,,,,,,,,
1,气得我饭都吃不下。,,,,,,,,
1,哎        不知道现在还有多少会记得这个日子,,,,,,,,
1,啊 我手机日历提示我今天是南京大屠杀公祭日……勿忘国耻……,,,,,,,,
1,我辈当自强 不负先辈们的牺牲 这是对他们最好的纪念,,,,,,,,
1,从来都不该忘记，却也不愿总挂在嘴边。心中牢记偶尔回忆起默默流出的泪，远比某些以此作为仇视恶化中日关系的呼喊来的深刻。请不要忘记历史，也请记住先人。而不是一味的仇视，如果真要算起账来，五千年这么长一张生死谱上有多少冤魂野鬼，滚滚长江又淘净了多少英雄血？铭记历史，把握的是当下。而不是深陷过去的漩涡无法自拔，固步自封。,,,,,,,,
1,记住历史，惨痛的教训告诉我们落后就要挨打，新民粹主义要不得，而是要专心发展，搞建设，让外敌再难对我们有瓜分的意图,,,,,,,,
1,永远不相信日本的“友好”谎言，除非他们把真相写进教科书,,,,,,,,
1,勿忘国耻,,,,,,,,
1,在南京上学，今天上课期间我们会停下来默哀一分钟的。,,,,,,,,
1,一寸山河一寸血，十万青年十万兵。,,,,,,,,
1,永不会忘记，那年金头，南京大地上的惨绝人寰，永不会忘记，那些因战争无辜受害的人们。永不忘国耻！,,,,,,,,
1,勿忘国耻，和平来之不易!没有人点赞让我有点感动网友的默契。,,,,,,,,
1,勿忘国耻,,,,,,,,
1,"勿忘国耻。对逝去的抗日战士默哀。希望对面的岛国。能够正视历史友好相处。未来的中国能有轻犯罪法。真心祈祷我国国泰民安。<img alt=""[酸了]"" class=""small"" src=""//i0.hdslb.com/bfs/emote/92b1c8cbceea3ae0e8e32253ea414783e8ba7806.png@100w_100h.webp""/><img alt=""[大哭]"" class=""small"" src=""//i0.hdslb.com/bfs/emote/2caafee2e5db4db72104650d87810cc2c123fc86.png@100w_100h.webp""/>",,,,,,,,
1,这个视频不能有点赞。,,,,,,,,
1,总有一天我们会让日本政府承认他们的罪行并且道歉,,,,,,,,
1,不忘过去，珍惜和平。不忘初心，方得始终。不畏将来，砥砺前行。,,,,,,,,
1,团团头像都灰了,,,,,,,,
1,国家公祭，祀我国殇！勿忘历史，吾辈自强！,,,,,,,,
1,所幸生在和平年代，今天所有的一切都建立在国家强大的背景之下。吾辈当自强,,,,,,,,
1,前事不忘，后事之师,,,,,,,,
1,勿忘国耻，振兴中华,,,,,,,,
1,今天是我生日，想忘也忘不了啊(;¬_¬),,,,,,,,
1,铭记历史，勿忘国耻，振我中华,,,,,,,,
1,警惕这个年代抬头中的任何新法西斯意识形态,,,,,,,,
1,南京大屠杀死难者国家公祭日,,,,,,,,
1,勿忘国耻,,,,,,,,
1,勿忘国耻 吾辈当自强,,,,,,,,
1,铭记历史，珍爱和平,,,,,,,,
1,有一个算一个，日本人如果不怀有忏悔之心，那就是有罪的。你们要把日本政府和日本人民割裂开，可以啊。让日本人民自己选择。如果日本人民真的无辜，早该推翻现有的政府了。,,,,,,,,
1,"国家公祭日，哀悼<img alt=""[爱心]"" class=""small"" src=""//i0.hdslb.com/bfs/emote/ed04066ea7124106d17ffcaf75600700e5442f5c.png@100w_100h.webp""/>",,,,,,,,
1,国殇国殇…_红旗为何这般红？鲜血染就金星为何挂高空？永垂不朽_但愿国旗永不褪色但愿祖国繁荣昌盛_🇨🇳海外学子最真挚的心,,,,,,,,
1,我在思考活下去的意义 看到这个视频我想通了 很多东西需要传承 前辈披荆斩棘开辟下来的路不能荒芜掉  虽然是芸芸众生 微如沙粒 但是 我的存在 或许会让这个社会有一点点一点点的向前与改变   我会好好的活下去 还要努力的活下去,,,,,,,,
1,"勿忘国耻，愿逝者安息<img alt=""[委屈]"" class=""small"" src=""//i0.hdslb.com/bfs/emote/d2f26cbdd6c96960320af03f5514c5b524990840.png@100w_100h.webp""/>",,,,,,,,
1,勿忘国耻,,,,,,,,
1,唉，看着灰色的团团头像快哭了……,,,,,,,,
1,勿忘国耻，铭记历史，不可原谅！！！,,,,,,,,
1,振兴中华，勿忘国耻！,,,,,,,,
1,"有幸在9.18那天到过南京，当警笛响彻金陵城的那一刻，所有行人车辆全部停下默哀，当时时间像是停止了一般，我又感动又难受得哭了<img alt=""[委屈]"" class=""small"" src=""//i0.hdslb.com/bfs/emote/d2f26cbdd6c96960320af03f5514c5b524990840.png@100w_100h.webp""/>",,,,,,,,
1,我们没有权利，也没有资格去那些逝去的国人和先烈去原谅，我们能做的只有铭记那段耻辱史，然后奋力向上，落后就要挨打，,,,,,,,,
1,海阔接天浪声嘶，万里空锁中原。战炮惊破帝皇冢，何处祖龙安眠。  狼烟烬泪付秋风，一炬苟望擎蛟龙。  千帆连焰蒸黄海，八荒合刃宰东穹。  断南不释七子泪，北城空吟秦汉梦。  台海尽是他乡客，别国月圆明关东。  乱首残尸掩金陵，血雨浇城蔽青天。  可怜热泪灼焦土，三十万魂恨难填。  但见神龙重驭天，举颅啸傲定坤乾。  奋膂激昂振山河，万元一新除旧魇。  晓来彤霞浸九州，赤旗随风飞迎春。  旦今不忘外侮恨，笑泪共盈炎黄魂。  百年苦难终流水，一言当示后来人。,,,,,,,,
1,@南京发布：侵华日军南京大屠杀遇难同胞纪念馆可以称南京江东门纪念馆，但不能称南京大屠杀纪念馆！南京大屠杀死难者国家公祭日，不能称南京大屠杀纪念日！附全文：https://mp.weixin.qq.com/s/oZj9sAk3xNOWB7qD7ciOtw,,,,,,,,
1,我们生活在和平年代，但这不是我们忘记痛苦的理由，我们要做的，是努力建设我们的国家，不让我们的国家，人民，再受到这种伤害，这才是那些逝去的人愿意看到的，我们要让他们看见，我们现在的祖国是多么强盛，多么繁荣！牢记历史，勿忘国耻，珍惜现在，建设未来！,,,,,,,,
1,暨南京大屠杀遇难者同胞纪念日,,,,,,,,
1,勿忘国耻，砥砺前行,,,,,,,,
1,"希望大家可以看看纪录片《三十二》和《二十二》 愿世界和平 逝者安息 愿阿婆们来生可以被温柔以待三十二 <img class=""jump-img"" src=""https://i0.hdslb.com/bfs/activity-plat/static/20201110/4c8b2dbaded282e67c9a31daa4297c3c/AeQJlYP7e.png""/><a class=""comment-jump-url"" data-report=""1"" href=""https://b23.tv/ep125984"" target=""_blank"">三十二</a>二十二 <img class=""jump-img"" src=""https://i0.hdslb.com/bfs/activity-plat/static/20201110/4c8b2dbaded282e67c9a31daa4297c3c/AeQJlYP7e.png""/><a class=""comment-jump-url"" data-report=""2"" href=""https://b23.tv/ep198189"" target=""_blank"">二十二</a>",,,,,,,,
1,铭记历史，勿忘使命,,,,,,,,
1,勿忘国耻，牢记历史 南京大屠杀八十二年默哀,,,,,,,,
1,勿忘国耻，牢记历史。,,,,,,,,
1,勿忘国耻！！！吾辈自强！！！强国富民！！！重振雄风！！！我们没有资格也没有任何理由可以宽恕日本在二战时期在中国犯下的滔天罪行，日本永远欠中国一个交代，一个真诚的道歉！,,,,,,,,
1,打倒军国主义和民族败类，愿祖国永远繁荣富强,,,,,,,,
1,"我辈当自强<img alt=""[打call]"" class=""small"" src=""//i0.hdslb.com/bfs/emote/431432c43da3ee5aab5b0e4f8931953e649e9975.png@100w_100h.webp""/>",,,,,,,,
1,说句日本鬼子就会被举报？？？就这？当时那些日本军队，不是鬼子是什么？,,,,,,,,
1,前事不忘，后事之师，铭记历史，珍爱和平,,,,,,,,
1,你的头像这么黑了,,,,,,,,
1,铭记历史，勿忘国耻，振兴中华#中国##爱国##南京大屠杀##国家公祭日##南京南京##历史#,,,,,,,,
1,"晚上在被窝里起了鸡皮，眼角里泛起泪水，我真的不知道说什么，只感觉心痛<img alt=""[大哭]"" class=""small"" src=""//i0.hdslb.com/bfs/emote/2caafee2e5db4db72104650d87810cc2c123fc86.png@100w_100h.webp""/>",,,,,,,,
1,侵华日军南京大屠杀遇难同胞纪念馆不可被简称为南京大屠杀纪念馆。南京大屠杀死难者国家公祭日也不可被简称为南京大屠杀纪念日。,,,,,,,,
1,侵华日军南京大屠杀遇难同胞纪念馆不可被简称为南京大屠杀纪念馆。南京大屠杀死难者国家公祭日也不可被简称为南京大屠杀纪念日。,,,,,,,,
1,http://www.cngongji.cn/m/如果大家有时间，希望大家去公祭网敲敲钟，献上花圈，点上一支蜡烛。今天，三十万南京人要回家！转,,,,,,,,
1,勿忘国耻呀，少年！,,,,,,,,
1,有人注意到官方的头像嘛……好用心QAQ,,,,,,,,
1,"默哀三分钟，逝者安息<img alt=""[委屈]"" class=""small"" src=""//i0.hdslb.com/bfs/emote/d2f26cbdd6c96960320af03f5514c5b524990840.png@100w_100h.webp""/><img alt=""[委屈]"" class=""small"" src=""//i0.hdslb.com/bfs/emote/d2f26cbdd6c96960320af03f5514c5b524990840.png@100w_100h.webp""/><img alt=""[委屈]"" class=""small"" src=""//i0.hdslb.com/bfs/emote/d2f26cbdd6c96960320af03f5514c5b524990840.png@100w_100h.webp""/>",,,,,,,,
1,还记得团团之前微博说话的话吧真正热爱祖国的年轻人，即便他们是日本动漫游戏的铁杆粉丝，他们也会在大是大非的问题面前维护自己国家的主权和民族尊严。而那些没有脊梁骨、双膝发软的人，即便他们对日本没兴趣，也迟早会跪倒在其他人面前，嘲笑着中国的一切，包括中国的主权和民族的尊严                                    逝者安息,,,,,,,,
1,忘记历史，意味着即将重复,,,,,,,,
1,勿忘国耻!,,,,,,,,
1,今天是国家公祭日，昨天晚上我参加的年会是在一对老夫妇的工作室里举行的老人家说自己的爷爷做过对不起中国的事情，我特别喜欢中国的文学，衷心希望中日关系能够变好我觉得我们后人能做的只有不忘国耻，日本人承认历史，才能让中日关系能够和平稳定发展,,,,,,,,
