链接,标题,播放数量,弹幕数量,发布日期,点赞数量,硬币数量,收藏数量,转发数量,评论数量
4,评论能不能别那么语言暴力，动不动就给人扣日杂的帽子?这些都是国耻谁人能忘!中日世仇又有谁能忘?但这也不代表就能以此扭曲事实吧，用一些夸张不经考究的数据和言辞来激起的爱国情绪就是好的么?与其在这里轻易听信别人言语让别人引导自己的情绪，不如自己去多看看书真正去了解一下历史，去了解一下对手，敌人是怎么想的，我们欠缺了什么，固步自封自哀自怨你就不怕会有下一个大屠杀，我们要做的不是一直沉浸在往日的悲痛无法自拔，我们是要背负着往日的悲痛继续前进!!!理智一些吧!,,,,,,,,
4,日本当年为什么要这么干，一句话，如果你是日本人，你面对着当时19世纪的萧条经济危机，再加上你是生在一个岛国，旁边就是一块各位庞大的超级大陆，自己手里的科技技术已经回春而旁边的一个原本的“超级帝国”却是大门紧闭充耳不闻，技术被别人拉出几条街都不知道，你完完全全有能力把这个国家给你服务，你会对此怎么想???所以说别站着所谓的民族道德制高点说话，这完完全全就是想要引发战争的思想，就是“碍国粪青”，对祖国的未来一点好处都没有，只知道仇日，从所谓的“中国人”的角度来强行看待历史问题，历史是需要我们去客观看待的，而不应该是以民族仇恨的角度去强行定义历史。,,,,,,,,
4,说起来也是搞笑，我就知道有一些无脑爱国的人看了我的评论就说**杂开始疯狂骂人，还是私信骂人，换位思考都不懂的人真是真实睿智,,,,,,,,
4,作为一个赵国人的后代，我强烈要求掘白起的坟，以及让所有秦国人的后代向我道歉(▔□▔)/,,,,,,,,
2,得了吧，1楼，我又不是没去过南京。南京很多人都喜欢去日本旅游好吧，不服来辩,,,,,,,,
3,"我真想知道，评论区的各种爱国愤青。有几个是南京人。当日本人侵略中国，你们的祖宗是去战场了?**老前辈骂日本人的我是没看几个，家里有烈士的我也没见几个放狠话的。狠话你们没资格说，你们还没日本人厉害呢!中国如果再被侵略，你会抛弃家庭去上战场再说话。想起清楚了战争得本质再说话。""往日本再扔俩核弹那个""你真不如日本人，评论前几的真不如日本人!",,,,,,,,
0,人不可貌相，澳大利亚杀了20万俘虏来着真的可怕,,,,,,,,
0,@SwedenMice :选择性遗忘可真是有趣。顺便扣带帽子，拉黑屏蔽，这一手操作在下佩服。,,,,,,,,
0,12分30秒,,,,,,,,
0,朝香宫那个渣渣呢？,,,,,,,,
0,应该千刀万剐之后骨头下油锅,,,,,,,,
0,你们。。真的全看完了啊。。我真的看不下去，实在太惨了，也许我胆子小吧,,,,,,,,
0,战争从古至今 牺牲的生命太多太多,,,,,,,,
0,活 该,,,,,,,,
0,应该折磨死他，每天生不如死,,,,,,,,
0,松紧石更？,,,,,,,,
0,还有裕仁,,,,,,,,
0,现在有个严峻的世界性问题，用什么方法或者手段能让世界人口减半,,,,,,,,
0,做成人彘才好，让他多活几年，感受一下人生的漫长ヽ(`Д´)ﾉ,,,,,,,,
0,历史上这种事从来不在少数，无论远古还是近代。哪怕是现代都一样。选择不同，结果不同但我期望的只有一个，能够明白的死去或者活着。而不是愚昧的被诱导,,,,,,,,
0,凌迟了解一下,,,,,,,,
0,呃，b站**的果然还是多,,,,,,,,
0,55楼是什么品种？？都看不下去了都,,,,,,,,
