链接,标题,播放数量,弹幕数量,发布日期,点赞数量,硬币数量,收藏数量,转发数量,评论数量
1,中国人民和日本人民是一致的，只有一个敌人，就是日本帝国主义和中国民族败类,,,,,,,,
1,不管怎样日本鬼子不可原谅,,,,,,,,
1,我从来不说原谅日本鬼子，因为他们不配被原谅，并且我也不想看到某些中国人说原谅日本人 你们都没资格说原谅包括我也没资格,,,,,,,,
1,采访日本小学生放中国中学生图片？,,,,,,,,
1,當今日本軍國主義教育下，日本人幾乎都會淪為一群身披人皮的妖怪們！我在此希望林正英大哥在天之靈、不老不死的無心法師、VAN HELSING教授及CONSTANTINE教授等全世界一系列神話及文化作品中的驅魔師們能前往日本將這些軍國惡妖們徹底收伏！不求封印只求他們都永不超生、永無輪迴！日本，一個充滿軍國主義邪魔妖獸的地獄小島國！,,,,,,,,
1,有些年轻人没经过战争不知道历史的残酷，自然对日本就有好感，不认为日本是个变态邪恶的国家。,,,,,,,,
1,核平万岁！核平东北亚，和平全世界！萝卜头吔屎了！,,,,,,,,
1,这种视频下我选择给呼吁辣鸡视频滚出b站的人一人一个赞\(≧▽≦)/,,,,,,,,
1,赚钱请去别处,,,,,,,,
1,还是很多中国人喜欢拿别人的痛苦来开玩笑,,,,,,,,
1,日本人未必不知道，只是不敢说，有人说然后被日本政府逼自杀的。这日本政府这样，人民怎么正视历史？,,,,,,,,
1,内容全靠编,,,,,,,,
1,举报了。为了“用户激励计划”的钱，真是无所不用其极。要点脸行吗？非要用一大段侮辱观众智商的旁白消费历史？非要随意找个理由煽动网友的爱国情怀？,,,,,,,,
1,只要战争就会死亡，这是不可避免的，只能说勿忘国耻爱我中华，时隔这么多年了 也应该过去了，因为今天的中国不能与当时的中国可以比较的，中国强大了 绝对不会报复，或者欺负，21世纪是中国的世纪 是中国的精神，中国的文化，中国文字文化超过5000年 没有文字文化超过一万年，这些是无法比拟的，修身齐家治国平天下，平天下这里解释一下，是平等，公平，互帮互助，共同繁荣。,,,,,,,,
1,请问你敢不敢把你的所有视频发到油管上去,,,,,,,,
1,不能延续仇恨，要铭记历史,,,,,,,,
1,沙雕日本,,,,,,,,
1,铭记不是仇恨，勿忘国耻不是以牙还牙,,,,,,,,
1,人血馒头好吃吗？,,,,,,,,
1,"Les gouvernements sont parfois des voleurs, et les gens ne seront jamais des voleurs.         Victor·  Hugo政府有时会是强盗，而人民永远也不会是强盗。        维克多·雨果",,,,,,,,
1,逃避解决不了问题，只会解决你自己,,,,,,,,
1,败类，居然把同胞的牺牲当做生财工具，枉为人,,,,,,,,
2,静静看爱国愤青们撕逼，，哈哈哈,,,,,,,,
3,辣鸡日本,,,,,,,,
1,理性爱国,,,,,,,,
0,南京真的不想去，总感觉30万冤魂在周围咆哮,,,,,,,,
0,这种视频也太恶心了吧 我真的服了,,,,,,,,
0,虽然对日本没什么好感。但刻意扇动民族仇恨不可取，你这是虚假新闻吧,,,,,,,,
0,拉黑包平安,,,,,,,,
