链接,标题,播放数量,弹幕数量,发布日期,点赞数量,硬币数量,收藏数量,转发数量,评论数量
6,说实话，这里是我最喜欢的评论区之一了，热评，大家都很统一，基本没有人撕，也几乎没有人洗。,,,,,,,,
6,日本军国主义是影响了日本整个国家的，在中国杀人放火、**辱掠，鬼子还有他们在日本的父母妻子人人都觉得很光荣。日本人绝对都是有罪的,,,,,,,,
6,说实话，我觉得确实铭记历史要比铭记仇恨重要的多。真正的爱国从来不是在屏幕面前用你的键盘打出“我要杀了所有日本人”或者是说对一些没有反 华倾向的日本艺人以及普通民众进行人身攻击。而是应该努力提升自己，使我们的国家强大到曾经侵略和轻视过我们的国家，都望尘莫及的地步，我觉得这样的爱国才是有意义的。,,,,,,,,
6,在评论区里看了太多类似“看番的二刺猿＝**＝为日本罪行洗地＝主和的叛徒”的结论。首先，我看番是我的个人爱好是兴趣的一种不是你们来攻击人的理由，我承认的确是有些二货，上来就喷人，以至于让我们这些当初圈地自萌时代的老人都惊呼二不起。其次，我只想说:“**都是一群空有人样的家伙！”然后，为日本洗地这种事情，我就得除非他是一个被洗过脑的**，要不然一个正常的中国人谁会干这种事，虽然“站在他人的角度想问题”的确是好事，但请看看时间和地点，这不是你和朋友的吵架，这是关呼国家尊严的大事，是这个民族不可磨灭的伤痛。最后，主和不是我们决定的，是时代决定的，现如今那个国家在安定之后还想着发动战争会被群起而攻之，除非对方先动手，所以主和是有市场的，但不是必须的，如果日本先做了什么，主和必然不可，但我们不出无名之师。以上是我作为一个中国人的愚见，望个方大佬见谅。,,,,,,,,
6,呵呵，说句日本有罪就要删，b站真是有能耐了，在中国的网络上，还头一次见到这么没有言论自由的网站。,,,,,,,,
6,我们没资格替前人原谅，但可以送他们去见前人，中国人早已醒来！！！！,,,,,,,,
6,老说历史历史，不是要活在过去，而是要明白，历史是什么，历史就是经验，经验就是教训，就像去找工作哪里都要有经验一样，历史就是对国家对民族乃至人类的经验，明白为什么当年我们会受尽屈辱，为什么有这么多人即便去死也要抗争,,,,,,,,
6,"我不管，我就是想灭了那个岛，一天不灭了他，就一天不得安生<img alt=""[小电视_发愁]"" src=""//i0.hdslb.com/bfs/emote/05e279abbf3f72d5cc45548504a4220c5514b8b9.png@100w_100h.webp""/>",,,,,,,,
7,在这里喊屠杀日本的，失了理智。在这里骂人小将粉红的，没有社交。一个人因为看到这种视频而愤怒影响理智是正常的，在人的气头上浇一盆冷水，你觉的会有什么良性进展？无非是唇枪舌剑一顿然后不欢而散。,,,,,,,,
7,求你们干点实际的事为国家出力，难道要用键盘打日本吗,,,,,,,,
7,这种视频就不要占楼了吧，好难受啊愿你们的在天之灵安息,,,,,,,,
8,热评上说的都有理，但是，记住历史，等于记住了仇恨,,,,,,,,
8,中华民族与日本的仇恨永远不共戴天，我不会忘记,,,,,,,,
8,我记住历史，也会记住仇恨。如果将来哪一天和日本开战，我会去第一线上。以比它们残忍一百倍的方式对它们，哪怕是普通百姓，哪怕是变成魔鬼也在所不惜。君子报仇，十年不晚。魔鬼报仇，一百年都不会晚。,,,,,,,,
9,"有很多理智的朋友嘛，错的是政府，不是人民，不能一竿子打死，日本有很有的愿意承认的人。我非常支持你的观点，日本人民无罪！应该说其实是日本政府压迫人民而已，人民都是友好善良的，他们很愿意承认历史，和中国人友好，他们大部分不会隐藏内心会和你吐露心，他们大部分都不歧视中国人，不会认为中国人都没素质，他们也不会在网上一口一个只拿人的叫，他们不会几乎没有人为中国说话，雅虎日本，2CH，facebook,谷歌赞数最高的评论绝对不会是否认暴行的，N站这样的二次元网站也不会是反华为主流，孩子更是无辜的，他们绝对不会在幼儿园里喊叫保卫钓鱼岛，打败无耻的中国和韩国，为了首相大人的话语，日本的私人媒体更不会摸黑中国，把中国妖魔化，日本的老百姓们会成群结队地在靖国神社前嚷嚷，要打到军国主义，这些都证明了现在的日本人很无辜，奈何受政府压迫，虽说是民主国家，但是右翼政府把控了大权，大家的选票都是被处理过的，日本人想反对政府，人民不想投给右翼政府但是无奈政府太厉害，友好善良的日本人民真是生活在政府高压中啊，只能哀叹，我们应该体谅。不应该怪罪现在的友好的人民。相信我，他们和动漫表现的一样，友好，开朗，活泼，勇敢，坚强善解人意，天使一样。真的不知道为什么有这么多无脑愤青喷，历史都过去这么久了，还想着复仇，还骂日本，没有素质，我真是对国人痛心疾首",,,,,,,,
5,评论区一如既往的晦气←_←,,,,,,,,
5,永远记住自己是一个中国人 留着华夏民族的血,,,,,,,,
5,"我想说我们看日漫就是为了取经，当国漫完全超过日漫的时候，岛国也没必要存在了<img alt=""[星梦手记_卖萌]"" src=""//i0.hdslb.com/bfs/emote/375e4296c26f65be888e86bea4af4f858642a7bb.png@100w_100h.webp""/>",,,,,,,,
5,我将来会写一部战争的小说，其中有一段日本二次侵华，但是这回日本败得很惨。中国还攻入日本。但是就并没有进行什么屠杀，倒是入过东京。给他们一个非常大的教训。日本还割让了不少的岛屿，中国才算返回。我不知道这部小说是不是会有什么缺陷，希望其他大佬能给我科普一下，我也好进行小说的写作。,,,,,,,,
5,哪怕没有731，南京大屠杀，旅顺大屠杀，日本也是中国的敌人，因为他们的存在威胁了中国的安全。,,,,,,,,
5,我只想说看看热评，理智爱国。,,,,,,,,
5,战争是一台毫无人性的机器，不管你是手无缚鸡之力的人还是高大无上的，只要卷进战争，人性将无复存在！劝那些动不动发动战争的人 ，仔细想想战争是搭上人命的，何况坐在电脑面前敲着键盘的你！落后就要挨打！铭记历史，而不是打着历史的旗号以武力宣战！日本也分左翼右翼！政治问题为什么怪罪人民！人民只是跟着政治走，回望中国历史总有那么相似的地方！理性爱国！铭记历史！勿忘国耻！,,,,,,,,
5,国仇家恨焉敢忘，从来爱恨岂无由？对于日本，依然是那句话：非我族类其心必异！,,,,,,,,
5,别说话安静看，不论你说了什么，只要你提到了冷静下来，铭记历史勿忘国耻放下仇恨你就会被扣上日 杂，精 日，给日本洗地的帽子，zf真要想复仇的话，可能自己国内就先掐起来了,,,,,,,,
5,没有让你们小鬼子亡族灭种，已经是我中国人最大的仁慈了，现在的日本右翼，我看你们是想让曾经的差点灭亡，变成彻底灭亡！君子报仇，十年不晚，血债必须血来偿,,,,,,,,
5,历史需要铭记，不需要高潮。鼓吹战争的都是zz( ´_ゝ｀),,,,,,,,
5,"坐看各位引战，顺便丰富自己的黑名单<img alt=""[蛆音娘_吃瓜群众]"" src=""//i0.hdslb.com/bfs/emote/5d0d6cc54b508d30b4f50b6b5f7b7e1e259d84ea.png@100w_100h.webp""/>",,,,,,,,
5,"我以前好精ri,但是看到这个我为以前jing日行为道歉，以前说**砸真的是骂的好，我要改过自新。日本真的有罪，罪该万死，日本人恶心至极！！",,,,,,,,
5,其实只是🇨🇳现在没有强到一定程度，只要有那实力，早就把🇯🇵给踏平了,,,,,,,,
5,日漫?我的列表里只有国创！！！,,,,,,,,
5,说真的，不太喜欢日本。虽然日漫我看，但是对于里面的抄袭的文化硬要说自己原创的我也是不敢苟同。三观正的动漫就好(▔□▔)/,,,,,,,,
5,"<img class=""jump-img"" src=""https://i0.hdslb.com/bfs/activity-plat/static/20201110/4c8b2dbaded282e67c9a31daa4297c3c/AeQJlYP7e.png""/><a class=""comment-jump-url"" data-report=""3"" href=""//www.bilibili.com/video/av19135131"" target=""_blank"">南京记忆：美国人拍摄的77年前的南京大屠杀</a>",,,,,,,,
5,中国的崛起需要这些禽兽的鲜血，我这人就是这么极端，少来给我讲大道理，3500万同胞在天上看着呢！说我这种人恶心，我无所谓，我就是要恶心的你们忘不掉这段历史,,,,,,,,
3,贪婪凶狠没有人性，正义必胜,,,,,,,,
3,曲解和侮辱历史的人终将在正义和鲜血面前长跪不起。,,,,,,,,
3,我不敢看,,,,,,,,
3,日本该死,,,,,,,,
3,我没有勇气看下去…但是这段历史我一直在心里铭记,,,,,,,,
3,我只能说对不起,,,,,,,,
3,不敢点开。,,,,,,,,
3,总而言之吧，现在日本政府这揍性就是美国惯出来的。,,,,,,,,
3,历史可以被掩盖，但决不会被毁灭，决不会被遗忘。,,,,,,,,
3,战争很可怕 就算国家强大一样会死人 所以禁止战争 战争真的可怕,,,,,,,,
3,这些虽然我没办法看，但我不会忘记的,,,,,,,,
3,我觉得热评在搞事情(微笑)，评论撕逼 热评要背一半的锅,,,,,,,,
3,播放量不太高是应为很多人都不忍心点开看吧！太残忍了！,,,,,,,,
3,我真的没办法点开这个视频，咬牙,,,,,,,,
3,勿忘历史才能昂首直面未来，日本不道歉就必将有一日被我中国人民解放军占领,,,,,,,,
3,恨恨恨,,,,,,,,
3,同胞仇，犹未雪,,,,,,,,
3,以德报怨，何以报德？,,,,,,,,
3,他们只不过觉得没输给我们，只是输给了他们的父亲,,,,,,,,
3,点开了不敢看,,,,,,,,
3,難受，無法用語言表達，勿忘國恥,,,,,,,,
3,除了愤怒还是愤怒,,,,,,,,
3,恨不能亲手手刃当年的侵略者们。,,,,,,,,
3,正因为看到这些历史，我们更应该努力！只有我们强大富足才不会被外寇肆意凌辱！可惜，有些人看到这些只会发发牢骚借此发泄心中不满过后依然破罐破摔……我们铭记历史不是为了铭记仇恨，而且为了知耻后勇莫让我们重蹈覆辙！,,,,,,,,
3,其实挺不想点开这个视频的，又怕自己会哭了起来。生于和平之时，不敢忘此辱，亦不能忘。,,,,,,,,
3,人是健忘的，不记仇；但是不能忘记,,,,,,,,
3,铭记历史，理智爱国，文明发言。,,,,,,,,
3,记住历史，勿忘国耻，看了这种视频是真的头皮发麻，就是非常非常非常气愤。原谅日本么?别做梦了，连道歉都不会的国家原谅他做甚。,,,,,,,,
3,南京血雨八十载，后人莫忘万魂哀,,,,,,,,
3,“真正热爱祖国的年轻人，即便他们是日本动漫游戏的铁杆粉丝，他们也会在大是大非的问题面前维护自己国家的主权和民族尊严。而那些没有脊梁骨、双膝发软的人，即便他们对日本没兴趣，也迟早会跪倒在其他人面前，嘲笑着中国的一切，包括中国的主权和民族的尊严。”——转自团团的一篇文章我们，永远都不会忘！,,,,,,,,
3,@日本驻华大使馆,,,,,,,,
3,名古屋市长:如果有南京大屠杀我就去南京跪着认错。,,,,,,,,
3,永远不会忘记历史，但也不能原谅侵略者,,,,,,,,
3,我见过不少“双面派”，对待日本文化和日本历史是两个态度，对待韩国明星和韩国态度是两个态度,,,,,,,,
3,三分人样未全，七分兽性十足,,,,,,,,
3,想起来上次上历史课，老师说了《二十二》，同学居然全在笑。当时我迟到了，还不知道发生了什么。听了老师讲完我才知道。我那时不理解他们竟然会笑！！！,,,,,,,,
3,惨不忍睹惨无人道惨绝人寰不忘国耻奋斗吧骚年,,,,,,,,
3,楼下，日本人没有罪你是怎么判断的出来的，不要一厢情愿好吗。而且你说的是二战时候的日本人，还是现在的？,,,,,,,,
3,团团为什么要开评论区。。没往下翻，我就知道这评论数量有毒，早上不要让负能量爆发，开心每一天,,,,,,,,
3,战争我永远不支持，但我也不会放下对日本的仇恨,,,,,,,,
3,为中华之崛起而读书！！！,,,,,,,,
3,不承认历史，不承认错误，何来的中日友好？,,,,,,,,
3,把日本打折腿了 他们才肯知道历史,,,,,,,,
3,一定要上首页,,,,,,,,
3,"<img class=""jump-img"" src=""https://i0.hdslb.com/bfs/activity-plat/static/20201110/4c8b2dbaded282e67c9a31daa4297c3c/6BO9VeUCy.png""/><a class=""comment-jump-url"" data-report=""4"" href=""//www.bilibili.com/read/cv1595"" target=""_blank"">喜欢二次元就是不爱国吗？</a>，是的团团这篇文章说的就对。所以不讨论其他不相关的东西了。",,,,,,,,
3,铭记历史，不忘仇恨。但这并不意味着要从一个极端走向另一个极端。愿祖国和平发展。,,,,,,,,
3,在有罪的热评里你可以抓到很多精x日,,,,,,,,
3,我想再骂一句，畜牲不如,,,,,,,,
3,封评吧，群魔乱舞看着闹心,,,,,,,,
3,战争是历史的必然，可是泯灭人性的做法却可以避免。731人体实验，慰安妇，杀戮平民。可以原谅日本发起战争，但不可能忘记它们丑陋的嘴脸。日本认错，我相信我国和日本今后人员文化交流的环境会好很多的。国家只想好好让它道个歉，它却不承认错误，还一味的隐瞒，只有铭记历史，才能告别战争日本记不起来？没关系，历史可以帮你记住。世界帮你记住。中国帮你记住。但你要认错,,,,,,,,
3,日本有罪,,,,,,,,
3,变态无耻的民族,,,,,,,,
3,吾同胞冤魂至今在地下呐喊，日本自古学中国，三分人性还没学会，七分兽性倒是根生蒂固,,,,,,,,
3,两枚硬笔奉上，让更多中国人知道这帮渣滓！,,,,,,,,
3,铭记，被蛇咬了一口，不一定要咬回去，但一定要记住这是条蛇咬人。要不要给蛇机会咬一口。还有不仅有蛇。,,,,,,,,
3,615楼反串黑，不是友军，这种一看就是故意给爱国者招黑的。,,,,,,,,
3,畜牲一样的国家,,,,,,,,
3,不讨厌日本，但讨厌右翼( ´_ゝ｀),,,,,,,,
3,让我好好看待日本人的唯一方法，正视自己的历史，学习德国！,,,,,,,,
3,日本有罪,,,,,,,,
3,不选择原谅也不轻易忘记，踏在中国这片土地上就要维护家园，虽说战争不能解决问题，但我们要在其他方面证明我们不能再被轻易欺负，少年强则国强。多说一句，为日本人开脱的某些人我真是想给你们两锤子。,,,,,,,,
3,"<img class=""jump-img"" src=""https://i0.hdslb.com/bfs/activity-plat/static/20201110/4c8b2dbaded282e67c9a31daa4297c3c/AeQJlYP7e.png""/><a class=""comment-jump-url"" data-report=""5"" href=""//www.bilibili.com/video/av14569472"" target=""_blank"">【亚历山德罗夫红旗歌舞团】我是一个兵</a> <img class=""jump-img"" src=""https://i0.hdslb.com/bfs/activity-plat/static/20201110/4c8b2dbaded282e67c9a31daa4297c3c/AeQJlYP7e.png""/><a class=""comment-jump-url"" data-report=""6"" href=""//www.bilibili.com/video/av8016549"" target=""_blank"">哈哈哈，一起来跟黑蜀黍唱《我是一个兵》！</a> <img class=""jump-img"" src=""https://i0.hdslb.com/bfs/activity-plat/static/20201110/4c8b2dbaded282e67c9a31daa4297c3c/AeQJlYP7e.png""/><a class=""comment-jump-url"" data-report=""7"" href=""//www.bilibili.com/video/av8734229"" target=""_blank"">中國人民解放軍軍歌_高清</a>   来和他们一起，平息心中怒火，让自己清醒！其中第三个视频是蒋匪军后裔，不知道什么原因他竟然自己觉醒了，虽然易容(纹身和最后动作)不怎么样，但能有这种觉悟真的非常不错！",,,,,,,,
3,日本人有罪,,,,,,,,
3,"想想在地道战遗址卖伪军衣服的商人就暴躁<img alt=""[小电视_好怒啊]"" src=""//i0.hdslb.com/bfs/emote/68d524b7e515396b6563d320fb710c64abfb1063.png@100w_100h.webp""/>",,,,,,,,
3,日本有罪,,,,,,,,
3,492楼确认为洗地分子，该干什么你们懂的╮(￣▽￣)╭,,,,,,,,
3,大是大非面前，没有理由,,,,,,,,
3,中国如今强大了，但不要忘了身边还有一个一直想从中国身上咬下一块肉的狗（日本）曾经因为中国弱小才出现了侵华战争乃至南京大屠杀这样的永远不会痊愈的民族创伤，所以我们要强大起来，不让中国再次受到战争的毒害，不再成为案板上的肉，而是一头站在山顶的头狼。最后一句：铭记历史，勿忘国耻！,,,,,,,,
3,苦痛是漫长的，那个破败不堪的中国没有被日本打败，但是今天。。。。当越来越多的人在上学路上对我说哦哈哟，收到我的礼物说阿里嘎多，每天的话题不是日本留学旅游就是动漫，在淘宝上挑选好看的和服还询问我的意见的时候，我就知道，表面上中国站起来了，其实还在沦陷着,,,,,,,,
3,(´;︵;`)话说，团团的视频文章能不能看看，再发评论。毕竟有些时候内容蛮严肃的，不太适合抢楼和玩梗。,,,,,,,,
3,"大致翻了一遍评论区，觉得还是关闭评论比较好<img alt=""[小电视_思索]"" src=""//i0.hdslb.com/bfs/emote/f8219e484d5a55787c3f1722dc3112d0eba03a69.png@100w_100h.webp""/>",,,,,,,,
3,太沉痛了，那两个**怎么会干出这种事！幸存者还仍健在，这段依然不能算作历史的日子。曾经人们抗争过的地方！现在却有中国人再穿着日军衣服。他们不怕被厉鬼啃食、被白骨撕咬吗！他们，真的还算是 中国人 吗！,,,,,,,,
3,气到爆炸又莫名心酸,,,,,,,,
3,坐标383 390 请求举报！谢谢！,,,,,,,,
3,勿忘国耻,,,,,,,,
3,看着封面就不敢看(´；ω；`)害怕被气哭,,,,,,,,
3,国内还有一些精神曰本人的……，好好活着不好吗?非要作死!ヽ(`Д´)ﾉ,,,,,,,,
3,记起一句话，“因为我们珍爱和平，所以回首战争”,,,,,,,,
3,谁公开的？     日本吗早干什么去了,,,,,,,,
3,"我不敢点开，请原谅我的胆小，我害怕会做恶梦，但我不会忘记国耻和中国所遭到的屈辱历史<img alt=""[小电视_哭泣]"" src=""//i0.hdslb.com/bfs/emote/938bdf98df945576ae88e2a22931db07ded9e663.png@100w_100h.webp""/><img alt=""[小电视_哭泣]"" src=""//i0.hdslb.com/bfs/emote/938bdf98df945576ae88e2a22931db07ded9e663.png@100w_100h.webp""/><img alt=""[小电视_哭泣]"" src=""//i0.hdslb.com/bfs/emote/938bdf98df945576ae88e2a22931db07ded9e663.png@100w_100h.webp""/>",,,,,,,,
3,会铭记这段历史 但是 这段视频 原谅我没有勇气打开,,,,,,,,
3,铭记历史 缅怀先烈 珍爱和平 开创未来,,,,,,,,
3,勿忘国耻，振兴中华！,,,,,,,,
3,活着就不会忘记,,,,,,,,
3,不能原谅！忘记就等于背叛！,,,,,,,,
3,日本：不存在的，我否认,,,,,,,,
3,看的心脏都骤停了……,,,,,,,,
3,"<img alt=""[大哭]"" class=""small"" src=""//i0.hdslb.com/bfs/emote/2caafee2e5db4db72104650d87810cc2c123fc86.png@100w_100h.webp""/>",,,,,,,,
3,这种视频不敢点开看，直奔评论区，而且猜到一定有这样的言论“原谅，都是右翼的错，rb平民无罪，小粉红，键盘爱国，爱国z……”看到有人怼，我放心了，说实话，在这种视频下，再怎么说rb都可以理解，不关乎和平不和平，理性不理想的问题！,,,,,,,,
3,现在的年轻一代没资格代表先们辈原谅日畜,,,,,,,,
3,"<a data-view=""6150353"" href=""//www.bilibili.com/video/av6150353/"" target=""_blank"">av6150353</a>美国人拍的南京大屠杀纪录片，很恐怖，很残忍，心理承受能力弱的人建议别看。(如果嫌长可以跳到<a class=""video-seek"" data-p=""-1"" data-time=""3060"">51:00</a>开始看)",,,,,,,,
3,永不原谅，永不忘731、旅顺、南京大屠杀以及各类日狗的罪行,,,,,,,,
3,这种卑劣的民族就应该受到了所有爱好和平，和中华儿女的唾弃,,,,,,,,
3,一个不能正视历史的国家，太平洋是他最好的归属，我们的后代要预防他们的科技再次绝对超越我国，否则历史不会再给他犯错的可能,,,,,,,,
3,不要用你所谓的大度去替先辈们原谅，装模作样的善良，很恶心,,,,,,,,
3,原谅日本是上帝的事我只负责送他们去见上帝( ´_ゝ｀),,,,,,,,
3,铭记历史，勿忘国耻，日本人所犯下的罪孽早晚会付出代价。,,,,,,,,
3,刚想进来说一句“过审老国王” 一看ID 溜了溜了,,,,,,,,
3,日本的年轻人没有几个知道有南京大屠杀这回事,,,,,,,,
3,看日漫并不代表对日本有好感,,,,,,,,
3,我认为要摆脱掉两种极端: 既不能做历史的怨妇，也不能做历史的情妇。,,,,,,,,
3,历史的巨轮永远在转动，勿忘国耻，不应为糖衣炮弹而被驱使。,,,,,,,,
3,原子弹炸得好,,,,,,,,
3,好气！！！,,,,,,,,
3,说实话，我喜欢二次元，喜欢动漫，也想去日本旅游看看，当然不只是日本，各个国家美景都想看看，但是没次看到侵华战争，我是真的流浪了，看久了难受啊，真的难受,,,,,,,,
3,当日军俘虏被带到孙立人的面前时，缅甸抗击日本中国国民党38师孙立人厌恶地皱皱眉头，不加思索地命令参谋：“你去审一下，凡是到过中国的，一律就地枪毙，今后都这样办。”命令被迅速执行。国际法规定不能杀俘虏，日本人听到这个命令感到毛骨悚然，我不知道各位对于这位国军的军官有什么看法，反正我个人是支持的，日本人连禽兽都不如，几岁的孩子都要糟蹋，我觉得孙立人做得好，把日本人就地枪毙，这个军官是最狠的，也是杀日本人最多的，当时听历史老师用课件讲,,,,,,,,
3,干这事的日本人最后也被中国军队杀光了，1944年收复腾冲，中国云南,,,,,,,,
3,怎么过审的？,,,,,,,,
3,可悲，现在好多人却选择性遗忘了。还记得昨天那个在朋友圈发“好可怕，大家都在默哀，买点日货压压惊”的女的么？,,,,,,,,
3,不要扯到动漫和音乐因为音乐和动漫无国界,,,,,,,,
3,历史需要铭记。但不要仇恨。忘记历史是对自己的背叛。,,,,,,,,
6,宽容善良？体谅？扯淡 只有以暴制暴才能压制住恶.,,,,,,,,
6,说不忘国耻，不如说愿世界和平。希望惨剧不要再发生，希望罪人赎罪，希望受害者得到帮助。,,,,,,,,
6,日本有罪ヽ(`Д´)ﾉ,,,,,,,,
6,二战日本对自己人都不友好还指望对中国人友好，不说中国了，日本就连在中途岛海战前他们的人民只能勉强**呢，他们所谓仁慈的天皇把粮食都征收了，给士兵发的军饷几乎同我们中国军阀的杂牌军等同，他们的士兵在军官眼里甚至和畜生差不多，就这样的军队和政府还指望他们饿着自己国民不劫掠我们中国人？真不知道那些给日本洗白和说好话的人怎么想的。,,,,,,,,
6,其实我觉得以后说什么日本有罪啦，日本哪里又在跟中国挑衅了之类的，还是加上日本右 翼比较好，讲话要有个准确，别人不准但得保证我们说话准确,,,,,,,,
7,up主后台巨硬，日杂大本营表示无可奈何,,,,,,,,
4,不是不报，时候未到，当咱们的军力处于压倒性的时刻……自然会有让仇敌胆寒的一天,,,,,,,,
4,"中日友好基本就是不可能的事,国家现在不提这些是因为美国.,如果有一天中国真的走到了世界霸主的地位,我还真不信中国还能像现在一样老实。",,,,,,,,
4,如果大家在这类视频下面看到愤青的过分发言，举报+黑名单就足够了，别和不讲理的人讲理。铭记历史，勿忘国耻，国家不需要愤青和键盘侠。,,,,,,,,
4,"播放量被删到4万<img alt=""[小电视_发愁]"" src=""//i0.hdslb.com/bfs/emote/05e279abbf3f72d5cc45548504a4220c5514b8b9.png@100w_100h.webp""/>",,,,,,,,
4,这个仇，早晚会报的！早晚。,,,,,,,,
4,日本人不可能被你们原谅，原谅是指宽恕和谅解，你们会因为什么理由谅解一个在征服带动下全国充斥着不承认侵华的风气的国家？不原谅是勿忘国耻，是发愤图强，是为国争光，是在中日双方遇见问题时站出来为自己的祖国尽力而为，是抵制一切日本右翼行为。而非要抵制日本所有一切，日本人就该死光，一切和日本相关的东西都是错的，对日本人没素质是应该的。我针对的是两种极端，一种是纯日杂日精一点爱国荣誉感都没有的败类，还有一种是把爱国当借口只是在抒发自己内心不满什么行动都没有只会骂人的人渣。,,,,,,,,
4,如果未来中国的人民生活水平比日本更高，科技比日本先进，ZHENGZHI比日本清廉，军事比日本强大，MINZHU程度比日本更高，文化产业比日本发达，就是对日本最好的报复。,,,,,,,,
4,三千多评论，可能就只有热评的三观最正。,,,,,,,,
4,记住教训，不想自己和子孙后代重蹈覆辙那就最好时刻谨记。,,,,,,,,
4,大部分人连三段式推导都做不到。却以为自己仅靠本能筛选的信息都是真理。某些以忽略逻辑的二段推导诱导和鼓动民众情绪为重要手段的政体是对“文明”这个词的侮辱吗我认为不是。因为“文明”这个词本就是政治家创造的。 ​​​,,,,,,,,
4,关了评论区吧,,,,,,,,
