链接,标题,播放数量,弹幕数量,发布日期,点赞数量,硬币数量,收藏数量,转发数量,评论数量
1,在现在的大前提下没有任何中国人能代表13亿人民去谅解曾经共同的苦难记忆，也没有一个有良知的日本人能代表他们的国家和国民去正式向所有受到上世纪日本军国主义侵害的国家以及他们的人民道歉。但是既然大家了解如此的国际政治仍然有一群热爱和平的日本人愿意在被日本右翼陷害并打上“叛国”的情况下正视历史，愿意把自己国家甚至是自己亲自犯下的过错袒露出来。已经是一个勇气十足的“人”了，以对待一个有良知的人而言我尊敬他们。南京大屠杀遇难同胞纪念馆的最后警语就是告知世人：铭记历史，珍惜和平。所有热爱和平的人类都不该忘记南京大屠杀，但是同样作为热爱和平的这群人也不应该让这种事情再次发生，无论是让别人还是自己杀人，无论被害者是中国人还是其他国籍。,,,,,,,,
1,"日本的正常人也就这么几个了<img alt=""[呆]"" class=""small"" src=""//i0.hdslb.com/bfs/emote/33ad6000d9f9f168a0976bc60937786f239e5d8c.png@100w_100h.webp""/>",,,,,,,,
1,我们要做到铭记历史！,,,,,,,,
1,我们也要铭记在南京大屠杀期间拯救过几十万中国男女老幼的德国人拉贝和美国人约翰马吉、魏特琳等，在战后积极搜集战犯证据的已故先辈高文彬，和承认日本侵华向中国道歉并每年探望大屠杀幸存者的日本教师松冈环。更要铭记从1840年至今无数为国牺牲的爱国义士。,,,,,,,,
1,过去的，不可能有办法能原谅的了的，去世的人们起不来了，这份伤痕不允许触痛。但为了和平愿意付出的人，即使很少，也应该尊重。为了未来的友好加油,,,,,,,,
1,跟罪犯讲道理可以但是你要有枪顶着它的头，我们不是要学小鬼子，但是一定要让它们付出应有的代价。随便一提视频中的人不容易毕竟顶着全日本的压力,,,,,,,,
1,这就是日本少有的善良人,,,,,,,,
1,感谢但是不会原谅，他们只知道自己如何挨打了，但是不知道原因所在。只知道太平洋战争自己如何惨烈，没有想过侵略中国时候犯下的滔天罪行。,,,,,,,,
1,果然还是有一些人是有良心的,,,,,,,,
1,大概都是当年希望和平的人,,,,,,,,
1,良心是应该的。在没良心的社会中保持良心是可敬的。,,,,,,,,
1,什么叫仅存的日共，日共不是现今日本第四大政党，历史上整了9000次工潮的狠角色吗,,,,,,,,
1,哎，这样的日本人有多少呢，向他们问好,,,,,,,,
1,起码他们知道历史,,,,,,,,
1,这只是少数，多数日本人只记得自己是核爆的受害者，忘了自己祖辈是施暴者,,,,,,,,
1,所以说啊，日本没未来,,,,,,,,
1,只有老人了，他们也渐渐的和当初的亲临者一样迟暮，还有多久时间，还剩多少时间，日本终将会遗忘，他们做过何等龌龊之事，被那群资本利益之徒，军国主义政府的毒瘤操控着控制着历史，遗忘再遗忘，最终会变成民众只记得自己是一个傻白甜，凶残的事迹会被淡化看的轻蔑，“既然我们屠杀他们为什么不反抗呢？”他们会这么说，可怕的屠杀会被吹捧成绝无此事的空闻，“所以我们这么善良又怎么做过侵略者呢？”他们只会这么想，黑和白没有了界限，有的只是有人想让他们记住的，他们终将会成为那段历史的继承者，只是那段历史，早已在淡化与更改中变得失去真实，只剩下统治者乐于呈现的样子。他们最终会摒弃那段历史，将自己粉刷成那个时代的正义之士，将龌龊的过去塞进不可告人的碎纸机，指着谎话，说：“这才是真相！我们是正义的，他们才是邪恶的！他们才是欺骗者！不信你们看啊国民们，代表了正直民主自由的灯塔之国美国都这么说了，他们还有什么好辩解的？”,,,,,,,,
1,看到评论还是咱国人明白人多呀，这真的是日本的极少数的极少数勒。只能说是极个别啦，观学院的妮妮老师已经说的很明确了。不管日本人记不记得，我会让我4岁的儿子记住。,,,,,,,,
1,那么既然是有识之士，这些年纪都不小的人，他们的后代呢？难道“有识”就只是纪念的“仪式”么？连他们的后代都没有教育好，甚至可能根本就没教育这些，很难理解这样的“有识之士”，难道只是为了日本人的“面子”做给中国人看的么？,,,,,,,,
1,他们影响力还是太小了，以后人会越来越少,,,,,,,,
1,日本年轻人不是没良心，是很多都不知道这件事情，日本的教育在这件事淡化了，教科书更是一笔带过,,,,,,,,
1,我记得日本n站也有关于南京大屠杀真实的报道。。,,,,,,,,
1,都是老人，哎。。,,,,,,,,
1,都是些头发花白的老人……,,,,,,,,
1,何止三十万的冤魂！,,,,,,,,
1,要是老年人死了的话，还有谁还知道他们国家在中国南京犯下的罪过呢,,,,,,,,
1,太少了...,,,,,,,,
1,日本也是有日本共产党的，那些也是一群勇于和资本战斗的人,,,,,,,,
1,人太少了，大部分都不在乎吧，毕竟新一代都没怎么能学到这块,,,,,,,,
1,那不是纪念大屠杀，是纪念大屠杀遇难者，或者说反思大屠杀,,,,,,,,
1,都是上了年纪的老年人,,,,,,,,
1,标题请写：侵华日军南京大屠杀死难者公祭日。我们纪念的遇难者，而不是大屠杀！,,,,,,,,
1,纪念，还真是很值得纪念呐,,,,,,,,
1,战争里只有活着的人，和那些看着家人举起屠刀，心中唯有用一生来赎罪的好人，来承受这些无望的伤痛与悲哀，双方都将用生生世世，子孙的生生世世来铭记这场劫难，人命往往比樱花更脆弱，却也比泰山更沉重。,,,,,,,,
1,日本年轻人大部分抖都没有听说过，日本政府就是不承认！,,,,,,,,
1,这里面有几个年轻人吗,,,,,,,,
1,基层人民才会互相理解,,,,,,,,
1,是祭奠，不是纪念,,,,,,,,
1,前人栽罪，后人乘责。但有勇气承担责任的人不多。,,,,,,,,
1,全是老年人啊……日本年轻人，唉。,,,,,,,,
1,是纪念遇难同胞，不是纪念屠杀啊，严谨一点好吧。我们去纪念馆，辅导员都要特别强调是“侵华日军南京大屠杀遇难同胞纪念馆”，要么说全称，要么说遇难同胞纪念馆,,,,,,,,
1,等这些人去世了，日本还有人记得吗？,,,,,,,,
1,据《康熙朝起居注》记载，康熙说：倭子国，最是反复无常之国。其人，甚卑贱混账，不知世上有恩谊，只一味慑于武威……故尔，不得对其有稍许好颜色。,,,,,,,,
1,我觉得纪念这个词不妥吧 应该改为铭记,,,,,,,,
1,可惜现在的日本年轻人，你们懂的,,,,,,,,
1,既定的事实无法改变，民族的仇恨已经种下了，注定要在某一个时间解决。,,,,,,,,
1,愿世界永保和平啊,,,,,,,,
1,能正确认知中日历史的日本人也就极少极少数了,,,,,,,,
1,左翼人士的关注,,,,,,,,
1,应该叫忏悔日,,,,,,,,
1,都是老人,,,,,,,,
1,怎么都是老年中年人？,,,,,,,,
1,"希望这后面有那些曾经志同道合的达瓦里氏的影子<img alt=""[大哭]"" class=""small"" src=""//i0.hdslb.com/bfs/emote/2caafee2e5db4db72104650d87810cc2c123fc86.png@100w_100h.webp""/>",,,,,,,,
1,为什么都是老年人？年轻人去哪了？年轻一代宁可听信右翼分子胡说八道也不敢正视历史，这是日本的悲哀！,,,,,,,,
1,只有真正见过感受过战争的人才能深切的体会到那种恐怖朋友亲人的离去日本的中国的老百姓都从那个时候走过来，年轻人没经历过战争不明白战争的意义对自己的损害也是正常的,,,,,,,,
1,日本右翼一天不亡，就多一天是中国的敌人。,,,,,,,,
1,前事不忘，后事之师,,,,,,,,
1,难得,,,,,,,,
1,可惜了都是老人,,,,,,,,
1,woo,,,,,,,,
1,确实都是老年人,,,,,,,,
2,"谢谢，我们真的很需要。<img alt=""[大哭]"" class=""small"" src=""//i0.hdslb.com/bfs/emote/2caafee2e5db4db72104650d87810cc2c123fc86.png@100w_100h.webp""/>",,,,,,,,
2,国家是一个集合，不是一个人，里面各种各样的人都有。只能说做好自己的事情。,,,,,,,,
2,幸好，依旧有日本人没有忘记,,,,,,,,
2,这也仅仅是少数人，哎,,,,,,,,
2,"没什么好说的，血债血还，这是对日本这个民族最大的回击...<img alt=""[笑]"" class=""small"" src=""//i0.hdslb.com/bfs/emote/81edf17314cea3b48674312b4364df44d5c01f17.png@100w_100h.webp""/>",,,,,,,,
0,我们只能尊重，但无法原谅,,,,,,,,
0,希望这种良好的认错意识出现人传人现象,,,,,,,,
0,终于有少数人做了早就该做的事。。。。希望这件事情可以影响更多人吧。,,,,,,,,
0,唉！,,,,,,,,
0,这是南京大屠杀遇难者同胞纪念，不是南京大屠杀纪念！！！！,,,,,,,,
