链接,标题,播放数量,弹幕数量,发布日期,点赞数量,硬币数量,收藏数量,转发数量,评论数量
https://www.bilibili.com/video/BV1aK4y1h77S?from=search&seid=14204589028410475788,【血战与杀戮】南京沦陷前后！,81000.0,427.0,20201018.0,3305.0,599.0,1812.0,101.0,140.0
评论点赞数,评论内容,,,,,,,,
532,少看抗日神剧，不如直接封禁抗日神剧，免得浪费资源,,,,,,,,
298,有很多视死如归的国军士兵就是被高层的微操和拉跨的指挥给坑了,,,,,,,,
212,一直不敢看南京大屠杀，一想到中国人民当时的在日本屠刀和铁蹄下真真切切感受到的血肉横飞，肢体分裂，肆意杀戮，再想到中国因为国力的孱弱未能清算日本，使今日之日本不仅没有走向友好反而加深与美国合作与中国对抗，成为美国在第一岛链最大的“桥头堡” ！以及在全世界自诩文明得到那些曾经的西方强盗们的一致赞许的那种荒唐和无耻，就感觉既愤怒又遗憾！现在想想，我们不仅要铭记历史，更应该彻底清算这段历史，让日本像德国一样付出它应该付出的代价，而不是让裕仁寿终正寝，让参拜靖国神社成为中国无可奈何的日常，让日本逐渐再次成为中国的心腹大患！中国已经不能再被蹂躏一次了。近代的蹂躏已经几近摧毁了中国人的自信心，一种到现在都是一种半死不活的状态，如果未来还得不到清算，中国近代历史的悲痛也只能让人又气又恨，而无法一雪前耻……,,,,,,,,
93,那4个装甲兵是真英雄,,,,,,,,
84,要是能配合地图讲，就完美了,,,,,,,,
78,看到那些吹国军的努力争辩，真是又恶心又好笑，一个考试得2分的跟得98分的说：我也不是没有作对的题，你也不是没有错的。这p没错，但是你们觍着脸放p也是事实，这两分也是因为中国人民本身的勇敢与牺牲精神，国民党烂透了。,,,,,,,,
48,国民党的传统技能，干啥啥不行，无能第一名,,,,,,,,
38,真的没勇气看，怕看了想杀人,,,,,,,,
28,对不起，我点开以后我直接写的评论，关于那段历史我看一次哭一次，痛一次，恨一次,,,,,,,,
27,杀光倭贼！,,,,,,,,
42,这是蒋介石的国民党反动派留给中华民族最大的耻辱和伤痛。,,,,,,,,
30,如果我是领导下令死守…那肯定自己也要留下…这才是一个合格的指挥官,,,,,,,,
21,日本真是不要个脸,,,,,,,,
24,只去过一次南京大屠杀纪念馆，我之后还会去。我不信有哪个人会进去之后轻松的出来，我当时是看到进门的证人墙眼泪绷不住了，照片的灯在一盏盏熄灭，他们等了一生都没有一个道歉。我走到南京当时的街头复原中，真的感觉很可怕 很压抑，我相信事实会比我的感受可怕100倍，我真的无法相信，两个日本鬼子可以在南京街头比赛杀人，随后得意洋洋的拍照。还有受害者姓名墙，一排排在那立着，每一个上面都有数不清的名字，每一个名字背后就是一个家庭，我真的无法想象当时中国人民是有多么害怕，我也更无法理解那些为日本洗白的人，你配当中国人吗？最可笑的就是日本也是二战受害者言论，我真的觉得无语，借用商细蕊一句话“你们侵略我们国家，做的是伤天害理的事情，死在战场上不叫英雄，叫报应”。“前事不忘后事之师”，这句话印象十分深刻，我们的今天是生活富裕了，环境也和平了，所以我们更不能忘记曾经中国土地上的苦难!你知道日本为什么避而不谈历史吗？他在等，等中国人忘记，等受害者全部死去，等那段历史被人遗忘，等到那一天，他可以光明正大的否认，作为一个正常的中国人不会有那一天到来，日本必须道歉!必须正视历史!必须给我们受害同胞一个公道!,,,,,,,,
16,这场战斗告诉我 国家贫弱，普通人就没有好好活着的权利。什么小民意识，拜托，真到了这个时候，谁来救我，我手里的键盘吗？,,,,,,,,
13,南京保卫战打的真是惨，部分基层指战员再怎么英勇顽强都挽回不了整体的颓势，完完全全的溃败。同样是中国军队，同样是装备劣势，而志愿军就能把美国人打回三八线，而蒋介石和国民党却大部分时间都在溃败，所以他们在内战中输的真的不冤。,,,,,,,,
13,不能忘记这段历史。,,,,,,,,
12,防火？防水？防骗！防外国鬼子？防内奸！！！！！！,,,,,,,,
11,没有三围地图，没有代入感,,,,,,,,
8,死守南京唐生智,,,,,,,,
25,天天二次元，追日漫，家长应该带着去南京纪念馆看看！现在的小孩子满脑子这些，好好学习才是强国之本。,,,,,,,,
11,我从小就不喜欢看抗日剧，天天轮番轰炸赶上新闻联播了都,,,,,,,,
6,希望中国复兴，国际地位像唐朝一样，然后让日本恢复到史前文明,,,,,,,,
5,什么时候解放东京就好了,,,,,,,,
5,将熊熊一窝,,,,,,,,
5,一城一池的得与失，不关宏旨，但关宏志,,,,,,,,
4,"那些骂果军的，果党确实不是什么好东西，但不要把果军看成果党呀，果军也在抗战中牺牲了这么多<img alt=""[捂脸]"" class=""small"" src=""//i0.hdslb.com/bfs/emote/6921bb43f0c634870b92f4a8ad41dada94a5296d.png@100w_100h.webp""/>",,,,,,,,
4,南京大屠杀给我的感觉更多的是一种耻辱，我们需要的是反思，而不是甩锅给日本人毫无人性的屠杀（在历史上但凡侵略基本上都伴随屠杀），几天不合眼的战场杀戮，应该没几个理智正常的人了，至于疯子会做出什么样的事情，历史已经说明了。战争这种东西完全是对人性的摧残，就像我们平时说的永远不要考验人性……,,,,,,,,
4,要是南京是第二个斯大林格勒就好了,,,,,,,,
3,蒋介石死守南京的真正动机，其实也是期待苏联会出兵。,,,,,,,,
3,我每次看淞沪会战这一段，每每谈到“送进一个师，又送走一个师”这一段都泪目,,,,,,,,
3,我记得一组南京保卫战纪实的书24本一本67百页记录说抛尸江中的，火烧的尸体找不全找不到的算上这些至少43万，30万是尸体找得全的,,,,,,,,
3,这个题目给我推了第三次的时候才有勇气点进来看,,,,,,,,
3,你这普通话参加奇葩说╮（╯＿╰）╭唉加油吧！,,,,,,,,
3,普通话有待提高。,,,,,,,,
3,朝鲜战争制空权也不是全在中国人手里呀,,,,,,,,
3,唉，唐某人就不能来一个携民渡江嘛,,,,,,,,
2,"日本军队整体战斗力和单兵作战能力都很强的，并且日军刚刚赢了淞沪会战，士气高涨非常高，所以抗日神剧真的是害人不浅<img alt=""[辣眼睛]"" class=""small"" src=""//i0.hdslb.com/bfs/emote/35d62c496d1e4ea9e091243fa812866f5fecc101.png@100w_100h.webp""/><img alt=""[辣眼睛]"" class=""small"" src=""//i0.hdslb.com/bfs/emote/35d62c496d1e4ea9e091243fa812866f5fecc101.png@100w_100h.webp""/>",,,,,,,,
2,想了一想，能被屠杀的真正原因还是人民麻木。中华民族的民族团结最重要！,,,,,,,,
2,40多万人啊！这种时候不反抗到底要撤退？不把人当人吗？,,,,,,,,
2,听着好心疼，都是一条条命啊,,,,,,,,
4,蒋介石这个废物应该负全部责任,,,,,,,,
1,江东门纪念馆的滴答声，这辈子听一次就够了!祈愿平和……,,,,,,,,
1,血战钢锯岭看了我的感觉更多的并不是感慨男主的勇敢无畏，想的更多的则是中国能够在这群野蛮之徒中夺回领土的多不容易。,,,,,,,,
1,输的原因就是国军不会打运动战，只会和日军拼火力，打阵地战。不会扬长避短。抗美援朝表明装备悬殊不是失败的主要原因。,,,,,,,,
1,"这要是三年前，根本就不可能过审<img alt=""[无语]"" class=""small"" src=""//i0.hdslb.com/bfs/emote/44667b7d9349957e903b1b62cb91fb9b13720f04.png@100w_100h.webp""/>",,,,,,,,
1,"限流了，在曰抗曰，你号没了<img alt=""[笑哭]"" class=""small"" src=""//i0.hdslb.com/bfs/emote/c3043ba94babf824dea03ce500d0e73763bf4f40.png@100w_100h.webp""/>",,,,,,,,
1,南京人，不忘国耻,,,,,,,,
1,没有像苏联人死守斯大林格勒那样死守南京城,,,,,,,,
1,真该把拍抗日神剧和审这些抗日神剧的败类抓起来  判去沙漠改造  整天拍些垃圾毒害国人  不如干点造福子孙的实事,,,,,,,,
1,"灭了小日本<img alt=""[生气]"" class=""small"" src=""//i0.hdslb.com/bfs/emote/3195714219c4b582a4fb02033dd1519913d0246d.png@100w_100h.webp""/>",,,,,,,,
1,一苇渡江,,,,,,,,
1,up口音，好像是我们南京人,,,,,,,,
1,封面背景好像是我哎,,,,,,,,
1,抵抗太激烈啦！给？小鬼子打急眼啦！爆发了！兽性啦！,,,,,,,,
1,奇葩说啥时候播出啊？,,,,,,,,
1,勿忘国耻！,,,,,,,,
1,"<img alt=""[阴险]"" class=""small"" src=""//i0.hdslb.com/bfs/emote/ba8d5f8e7d136d59aab52c40fd3b8a43419eb03c.png@100w_100h.webp""/>",,,,,,,,
2,蒋介石卖啦？南京的人民！！！！！,,,,,,,,
2,听说台儿庄还打的是日本后勤部队，是真的么？,,,,,,,,
0,国民党的指挥能力尤其是组织能力，完全就是屎一样,,,,,,,,
0,弹幕好戾气啊,,,,,,,,
0,不讲豫桂湘,,,,,,,,
0,麻煩叫國軍,,,,,,,,
0,尊重历史，铭记历史,,,,,,,,
0,你瞅瞅这些精分日漫痴 不给他们看二次元 他们就忘记南京了,,,,,,,,
0,9分35秒，第一排，从左至右第5个兵仔细看，有惊喜,,,,,,,,
0,包子手雷，那个电视剧，还有子弹转弯打。,,,,,,,,
0,蒋介石领导的国民党是真的腐败,,,,,,,,
0,根本不敢点开看，赞一下走人，30岁老叔叔告诫大家，勿忘。,,,,,,,,
0,唐生智实际能指挥的兵力有一个团吗？,,,,,,,,
0,当年没有武器生产，艰难也是必然，不是工业国。现在，中国已经是一个强大的工业国家，日本的重工业其实不如中国。美国，日本要想侵略中国已经非常不可能了。重视工业，重视科技，重视人才。,,,,,,,,
0,我们可以欣赏日本的一些优秀品质，优秀文化作品，但对于这段血海深仇的历史以及刽子手的后人，请不要忘记，不要忘记,,,,,,,,
0,国军战斗力一直是个迷，要么特怂要么特勇，所以哪位大佬能所说国军准确的战斗力,,,,,,,,
0,后天去南京大屠杀纪念馆参观，哎！,,,,,,,,
0,只有不能打的政客，没有不能打的中华儿女。,,,,,,,,
0,"我就在南京，也在雨花台那边工作过，也有幸去过几次遇难者同胞纪念馆，看的人是触目惊心，虽说胜败乃兵家常事但是这个失败的代价也太大了30万条命，中国进行了100多年的组装斗争现在的胜利来之不易，我们要铭记历史缅怀先烈珍惜和平<img alt=""[大哭]"" class=""small"" src=""//i0.hdslb.com/bfs/emote/2caafee2e5db4db72104650d87810cc2c123fc86.png@100w_100h.webp""/><img alt=""[大哭]"" class=""small"" src=""//i0.hdslb.com/bfs/emote/2caafee2e5db4db72104650d87810cc2c123fc86.png@100w_100h.webp""/><img alt=""[大哭]"" class=""small"" src=""//i0.hdslb.com/bfs/emote/2caafee2e5db4db72104650d87810cc2c123fc86.png@100w_100h.webp""/>",,,,,,,,
0,我们要是强大何必会经历这些，不恨侵略者的残酷，只恨当时自己国家无能，,,,,,,,,
0,艰难度过的抗战日子！,,,,,,,,
0,zhao'ji,,,,,,,,
