链接,标题,播放数量,弹幕数量,发布日期,点赞数量,硬币数量,收藏数量,转发数量,评论数量
https://www.bilibili.com/video/BV1wW411t7kX?from=search&seid=9057015741557747434,【血腥慎入】证实日军在华屠杀慰安妇影像首度公开,462000.0,1174.0,20180228.0,10000.0,4094.0,5243.0,875.0,1720.0
评论点赞数,评论内容,,,,,,,,
10524,“真正热爱祖国的年轻人，即便他们是日本动漫游戏的铁杆粉丝，他们也会在大是大非的问题面前维护自己国家的主权和民族尊严。而那些没有脊梁骨、双膝发软的人，即便他们对日本没兴趣，也迟早会跪倒在其他人面前，嘲笑着中国的一切，包括中国的主权和民族的尊严。”——转自团团的一篇文章,,,,,,,,
6849,世界上没有一个国家会忘记自己的过去和历史，美国在纪念珍珠港，日本在纪念广岛原子弹爆炸，俄罗斯纪念卫国战争，难道中国讲历史就是为了复仇吗？南京大屠杀幸存者李秀英说过：“要记住历史，不要记住仇恨。”这就是我们观察历史、进行历史教育的一种视角。我们主要是汲取历史、吸取教训，而不是为了复仇，这一点非常明确。绝不能把历史对立起来，一个忘记历史的民族，是没有希望的民族———————南京大屠杀纪念馆馆长,,,,,,,,
2795,没人说日漫，怎么老有人给自己加戏，对待日漫的态度，局座已经说过了：“日漫是敌人的糖衣炮弹，我们把糖衣吃掉，把炮弹打回去” 我也看日漫，但是我拒绝日漫给我输出的任何恶心的价值观，我也不会被日漫洗了脑子，因为糖衣我吃下去了，但炮弹我 一发一发的 打回去。,,,,,,,,
4431,我想说铭记历史不代表在网络上鼓动战争，而是在现实中将它记在心里，做好自己的每一件事，做出自己的贡献,,,,,,,,
1029,村里老“倭”家祖上就不是什么好东西，打死我们家大伯二伯，虽然判了刑，但他们家到现在还死不认错，前两年不知道怎么地就富了。我们家这一辈儿的孩子看着他们家孩子穿的新衣服和新玩具，也羡慕的想要，家里大人说以后日子好了我们也买。如今我们家靠着勤快日子也越来越好过了，有时候也会跟风似的买老“倭”家孩子那样的新衣服和新玩具，大街上学校里遇见也是要打招呼。但大伯二伯的坟还在那儿呢，所以我们虽然也没想着杀人偿命，但总不能不防着吧。时不时的看看当年大伯二伯的照片，听家里老人讲当年的事儿，吸取教训。玩他们家一样的玩具可以，穿的像他们家劳改的那几个，打断狗腿都是轻的。,,,,,,,,
360,真不明白为什么老有人急着代表全体国人原谅日本的？是收钱办事还是心向日本？就现在这个篡改教科书，解禁集体自卫权，小动作不断的日本哪里值得原谅了？还有说在日本右翼只有极少一部分的，极少一部分就能影响政府的决策了？,,,,,,,,
1320,日本有罪,,,,,,,,
308,没有人有资格原谅日本，因为有资格的人已经死了，他们下手这么狠，超出人性的底线，也断了自己做人的后路。,,,,,,,,
740,日本有罪,,,,,,,,
182,南京大屠杀（Nanjing Massacre）指1931至1945年中国抗日战争期间，中华民国在南京保卫战中失利、首都南京于1937年12月13日沦陷后，在华中派遣军司令松井石根和第6师团长谷寿夫指挥下，侵华日军于南京及附近地区进行长达6周的有组织、有计划、有预谋的大屠杀和**、放火、抢劫等血腥暴行。在南京大屠杀中，大量平民及战俘被日军杀害，无数家庭支离破碎，南京大屠杀的遇难人数超过30万。南京大屠杀是侵华日军公然违反国际条约和人类基本道德准则，是日军在侵华战争期间无数暴行中最突出、最有代表性的一例之一。南京大屠杀期间，《纽约时报》、《中央日报》、《新华日报》等中外媒体，均对南京大屠杀进行了大量的揭露。南京审判战犯军事法庭经调查判定，日军集体屠杀有28案，屠杀人数有19万；零散屠杀有858案，死亡人数有15万，总计死亡人数达30多万，制造了惨绝人寰的特大惨案。（转自百度百科）铭记历史 缅怀先烈 珍爱和平 开创未来,,,,,,,,
159,"现在这个新闻在日本掀起了很大波澜，日本人的普遍的态度是不承认不相信，主要观点有：是1.美国士兵拍的所以不合常理，2.韩国人的捏造，3.是中国士兵杀的一般人，4.是日本士兵玉碎后的尸体，5.列举韩国中国的残虐行为。以上观点基本占了日本大型新闻网站雅虎评论的99% 由此可见日本人从根本不承认这段历史，一直这样未来不会有好结果的。（粘贴  @  腐化の世界）<img alt=""[2233娘_喝水]"" src=""//i0.hdslb.com/bfs/emote/695bf5429472049b52c1e0de586f8a2511195a23.png@100w_100h.webp""/>",,,,,,,,
148,你可能不知道，当时一个九十多岁的日本老妪领着她孙子叫他参加侵华日军，每次日军有什么大小战役胜利都会举国欢庆。男人上战场，女人孩子搞后勤，有些日本女人上战场杀起人来比男人还猛。你真以为像传闻那样的都是高层的错？日本有罪是个陈述句，日本包括政府和人民都是有罪的。而且我们根本不能原谅他们，有资格原谅日本的是那些九泉之下的先辈们，他们受尽折磨、死不瞑目，尸体烧成灰烬，被掩埋在土里，没人听过他们的呻、’吟和哀嚎，他们甚至连名字都没有。他们都没开口说原谅，小崽子们倒是开始了？,,,,,,,,
151,日本就是有罪啊，一群人莫名其妙觉得这句话有问题，然而日本有罪只是一句陈述句，哪里看出鼓动战争了？日本到底有没有罪？请你边看这个视频边回答我，摸着你的良心回答我。,,,,,,,,
155,评论区有人说到了，关于日漫的问题，这个话题不深究，易引战。我觉得吧，大家多多少少看日漫，看了日漫又没变日杂，遇到民族问题照怼不误，因为民族尊严是潜意识里的东西了，不会因为几部动漫而改变，那些容易精，日，的就算不看日漫脑子也会有问题，请不要因为国人在看日漫就说国人其实都亲日什么什么的，举例不恰当。确实当前隔空喊话日本是没用的，鲁迅先生曾提出指望，我们需要落实，国家富强才能震慑四方。,,,,,,,,
117,保罗·蒂贝茨，1915年生，美国空军飞行员。1943年3月，正在美国航空兵团服役期间的蒂贝茨突然接到了一个秘密通知，由于他的飞行计划过硬，波音公司让他负责刚研制成功的B-29轰炸机试飞工作。1945年8月5日凌晨2点，蒂贝茨驾着以他母亲名字“埃诺拉·盖伊”命名、序号为82的B－29轰炸机携带“小男孩”原子弹，向日本广岛飞去。这是一次悲壮征途，如果没有完成任务或被日军俘虏，蒂贝茨将立即吞毒自杀。后面的事，大家都了解了，原子弹投掷成功了！2005年，这是二战胜利60周年，蒂贝茨对美国三大广播网的记者们说：“如果需要，我还会再干一次。我也有感情，但我绝不后悔！”“使用原子弹是历史的一个必然。如果当时盟军以登陆日本本土的方式结束二战，那么我们中的很多人都活不到今天。很多日本人主观地认为我会为轰炸广岛而感到内疚、良心备受谴责。但事实上，我为什么要感到内疚呢！我亲眼看过有关中国南京大屠杀的纪录片，看到过日本士兵用刺刀把胎儿从中国孕妇的肚子里挑出来的场景。这样的暴行，并不比我向他们扔原子弹仁慈多少。日本人只强调他们遭到原子弹轰炸，却没有想过发生这一事件的原因。”事实上，蒂贝茨并没有后悔自己当初的举动，而且每晚都睡得很香。分行阅读更方便,,,,,,,,
104,哪个国家没有好人？日本韩国我相信有很多好人存在，但是是好人就不讨厌中国了吗？难道我讨厌日本我就不是好人了？日本平民善良是对亲人朋友的，可不是对中国人的，也就中国人那么蠢，抓住那点善良不放，替人家洗白，日本人知道吗？知道了一定会感动哭吧，换作日本被大屠杀，应该没几个出来为中国说话的吧，什么善良的平民，还是三岁小孩吗,,,,,,,,
97,为什么德国能获得尊重？因为他敢于承认自己所放下的过错。虽然跪下的只是一个人，但站起来的却是整个德国。,,,,,,,,
79,一些科普历史的视频下的评论总会有人说什么引战，铭记历史被说成粉红，勿忘国耻被说成爱国 贼。某些人想要抹杀历史的企图昭然若揭。以史为镜可以知兴替，热爱日漫不代表热爱日本的一切，可总有人看到有关抗日的话题就恼羞成怒，披着热爱和平的皮，做着抹杀历史的事。,,,,,,,,
88,我也是看着日漫长大的，现在还在玩fgo，可是像这种问题我也不会也不能退让分毫，即便现在的日本民众有多么多么友好，但是别忘了，右翼势力崛起就是民意！台湾的台独，某些程度上还能咱们双方都睁一只眼闭一只眼，只要你承认两岸同属一中，就万事大吉；可是日本不一样，某些人说的民间怎么怎么友好，我确实眼见甚少，且以我所见，大抵都是华人与狗不得入内之流，再有，日本的现行道路，很大程度上于《脱亚入欧论》有关系，欧美最擅长文化入侵，日本更厉害，直接是从小洗脑，看日漫，没有错，但是别让因为喜欢日漫的个人情绪，带动你的判断能力,,,,,,,,
75,高中历史书上有两张图，一张“日本军人在入侵中国前与家人在一起”，一张“日军屠杀中国人的狰狞面目”这两张图并排放着，上面有一段文字：     “日本侵略者有家庭，妻子儿女········其乐融融。但是，······，对手无寸铁的中国平民进行了极其残忍丧失人性的屠杀。他们把一位青年拉到街上，······，用硫酸浇到身上，再逼令其行走，直到倒地而死；······把俘虏的士兵捆在柱子上，用锥子刺成血人，······；还轮-奸孕妇，·····剖出胎儿······。‘’     文字边问着：是什么使日本侵略者从人性变为***的兽性？     放下仇恨，是因为我们没有资格原谅。     愿逝者在泉下安眠，那些绝望和痛苦都由我们来替你们铭记。,,,,,,,,
65,各位，这个视频是讲日本的暴行的，但下面的评论我给你们总结一下啊，不要做国吹，不要记住仇恨，有些人真极端，日本也有好人，你们只会嘴炮爱国。一看挺有道理，但是我很奇怪你们看到日军暴行的第一反应居然是这些，如此淡定或者已经想到要教育激进的爱国者啊，果然我们一般人不能体会这个高境界。,,,,,,,,
77,明明只是一个日本屠杀视频，非要有一堆日漫粉在这里蹦哒过来蹦哒过去，嗡嗡响的烦死人，知道为什么日漫粉声誉不好吗？知道为什么还得团团公开发声说明喜欢日漫和爱国不冲突吗？就是你们这群睿智的锅，懂了吗？(๑･̆⍛･̆๑),,,,,,,,
60,对，放下仇恨，铭记历史！话虽然是这么说，可是右本子们玩鹰，照死不承认，你就真的不想照死抽这帮杂种草的么？你就真的不想给它们拽出来一顿猛干吗？是，应该抛开仇恨和惩戒，漂亮话可以说，做事情可以更干净利落，但是这应该有个前提，那就是曾经的施害方不要出来挑衅，不要犯贱。看到自己同胞被杀因为和平与发展而忍气吞声，我们做的已经很好了。可惜人家施害方依没赔钱，没出技术更没偿命，子孙后代依旧安居乐业，依旧骂你是支**，依旧指导后代屠杀是没有的事，指导后代种族的优越性，更是指导咱们自己的败家子儿穿军服，戏弄国民，甚至对自己同胞恶语相向更加威胁。这些都发生过吧？光靠自己对方不作为，能简单放下仇恨吗？这就好比有个精神病把你打一顿，医院把他带走了，治疗，一不受苦二不受罪，家属不赔偿，自己花钱看病，然后好不容易病要好了，追溯期刚过，精神病跑出来了说自己没病，家里人配合精神病叫嚣说你污蔑他们，告诉后代你是精神病，朋友圈天天转发你当时其实也有问题，然后你家邻居也都纷纷疏远你觉得是因为你脾气大，好心的爷爷奶奶劝你都这么大人了干嘛非和人家动这么大气？然后你回家看到自己孩子穿着精神病当年穿着的衣服冲你做鬼脸……顺路难听的别说忘记仇恨了，想弄死精神病他全家的心估计都有了吧？所以话要说清楚，比如放下什么仇恨？放下杀得他们片甲不留的仇恨当然是必须的，放下对着他们一顿骂街的仇恨也可以啊，不伤害无辜日本人的后代这更是必需的，免得显得自己小家子气。但是放下冲安倍等右翼集团等人脸上啐一口甚至猛抽大嘴巴的仇恨，看了某某供奉的“先勇”就想给它砸了的仇恨，看到某些傻壁站出来辱华就想一拳打他脸上的仇恨……这我根本做不到！我们应该透过现象看准本质。为什么要放下仇恨？只是因为不愿意参与到无畏的踢皮球当中去罢了。种花家的优秀传统是艰苦奋斗和取精华去糟粕，即便是敌人我们一样该学学该批评批评，这就是为什么我们一路过来世界地位越来越高的原因。所以，等有一天我们国家强大到具有一定话语权的时候，我保证这段历史罪债还是要追讨的！一定会这样！,,,,,,,,
60,爱好和平根本不影响我仇恨日本！请日杂不要再给日本洗了！所谓当初充满兽性的战争都是天皇的洗脑的言论，都是日本官方甩锅的说法吧！而那些为战争背锅的人，如今都在精锅神社里受香火供奉！别忘了死去的是我们的祖辈！我们的亲人！我们的骨肉同胞！即便当今日本跟世界上所有国家一样，好坏参半，但只要日本一天不认罪日本就永远是中国的罪人！,,,,,,,,
73,铭记历史，放下仇恨，这话真她嘛搞笑，铭记历史的话能放下仇恨吗？中日和平？？呵呵，这都是场面话，国际政治上，中日哪个不是有机会就他嘛互捅刀子，联合国上日本的提案中国哪次不是否决否决再否决？再说说日本，日本亲中的首相官员有几个好下场的？反倒是反华的，任期一个比一个长，真他麻讽刺，很多人说大多数日本人都是友善的，所以选出了安倍晋三？还当了这么多年首相？八成的日本人都有着当年大东亚共荣的思想，也从心底瞧不起中国人，只不过很多没表现在脸上罢了，和平这两个字，只不过是如今各国对峙的产生物罢了，地球利益就这么大，如果不走出宇宙，第三次世界大战迟早爆发，无论中国史还是世界史，基本都是打过来的，我们只是幸运得出生在一个较为和平的节点而已，我们如今的发展，或许有可能只是为未来的战争备战而已，放下屠刀立地成佛这事，永远只有活下来的人能说，你死在他屠刀下，那就只能活该，而他却能立地成佛，潇洒自在。我说这么多不是什么愤青，只是让大家记住这笔仇，仇恨，在一定意义上是一个国家发展的不竭动力，或许如今的这代日本人无罪，但是老一辈有罪的受到惩罚了吗？中国千万冤魂做何说法？如今的日本，对于历史都是直接否认，呵呵，当初中国总共多少人？换算下如今，得死多少？？记住，日本这个民族，当初要亡中国的国，灭中国的种的民族，如果不是老一辈人拿自己的命填出了一个未来，咱们或许跟台湾的一些皇民没什么区别，站在民族大义上，中国人就没资格为日本人洗，这是亡族灭种的大仇，没有什么理智可说，不要站在什么道德制高点去评论别人，理智爱国不代表要放下仇恨去爱国，这是一个民族的仇,,,,,,,,
63,就3類人會幫日本洗白                         1：屁事都還不懂聽風就是雨的社會小白（學生），跟風黑的。            2：真正的日雜            3：拿錢洗地的漢奸,,,,,,,,
52,金一南将军曾举例：918次日，一高龄老妪拉着它的几个孙子要求参加侵华日军。日媒喉舌报刊当作重大事件报道。以及平民百姓对侵略战争不同阶段的胜利都有着近乎疯狂的庆祝举动。  希望团团能把这些资料找出来。  就是要给那些平民无罪的人看看。,,,,,,,,
51,"日本也有好人，只可惜可能数量太低，微乎其微，复制某人评论但因为视频不一样，内容有出入，但是大意对就行：我是讲道理的,实事求是，我只相信我看到的真相，但有些人是不是越过底线了?有人极端是不妥，你们居然开始怪国人不对日本友好？，我看评论有什么为什么不去怪八国联军?怎么不去怪。?八国联军造成了中国3500万人死伤?八国联军在中国大规模的惨无人道?请你去看看矿洞的万人骨骸，731，华北无人区……再来质疑国人的态度，有评论说什么要区分少部分日本人坏，大部分友好，敢情你调查过?我先不说日本政府什么样，不然你们又要说日本政府其实代表不了人民，我在日本最主流的网站，雅虎日本，2CH等看到只要关于中国的几乎没有什么正面评价，各种摸黑中国，就像NHK电视台播放了一个纪录片731，下面也是各种抵赖，说中国人用编造出的可怜来谋求国家利益，还举了一大堆不知怎么来的的证据说南京事件不存在，731不存在，慰安妇也不存在，这样的言论往往是赞数最高的，评论里几乎没有为中国说话的，称呼知拿人的大有人在，中国和韩国几乎就成了上面的老鼠屎了，甚至和二次元B站息息相关的N站，评论也是反华为主流，现在**不难，你可以自己去看，除了关于料理和熊猫的。还有日本的媒体，无论是官方还是非官方，甚至左翼媒体，都喜欢见中必黑，我想，这应该能说明一定问题了，友好的日本人真的是大多数吗?我不反对有喜欢中国的日本人来，但是我希望每一个来日本的中国人端正态度，承认历史，我也不喜欢某些同胞，别人都没给好脸，你却拼命维护。我不极端，我也不说什么复仇，我会日语，也喜欢动漫，也去过东京一次，感觉还不错，但是，人总有个底线对吧?                                      作为受害者的我们，态度已经算不错了，但是最作为为加害者的日本人真正反思的有几个，还言语攻击比中国还厉害。换句话，这是所谓高素质日本人应有的态度？中日友好的问题永远不在中国，在于日本人自己的态度!",,,,,,,,
48,当日军俘虏被带到孙立人的面前时，缅甸抗击日本中国国民党38师孙立人厌恶地皱皱眉头，不加思索地命令参谋：“你去审一下，凡是到过中国的，一律就地枪毙，今后都这样办。”命令被迅速执行。国际法规定不能杀俘虏，日本人听到这个命令感到毛骨悚然，我不知道各位对于这位国军的军官有什么看法，反正我个人是支持的，日本人连禽兽都不如，几岁的孩子都要糟蹋，我觉得孙立人做得好，把日本人就地枪毙，这个军官是最狠的，也是杀日本人最多的，当时听历史老师用课件讲,,,,,,,,
44,"日本发动侵华战争时，日本国内有上百万日本妇女远下南洋，把用出卖自己赚到的钱捐给侵华日军，支持侵华日军屠杀中国人！所有日本人都有罪！！！<img alt=""[那兔_找事儿]"" src=""//i0.hdslb.com/bfs/emote/55022a863de195f355394296647a8cea2ad69d57.png@100w_100h.webp""/>",,,,,,,,
44,然而外网日本人基本上是不承认的态度，狡辩的方式也是千奇百怪不统一。。。还是奉劝一些人，你可以爱日本爱日本文化，中华兼容并蓄。但是有些事一定要记在心里，那是你作为中国人一定要记住的事情,,,,,,,,
43,很抱歉，我不敢看。然后关于原不原谅日本这个问题，你见过犹太人原谅纳粹吗？还是死不悔改的纳粹，我也不是对日本人一棒子打死，不可否认日本也有好人，就像中国也有垃圾一样哪个国家都不可避免，至于原谅日本等到他们可以正视历史，郑重道歉并且清除右翼分子拆毁靖国神社。或许可以考虑。,,,,,,,,
48,"我想说的是，有些人喜欢上日漫以后没发现自己发生了什么变化吗？当然只指部分人。只要b站上有对日本不好的东西，比如前段时间共青团发的视频，你就会说b站谈政治有病吗，滚出b站好不好,有意无意避开一切对日本不好的东西，以不喜欢政治为理由，关于特朗普蔡英文的视频我从来没见过什么b站不能谈政治的言论，从来没有，为什么？你自己说。一有关于南屠的东西，你就说日本不止有右翼啊，还有很多善良友好的人啊。请问谁不知道哪个国家都有好人坏人，需要你这样“费心提醒”吗，在我看来，不过是一种无力的洗白。你真的有那么善良吗，换作别的国家你也会这么说吗？你真的有一颗慈悲心肠吗，你对你身边的人都这样维护吗？无形之中已经在出自本能的维护日本了你自己发现不了吗?觉得自己可怜的要死，你看个动漫还有人骂你卖国贼，当然这不对，可你不想想为什么总会有人这么说，你的一言一行不是在维护一个。屠。杀。中国多少人的国家吗？一看国漫各种挑刺，有的日漫再烂也是你的信仰不是吗？你真的不明白共青团来了b站什么意思吗?我从前和部分人一样，最近从龙腾网看了很多日本对南京事件的评论，我谢谢他们终于让我看清大部分日本人，看日漫，但再也不会为日本说话了",,,,,,,,
47,越来越多的人会说不要一棒子打死全部日本人，日本也有好人啊，难道我说出这句话我就不爱国了，我就是卖国贼了吗？对，当你说出这句话后你就输了，你就已经成神了，你是耶稣，你原谅了日本人在中国土地上的所作所为，这个要你特意来提醒吗？他们不承认南京大屠杀，还在街边演讲被中国大妈看到就被警卫带走了那一幕还记得吗？有的人喜欢日漫，就吧南京大屠杀给忘了，与几十万无辜的没有做错什么不知道为什么就该死的人相比，还是日漫重要，我就励志成为一名漫画家，我这辈子一定要去日本，日本太好玩了，日本人素质真高那个垃圾会分类，再看看我们老是乱扔垃圾，恶心，当你说这句话的时候，你扔垃圾的时候有没有给垃圾分类？有没有随手捡起地上的垃圾？只要日本人再坚持个七十年不承认南京大屠杀，中国人就可以全部原谅，全部忘记，看看萨德才几个月就忘得一干二净，钓鱼岛几年就忘得一干二净，南京大屠杀现在还有多少个人觉得日本有错，每次说南京大屠杀的时候都要拿满清杀汉人来比，你是多想日本吧中国给收了？有的人可能会说，那你教好你孩子啊，世界观来源于生活，当生活里的同龄人都被这种喜欢原谅别人唯独不能原谅自己的人教出来的孩子在一起玩的时候，我的孩子也会被同化，因为为了融入集体，有的人学好画画就想去日本发展，你是为了日本的漫画事业崛起而学习漫画的吗？你生来就是想为日本人服务的吗？怎么没有人说，日漫那么厉害，我国漫才不会输给你，让我来努力发展国漫，你这个垃圾小倭寇。,,,,,,,,
40,"有毛病吧，爱国就是粉 红？有些人说话明明挺理智的也能被喷，无脑喷的人你们是来秀智商的吗？<img alt=""[小电视_差评]"" src=""//i0.hdslb.com/bfs/emote/38456e3bde2839b00b536a8be13934fa57c8e298.png@100w_100h.webp""/>",,,,,,,,
40,天天错的是日本右翼，普通百姓冤枉的，日本整体是好的！咋日本右翼多少年了，还不都是你们口中的普通百姓选出去的？日本为了突破自己岛国弊端来侵略中国，站在所有日本人的角度来看都是正确的好不好，中国当年被日本打成那样，死那么多人的，受那么多侮辱现在说句日本有罪还能被喷？告诉你们这些精，日，日本不光有罪，血债还得血偿,,,,,,,,
