链接,标题,播放数量,弹幕数量,发布日期,点赞数量,硬币数量,收藏数量,转发数量,评论数量
11,"看b站好几年了，第一条评论献上(兄弟姐妹一起用一个号，可能她们发过)不喜欢发评论，被喷估计会气哭，但想说点什么，大概会很乱最想表达的大概就是在b站上看到很多关于“平民无罪论”的话了，说实话，我是很喜欢日漫的，甚至弟弟妹妹都是我带入坑的。我可以把龙猫，千与千寻等电影刷上几十遍，但是日本拍的例如萤火虫之墓，我看了开头就觉得恶心，看不下去，所以明明算很老的电影，都没有看完。我不会有那种现在中国拿着枪报仇把日本全杀光的想法，也从没有在日本受什么灾难时在网上冷嘲热讽。但就内心想法，我会为b站伊拉克，利比亚，阿富汗之类的平民视频流泪，但对于日本，我不会发表，也不提倡冷嘲热讽，但我真实想法就是报应，极度恶心日本拍的战争导致日本平民受害的电影，但说小男孩和胖子，有一说一中国人不应该感谢这两个蛋嘛，甚至如果早点投，是不是就不会有南京大屠杀了，圣母可怜原子弹下日本人的，大概不会想原子弹晚一天中国大概会死多少人。就我浅薄的历史知识，中国人是被日本人侵略闯入家门，屠杀平民，呵，日本是偷袭美国，被美国轰炸本岛。中国杀过日本平民吗？都不说那些人算不算平民，给国家捐款侵略别的国家助纣为虐，难道他们真不知道吗？中国人真的太太太仁慈温和，战后还收养了很多在中国的日本遗孤，善待俘虏。没有赔偿，没有归还抢去的东西，甚至都没有道歉，中国还有人圣母到日本侵略中国，美国轰炸日本，导致日本停止侵略，还要去可怜日本。乱七八糟打了一堆，也不知道自己主题是啥<img alt=""[捂脸]"" class=""small"" src=""//i0.hdslb.com/bfs/emote/6921bb43f0c634870b92f4a8ad41dada94a5296d.png@100w_100h.webp""/><img alt=""[捂脸]"" class=""small"" src=""//i0.hdslb.com/bfs/emote/6921bb43f0c634870b92f4a8ad41dada94a5296d.png@100w_100h.webp""/><img alt=""[捂脸]"" class=""small"" src=""//i0.hdslb.com/bfs/emote/6921bb43f0c634870b92f4a8ad41dada94a5296d.png@100w_100h.webp""/>总之，希望今后不再有战争，世界和平。死不认错的国家，希望苍天有眼，出来混迟早要还的。",,,,,,,,
11,德国敢于承认错误，而日本政府还要去纪念侵略中国的战犯，还在教科书上淡化侵略历史，如果日本政府承认错误的态度能做到德国的一半我们也不至于厌恶他们，不过我们纪念九一八 纪念南京大屠杀死难者，不是为了报仇消灭日本，而是为了铭记历史，缅怀先烈，珍惜和平，开创未来，只有国家强大了，才能不被欺负，才能繁荣富强，我们珍惜和平，不侵略他国，但我们也不惧怕战争，如今的中国已经不再是任人欺负的样子了，虽然我们珍惜和平，但如有来犯之敌，虽远必诛，就算我喜欢日漫，但我分得清大是大非，这不冲突，因为这是真正的理性爱国。我希望大家能够做到。,,,,,,,,
11,坐标南京，今天上课上语文课上一半警报响了，同学和老师都很自觉的站起来沉默的默哀，默哀之后语文老师轻声的感慨了一下“又一年了啊。南京啊，真是个多愁的城市”心情陡然间变得更沉重了，是啊，又一年了，但几十年前那些眼泪与痛苦，却还清晰的铭记在心中。我在南京大屠杀遇难同胞纪念馆附近长大，所以这种家国情怀会格外浓烈。因为小学离南京大屠杀遇难同胞纪念馆很近，在12月13日还没成为国家公祭日之前，我们会在当天去馆内参加默哀，即使当时还很小，但嘶鸣的警报声，沉重的钟声，和漫天的和平鸽永久的深深的震撼了我。看着馆内的一份份血淋淋的证据，当时小不知道做过多少次噩梦，那种绝望，那种国耻的痛，即使到现在我一回想都格外悲愁。真的很建议大家来南京旅游的时候去看看南京大屠杀遇难同胞纪念馆。（今天放学回家出地铁站，路面上的广告牌常年放着关于和平的海报，今天看格外有感触。南京啊，真是个多愁的城市。）勿忘国耻，珍惜和平。,,,,,,,,
11,铭记历史。砥砺前行。逝者安息。生者奋进。山河无恙，国泰民安，欢迎先辈回家,,,,,,,,
10,今天南京的路上很堵，因为有三十万人要回家。,,,,,,,,
10,“我不是复仇主义者，我无意于把日本军国主义欠下的血债写在日本人民的账上。但是，我相信，忘记过去的苦难可能招致未来的灾祸。”,,,,,,,,
10,同志们。我们要做的不是报复日本，而是要维护和平。,,,,,,,,
10,连道歉都没有连承认都没有等着慰安妇死掉失去人证然而这段历史是全世界公认的历史愚蠢的操作但是我们却也满满不在意了？？？勿忘国耻不重要振兴中华才重要的那条弹幕你退出一下，看看是什么视频。这个视频不用提醒这个，大家都懂骂的都是当时的侵略者而不是宫崎骏桥本环奈十元里美，拎得清分的出，别出来再拎一次，大家不是ZZ,,,,,,,,
10,总有人在这个时候装理客中，说中国渲染反日情绪，刻意制造中日对立，我只想问三个问题:是谁参拜供奉甲级战犯的靖国神社?是谁脚踹慰安妇铜像还说是腿麻了?是谁篡改教科书否认南京大屠杀?到底是日本右翼的极端行为激发了中国人的反对，还是中国人刻意渲染民族仇恨？这是一个关键问题，不能不说清楚,,,,,,,,
10,国家公祭日是为了纪念曾经发生过的重大民族灾难而设立的国家级祭日2014年我国将12月13日立为南京大屠杀死难者国家公祭日今年是南京大屠杀同胞遇难82周年在第6个公祭日来临之际让我们从日常生活中暂且抽身片刻以自己的方式缅怀无数为抗战而牺牲的先人与英烈,,,,,,,,
10,“这里曾经都是人，现在欢笑声不再了……但是请记住，同志……总有一天事情会发生转机。我们会把战火带给他们的土地，他们的人民，他们的血……”维克多·雷泽诺夫，1942年，斯大林格勒“但我们不需要他们的土地，他们的人民，或是他们的血，我们需要的只是他们的忏悔，哪怕只有一次真心诚意的忏悔，至于地狱，是留给那些恬不知耻的法西斯野兽的。”,,,,,,,,
9,"转眼又一年了.....<img alt=""[保佑]"" class=""small"" src=""//i0.hdslb.com/bfs/emote/fafe8d3de0dc139ebe995491d2dac458a865fb30.png@100w_100h.webp""/><img alt=""[保佑]"" class=""small"" src=""//i0.hdslb.com/bfs/emote/fafe8d3de0dc139ebe995491d2dac458a865fb30.png@100w_100h.webp""/><img alt=""[保佑]"" class=""small"" src=""//i0.hdslb.com/bfs/emote/fafe8d3de0dc139ebe995491d2dac458a865fb30.png@100w_100h.webp""/>",,,,,,,,
9,1937年12月13日晨，日军攻入南京城，开始了长达四十多天的南京大屠杀。日军用机枪射杀，集体活埋等残忍的方式屠杀城中老百姓，更开展了丧失人性的“百人斩”杀人竞赛，当时城内房屋尽毁，血流成河，可以说，现在的南京没一处都曾流淌着我们同胞，我们祖先的鲜血，更别提长江中的数万冤魂。今天是12月13日，国家公祭日，我们要牢记历史，珍视现在的和平。,,,,,,,,
9,侵华日军在中国所犯下的残暴罪行可不止南京大屠 杀一件。以下我就列举几个我知道的：旅顺大屠 杀（公元1895年）雾社大屠 杀（公元1930年）上海一.二八大屠 杀（公元1932年）平顶山大屠 杀（公元1932年）新宾大屠 杀（公元1932年）西宝屯大屠 杀（公元1932年）榆城大屠 杀（公元1933年）临江大屠 杀（公元1933年）依兰大屠 杀（公元1934年）老黑沟大屠 杀（公元1935年）天津大轰炸（公元1937年）金山卫大屠杀（公元1937年）上海大轰炸（公元1937年）罗径大屠 杀（公元1937年）阳高大屠 杀（公元1937年）苏州大屠 杀（公元1937年）南京大轰炸（公元1937年）南京大屠 杀（公元1937年）武汉大轰炸（公元1938年）重庆大轰炸（公元1938年）成都大轰炸（公元1938年）延安大轰炸（公元1938年）兰州大轰炸（公元1939年）潘家峪大屠 杀（公元1941年）上饶细菌战（公元1942年）厂窖大屠 杀（公元1943年）桂林七星岩大屠 杀（公元1944年）而在某些人眼里，它只看得见那两颗原子弹。鬼子，看你洗31年侵占东北，日本人民在干啥？37年侵占华北，日本人民在干啥？41年偷袭珍珠港，日本人民在干啥？45年挨炸弹了，日本人民觉得冤？31年日本入侵东北，日本人民在狂欢，因为它们得到了矿石，粮食（中国人的），37年入侵华北，日本人民在狂欢，因为它们开始了“大东亚共荣圈”（日本帝国主义），41年日本打美国，日本人民在狂欢，因为它们得到了南洋和东太平洋的统治权，45年被核平，日本人民从了美国,,,,,,,,
9,哪个憨批踩的踩？,,,,,,,,
9,我喜欢日漫，用着日本人物的头像和名字，但我决对没有一刻忘记自己是个中国人，我爱中国，应该说我不爱中国才奇怪，我喜欢日本的东西，不代表可以原谅它对中国的侵略！我知道，在某些人眼里，会觉得我这种的人就是精日，觉得我不配在这么严肃的视频底下评论，但我也不怕了，你们爱说什么就说什么吧，我是个中国人，往后的一辈子也会是中国人，我时时刻刻都没有忘记那句话:勿忘国耻，振兴中华。有人问，日漫和国家你选哪一个？我只能说，你太蠢了，你觉得世界上还有比祖国更重要的东西？跟民族振兴相比，日漫连屁都算不上，更不如说，谁给你的勇气让你把拥有上下五千年历史文化的祖国跟一种文化形式相比的？？？我相信只要是个中国人都会有衡量二者的分寸，就算心里扭曲了，也终会有一天回头是岸。,,,,,,,,
9,转载的但是有一个问题我希望能注意一下，现在评论区里有带节奏的说原谅的资格的问题，这里有一个很阴险的深层逻辑在误导大家，那就是法西斯的罪行是可以原谅的，重点并不是你有没有资格，只要是人类，无论是过去的人现在的人甚至是未来的人，面对法西斯这个人类公敌的时候，都不可能谈原谅不原谅的问题，因为它并不是我们朋友的错误这种小事你可以选择原谅或者不原谅，我们根本就没有原谅这个选择，法西斯分子必须得到彻底的清算！这里提一下日本人民的问题，过去的日本甚至现在的日本，大部分人民已经被右翼分子洗脑很难通过教育改造来让他们回归正途了。但是，就像鲁迅先生在狂人日记中呼吁的那样，“救救孩子”，美帝和右翼依然控制着日本人民的教育和舆论，原本纯洁的孩子还在不断地被他们“培养”成帝国主义的帮凶，打破美帝对于国际舆论的垄断才是当务之急，而不是纠结于所谓的中日民族矛盾，这恰恰是西方资本家分化两国人民的一个重要手段，一定要警惕。,,,,,,,,
9,今天南京的车站好挤，因为有三十多万人要回家,,,,,,,,
9,"八十二年易逝，忠骨英魂永存！
勿忘国耻，牢记历史。",,,,,,,,
13,“ 广大日本民众也是无辜的，罪魁祸首是占少数的日本军国主义。”二战中的日本战犯仅仅是1946年被东京国际战犯法庭判处绞刑的东条英机等几人吗？历史不是这样的。一个国家，一个地区的全部人民，整体走入误区，历史上比比皆是，没有什么值得奇怪的。1931年九一八事变的第二天，日本报纸就报道了这样的消息：在日本陆军部来了一个老太太，带着三个孙子：10岁，8岁，5岁，每个孙子捧着一个泥巴的钱罐到陆军部全部砸碎，全部捐出来。当天，东京有三名电车女售票员，请求参军没有得到批准，随后全部跳车自杀。在北海道，二十五名青年要求参军，没有被批准，他们就切掉左手食指放到瓶子里，给日本陆军部送去。日本报纸还报道称，一名军官的夫人，送她的丈夫到满洲参战，夫人给丈夫准备好所有的东西，第二天早上，送丈夫出门，然后夫人把门锁上，翻身从楼上跳下自杀身亡。给丈夫留了遗书：为了使你在前方毫无牵挂的杀敌，我今天自杀了。一个国家，一个民族之间的对抗，绝不简简单单是几个坏人的捣乱，不是这样的。当时日本整个社会那种狂热令人感到震惊，有大量的纪录片展现当时日军占领上海、南京、杭州后，日本社会万人空巷，白天游行，晚上打着灯笼火把，载歌载舞欢呼雀跃。这是民族之间的战争，他的目的就是要压垮中国，把中国的财富全部掠夺，据为己有。日本人民真的是战争的受害者，而不是战争的始作俑者吗 ？不是的。那些军国主义的军阀只不过是走在了这个战争狂热浪潮的最前列而已。在“ 广大日本民众也是战争受害者 ”理念的指导下，一部分被侵略国也去参与了日本广岛长崎原子弹轰炸的纪念，可日本人却从不去纪念如九一八事变、七七事变、南京大屠杀，他们每年专门纪念广岛长崎原子弹投弹那一刻。这些纪念搞得越多，日本人仿佛就真的成为了战争的受害者 ，而不是战争的始作俑者。美国人为什么投射原子弹的原因没人讨论了，只剩下日本人非常凄惨的结论。我们过去理念是，人民是好的，百分之九十，甚至百分之九十五以上的人民是好的。这是马克思主义的历史唯物史观、是一个认识问题的方法，也是我们认识世界的方法，但是需要特别注意，这不是唯一的方法，还有别的方法 。比如俄罗斯的列别德，就是原来要竞选俄罗斯总统，后来坐直升飞机摔死了 ，他就讲过：5% 的精英和5 %的败类，90 %的人要么跟着精英跑，要么跟着败类跑。很显然这不是历史唯物主义的认识方法,,,,,,,,
8,"上海有个叫做吴祖康的老爷子，2000年开始创建一个叫：918爱国网   <img alt=""[爱心]"" class=""small"" src=""//i0.hdslb.com/bfs/emote/ed04066ea7124106d17ffcaf75600700e5442f5c.png@100w_100h.webp""/>的网站，网站收集了目前几乎所有的抗战资料新闻。20年间，老人家一直靠自己的退休金和各界人士的捐赠维护网站，时而还要去慰问抗战老兵，目前网站还一直处于赤字状态。在今天这个特殊日子，希望有能力的小伙伴对网站进行捐助，2000年开始，每一分捐助的使用情况全部都在网站上透明公开大家可以看一下这个网站，或者复制一下这段话，评论到其他视频下，让更多人知道这个网站",,,,,,,,
8,明天又到了，勿忘国耻,,,,,,,,
8,日本平民享受着军国主义带来的战争红利，失败后脱下军人的外面变平民逃避审判，别说什么原谅日本平民，军国主义是他们推选出来的，直到现在日本人都看不起中国人，把我们当印度人看待的。,,,,,,,,
8,"日本人把自己当人，你也把它们当人，哈哈<img alt=""[喜极而泣]"" class=""small"" src=""//i0.hdslb.com/bfs/emote/485a7e0c01c2d70707daae53bee4a9e2e31ef1ed.png@100w_100h.webp""/>——致在天国的圣母",,,,,,,,
8,"日本只反思自己为什么战败，而不反思战争给世界带来多少破坏<img alt=""[小电视_差评]"" src=""//i0.hdslb.com/bfs/emote/38456e3bde2839b00b536a8be13934fa57c8e298.png@100w_100h.webp""/><img alt=""[小电视_差评]"" src=""//i0.hdslb.com/bfs/emote/38456e3bde2839b00b536a8be13934fa57c8e298.png@100w_100h.webp""/><img alt=""[小电视_差评]"" src=""//i0.hdslb.com/bfs/emote/38456e3bde2839b00b536a8be13934fa57c8e298.png@100w_100h.webp""/>",,,,,,,,
8,还是局座他老人家说得对    对于日本这个国家喜不喜欢得看哪方面   动漫？ 当然喜欢    奥特曼？  童年啊  肯定的     南京。。。。不好意思，别拿你们国家好的和垃圾的放一块对比   先把以前那堆陈年旧账算清楚再说,,,,,,,,
8,日本就是有错，别舔了各位精日弟弟们。勿忘国耻，振兴中华！,,,,,,,,
8,对待南京大屠杀事件，勿忘国耻是必然的，日本方面也得血债血偿，但血债血偿针对的是那些战犯而不是所有的日本人，那些战犯在东京审判中被判处绞刑得到了应有的惩罚。但日本方面自己也请做做检讨，为什么我们会那么想呢？仅仅是因为你们曾经带给我们的苦难吗？我们憎恨的是日本方面并没有深刻反省二战时期自己带给世界，带给中国，带给南京人民的灾难。而且出现了安倍晋三参拜靖国神社，篡改教科书企图歪曲历史事实，在公开演讲中说上面侵略在国际上没有什么具体定义等行为。怎么？做过的事不敢承认了？你们就算深刻反省我们都不一定原谅你，更何况你们这么做那就更加不值得去原谅了。再看看同样身为曾经的法西斯国家德国是怎么做的，德国方面不仅完全承认自己侵略的事实，有一些和希特勒有关系的阿道夫姓氏种族的人甚至和自己的配偶商量不留后代。看看人家德国，这就是差距，如果日本做到如此程度，想必中国人也不会像这样反感，痛恨现在的日本人。当然，针对这一现象也要理智看待，不是所有日本人都是这样的，但对于某些不要脸掩盖事实甚至歪曲事实的日本人永远不值得原谅，你们将被所有中国人所痛恨。牢记历史，勿忘国耻。落后就会挨打。要想不让南京大屠杀这样的事情再发生就要让自己的国家富强起来，所以我们要艰苦奋斗，为祖国的建设出一份力。一时感慨所写如果有语病或者逻辑上的问题请多多谅解。,,,,,,,,
8,以前对南京大屠杀的认知也仅仅是停留在死亡人数的那个数字仅此而已 直到前几天历史公开课 老师给我们看了一部南京大屠杀小短片 哀嚎不绝于耳 哀鸿遍野 满地的尸首 战火连天 看着看着就哭了 在众多同学和外校老师面前 我是个男生 但我并不觉得有什么 这是我的国家 我为我的人民而流泪 我为他们的遭遇而痛彻心扉 我头一次意识到自己心中的爱国情愫 也是首次真正感受到了我的祖国的伟大 国之殇 勿忘,,,,,,,,
8,损了别人牙眼，却反对报复，主张宽容的人，万勿和他接近。         －－鲁迅,,,,,,,,
8,我头像好看吗,,,,,,,,
8,勿忘国耻，但更应该记住振兴中华！,,,,,,,,
8,哪有什么岁月静好，只是有人帮助我们负重前行！！！,,,,,,,,
10,有的人说，我们没有资格替先人原谅。但我们就有资格替他们去仇恨吗？难道把仇恨转接到现在吗？有些人说，要让（现在的）日本血债血偿，如果我们真这样做，那我们和他们还有什么区别？即使是那些在那个为国家做出贡献的人——比如毛主 席，仇恨的也只是日本帝国主义者。记住历史，不要记住仇恨——《南京大屠杀死难同胞纪念馆结语》这句话如果是一个普通人说出来，键盘侠一定会说那个人是精日、狗 杂。那我问你们，你们又有多少是真正爱国的呢？你们为国家做过多少贡献呢？,,,,,,,,
10,作为南京人，原谅？不存在的，不管多久都不会原谅的！但是宣扬仇恨思想？移平日本？不好意思，你这是挑拨战争，是错误思想！只能说你没看得清！,,,,,,,,
10,海外游子感谢中国强大 愿明年能毕业回家报效祖国,,,,,,,,
7,靖国神社年复一年的祭拜活动，就已经说明日本人对待历史的态度，虽劣迹斑斑却引以为傲，无可救药。,,,,,,,,
7,知小节无大义,,,,,,,,
7,旅顺大屠 杀（公元1895年）雾社大屠 杀（公元1930年）上海一.二八大屠 杀（公元1932年）平顶山大屠 杀（公元1932年）新宾大屠 杀（公元1932年）西宝屯大屠 杀（公元1932年）榆城大屠 杀（公元1933年）临江大屠 杀（公元1933年）依兰大屠 杀（公元1934年）老黑沟大屠 杀（公元1935年）天津大轰炸（公元1937年）金山卫大屠杀（公元1937年）上海大轰炸（公元1937年）罗径大屠 杀（公元1937年）阳高大屠 杀（公元1937年）苏州大屠 杀（公元1937年）南京大轰炸（公元1937年）南京大屠 杀（公元1937年）武汉大轰炸（公元1938年）重庆大轰炸（公元1938年）成都大轰炸（公元1938年）延安大轰炸（公元1938年）兰州大轰炸（公元1939年）潘家峪大屠 杀（公元1941年）上饶细菌战（公元1942年）厂窖大屠 杀（公元1943年）桂林七星岩大屠 杀（公元1944年）距统计，抗日战争直接导致4500w中国人伤亡，总计2亿中国人受到战争损害！但某些人眼里，它只看得见那两颗原子弹。（转）,,,,,,,,
7,12.13纪念永远逝去的同胞，国家不会忘记，后辈不会忘记！九天之上星斗追，帝乘东飞下翠微。将御强寇国门外，不教铁血魂无归。斑竹一枝千滴泪，红霞万朵百重晖。沉舟旧港千帆起，星辰大海始轮回。,,,,,,,,
7,明天又要发了，勿忘国耻,,,,,,,,
7,之前，也有人说过，我喜欢日本明星，喜欢日本景色，喜欢日本人。但是，当他们拿起了枪，侵略我们，那我手上的刀，会变成砍向他们的屠刀！我们不忘记历史，不忘记先烈，我们没有资格原谅他们，但不代表去全盘否认他们，我们汲取他们的优点，补充到我们身上，是为了更好的，为保卫国家而努力！,,,,,,,,
7,我很喜欢日本，喜欢什么呢？日本的动漫声优都栩栩如生。我也很讨厌日本，讨厌什么呢？讨厌他们一脸嬉笑的笑谈侵略战争,,,,,,,,
7,"其实我觉得美国可以再丢几颗，反正他们大概不嫌多<img alt=""[吃瓜]"" class=""small"" src=""//i0.hdslb.com/bfs/emote/4191ce3c44c2b3df8fd97c33f85d3ab15f4f3c84.png@100w_100h.webp""/>",,,,,,,,
7,我相信那时代的军人们说的最多的话就是“活下去”而不是“替我报仇”。勿忘国耻的意义是珍惜现在的和平，战争带给任何一方的都只能是悲痛。我说这些话的意思并不是叫大家去原谅，恰恰相反，在他们承认自己的罪行之前永远不要忘记，永远不要原谅。但是审判的利刃必须要劈在正确的人身上，而不是黑白不分，一棒子打死所有人。,,,,,,,,
7,大家不要只在国内抒怀，我这几天一直在做南京大屠杀的research，想要在日本同学面前去讲这个事情，我觉得如果他们的国家这么多年来都隐藏这个事情，至少在大学里有自由听我讲一讲。但是我的爸妈同学全都是在批判我阻止我，说我太过自我了，难道不怕那些同学会把我想成一个奇怪的人吗。我就不懂了，我凭什么要因为这个改变我想做的课题?,,,,,,,,
7,死的人不是我，失去家人的也不是我，我有什么资格替先辈们原谅他们？那些原谅了的人我就奇怪了，自己跟自己拜把子，你算老几？,,,,,,,,
7,现在这一代的日本人民最初没有任何罪过，但掩盖自己祖辈的罪行，企图让所有人都忘记这段惨痛的历史，就是助纣为虐。仇恨，是无用的，是最恶毒，是最懦弱无能的行为。真正能做的并且应该做的唯有尽力做好身边的每一件事，振兴民族，让国家强盛。只有强大起来，国家才能保证自己的国家安全。和平不是用妥协与一味的谅解换来的，和平是用自己的强大和友好打拼出来的。勿忘国耻，振兴中华！！！,,,,,,,,
7,为受害者默哀！日本帝国主义曾经犯下的暴行会被历史永远记住，被全世界包括日本人民谴责。并且让我们也记住那些最容易被忽视的为反对日本法西斯主义而奉献的日本人民和革命者！侵略是帝国主义行为，无关民族,,,,,,,,
7,"抱歉，作为没有能力为在南京被害诸位报仇的后人，我没有资格请你们安息，没资格平息你们的愤怒、哀伤与绝望，更没有资格替你们做出任何决定，对不起，我能做的只有努力奋斗，爱国报国，尽全力不让悲剧重演而已，对不起<img alt=""[大哭]"" class=""small"" src=""//i0.hdslb.com/bfs/emote/2caafee2e5db4db72104650d87810cc2c123fc86.png@100w_100h.webp""/>",,,,,,,,
7,南京大屠杀太可怕了，我以前对此没有概念，直到看了一些小说才明白有多惨烈我今年13，我永远不会忘记我们国家经历过什么的,,,,,,,,
7,"我现在要告诉那些精日分子们，你们没有资格去原谅那群日本人，日本人举国欢庆的时候可没想过自己喝的是中国人的血与泪！而且你们还常常用什么所谓的”共产国际”和毛主席说的话来曲解，之后就用这些来当挡箭牌还为日本洗地，我想知道，宁们配吗<img alt=""[微笑]"" class=""small"" src=""//i0.hdslb.com/bfs/emote/685612eadc33f6bc233776c6241813385844f182.png@100w_100h.webp""/>",,,,,,,,
