链接,标题,播放数量,弹幕数量,发布日期,点赞数量,硬币数量,收藏数量,转发数量,评论数量
7,可能有些网友不理解那句“中国人民与日本人民是一致的，只有一个敌人，就是日本军国主义与中国的民族败类”。其实说这句并不仅仅只是个政治表态，而是根据马克思主义作出的论断。法西斯主义的一个特征就是借国际斗争来掩盖阶级矛盾，日本侵华就是这一特征的体现，通过对外战争转移内部矛盾。而共产主义恰恰相反，强调“全世界无产者联合起来”“人民当家作主”。从阶级的角度看，日本的无产阶级在战争处于被利用和被剥削的状态，战争的红利则被军阀财阀所占据。无论他们自身是否意识到这一点，都不改变其被剥削的实质。所以，在共产主义者看来，真正能够带来和平的不是一国打赢另一国，而是人民是否能够获得解放。这也是我国为什么把抗战称为反法西斯战争的原因，因为这不是民族仇杀，而是进步与反动的战争，是人民解放的战争。至于今天所谓的“日本人民不知错”之类的现象只是表面现象，所体现的实质就是人民没有获得真正的解放。,,,,,,,,
7,看見共青團進來了，第一時間點讚，可是發現沒人點讚很奇怪，看了視頻後果斷取消點讚!勿忘國恥!,,,,,,,,
7,我们没有资格替他们原谅任何人,,,,,,,,
7,看到我的空间动态全是些自拍照和双十二，我就知道他们一定把国耻忘了，但我不会忘。铭记历史，振兴中华。,,,,,,,,
7,老有人说现在日本无罪，你先让他们先把那破厕所拆了,,,,,,,,
7,有没有人发现今天共青团的头像是灰色的。。。。,,,,,,,,
7,我知道，我呼吸的每一口空气，都是他们未曾呼吸到的。我也知道，我享受的任何一切安宁，都是他们未曾体验过的。但凡是有任何一天，我存在的日子，他们就一定有人在铭记着，先辈们，悼念你们，也同时谢谢你们，面对死亡的恐惧，你们依然选择了保卫家园，为我们打下了这片天下，造就了这片盛世，捍卫了我大中华的尊严，此时此刻，愿你们沉眠之安宁，你们的子孙，尽管有些人走歪了，但，一切都好。,,,,,,,,
7,团团的头像都变灰了...,,,,,,,,
7,1213，在南京这么多年，很难忘记的日子，去过纪念馆，很难受。愿逝者安息，和平长存，世间少点战乱,,,,,,,,
17,勿忘国耻！（头像已变灰）,,,,,,,,
10,在下，今年大一，是一名日语专业的学生学习日语，因为一些兴趣使然，所以去学习但是我永远不会忘记自己来自哪里我的根来自哪里以及那些历史的满目疮痍我是中国人，我是中国公民，我是一名共青团员，我诚挚的，永远的，热爱这个国家的一点一滴即使我学习日语，唱日语歌，看动漫，混二次圈但只要祖国需要我，我必和祖国一心同体历史不会饶恕罪恶，无论是谁，都无法饶恕，也永远的不会饶恕但新时代的我们，将会竭尽所能的用自己学习的知识，去守护，去贡献给当今的和平斯人长已矣，吾辈当自强我，永远永远热爱种花家1937.12.13——2019.12.13，永悼国殇勿忘国耻，砥砺前行🇨🇳,,,,,,,,
6,作为一个南京人，和一个外地朋友聊天，谈到我是南京来的，他当时脱口而出南京大屠杀。我不知道当时是什么心情，有一种“原来还有人记得”的欣慰，也有“可是它也是六朝古都是梧桐树是曾经的首都”的不甘。然后我说是啊，每年都会拉警报呢，他很诧异的说啊？不是都过去几十年了吗？这时我突然发现，原来因为我是南京人，我们每年公祭日有警报有默哀，我们有纪念馆，我就以为中国人都会知道都会重视。南京我一个南京人心里永远的意难平,,,,,,,,
6,吴青峰的歌,,,,,,,,
6,2019年12月13日更新公祭日吊李白还将进酒 君不见，强汉大刀华夏见，封狼居胥扫匈奴。尽不闻，盛唐横刀立战马，白江沧海传剑魂。 子不见，仁宋斩刀造英雄，直捣黄龙续辉煌。 皆不闻，大明长刀王者归，青出于蓝海波平。 今人通晓武士刀，殊不知，东吴名刀天皇叹！ 人道是，旧日邦格之现世神，教百姓侍道以奉君。 然并罔，令万民自绝赴皇命，求美父胯下以苟和。 其面皮之厚，而下限之低，纵观天下帝王未寻得能出其右者， 有史以来古书云： 秦始徐福占蓬莱，东汉敕令邪马台。 盛唐白江征扶桑，宋逝神风悯东瀛。中华崛起震日本，大明万历荡倭臣。 偷虐成疾惘国运，空爆犁地零冤魂。 极东四岛本谁居，毛人虾夷无大和。 只惜时年君哭晁卿衡，还看今朝谁人跪江宁？ 冠军侯，太白仙，将进酒，杯莫停。 与国诗一篇，愿国为民写信仰。 横刀纵剑侠骨心，神州皇曌君圣临。 风林火山阴雷变，天人合一启苍明。 忠孝仁义礼智信，临兵斗者列前行。 华夏君王死社稷，星汉天子御国门。 修身齐家治国平天下，升格封神创世造万物。 工农兵策，商学济艺，道法神圣，诸子百家。 是以，我辈何以奉家国？ 知行合一，不负初心。 为民族立信，为国家立威。 为英雄传奇迹，为忠魂书不朽。 汗血马，明光甲，一骑绝尘携美酒，与天同销万古愁。 凡无知者必自大，而无耻者故自卑。 自大狂知耻然后勇，自卑奴恬而不知耻。 天生你材必有用，千言散尽还复来。 赤子无悔终化龙，丹心亦非促织存。来世宁为狂龙啸，此生岂做奴虫鸣。自始，明月归故里照天下，还至，五星出东方利中国。 ————————————二零一七年十二月十三日 书,,,,,,,,
6,我也不知道随着时间的变化，这份恨最终会变成什么样子，越来越多的人谈理性，谈道歉，谈承认罪行，到时候你们可以原谅，后人可以原谅，可是我原谅不了。我姥爷三岁的时候父母就被日本人杀害了，一个人活了一辈子没见到过父母，没感受过家庭的温暖，在那个年代一个人最卑微的活着，一个人的一生就这么被毁了被破坏了，然后现在和我说道歉说原谅，道歉能让我的姥爷人生重来吗？道歉能让我的姥爷死前的遗憾消失吗？历史可以向前走但是人就这么没了，就是我姥爷生前也不会接受道歉更别说已经逝去的人。我是不能原谅，不为了别的，为了真心对我好的那个老人，为了很少看见笑容的姥爷。,,,,,,,,
6,今天是一个南京大学生在外地的第一个大屠杀纪念日，当十点到来的时候，我在路边驻足静立默哀，然而，路过的同学并没有停下脚步，反而诧异地看着我。看了高中同学发的视频，南京的防空警报还是一如既往，新街口的鸣笛依旧响彻天空。而在异乡，这好像只不过是普通的一天。我的室友告诉我，他们知道南京大屠杀，但是从来不哀悼，他们每年只听过九一八的防空警报。说实话，不拉防空警报我可以理解，但是能否占用你们一分钟的时间，为这三十多万的死难同胞默哀呢？我希望这个日子不要成为南京人的日子，三十万同胞的灵魂不应只停留在南京人的血液中，他们应该流淌着全国人民的血液里。,,,,,,,,
6,http://www.cngongji.cn/m/如果大家有时间，希望大家去公祭网敲敲钟，献上花圈，点上一支蜡烛。今天，三十万南京人要回家！转,,,,,,,,
17,身为南京人，身为中国人，明天要做的，是等他们回家,,,,,,,,
5,这个视频不会有点赞,,,,,,,,
5,侵华日军在中国所犯下的残暴罪行可不止南京大屠 杀一件。以下我就列举几个我知道的：旅顺大屠 杀（公元1895年）雾社大屠 杀（公元1930年）上海一.二八大屠 杀（公元1932年）平顶山大屠 杀（公元1932年）新宾大屠 杀（公元1932年）西宝屯大屠 杀（公元1932年）榆城大屠 杀（公元1933年）临江大屠 杀（公元1933年）依兰大屠 杀（公元1934年）老黑沟大屠 杀（公元1935年）天津大轰炸（公元1937年）金山卫大屠杀（公元1937年）上海大轰炸（公元1937年）罗径大屠 杀（公元1937年）阳高大屠 杀（公元1937年）苏州大屠 杀（公元1937年）南京大轰炸（公元1937年）南京大屠 杀（公元1937年）武汉大轰炸（公元1938年）重庆大轰炸（公元1938年）成都大轰炸（公元1938年）延安大轰炸（公元1938年）兰州大轰炸（公元1939年）潘家峪大屠 杀（公元1941年）上饶细菌战（公元1942年）厂窖大屠 杀（公元1943年）桂林七星岩大屠 杀（公元1944年）忘记，等于背叛！,,,,,,,,
5,日本是懦夫，不敢承认的懦夫，看不起你们,,,,,,,,
5,"我是12月13日出生的，从我懂事起，我父母就和我说，以后的生日挪一天过，因为生日那天要祭拜先人。小时候不知道南京大屠杀，现在才明白这是一件多么惨痛的事。我今天最不希望别人和我说“生日快乐”。<img alt=""[大哭]"" class=""small"" src=""//i0.hdslb.com/bfs/emote/2caafee2e5db4db72104650d87810cc2c123fc86.png@100w_100h.webp""/>",,,,,,,,
5,明天 或许我有幸会成为一名历史教师 但无论成功与否 将来我一定会传授给我的学生 正确的三观 当然 包括看待这82年前悲惨事件的态度 历史不仅让我们铭记过去 更是为了让我们更好地书写外来 钟声在耳边回荡 加油 我们中华民族命由吾辈 运载后人。,,,,,,,,
5,屑站连这个都限流？？？快1天了570W的共青团才30W播放？？？？真是屑站,,,,,,,,
5,日本人喜欢三国文化，但毫无关云长的“略读书，晓春秋大义”的精神。事实上，他们学再多的中国文化，也根本不懂什么叫寡廉鲜耻，是非大义。我也不觉得今天的日本能彻底消化西方的价值观，对我们来说，国家虽大，忘战必危。,,,,,,,,
5,不是为了煽动，不是为了报复，而是告诫你我，不自强，还会有美国鬼子，英国鬼子。。。,,,,,,,,
5,南京大屠杀是日寇侵华的罪恶典型，还有旅顺大屠杀，重庆轰炸大惨案，1942晋察冀大扫荡等。罄竹难书的丑恶使得大量无辜先辈因此身死，尤其令人难忘的是婴儿和胎儿的惨死。,,,,,,,,
5,团团头像变灰了，逝者安息，牢记历史,,,,,,,,
5,振兴中华，勿忘国耻。,,,,,,,,
5,如何让现在的日本人清楚知道我们是多么沉痛？如何让他们明白历史不能被忘记？希望在日本也能有这样的南京公祭日活动。,,,,,,,,
5,牢记历史，痛苦使我们伟大！,,,,,,,,
5,从知道南京大屠杀这个事件过后 就再也不敢看关于南京大屠杀的视频了 因为害怕 心里慌的很 但我永远会记着这个5个字和里面的含义 30万,,,,,,,,
5,同学们，大家起来，担负起天下的兴亡！听吧，满耳是大众的嗟伤！看吧，一年年国土的沦丧！我们是要选择“战”还是“降”？我们要做主人去拼死在疆场，我们不愿做奴隶而青云直上！我们今天是桃李芬芳，明天是社会的栋梁；我们今天弦歌在一堂，明天要掀起民族自救的巨浪！巨浪，巨浪，不断地增长！同学们！同学们！快拿出力量，担负起天下的兴亡！巨浪，巨浪，不断地增长！同学们！同学们！快拿出力量，担负起天下的兴亡！,,,,,,,,
7,有人说，中国的南京大屠杀是悲剧。那在日本爆炸的原子弹又何尝不是悲剧呢？首先，日本对于南京大屠杀从来没有做过正面回应，而且历史教材上对日军的侵华行为呈不表述态度，力图从虚无史观角度阐述与曲解历史。其次，二战时期的日本全国上下充斥着军国主义思想，几乎是全民皆兵的状态，每个人是日本罪行的帮凶，时至今日还有相当一大部分日本人愿意相信，南京大屠杀是假的。而且最最重要的一点是，有一个美国专门研究南京大屠杀的中国小姐姐，在日本右翼势力的逼迫下自杀！这是何等的荒谬！而且经常有一些别有用心的人在今天提到日本的原子弹，为日本洗地！那我今天就告诉你们，即使日本的原子弹是一场悲剧，这也不妨碍我为此感到开心！！！,,,,,,,,
7,长存的是历史，更是和平与正义，是血液里流动的对同胞的爱、对家国的爱,,,,,,,,
6,今天是南京大屠杀同胞纪念日，说实话，我并不讨厌日本人，但是我讨厌的是日本侵略者和日本右翼分子。逝者安息。,,,,,,,,
6,"感谢曾经为祖国奋斗的前辈感谢带领人民慢慢走向富裕的共产党感谢哔哩哔哩让我认识了很多让人内心温暖的人与事<img alt=""[一人之下_打call]"" src=""//i0.hdslb.com/bfs/emote/7f979ab31d61e09acb3da46b52c52376e1131abe.png@100w_100h.webp""/><img alt=""[一人之下_打call]"" src=""//i0.hdslb.com/bfs/emote/7f979ab31d61e09acb3da46b52c52376e1131abe.png@100w_100h.webp""/><img alt=""[一人之下_打call]"" src=""//i0.hdslb.com/bfs/emote/7f979ab31d61e09acb3da46b52c52376e1131abe.png@100w_100h.webp""/>",,,,,,,,
4,日本就是想拖到老人们都离世，让这件事大事化小，小事化了，我们必须对日极限施压,,,,,,,,
4,"巍巍金陵,滔滔大江,鍾山花雨,千秋芬芳。一九三七,禍從天降,一二一三,古城淪喪。侵華倭寇,擄掠燒殺,屍橫遍野,血染長江。三十餘萬,生靈塗炭,煉獄六週,哀哉國殤。舉世震驚,九州同悼,雪松紀年,寒梅怒放。亙古浩劫,文明罹難,百年悲嘆,警鐘鳴響。積貧積弱,山河蒙羞,內憂外患,國破家亡。民族覺醒,獨立解放,改革振興,國運日昌。前事不忘,後事之師,殷憂啟聖,多難興邦。八十二載,青史昭彰,生生不息,山高水長。二零一九,國家公祭,中外人士,齊聚廣場。白花致哀,莊嚴肅穆,丹忱書寫,和平詩章。大道之行,天下爲公,大德曰生,和氣致祥。和平發展,時代主題,民族復興,世代夢想。龍盤虎踞,彝訓鼎銘,繼往開來,永誌不忘。",,,,,,,,
4,b站整个主页都是黑白色的，果然我没看错小破站,,,,,,,,
4,今天的南京城一定很挤，因为今天会有30万同胞回家,,,,,,,,
4,英语课上到一半，眼看十点就要到来，教室里电子钟跳转到那一刻，所有人都安静了。老师提出的问题没有人思考，没有人回答，手中的笔全部放下，55人清一色地起立低头默哀。当时只能听得见窗外的警报，同桌的脸都看不见，因为大家的视线垂直于桌面，或者是，这一分钟里闭上了眼。回望历史，八十又二年，作为一个南京人，即使没有经历这段，仍应缅怀我们的祖先，我迈着坚定的步伐，沉痛在历史积淀，却不忘初心，踏步向前。——南京市第十三中学学子,,,,,,,,
4,"我的太姥爷是红军，1938年赴晋察冀地区参加游击战，2008年太姥爷去世，借我一句我太姥爷的话：谁敢杀我乡亲父老，我必要他十倍偿还。太姥爷生前每提起日本人，眼中都像有一把刀要冒出来。作为晚生，不敢忘记国恨家仇，我也不会替逝去的人原谅他们<img alt=""[生气]"" class=""small"" src=""//i0.hdslb.com/bfs/emote/3195714219c4b582a4fb02033dd1519913d0246d.png@100w_100h.webp""/><img alt=""[生气]"" class=""small"" src=""//i0.hdslb.com/bfs/emote/3195714219c4b582a4fb02033dd1519913d0246d.png@100w_100h.webp""/><img alt=""[生气]"" class=""small"" src=""//i0.hdslb.com/bfs/emote/3195714219c4b582a4fb02033dd1519913d0246d.png@100w_100h.webp""/>",,,,,,,,
4,保罗·蒂贝茨，1915年生，美国空军飞行员。1943年3月，正在美国航空兵团服役期间的蒂贝茨突然接到了一个秘密通知，由于他的飞行计划过硬，波音公司让他负责刚研制成功的B-29轰炸机试飞工作。1945年8月5日凌晨2点，蒂贝茨驾着以他母亲名字“埃诺拉·盖伊”命名、序号为82的B－29轰炸机携带“小男孩”原子弹，向日本广岛飞去。这是一次悲壮征途，如果没有完成任务或被日军俘虏，蒂贝茨将立即吞毒自杀。后面的事，大家都了解了，原子弹投掷成功了！2005年，这是二战胜利60周年，蒂贝茨对美国三大广播网的记者们说：“如果需要，我还会再干一次。我也有感情，但我绝不后悔！”“使用原子弹是历史的一个必然。如果当时盟军以登陆日本本土的方式结束二战，那么我们中的很多人都活不到今天。很多日本人主观地认为我会为轰炸广岛而感到内疚、良心备受谴责。但事实上，我为什么要感到内疚呢！我亲眼看过有关中国南京大屠杀的纪录片，看到过日本士兵用刺刀把胎儿从中国孕妇的肚子里挑出来的场景。这样的暴行，并不比我向他们扔原子弹仁慈多少。日本人只强调他们遭到原子弹轰炸，却没有想过发生这一事件的原因。”事实上，蒂贝茨并没有后悔自己当初的举动，而且每晚都睡得很香。,,,,,,,,
4,我能做只是缅怀先人，毕竟和平不易。,,,,,,,,
4,妈的，还有人脸皮厚的把代表被杀害的平民的石子来打水漂，还在嬉皮笑脸没有人制止，小孩子不懂事就算了，大人还在旁边笑呢。,,,,,,,,
4,小孩子都不放过真的畜生,,,,,,,,
4,"勿忘国耻，爱我中华，这真不是说说的口号。我95后，从小的教育就是爱国爱党爱人民，国家太难了，党太难了，人民太难了，不努力怎么对得起前辈先烈的热血和赤忱。最佩服那个时代最可爱的人，在看不到未来的黑暗里互助前行，就为了给国家和党和人民能留一份净土，就为了实现大多数人想要却做不到的蓝图奋斗着，就为了对得起自己内心的那一番宏图抱负，就为了自己的死能换来更多人的活。每年的阅兵仪式，每年看的时候都会哭好多回，我爱人每回都会安慰我，这么多年，我们国家党和人民都在努力，我们越来越强大，无数先烈前辈可以放心了。我们吃了多少苦，我们付出了如此大的代价才能换回现在的安定团结，真心要好好努力，不能辜负这么多最可爱的人的期冀。百年之后，中国可好？山河犹在，国泰民安。此生无悔入华夏，来生愿在中华家。<img alt=""[支持]"" class=""small"" src=""//i0.hdslb.com/bfs/emote/3c210366a5585706c09d4c686a9d942b39feeb50.png@100w_100h.webp""/><img alt=""[支持]"" class=""small"" src=""//i0.hdslb.com/bfs/emote/3c210366a5585706c09d4c686a9d942b39feeb50.png@100w_100h.webp""/><img alt=""[支持]"" class=""small"" src=""//i0.hdslb.com/bfs/emote/3c210366a5585706c09d4c686a9d942b39feeb50.png@100w_100h.webp""/><img alt=""[支持]"" class=""small"" src=""//i0.hdslb.com/bfs/emote/3c210366a5585706c09d4c686a9d942b39feeb50.png@100w_100h.webp""/><img alt=""[支持]"" class=""small"" src=""//i0.hdslb.com/bfs/emote/3c210366a5585706c09d4c686a9d942b39feeb50.png@100w_100h.webp""/>",,,,,,,,
4,http://www.cngongji.cn/m/    如果大家有时间，希望大家去公祭网敲敲钟，献上花圈，点上一支蜡烛。今天，三十万南京人要回家！ 转!,,,,,,,,
4,对于日本右翼，军国主义分子，我只想说:去shi吧！对于当代日本人，我有以下三点要求:一、正视历史，了解真相；二、在国家民族层面，对当时的受害者怀有愧疚之情；三、以史为鉴，珍爱和平，谨防军国主义死灰复燃，让历史悲剧不再重演！,,,,,,,,
4,团团的头像灰了,,,,,,,,
4,啊，团团头像...,,,,,,,,
4,勿忘历史！我辈自强！,,,,,,,,
4,原来12.13了。共青团都灰了。日子虽然记得，但真到了这天差点没想起来。。多谢共青提醒。。,,,,,,,,
4,这几天正在重温张玉安参加的综艺 在里面mc问日本代表日本的历史是必修吗？答案，不是。说到小学会学之后都是自选，内容正好截止在二战！张玉安：“为什么都是受害者在学历史，加害者却没有！”,,,,,,,,
4,刚刚我打开B站看到唉团团的头像怎么变黑了刚想在上一个视频里问，看到这突然明白了【我没找到什么能表达我感情的表情】历史不会遗忘当年的南京当年苦难的中国，中国人民是不可战胜的!!!,,,,,,,,
4,现在是2019年12月13日凌晨1点01，我登入b站看见的是那一片黑白底色，看见了公祭日三字，心也跟着颤了,,,,,,,,
4,各位到國家公祭網敲一下鐘吧http://www.cngongji.cn,,,,,,,,
4,日本帝国主义迫害了中国人民和日本人民，建议去看一下《紫日》，有很深刻的描述。,,,,,,,,
4,此时此刻，一切都仿佛已经停止~静静地~眼角边不禁流下了............,,,,,,,,
4,看不了这种视频，眼里进砖头，明明也不是啥感性的人，就是看不得亲情，国家这种类型的东西,,,,,,,,
8,雪崩之下没有一片雪花是无辜的但到底哪片雪花罪责最大要分得清楚,,,,,,,,
8,我们今天没有必要去为他们昔日的暴行去吵闹着像是什么“报仇”“日本人都该死”的话现今我们都追求和平，但起码提起这段历史时，我们应该回想起我们所遭受过的摧残与侮辱勿忘国耻，将昔日的挫败作为今日的动力，用实力与功绩向他们证明我们已不再是从前那个任人宰割的国家，才是我们应该做的,,,,,,,,
11,不忘国耻！,,,,,,,,
5,铭记历史，强国强军，维护和平，和平必将永存！,,,,,,,,
12,抗战82年！,,,,,,,,
3,今年83年了！不敢忘，不能忘，不会忘！,,,,,,,,
3,BGM:吴青峰《跟着你到天边》,,,,,,,,
3,对了，什么时候登陆日本啊？？？,,,,,,,,
3,看了这么多视频，唯独这一个视频没有一个赞，人们保持绝对的统一，为了向逝去的族人哀悼,,,,,,,,
3,大家太团结了吧，没有一个赞，中国加油,,,,,,,,
3,团团今天的头像是灰色的……为南京大屠杀死去的同胞们默哀……,,,,,,,,
3,团团的头像变成黑白了,,,,,,,,
3,南京保卫战卫戍司令唐生智负首要责任 南京保卫战打的很惨烈 25名将校级军官阵亡 5万守城部队阵亡 撤退无序 指挥失当 造成三十多万中国军民丧生 但仍对日军造成4000人死亡 8000人伤 ，日军认为自己伤亡过大 开始了大屠杀。。。,,,,,,,,
3,仇可以不报，但耻辱不能忘！,,,,,,,,
3,他们承认都不敢承认，凭什么去原谅，而且我们没资格替先辈们去原谅 。,,,,,,,,
3,中华儿女，无人点赞,,,,,,,,
3,很在意的一件事，我想大家都会投了币然后再取消掉不小心点的赞吧，零点赞不代表视频不够好，只是表明了吾辈自强的态度,,,,,,,,
3,马关耻，犹未雪，南京恨，何时灭？驾长车，踏平天皇宫阙，壮志饥餐倭奴肉，笑谈渴饮东洋血！,,,,,,,,
3,勿忘国耻，荡平倭奴,,,,,,,,
3,12.13是在南京大屠杀基础上设立的国家公祭日，但希望不要再发300000了，当时四万万同胞中牺牲掉的远不止300000，公祭日，该纪念的不该只是300000人，而是所有在国难当头中失去生命的志士仁人与无辜百姓,,,,,,,,
3,我们没有资格替死去的先辈去原谅日本人！至少我不会！,,,,,,,,
3,我们真的没有资格去替先人原谅,,,,,,,,
3,开个楼，罗列一下日本鬼子的暴行，大家接力南京大屠杀济南五三惨案,,,,,,,,
3,"看到团团头像灰了我泪目了<img alt=""[大哭]"" class=""small"" src=""//i0.hdslb.com/bfs/emote/2caafee2e5db4db72104650d87810cc2c123fc86.png@100w_100h.webp""/>",,,,,,,,
3,"我奶奶在的时候也是幸存者，现在名字被刻在了纪念馆的碑上<img alt=""[大哭]"" class=""small"" src=""//i0.hdslb.com/bfs/emote/2caafee2e5db4db72104650d87810cc2c123fc86.png@100w_100h.webp""/>",,,,,,,,
3,然而我们现在的国人对日本的好感度百分之四十以上，还是一个不愿承认南京大屠杀的日本。,,,,,,,,
3,"这么可爱的人，怎么会忍心杀了啊，还杀人比赛游戏，30万啊！！你以为比纳粹要好吗？比纳粹法西斯都要可怕啊，只不过我们可以写那段屠杀的人，都屠杀死了，证据都很少了<img alt=""[大哭]"" class=""small"" src=""//i0.hdslb.com/bfs/emote/2caafee2e5db4db72104650d87810cc2c123fc86.png@100w_100h.webp""/>，还有细菌战，毒气战，知道美国为什么这么护着日本吗？知道日本为何这么久都不道歉吗？有一部分原因就是那时候日本在中国做的一些人体实验，惨无人道的揭破冰冻等等的资料和美国人共享了，什么美国那么喜欢日本，勿忘国耻，勿忘国耻，中华民族团结一致，中华民族必将复兴，然后日本必须道歉，那几百万的冤魂啊<img alt=""[大哭]"" class=""small"" src=""//i0.hdslb.com/bfs/emote/2caafee2e5db4db72104650d87810cc2c123fc86.png@100w_100h.webp""/>",,,,,,,,
3,只有B站把首页变成了黑色！,,,,,,,,
