链接,标题,播放数量,弹幕数量,发布日期,点赞数量,硬币数量,收藏数量,转发数量,评论数量
1,念君少壮，远镇四方。 念君风度，修身洁行。 念君气概，雅量高志。 念君弘才，筹略安邦。 一寸丹心，赤胆疆场。 志笃意刚，国利至上。 忠义之心，名垂百世。 英灵之气，万代流芳。,,,,,,,,
1,勿忘国耻,,,,,,,,
1,起来不愿做奴隶的人们,,,,,,,,
1,"勿忘国耻牢记历史！！！<img alt=""[滑稽]"" class=""small"" src=""//i0.hdslb.com/bfs/emote/d15121545a99ac46774f1f4465b895fe2d1411c3.png@100w_100h.webp""/>",,,,,,,,
1,最重要的是要记住！把真实的历史一代代地传下去。日本的做法是不承认，一直不道歉，然后让时间把犯下的罪行抹去，更甚者倒打一耙说是我们编造的企图摸黑它们，因为亲历者已经全部去世了。看看吧，现在国内已经出现了一些年轻人，开始质疑这段历史中一些事件的真实性，为日本鬼子洗白，玷污为国牺牲的先烈。就像被洗脑的废青一样。所以一定要勿忘国耻，做好教育传承，忘记历史等于背叛。还有，🙏别在拍那些抗日神剧了，请多拍一些正剧，不然以后真的会被倒打一耙把真实历史说成是我们为了拍电视乱编造的。,,,,,,,,
1,这些娃娃，不抓紧学习，搞什么形势主义，3分钟又能看两页书。,,,,,,,,
1,愿那些同胞们，又可以找到回家的路!_____南京,,,,,,,,
1,我们展颜待客看似早已放下，其实我们一直记着！,,,,,,,,
1,我们菏泽今天啥都没有,,,,,,,,
1,没有点赞只有投币吗？,,,,,,,,
1,勿忘国耻！！,,,,,,,,
1,勿忘国耻，珍惜和平。（12.13）,,,,,,,,
1,勿忘国耻,,,,,,,,
1,今天上午十点零五分左右，正在上数学试卷的讲评课。当时铃声一响老师立马让我们全体起立默哀。一分钟内听着鸣笛和防空洞的警报，想了很多，感触挺大的。一想到几十年前我们脚下的都是死尸就觉得难受。南京人不恨日本人，真的。我们恨的是那段黑暗的历史和当时毫无人性的日本军官。我们老师也常和我们说，我们铭记这段历史不是为了活在埋怨和仇恨当中，而是让我们珍惜当下的日子，为了不让历史重现。就像每一本教材上印刷的，努力学习，回报祖国。,,,,,,,,
1,不知道日本罪行的可以看看鬼子来了，比抗日神剧好多了,,,,,,,,
1,巍巍金陵滔滔大江钟山花雨千秋芬芳一九三七祸从天降一二一三古城沦丧侵华倭寇掳掠烧杀尸横遍野血染长江三十余万生灵涂炭炼狱六周哀哉国殇举世震惊九州同悼雪松纪年寒梅怒放亘古浩劫文明罹难百年悲叹警钟鸣响积贫积弱山河蒙羞内忧外患国破家亡民族觉醒独立解放改革振兴国运日昌前事不忘后事之师殷忧启圣多难兴邦八十二载青史昭彰生生不息山高水长,,,,,,,,
1,我们没有资格！替先人去原谅！,,,,,,,,
1,勿忘国耻，祝愿伟大祖国繁荣昌盛,,,,,,,,
1,好像30万冤魂在低吟，突然想哭。,,,,,,,,
1,82年前的今天，我们永远也不会忘却那敌人凶狠的刺刀；永远不会忘却那生灵涂炭的土地；永远不会忘却那30万亡灵的凄楚与悲剧!今天，站在每一寸国土上的我们，勿忘国耻，振兴中华，铭记历史，砥砺奋进！,,,,,,,,
1,每到每年的警铃想起 各大平台就会出现一群圣母 总而言之  理智看待  和平相处 现在是和平时代 不是让你敲键盘 复制粘贴那些无脑评论  只有歪人才觉得对,,,,,,,,
1,看完后刚才下意识点了赞，看评论看到了一条评论又取消了，愿世人勿忘国耻 日本现在混出中国了希望逝者安息吧,,,,,,,,
1,永世不忘,,,,,,,,
1,勿忘国殇 吾当自强,,,,,,,,
1,南京人民从首页点进来……今天默哀的时候听到窗外车鸣笛的时候真的感动,,,,,,,,
1,如果有机会可以去南京大屠杀纪念馆 一定要去，静下心来好好读读看看馆里的每一张图片 每一行文字还有每一位幸存者的采访    那种难以言表的痛苦和难过 会让你真正认识到什么叫铭记历史，勿忘国耻,,,,,,,,
1,钟声响起归家的讯号,,,,,,,,
1,日本人不在乎中国人谴责他们参拜靖国神社，但会忌惮我们为遇难同胞的默哀！,,,,,,,,
1,勿忘国耻！,,,,,,,,
1,我就纳闷了点赞咋了？？？攒多了会上首页让更多人看到这个视频他不香？？？？,,,,,,,,
1,前事不忘后事之师！,,,,,,,,
1,突然有种想哭的感觉。。。不过，其他人在默哀，拍照的在干嘛(゜ロ゜),,,,,,,,
1,"<img class=""jump-img"" src=""https://i0.hdslb.com/bfs/activity-plat/static/20201110/4c8b2dbaded282e67c9a31daa4297c3c/AeQJlYP7e.png""/><a class=""comment-jump-url"" data-report=""3"" href=""//www.bilibili.com/video/av79116966"" target=""_blank"">今天的共青团们，无人点赞。</a>，这盛世，如您所愿。",,,,,,,,
1,作为南京人 ，铭记历史,,,,,,,,
1,三十万。,,,,,,,,
1,明都遭炬旧骸留今倭奴虽退勿忘东贼 ,,,,,,,,
1,铭记历史,,,,,,,,
1,"评论不用看就知道肯定有撕b<img alt=""[微笑]"" class=""small"" src=""//i0.hdslb.com/bfs/emote/685612eadc33f6bc233776c6241813385844f182.png@100w_100h.webp""/>",,,,,,,,
1,不忘国耻,,,,,,,,
1,勿忘国耻,,,,,,,,
1,勿忘国耻,,,,,,,,
1,百万国军英魂也该回家了,,,,,,,,
1,我也顺手点赞  又取消了,,,,,,,,
1,我在睡觉……我忏悔……我对不起先辈……,,,,,,,,
1,别让历史重演,,,,,,,,
1,铭记历史，勿忘国耻！振兴中华，吾辈自强！,,,,,,,,
1,我们需要的是发展，世界太大了，何必争一时痛快呢。,,,,,,,,
1,一寸山河一寸血！十万青年十万军！,,,,,,,,
1,每年5.3济南也有防空警报,,,,,,,,
1,你们可能不信，我今天听到这个声音就哭了，真的历史就像是电影一样在脑海里过了一遍,,,,,,,,
1,不知道在南京的日本人感觉怎么样,,,,,,,,
1,泪目,,,,,,,,
1,918的东北也这样,,,,,,,,
1,国仇家恨永世不忘,,,,,,,,
6,我们恨的不是日本人，而是日本鬼子,,,,,,,,
5,"我不明白为什么有那么多人在宣扬着仇恨，杀戮，种族主义这种负面的情绪，不是所有的日本人都该杀，就像不是所有的中国人都爱国一样，因为一部分而全盘否定，那是不客观的，毛主席说过，中国人民与日本人民的敌人是日本军国主义，而不是指全体日本人，况且抗战里是有日本友人反省过来而加入八路军的，为什么要灭绝全体呢？这是在磨灭那些日本友人的功绩吗，日本人民是我们的朋友，日本军国主义才是我们的敌人！国耻教会我们的是落后就要挨罚！振兴中华才是我们这些后辈需要做的事！而不是拿着代表那些死去的人的名义而去干那些死去的人厌恶的事情，搞种族主义复仇主义我们与纳粹和军国主义又有什么区别？有感而发，可以理解，恶意利用民族情感宣泄仇恨，罪无可恕！那把死去的人当成了什么？搞种族主义的借口吗！？我们要认清谁是我们的朋友，谁又是我们该消灭的！而不是一棒子打死！最后，向十二年抗战以来逝去的同胞表示默哀。。<img alt=""[2233娘_大哭]"" src=""//i0.hdslb.com/bfs/emote/476a2a60f6e337b8c0697a592e0aa82781f6b33b.png@100w_100h.webp""/>",,,,,,,,
3,必须血债血偿！,,,,,,,,
3,你们也没有资格用以前的事去恨现在的日本人,,,,,,,,
2,"作为一个中国人,不可以也不应该在此事上原谅日本 但也不要每次日本发生灾害时幸灾乐祸,我们要构建人类命运共同体,要恨的是顽固不化的军国主义者,对于持正确意见的部分日本网民要宽容对待 (靖国神社倒了我也会十分高兴,日本发生灾难时我不愿哭,因为我是中国人,而那是日本;但我更不愿笑,因为我是个人)",,,,,,,,
2,"拍视频的人是怎么做到边默哀边拍视频的<img alt=""[喜极而泣]"" class=""small"" src=""//i0.hdslb.com/bfs/emote/485a7e0c01c2d70707daae53bee4a9e2e31ef1ed.png@100w_100h.webp""/>",,,,,,,,
2,请大家理智仇日不仇日的，你家里人活该被遇上日本鬼子,,,,,,,,
2,"奇了怪了，这种视频下面也能一堆理中客？服了，就宣泄宣泄情绪，不会真有人以为中国不会和日本合作要灭了日本吧？日本人自己都不知道你们这么为他们操心，也不枉费日本每年在搞宣传上花的钱了<img alt=""[偷笑]"" class=""small"" src=""//i0.hdslb.com/bfs/emote/6c49d226e76c42cd8002abc47b3112bc5a92f66a.png@100w_100h.webp""/>",,,,,,,,
2,以和为贵 就是扯淡 中和就不是中华文化 自秦始皇攻灭六国 汉武帝战略西进 北击匈奴 唐太宗 灭东突厥 高昌 龟兹 打高丽 真正的中华文化是 务实主义 和 尚武精神 不要妄想和日本和  愚昧无知的人才会这么想 日本现在人家讲的是再崛起 亲中 是给中国放烟雾弹 永远不要想跟日本谈和,,,,,,,,
2,的确，每人都有应该考量的问题。不怨恨当今的日本是一回事，勿忘曾经的日本又是一回事。如果有聊得来的日本朋友来家里做客，我自然会让他们感受一下地主之谊，以德服人。可如果有人说现在的日本人与这件事无关，那我说句不好听的话，这人是亚索吧？无论如何，战争的发起方都一定是想要掠夺想要抢占的。而人民就是其战争的基础。如果人民不支持你这样做，国家能这样做吗？只能说。当今的日本人民没有过错。但他们的祖先都有过错。他们不应该为自己道歉。而是应该为自己的先祖道歉。况且我认为，缅怀，的确是个噱头。让人们保留心中的仇恨?但谁知道不会有好事者把这仇恨化为现实?理性的认识历史，和缅怀逝去的人。别不分青红皂白的瞎缅怀，瞎激动。有这份冲动还不如去做点有意义的事情，让国家更上一层楼。所以理性面对已成事实的历史，用激情面对还未曾成为事实的理想。,,,,,,,,
2,我们没有权利替先人原谅日本反过来讲，先人也没有权利让我们仇恨日本 借用北京大学国际关系学院潘维教授的观点，“以爱家乡为基础的高尚情感，层层扩展，扩展到热爱国家疆界内的社会共同体，就是爱国主义。爱国主义一旦混入对他国社会共同体的歧视，同意为本国利益牺牲他国利益，就成为民族主义。因此，爱国主义是内向的、防御性的。民族主义是外向的、进攻性的“,,,,,,,,
2,上次去南京，好好走着脚突然就痛，在医院住了三个月。我想是逝者的不甘吧，愿各位永远被世界温柔以待。,,,,,,,,
2,傻比小日本!!!!!!!!!!!!!!!!!!!,,,,,,,,
2,勿忘国耻！理智爱国！那些恨不得把日本人杀光的“愤青”们。你们可以卸载b站了，毕竟这里边这么多的日漫是吧？,,,,,,,,
2,日本这个国家，从骨子里就是让人恶心的，他们侵略的野心不会停止，你别看那些日本人表面上装作对你友好，暗地里恨不得杀了你。日本的自卫队一年一年的在扩军，日本的准航母一艘一艘的下水，这些东西只是拿来自卫？现在日本本土正在向巴里亚拿大海沟漂浮沉没。你能保证它在未来三十年内不会和中国开战？这个国家的人民。和这个国家的政府不值得被中国人原谅。日本人的野心不会停止做为中国人的我们要君安思危啊。,,,,,,,,
2,·那些做过违背人理的事情的，对人民造成巨大灾难的死不足惜。无论是中国还是其他国家，生命都需要人们去尊重，但是玷污了的大可去唾弃。·决定一件事情往往由当事人来判断最佳。·勿忘国耻，但是后面别忘了，还有振兴中华。类似的一句还有不忘初心，砥砺前行。光是仇恨又有什么用呢？你一句仇恨能使对方说：“对不起，我们错了，我们现在就拆了靖国神社，立马跪下道歉，教科书立马换新的，我们会正式历史”这些话吗？我们要做的，只有不断向前努力，不断发展 ，只有发展，才能让自己变得更强，才能让别国知道我们中国的厉害，才能不像清朝那样被帝国主义蹂躏，践踏。人心难测好吗？所有国家都是为了本国的利益而行动的，寻求利益最大化。......反正，不管如何，中国只要一步步脚踏实地的向前走就对了，铭记历史，勇敢向前。当然，你们要在这键盘我无所谓，我没权利限制你们的发言权。,,,,,,,,
2,勿忘国耻是告诉我们落后就要挨打，带着你现代人该有的眼光看待社会，拿起手机你是义勇军，丢下手机你是男女叼丝，见过砸日系车的没见过砸日本大使馆的，国恨家仇不能忘，但是请不要只做个颓废的键盘侠,,,,,,,,
2,理论也是有极限的，与其在这里争辩，倒不如去拓展理论以外的东西吧，权限，信服力，信仰度，金钱，个人魅力，学识，地位，让自己的道路不再只是单一的一条。最后，世界没你想的那么简单，但也没那么复杂。,,,,,,,,
2,如果，我是说如果，我们中国在日本也爆发了一场屠杀，也杀了三十多万人，也是和我国南京那些无辜的人，你觉得那些无辜的人是该死的吗？如果你这么觉得也可以，因为日本当时军阀也是这么想的，那些人的生死于我们无关，杀了就行。你不觉得着种恩怨永远无法化解的吗？难道中国也要成为类似于法西日本那样的存在吗，在几十年后日本教课书里也是记录了那场屠杀，之后日本再来中国破坏，一直重复，这，真的好吗？我并不是原谅日本犯下的过错，反而十分痛恨，因为我家族谱上有个老人死于日本人手中，我也十分讨厌那些日本人，恨不得杀了他们，可是呢？那些无辜的人真的该死吗？犯下过错的是那些支持法西的人和政府那些人，他们该死，可是那些刚出生的孩子，还没有看到世界的孩子，我们就能忍下心来将其杀害吗？反正我是不能，他们没有错，凭什么剥夺了他们生活下去的权利，你这样很自私。当初日本的那些人也是如此这种事情很难以德报怨我知道，我也没有任何资格原谅他们，我能做的只是让大家理智一些，不要盲目认为日本人都该死，该死的只是那些犯了错的人，如果大家真的想报仇，可以让日本的青少年认识到自己国家的错误，从而影响一代又一代的人，让他们后来的人替先人做一个沉重的道歉，缅怀我们的受害同胞，这难道不行吗？,,,,,,,,
5,我不明白为什么有那么多人在宣扬着仇恨，杀戮，种族主义这种负面的情绪，不是所有的日本人都该杀，就像不是所有的中国人都爱国一样，因为一部分而全盘否定，那是不客观的，毛主席说过，中国人民与日本人民的敌人是日本军国主义，而不是指全体日本人，况且抗战里是有日本友人反省过来而加入八路军的，为什么要灭绝全体呢？这是在磨灭那些日本友人的功绩吗，日本人民是我们的朋友，日本军国主义才是我们的敌人！国耻教会我们的是落后就要挨罚！振兴中华才是我们这些后辈需要做的事！而不是拿着代表那些死去的人的名义而去干那些死去的人厌恶的事情，搞种族主义复仇主义我们与纳粹和军国主义又有什么区别？有感而发，可以理解，恶意利用民族情感宣泄仇恨，罪无可恕！那把死去的人当成了什么？搞种族主义的借口吗！？我们要认清谁是我们的朋友，谁又是我们该消灭的！而不是一棒子打死！最后，向十二年抗战以来逝去的同胞表示默哀。。                                                         转发的,,,,,,,,
5,每年去日本游玩的就属国人最多，这里一大波人刷国耻家仇的，视屏看完了，该吃吃该喝喝，该补番的补番，该买手办的买手办，下次看到类似的视屏在刷一波国耻家仇，几辈子都忘不了，过完嘴瘾舒服了，真要给你一把刀你敢去砍几个日本人祭奠那些为抗日牺牲的英雄？还是说你当过兵？在边防待过？为国家做出贡献（人口除外）?我个人没心没肺，跟各位爱国人士不一样，没那么多仇视心里，我只求父母健康，希望国家强大，我去年工作需要在小樽还碰到几个南京的大学生哈,,,,,,,,
0,中日友好万岁,,,,,,,,
0,我的家在东北松花江上那里有森林煤矿还有那满山遍野的大豆高粱我的家在东北松花江上那里有我的同胞还有那衰老的爹娘九一八 九一八从那个悲惨的时候九一八 九一八从那个悲惨的时候脱离了我的家乡抛弃了那无尽的宝藏流浪 流浪整日价在关内流浪哪年 哪月才能够回到我那可爱的故乡哪年 哪月才能够收回我那无尽的宝藏爹娘啊 爹娘啊什么时候才能欢聚在一堂,,,,,,,,
0,"上海有个叫做吴祖康的老爷子，2000年开始创建一个叫：918爱国网   <img alt=""[爱心]"" class=""small"" src=""//i0.hdslb.com/bfs/emote/ed04066ea7124106d17ffcaf75600700e5442f5c.png@100w_100h.webp""/>的网站，网站收集了目前几乎所有的抗战资料新闻。20年间，老人家一直靠自己的退休金和各界人士的捐赠维护网站，时而还要去慰问抗战老兵，目前网站还一直处于赤字状态。希望有能力的小伙伴对网站进行捐助，2000年开始，每一分捐助的使用情况全部都在网站上透明公开大家可以看一下这个网站，或者复制一下这段话，评论到其他视频下，让更多人知道这个网站复制的",,,,,,,,
0,勿忘国耻,,,,,,,,
