链接,标题,播放数量,弹幕数量,发布日期,点赞数量,硬币数量,收藏数量,转发数量,评论数量
https://www.bilibili.com/video/BV14x411g7ks?from=search&seid=14471170896752309338,【电影不烧口】一部中国人都该看的电影，女孩目睹母亲被数10名日本兵轮番糟蹋,193000.0,346.0,20171015.0,561.0,191.0,1323.0,101.0,300.0
评论点赞数,评论内容,,,,,,,,
1573,"“拍这个电影干嘛，仇日？”发这条弹幕的你确定你说这句话，经过脑子了？！
你说拍这个干嘛？！
你恐怕不是个傻子吧。
日本侵华战争比这个更残忍，现实更恐怖。难道不应该铭记历史吗？！
这是滔天大罪，血海深仇，岂是一睁眼一闭眼就能忘记的。
何况日本还没有道歉，更加不能遗忘历史。
你这种神志不清，胳膊往外拐的人，连日本人都会在心里耻笑！",,,,,,,,
129,今天看到微博上有个文章讲的是一位华裔张纯如小姐为了揭露南京大屠杀四处奔走，并写下书籍向全世界揭露南京大屠杀和日本人的暴行。但是她在36岁的年纪在美国自杀。因为南京大屠杀中日本人的恶性折磨着她的精神，使她患上了抑郁症。,,,,,,,,
72,我补充一下161楼关于731的事吧，大家应该努力把这个视频顶上去，我之前上班的地方留在哈尔滨平房区，并且我也去看过，里边还有好多以前留下来的东西，看的真是毛骨悚然，听我单位的老师傅说当年他才9岁左右中国解放，然后清理的时候骨头用拖拉机往出拉，加上消毒，等等足足忙了一年多，而且最可恨的是当时把那些带鼠疫的老鼠放出来了，平房区所有人几乎都打疫苗，防疫站年年来抓老鼠化验，而且不论男女老少都穿长筒袜，当时带细菌的跳蚤也特别多。,,,,,,,,
1127,论 中国人都该看的电影。和 不转不是中国人有何区别。,,,,,,,,
61,热评那俩，的确都很讨厌标题党，但是up主的推荐确实怀着警醒人们国耻勿忘的心意来的，看过就过了，不是每个时候都适合调侃和表示自己与众不同的,,,,,,,,
64,不管你怎么黑美国，这个国家现在站在实力的颠峰。不管你怎么黑中 国，世界上没一个政府敢说自己能让这十四亿人过得更好。不管你怎么黑日本，你手机的摄像头，你电脑里的电容，你电子设备里，90%有日本部件。战争与政治是把**射进敌人的膛，是把对手扔进监狱，而不是打字，如果你觉得你的祖国不好，你就去建设它，如呆你觉得政府不好，你就去考公务员去做官，如果你觉得人民没素质，就从你开始做一个高素质的公民，如果你觉得同胞愚昧无知，就从你开始学习并改变身边的人，而不是一昧的设骂，抱怨，逃离。横眉冷对千夫指，俯首甘为瑞子牛。_转载网上朋友的一段话。-最后祝祖国生日快乐。,,,,,,,,
90,仇日是错误的，盲目喜欢日本也是错误的，日本也有好的地方，漫画什么的，也有值得我国学习的地方，但是，作为中国人，勿忘国耻，不能遗忘那段被欺辱的历史,,,,,,,,
39,为了有一天能让日本人认罪，我们可以先放下仇恨，哪怕因为强忍愤怒指甲已经扎进肉里鲜血淋漓也保持微笑，从他们那里学习知识，但最终的目的是让自己强大到哪怕不用逼迫都能让他们下跪道歉。这份屈辱和仇恨只是暂时放下，绝对不能被遗忘。,,,,,,,,
28,总有人用元朝和清朝给日本洗白，那我就真得说一句了。扬州三日嘉定三屠是一场野蛮屠杀。南京大屠杀也是屠杀，但时代已经进入现代了，有着一些人类共同遵守的价值观，比如红十字会了 日内 瓦公约什么的。这是再对手无寸铁的平民屠杀就是反 人 类罪了，比如美国队波黑动武就是因为这个。所以南京大屠杀是犯罪,,,,,,,,
31,我们在等日本的道歉，而日本却在等我们忘记。,,,,,,,,
25,就看这标题，我还是去看二十二给阿婆们捐款吧，根本不想给up这种吃人血馒头的东西增加点击率,,,,,,,,
24,有人说这是煽动仇日情绪。呵呵，仇日情绪还需要煽动么？大仇未报，刻骨铭心啊,,,,,,,,
23,我们需要的不只是精神谴责，如果我们没有飞机大炮，日本人管你怎么骂他禽兽，该来欺负你还得来。有些福中人怎么就想不明白，还以为天下人都是好人似的。,,,,,,,,
27,我看不了这些东西，我特别仇恨这些，每次看到恨不得立即杀光他们……我讨厌日本这个民族，也不想说日本人民是姑无辜的，中国人民难道就是有罪的？,,,,,,,,
22,我觉得那些总在这些视频下问出“为什么仇日，人家也有好人啊”“和我们又没关，干嘛这么激烈”这种问题的人，你去看那些他们在中国做过的事，了解你现在生活的土地上当年被侵略的过往，了解躺在你脚底无辜的女人老人幼儿甚至被疱出来还没成形的孩子，把他们当做童话书翻页而不是当成自己老一辈先祖的悲惨的亲人，觉得他们要原谅求公道就是仇视人家整个民族就是有有色眼镜。我，至少我觉得这样是不对的。日本有好人多到愿意主动公开为当年的罪恶道歉吗？那么为什么这里这么多人争着抢着要原谅一个根本不承认罪行的世纪罪犯？好笑╮(￣▽￣)╭。,,,,,,,,
19,"上了高中我才知道为什么小学初中都放抗战片，了解爱国之后我就不抱怨抗战片太多了，相反感觉好的抗战片太少了，以前亮剑红日经常播，现在不是演技尬的爱情片就是以抗战为背景的爱情片…<img alt=""[小电视_无语]"" src=""//i0.hdslb.com/bfs/emote/fbd12affebfdaadd3d721bffdb685a6b1ee71219.png@100w_100h.webp""/>",,,,,,,,
17,65楼是傻。逼吗？大家没必要去翻评论，它说：管我屁事别人骂它他就拉黑，不敢怼别人，说了不对的话不敢承担责任只会拉黑，还一口一个脏话，看来烈士们用生命换来的不单单是和平，还有一些不懂感恩的废物！希望大家可以珍惜这来之不易的和平，不要做那样废物，尽自己能做的让祖国更加强大，让他国畏惧我们，不让历史重演！爱国不是要抛头颅洒热血，也不要做言语上的巨人，更不要一味的仇视日本什么的小国家，认认真真做好自己的工作，不做不利祖国的事情，多关心自己祖国的国情，才是真的爱国！,,,,,,,,
42,经常有人说要原谅他们，要忘记仇恨，我真是一个大写的呵呵挂在脸上！我们没有资格替侵华战争中死去的士兵和百姓原谅他们，我觉得身为一个国人，一想到那些被刺刀插穿胸膛的平民，那些被抓去做活体实验的战俘，那些被**的年轻的或年老的妇女，想起那些人类难以想象的残忍的杀人方式，我就恨的牙根痒痒，他们做的事情永远不值得原谅。有人说不能忘记，可以原谅，谁敢保证原谅的下一步不是忘记？只有记得这份痛，才能时刻警惕这个凶恶的民族，才能富国强军，让这个我们的国家乃至世界和平稳定。我知道我发的这些等于找骂，但是我还是要说出来，因为b站精日的太多了，我们不得不承认日本文化产业做的很成功，但是文化不等同于历史，不等同于政治，喜欢日漫和日剧可以，可是因为喜欢这些就对日本改观，对不起，我是做不到！,,,,,,,,
14,主要还是有些人  只是嘴上说着报仇报仇 很日本这那的  可是报酬的前提需要自己先强大起来啊  只有国家慢慢变强大了，才是一切的前提  而不是每天啃老  在手机面前说自己的是多么伟大,,,,,,,,
14,日本只要一天不承认罪行 作为中国人就要认清底线,,,,,,,,
26,我说声日本贱畜都该死没人反对吧。,,,,,,,,
12,历史是洗不白的，不是你们改几本书，动动笔杆嘴皮子就能抹掉那些血淋淋的痕迹。你肆意妄言的时候，知不知道那些成千上万的尸体都会转头盯着你，眼里的血泪汇聚着蜿蜒爬向你，和你永远缠绕在一起...嘻嘻，等着看你们的结局。,,,,,,,,
12,受不了那些日本人民无罪论，问一句，那些侵华犯罪的所有日本人就不是日本人民吗？那些各种杀人犯罪的人就不是日本人民吗？一个小士兵不是日本人民来的？？,,,,,,,,
12,"不用太在意标题，只看视频内容就好了，那些以标题为借口来撕逼转移焦点的人可耻至极，谁知道是什么居心。反正我没认识几个人，也没钱去请水军和小号顶赞，你们要是觉得我说的话有道理就赞个吧，看不惯我想举报也无所谓<img alt=""[小电视_思索]"" src=""//i0.hdslb.com/bfs/emote/f8219e484d5a55787c3f1722dc3112d0eba03a69.png@100w_100h.webp""/>我只为劝导各位正三观而已",,,,,,,,
12,你爱看看不想看就别看，热评里面非要搞事情？一个标题看把你急的,,,,,,,,
17,我在这里只想说两件事一，愤青是褒义词，别tm拿来形容键盘侠，这是对愤青的侮辱二，在鄙视愤青的时候，先想想我们中国在危难的时候就是愤青救的，你的历史老师和语文老师死的很早吗？话说完了,,,,,,,,
11,实际点来说，日本右翼才是最大威胁，最令人厌恶的存在。直接用外部力量引起内部反应，用日本民众的力量让右翼消失匿迹，让安倍下台。像美国政府对叙利亚做的那样。或者像普京年轻时那样做特工从另一个方面为国家出力。或者从事国际贸易合法纳税不避税，为国家提供经济上的帮助。又或者像张纯如那样用尽一生心血讲述了南京大屠杀的残忍历史，在国际上引起了巨大反响，真正为中国发声。又或者只是认真做好自己该做的事，学习，工作，养家糊口孝敬老人，做一个国家稳定的螺丝钉。无论怎样都比张开闭口灭日本要好的多。中国人很好。可最大的缺点就是自负。可能是因为中国几千年来都是世界科技经济文化中心的缘故。我们的骨血里流淌这种骄傲。别的国家进贡只是形式，对此我们要几倍的赏赐回去，因为我们好强要面子。我们给了韩国太极旗，给了日本文字。像一只骄傲的狮子，所有力量都要展现在外，爱憎分明不隐藏。而日本人冷漠自私残酷。优点却也是不能忽视的，他们谦虚谨慎，有纪律性。就像一头狼，他们可以不带感情的毁灭一个国家，灭绝一个种族，即使彼此之间没有仇恨。他们为达目的不择手段，在美国给日本广岛投过两个原子弹，使广岛成为不毛之地的之后，还能屈膝于美国，视美国为盟友。比起****，骂旅日的同胞，砸同胞的车，不停撕逼。比起那些我们更应该团结一致吧？不能在这点输给日本吧？一切只为国家更长远的利益着想，这点日本人能做到，凭什么我们做不到？想想怎么好好利用日本的资源技术，加强自身才是实际。我们超越日本成为世界第二大经济体可不是仅凭一腔国仇家恨，只有你变强了，你说的话才有意义。,,,,,,,,
11,不是记恨，是这些错误作为中国人不应该去原谅,,,,,,,,
23,b站里某些为日本侵略罪行洗白的中国人，你们不觉得耻辱吗？,,,,,,,,
10,勿忘国耻，铭记厉史，缅怀先烈,,,,,,,,
10,这个血海深仇，我会报仇的,,,,,,,,
21,正视历史就是仇日？不精日的就是仇日？日杂和他爸爸一样恶心且精神分裂。,,,,,,,,
21,不仇日的意思是爱日本维护日本么？这该是一个中国人该说的话么？就算如今的日本和中国表面宣称美好，我也喜欢日本动漫，爱听日语歌曲，但这不妨碍我仇日的心，勿忘国耻！勿忘爱国之心！,,,,,,,,
12,这种视频的初衷是为了激发国人的爱国心理，为了国家的未来而努力奋斗。国家所实行的爱国主义教育也是为了使人民能够更好工作，加快中国发展，本意不是仇日。不料却养出了一大群只会在网上空谈放屁，与人辩论，动动嘴皮子日本就沉了，现实中却屁都不干的人。要爱国就要有实际行动，为了国家发展，每天少看一小时B站，从我做起(･∀･),,,,,,,,
14,勿忘国耻同胞难，屠杀东京做好汉,,,,,,,,
9,日本雇国外媒体来抹黑中国美化它们自己被曝光了，还有什么好说的。,,,,,,,,
9,回复某弹幕  我们看日本动漫是喜欢和尊重日本人的文化 但是并不代表包容他的一切（严肃）,,,,,,,,
9,欲亡其族，必先毁其史,,,,,,,,
11,仇日？还用仇？中华民族对日本的敌意是骨子里带的,,,,,,,,
8,现在有不少人已经忘记历史了，比如那个说:拍这个电影干嘛？仇日？。这种人是彻底的忘记了即使。变态的维护日本,,,,,,,,
8,中国人不会整天都把仇日这个词挂在嘴边，毕竟现在以和平为主，但可笑的是***总是认为中国人已经忘了以前的事情。小鬼子是看不出来我们对他们有多憎恨的，因为这份仇恨是刻在中国人的骨头里的，我相信，可能是十年，可能是百年甚至千年，这笔账，一定会算清楚，东京大屠杀，我十分期待。,,,,,,,,
8,至于那些抗战神剧我觉得不只侮辱我们观众的智商。还侮辱了那些为抗战牺牲的人们。,,,,,,,,
10,在b站这个日杂聚集地发对太君们不利的视频，肯定是要被喷啊（#-_-)┯━┯,,,,,,,,
10,哈日的大侠们赶紧拿个日本绿卡吧中国太小容不了你这条qu,,,,,,,,
7,麻烦评论里用了日番头像在b站看过日番的别说什么“灭了日本”这种话好吗，很搞笑    从小就学的“勿忘国耻 振兴中华”你们真的懂了吗,,,,,,,,
7,日本到下面去请求先辈们的原谅吧,,,,,,,,
7,日本人:原谅你mb！谁要你原谅？！！老子根本没侵略你们好吗？？,,,,,,,,
7,但某些东西真的不能遗忘，嵌进骨子里的耻辱…我最喜欢看《亮剑》，很希望自己能生在那个时代，多多的杀日本人,,,,,,,,
9,我没看有些伤口不需要一次又一次的揭开撒盐这些血债只要日本人够聪明就永远没机会报但只要有机会我敢保证他们会后悔生为人,,,,,,,,
9,我很奇怪啊，为何up要用日本的天空之城当bgm。,,,,,,,,
6,此仇不共戴天。血的教训不能忘。,,,,,,,,
6,勿忘国耻知道了吗，仇日知道了吗，日本在我眼中一直很恶心，世界诸多名人，日本就没让我能尊敬崇拜的，tm还篡改历史，教他们的后代是我们中国无赖，诋毁他们，而且南京大屠杀，大屠杀，记住了，屈辱史。,,,,,,,,
6,"<img alt=""[小电视_发愁]"" src=""//i0.hdslb.com/bfs/emote/05e279abbf3f72d5cc45548504a4220c5514b8b9.png@100w_100h.webp""/>勿忘国耻，倒是真的",,,,,,,,
6,迟早有一天它们会血债血偿！战火会烧到它们的土地！让它们也尝尝被侵略掠夺的滋味！,,,,,,,,
6,我决定了，我要杀回去,,,,,,,,
6,是啊，本站不能乱评论，上次就被喷愤，青，,,,,,,,,
6,我们没资格替那些死难者原谅日本人！,,,,,,,,
8,日本就是一个白眼狼，看看历史哪次侵略不是在中国最弱的时期狠狠的咬你一口。以后中国万一虚弱了，第一个咬中国的绝对是日本,,,,,,,,
5,我个人感觉看不下去，心里知道就好，日本，日本，表面平静实际上只是没办法搞我们，如果他们敢搞事情，亚洲第一强国的我们一定会让他们知道什么叫三个月灭国的。,,,,,,,,
5,真，恶心的狗日本，维护中国的三观恐怕有点问题，我们这个年代的青少年都会痛恨日本，那那时候的人又是怎么想的呢，维护日本那些人，你们如果生活在那个时代，你tm还会维护中国，搞笑,,,,,,,,
5,b站的某些人真是敏感的可怕，有句话，说者无心，听者有意,,,,,,,,
5,我很小的时候看的这个电影，小女孩拿着孙悟空，以为这样就能得到保护，女孩的妈妈的*着的尸体在湖面飘荡。还有那句化成灰，变成雨，都令我心碎。日本人之所以肆无忌惮，也是因为那时候的国人不够团结，太过贫弱。可是现在呢？,,,,,,,,
5,何止只有南京大屠杀……,,,,,,,,
5,我们可以不恨他们，但没有资格原谅他们,,,,,,,,
13,我依然记得鬼子拿着刺刀，吧一个孕妇肚子挑开，刀剑上插这还没生出来的孩子，勿忘国耻，抵制日漫二次危害。,,,,,,,,
8,国人真的很忙！每天都在必看这个那个。。。,,,,,,,,
12,日本以前是中国的一条狗，朝鲜还是属国，日本在中国眼里只是一堆住在穷困小岛上的野人。日本人在人种学上定义是矮黑人种，脚趾外翻，牙齿不平，大腿粗，小腿短，矮小，腿型外八字，这是这个人种的特征。日本为何侵华，因为待在小岛上过不下去了，而中国当时正好国力弱小，于是野心膨胀，想占领大陆，获得大陆富裕的金钱和丰富的自然资源。*************************************************************************************************************************************************************************************************************************************************************************************************************************************************************************************************************************************************都炸不进去，国不要脸真的天下无敌，这就是某些人口中的日本人有素质?日本人的素质只会体现在一些小事，例如看到人会礼貌，不怎么闯红灯，吐痰，排队比较有秩序，但对大事日本人的素质为零，面对如山的证据竟还死不承认，这叫有素质?依我看最没品没德的就是他们。还有吹日本文化的，猴子有何文化，日本人的名字，制度，衣服，建筑，都是以中国为模板的，把公开上床做，爱当电影产业的变态配和中国五千年历史谈文化?,,,,,,,,
6,我们更应该要做一个有素质的公民，提高国家的人口素质，不应该在电脑面前说支持中国又啃着老。,,,,,,,,
6,其实不要太在意标题了、个人觉得视频还是可以的……感觉活在这个时代真的很幸运、emm...希望生活中遇到不好事情的人可以坚强点、和电影的人比起来我们很幸福了吧！(写完发现好鸡汤啊噗),,,,,,,,
6,你说我该看，我妈说我该写作业。,,,,,,,,
4,勿忘国耻,,,,,,,,
4,过去的事时刻放在心里，但不要挂在嘴边。怪别人残忍没有任何意义，重要的是自己变得强大，然后己所不欲，勿施于人,,,,,,,,
4,(･∀･)up主明明说的是应该看，哪儿来的戏精非觉的阿婆主强迫他们看不看不是中国人。。。多学学语文吧,,,,,,,,
4,没受过伤害就没资格说原谅,,,,,,,,
4,虽然我很不想说，但这是一个残酷的真相。电影中五月和八月在南屠以后逃到镇江避难，但其实在南京沦陷前镇江已经沦陷了。,,,,,,,,
4,这样发人深省，令人悲痛的影片才能令我们反思战争和历史。,,,,,,,,
4,小时候还不知道南京大屠杀的历史，很小的时候在电视上播的时候看的，简直童年阴影，特害怕，但又感动，现在资源都搜不到了，很老的片子了，叶童演的母亲印象深刻啊！,,,,,,,,
4,我仇日，就这么简单。,,,,,,,,
4,看哭我，不忘，不能忘，即便我天天追日剧，国耻依旧决不能忘。,,,,,,,,
4,唉我只觉得可悲，我国当时的同胞们居然落得如此凄惨的下场。心情沉重也无可奈何，历史已成定局。,,,,,,,,
4,愿世界没有战争,,,,,,,,
4,标题党,,,,,,,,
4,cctv6放过 对小女孩被压在死人下躲过一劫的映像很深刻QUQ,,,,,,,,
4,能不能斟酌一下标题再发，非搞一些让人有话说的标题。就不能写个“残忍的日本鬼子啥的”,,,,,,,,
4,好吧，这电影我看过，影名我也记得，叫 五月八月，不仅仅是影名，还是影片中主角两个小女孩的名字。拍的其实很好，影片前半场是以孩童的视角看南京大屠杀，后半部却是幸存孩子的生活，很发人深省，战争真的会牵连很多无辜之人,,,,,,,,
4,牢记历史，,,,,,,,,
4,"so,在死宅漫控狗泛滥的B站这玩意有人几人看?<img alt=""[嫌弃]"" class=""small"" src=""//i0.hdslb.com/bfs/emote/de4c0783aaa60ec03de0a2b90858927bfad7154b.png@100w_100h.webp""/>",,,,,,,,
4,难怪这电影为什么看起来和大陆拍的不一样，原来是香港拍的。,,,,,,,,
15,我想问问你们，当年犯下这些罪行的是印度，越南或俄罗斯，而且现在它们还觊觎我国土，你们会为他们洗地吗?你们中有人为日本洗地不就是被他们的文化洗脑了吗?就因为它们制造了美好的假象你们就是非不分了吗?你们还是华夏人吗？这个世界上大部分国家都可以和我们谈和平发展，只有美国，日本，棒子，八国联军参与国和一些在它们身后的跳梁小丑不行，因为它们不配!它们只有彻底灭亡，灭亡到连渣滓都不剩，顺带连倭国创造的侵蚀我国民思想的所谓二刺猿一并灭绝，世界和平才有希望!,,,,,,,,
5,总有些人不是活在现实里的，这个世界从来就不是和平的。活在本子里的孩子应该去了解一下中国跟美国的经济战争，了解一下日本跟中国钓鱼岛争端，了解日本跟中国在飞机，航母各方面的军事竞争，以及今天日本依旧在中国不停的间谍案。未来，当政治，经济手段无法解决争端的时候，战争终不可免，你能祈求日本人的人性给你怜悯才是最可笑的，不要忘记，丛林法则才是这个世界上生物发展的主要历史,,,,,,,,
5,喜欢日本 的 日杂 冷静 一下 看看你父母,,,,,,,,
5,一部中国人都该看女孩目睹母亲。。。。,,,,,,,,
10,在b站发这些题材电影，up做好被嘲讽的准备，要么就是弱了就该被打，要么就是天天发这些都过去那么久了，还巴拉巴拉的。,,,,,,,,
3,一群逃避现实的人,,,,,,,,
3,美国佬为什么不多杀几个日本人,,,,,,,,
3,怎么才能灭亡这个民族呢？急求555,,,,,,,,
3,什么时候才能灭日本！,,,,,,,,
3,杀光日本人。日本岛并入中华版图。我们需要新时代的霍骠骑，卫将军！,,,,,,,,
3,日杂:什么鬼子叫皇军,,,,,,,,
3,日军在撤出中国时将大量化学武器就地掩埋，造成在和平年代中国公民上千人死亡,,,,,,,,
3,日本从来都不友好   不要妄想不会重蹈从古至今日本对中国的侵略和对中国百姓的蹂躏,,,,,,,,
3,终生厌恶日本人,,,,,,,,
3,没事我们有原子弹,,,,,,,,
3,勿忘国耻才是该做的。,,,,,,,,
3,牢记历史！勿忘国耻！,,,,,,,,
3,没别的意思，但我真的好想在那条河边，把小狗捞走，它们也很无助,,,,,,,,
3,我就进来看看有多少人骂up的！哈哈哈哈哈哈哈哈嗝！,,,,,,,,
3,不要再说中国人该干啥了，搞的人们都忙不过来,,,,,,,,
3,我记得看完后还要写观后感,,,,,,,,
3,勿忘国耻，爱我华夏,,,,,,,,
3,b站很多都是嘴上喊着铭记历史，实际上给日本洗地，经常给本国同胞扣上个愤青小粉红的帽子，实则屁股歪倒不知道哪里去了,,,,,,,,
11,诸君，日本有罪，日本人有罪，日本政府有罪，为日本辩护的人罪无可恕，为日本辩解的汉奸不配当中国人，他们是伟大祖国的叛徒。(=・ω・=)（￣へ￣）,,,,,,,,
4,这是事实，为什么不能拍？问拍这个干嘛的有脑子吗？,,,,,,,,
4,别说什么灭了日本之类的话，真的感觉很无脑，灭了一个国家就靠你说说就可以了吗？有些时间怎么不去干点大事？真的很讨厌这种人,,,,,,,,
4,仇恨没有错。但应该以事实依据，不能罪犯杀了人就拍电影说罪犯杀人在奸在杀在吃，战争历史应该依据历史还原，一枪干掉一群鬼子，手雷炸飞机都是夜郎自大拿历史伤疤来娱乐圈钱，不能让吃瓜群众们看嗨了，过2分钟就去朋友圈晒图求赞，一起消费先人的伤痛,,,,,,,,
4,我不看还不是中国人了……？？？,,,,,,,,
5,果断投诉这种Up主,,,,,,,,
2,唉╯▂╰在日本除了动漫全是狗。,,,,,,,,
2,"落后就要挨打，也不要忘了先辈们的付出，现在的有些中国人就是怎样连自己的祖宗都不知道了，<img alt=""[正经人_火]"" src=""//i0.hdslb.com/bfs/emote/78579a24b156501c0b5583121beb42a72e9229b5.png@100w_100h.webp""/>",,,,,,,,
2,"用东风41核平的日本十个分导式核弹头够了~滑稽<img alt=""[小电视_无语]"" src=""//i0.hdslb.com/bfs/emote/fbd12affebfdaadd3d721bffdb685a6b1ee71219.png@100w_100h.webp""/>",,,,,,,,
2,勿忘国耻，但是不要把仇恨传递给下一代,,,,,,,,
2,教会救了很多中国人,,,,,,,,
2,早晚得讨回来,,,,,,,,
2,只有曾经的入侵者才可以道歉，如果那一辈的人全部逝去，哪我们就不需要道歉，记下仇，三战让他们变成大核民族,,,,,,,,
2,这部电影最大的BUG就是时间不对啊！众所周知南京大屠杀发生在寒冬的12月，可电影里表现的明显不是冬天啊……,,,,,,,,
2,天皇的八荒一隅，建立大东亚共荣圈的梦想就靠你们日杂啦！到时候给你们发良民证！????,,,,,,,,
2,**所以日本人的妈,,,,,,,,
2,勿忘国耻、勿重蹈覆辙,,,,,,,,
2,以前战争年代这种事很多，勿忘历史，我们要团结，超强，没人再敢侵略我们,,,,,,,,
