链接,标题,播放数量,弹幕数量,发布日期,点赞数量,硬币数量,收藏数量,转发数量,评论数量
https://www.bilibili.com/video/BV1XW411W7Wv?from=search&seid=1750330274017779470,南京大屠杀的策划者，被判绞刑后挣扎12分钟才死亡,172000.0,253.0,20180309.0,1612.0,532.0,786.0,138.0,500.0
评论点赞数,评论内容,,,,,,,,
2810,应该凌迟，由南京所有市民执行，每人一刀,,,,,,,,
1105,抢楼的有病吧？什么视频都抢？,,,,,,,,
248,"在国仇家恨的面前竟然看到了那么多不要脸的人为别人洗地。首先作为一个中国人，你都不站在中国人的立场来说句话，你觉得你配当中国人吗？还记得前段时间抓捕的那些日本人间谍吗？你们真的认为日本在拥抱和平了？还有你们认为会中国字就是中国人吗？现在学中文的外国人那么多。虽然现在网络上很多日本间谍在用所谓的理智和平给一部分智商还不健全的人洗脑，可是我真的没想到为什么这么严重。理智是什么？站在中国的立场理智就是发展强大等到下一次世界更替，到时如果不能用经济解决一切事情就用武力解决一切事情。和平是什么？站在现如今的中国立场来说不轻易发动战争就是和平。但是理智和平不是被用来给别人洗地的，一些残酷的历史是该被所有人铭记的。对于**份子我能说的就是你敢穿着日本军装去大屠杀现场拍照，那么你敢去日本靖国神社穿着中国军装拍照吗？别说中国连拍照的自由都没。还记得12年钓鱼岛事件后地域黑泛滥吗？现在民族黑阶级黑也泛滥了知道为什么吗？因为中国有一部分人因为自己利益就心甘情愿当外国从事间谍事业的人轻易挑动国内仇恨的工具,跟着那些网络间谍后面污蔑前辈先人甚至挑动国内敌对情绪。还有别去喷什么键盘侠愤青至少他们敢用键盘去喷那些垃圾，而不是用键盘说着理智和平去喷自己国家的人，当然这里先声明那些纯属给小粉红引战的你到底是为了什么我不评论，对于真的小粉红提个意见别人爱什么都可以这是别人的自由，你如果要骂就骂那些直接喷你国家的，也别拿着什么大义去评击别人你要做的就是代表个人观点去写评论去说事。对于现今的国内网络说一句话“如果有一天你连说爱国都错了，那么这个国家也就完了。”以上观点仅代表个人观点，如果你要喷请喷我一个人，我代表不了其他任何人，也代表不了国家，我只代表我自己。",,,,,,,,
182,“真正热爱祖国的年轻人，即便他们是日本动漫游戏的铁杆粉丝，他们也会在大是大非的问题面前维护自己国家的主权和民族尊严。而那些没有脊梁骨、双膝发软的人，即便他们对日本没兴趣，也迟早会跪倒在其他人面前，嘲笑着中国的一切，包括中国的主权和民族的尊严。”——转自团团的一篇文章请不要再说喜欢日漫就是喜欢日本国的这种无聊言论说出来,,,,,,,,
102,1.朝香宫鸠彦王(签署命令“全部杀掉”)2.松井石根(默许命令“不留俘虏”)3.中岛今朝吾(军团屠杀人数最多)4.谷寿夫(军团屠杀人数第二并亲自持刀屠杀平民)四名主犯均在南京侵攻战后受裕仁表彰,,,,,,,,
79,为什么人人都认为战争和百姓没关系呢？历史上哪一场战争没有百姓的参与，哪一场战争不是为了百姓，侵华日军发起战争不就是为了给他们日本的人民争取更多的生存空间吗？抗日战争是为了给自己国家的人民夺回原来的生存空间，历史上的秦扫六合，希波战争，十字军，蒙古铁骑横扫亚欧大陆，近代的殖民战争不都是为了给自己国家的人民争取更大的生存空间，有的人可能会说发动战争的人不是人民，和人民没关系的这种话，但是各位想想殖民战争，北美美和拉美是怎么出现的？还不是百姓默认了这场战争参与到了进来，当初在美洲开疆扩土伐林垦荒的人难道是欧洲的殖民军队？还不是欧洲的人民在开疆扩土，为了扩大自己的那点土地，不要总是觉得百姓在战争中是无罪的，百姓才是战争的隐性帮凶,,,,,,,,
85,我只想说，他们没有道歉，有的人就迫不及待的替遇难者原谅了？你凭什么？你有什么资格？！,,,,,,,,
61,谁敢否定南京大屠杀  我们就砸烂他的狗头(●￣(ｴ)￣●),,,,,,,,
57,热评神tm国民无罪论，看似批判实则给人家洗地！当初被洗脑，全民捐款帮助本子走上不归路的正是其国民，你应该批判那些政治家 军人和国民都有极其深切的罪孽，别忘了：军出于民。别拿什么“军人执行命令”来搪塞，少壮派军人组织投降日政变你告诉我是执行命令？谁的命令？东条鬼的还是天皇的？裕仁都被你们口中这群“无奈执行命令”的军人给吓得瑟瑟发抖你告诉我执行命令，智障洗地言论。批判右翼就算了还要说出这种谬论真的是可笑,,,,,,,,
45,致敬拯救了25万中国人的伟人---南京大屠杀中的保护神！约翰拉贝。和参与救援了20多万面临被屠杀的中国人，与20多位坚持留在南京的西方人士一起，谱写了一曲动人的人道主义乐章。约翰马吉！人道必胜！正义必胜。,,,,,,,,
48,呵呵，去他丫的靖国神厕，都该死的玩意儿,,,,,,,,
34,真正策划南京大屠杀的是裕仁天皇的叔叔朝香宫亲王，皇族的影响力不是松井能把持的，松井石根被捕是因为他早就官居日军大将，他什么都没干一样会被抓。因为协议不得审判日本皇族，南京大屠杀又被提上审判议程，恰好松井石根是当时名义上的最高司令官，所以成了替罪羊,,,,,,,,
37,南京大屠杀是日本天皇直接下令，朝香宫鸠亲王执行指挥的。两个罪魁祸首活到90岁。没有受到任何制裁，晚年好吃好喝好玩。中日永远没有可能和睦，以前没有，现在没有，将来有人不会有。UP主回家从新上完小学再来做历史视频吧,,,,,,,,
34,其实日本不承认南京大屠杀是很可笑的，因为它美爹的国家档案馆里对于南京大屠杀有着很详尽的记录。你说中国捏造历史，美国也帮着中国捏造？,,,,,,,,
30,"574楼说日本人屠杀之类的都是因为怕中国人反抗才屠杀被中国人逼的。有没有哪位暴躁老哥去安排一下？骂人我不怎么会<img alt=""[小电视_发愁]"" src=""//i0.hdslb.com/bfs/emote/05e279abbf3f72d5cc45548504a4220c5514b8b9.png@100w_100h.webp""/>",,,,,,,,
25,我芜湖的，毗邻南京，听老一辈人说当年小鬼子进芜湖动用了飞机投弹，大火沿着青弋江烧了整整3天，很多人都从城里面往四周乡村逃，然而在江边过江时，很多人都慌乱掉江里去了，有的人就再也没有上过岸，当时有个叫程玉笙的先生动员了很多人搞抗战募捐，是长期的。后来小鬼子在我们芜湖县有个叫三元乡的好几个村子里烧杀抢掠，打死了很多人！我不知道为什么有的地方人会说我们安徽抗战故事少，我告诉你，有个很会打仗的将军叫李品仙，我们安徽皖南抗战根据地听说过吗。我们芜湖有个叫军滩口的地方，老人家说那时候中国军队和日本鬼子打了一场恶战，最后中国被打完了，他们都说最后有一个人高马大的军人，不愿意做俘虏，只能自尽了！(´；ω；`)我们这里有一座叫神山的山，相传当年干将莫邪铸剑的地方，山上有个陵园，叫烈士陵园，山顶上有座碑叫人民烈士纪念碑！！！！还有好多东西我想告诉你们，可是我写不下去了（/TДT)/,,,,,,,,
28,某些**分子比这些日本鬼子还要可恶，比如前几天那两个穿日本军装的，妈的，劳资恨不得打死他们,,,,,,,,
22,我并不反对别人看日漫，但我发对看了日漫就不承认自己是中国人的那些人！你们如果说我道德绑架，我也没办法。,,,,,,,,
20,首先这个视频说了半天都是在放屁。进攻南京的日本师团是受松井石根直接指挥，但是攻下南京的当天，日本裕仁天皇就立即让自己的叔叔朝香宫鸠亲王接防，并直接下达指令开始惨无人道的南京大屠杀，其目的之一是抢劫南京中央银行的地下仓库和制造恐慌。南京大屠杀的元凶就是日本天皇与皇室。不要再想尽办法给日本皇室洗白，牺牲一两个替死鬼就让整个日本军国主义的元凶全部逃脱,,,,,,,,
19,在南京大屠杀视频里面洗任何日本的言论都应该死个玛，不管你是喜欢日本动漫，还是喜欢日本人，日本这个国家一天不道歉，一天态度不转变，我觉得网民怎么骂日本都是可以的。,,,,,,,,
19,前两天看了一个采访视频，关于对日本的看法，前面采访的几个老人，一般就是不能原谅，或者是只有出面正式道歉才能缓解一下，可气的来了，后面几个年轻的基本都是嬉皮笑脸，什么无所谓啊，历史问题不追究啊，都多少年前的事了之类，把我给气的，,,,,,,,,
18,把它的尸体铸成铁像，永远跪在南京,,,,,,,,
21,主谋是朝香宫亲王，松井只是个替罪羊而已。,,,,,,,,
21,这支执行南京大屠杀的军队，最终也得到了恶果。太平洋战争后期，这支部队被美军围困在菲律宾的原始热带森林里，他们被疟疾和饥饿折磨着。甚至出现了人吃人的情况，最终，也只有十几个苟延残喘。这就是报应,,,,,,,,
22,局座都说了，战败国就要点战败国的样子。现在还那么跳，说明那群逼还想翻身,,,,,,,,
19,看到这个，再想到在另外一个讨论日本和中国人仪态不同的视频。有人说日本人社会文化会导致不自信和过于卑谦，底下就在bb日本的卑谦是继承儒家正统，中国的“自信”是自大嚣张在国际上丢脸（举例一些游客事件 说的自信而不是狂妄 刻意歪曲罢了）。               压抑的等级尊卑社会都能洗成“先进的卑谦” 这些人真是累不累啊。,,,,,,,,
19,应该救下来，每天绞刑一次，多开心啊！,,,,,,,,
15,南京大屠杀不是松井一个人的事，其实朝香宫鸠彦亲王来屠城的时候松井根本管不住他。当时日本皇族对南京大屠杀都是知情的。,,,,,,,,
15,忘记历史也是一种卖国,,,,,,,,
14,很奇怪的现象，我同事很多都知道双十二购物狂欢节，却不知道12.13是什么日子,,,,,,,,
10,有的日本人在听闻这样的事情会忏悔，有的日本人则会破口大骂说这是捏造的，你应该把后者好好揍一顿，不，揍一顿太少了,,,,,,,,
14,有些人真的是看日漫看傻了,,,,,,,,
9,现在是多的是那些理中客，他们玩双标，要原谅，要士兵平民无罪。要抛开立场和国家。要冷冰冰冷血的看待历史。还替侵略者换立场换位思考。说不过就骂人，盖帽子说别人怎么不去杀光脚盆云云。看不出有什么理性。只觉得真是浪费中国的粮食,,,,,,,,
9,应该吊到十一分，放下。明天继续。,,,,,,,,
9,在南京大屠杀问题上，松井石根不过是个替死鬼而已，真正的元凶是天皇的叔叔朝香宫鸠彦，正是他下令屠杀俘虏，进而引发了南京大屠杀，可是战后却因为皇族身份逃脱了审判，而且以高寿去世,,,,,,,,
9,日本可没有和德国一样对待历史的态度，这是最气人的，犯了滔天大罪又不敢承认,,,,,,,,
9,日本大多数年轻人还不知道有南京大屠杀这回事，有的了解了，但不承认，因为在他们所受的教育里，日军在二战都是有纪律的，不杀平民，并且深信不疑。从n站相关视频的弹幕里看出来的。,,,,,,,,
9,不是很能理解因为日本动漫而爱上日本人民的人，而且这类人还很多,,,,,,,,
11,这日本有罪也算个风云人物了，我虽然不关注但还是有耳闻，毕竟被封号多次还能坚持到底也算传奇。之前我一直以为他被封是自身有些犯了禁忌的东西，但现在看来还真不是。他这些投稿顶多算个纪录片，但是这评论区里可是写出哲学、宗教、军事、历史、政治、文化、教育、经济等各方面的精彩剧本，建议八一电影制片厂破格提拔。,,,,,,,,
8,评论区的某些人，战犯就别洗了,,,,,,,,
8,日本人可以不承认对中国人民犯下的罪行，但身为中华儿女的我们如果连自己祖先受尽的磨难和屈辱都选择去忘记，那我们还有何颜面苟活于世？我们的今天，是多少英雄烈士用自己的鲜血交换而来的！我们脚下的土地可是红色的啊！,,,,,,,,
8,小   日    本就是中国的一面镜子，什么时候中国羸弱了，它就会过来咬一口，什么时候它彻底老实了，就说明中国什么时候强大了。,,,,,,,,
8,B站这么多泛黄区也必须有点红色了 加油,,,,,,,,
8,刚刚看一套的节目信中国，读到聂荣臻将军的信，甚是感动。,,,,,,,,
8,日杂洗地的我告诉你没有这个资格 第一你不是中国人，第二南京大屠杀死的不是你。,,,,,,,,
12,为什么在翻动评论区的时候毫无情感波动，仿佛这已经成为常态。我爱国，但是我也会批判这个国家的不对。我向往和平，但是我也会想使用最残酷的方式对待侵略者。这不是一纸空言式的口头表达，仿佛有些人想极力证明自己的爱国，别人的不爱国。这没有意义，有意义的是先让自己的拳头硬起来，实力强起来，不再悲剧重演。不然，你的称号就是某侠，你曾经最讨厌的人。,,,,,,,,
12,我大中国什么都缺，最不缺的就是日杂和慕洋犬！汉奸是我国历史上的一大特色，汉奸也是我国文化中的一部分，有国人的地方就会有汉奸！因为很多中国人都还保留着奴性！它们就算不向日本下跪，也会向别的国家下跪！,,,,,,,,
7,铭记历史而不是用键盘打上“垃圾日本人”(´･_･`)，真正爱国的人正在深思并且付出努力好好读书认真工作为了建设更好的中国，为了不让我们再受欺负，而不是拿着键盘骂日本，骂完就去打游戏睡懒觉。。。。,,,,,,,,
7,每次都喜欢点开这种视频的评论区看日.杂和“愤青”的战役,,,,,,,,
7,日本发动全面侵华战争后，朝香宫鸠彦于1937年12月2日被任命为上海派遣军司令，军衔中将。12月7日朝香宫鸠彦赶到南京前线，接替因肺病而正在疗养的侵华日军华中方面军总司令松井石根，出任日本攻占南京的临时总指挥官，亲自下达了屠杀南京的命令。战后，不仅没有接受审判，后来还成为“日本高尔夫球俱乐部”的名誉会长，轻松挥杆于青山绿水之间，并最终以93岁的高龄逍遥终老。,,,,,,,,
7,(。・`ω´・)兄dei，喜欢动漫是因为人物唯美可以幻想。日漫动漫技术比较成熟而已，其实国漫做好了，谁会看日漫？动漫是产物，日本是人。当然我个人是抵制日产货的，车我都是买国产！！！,,,,,,,,
7,731部队一个活体实验的日本军医，曾经利用试验资料跟美国交换，希望能够放过他。然后成功了。我希望不仅仅是南京大屠杀，731和慰安妇都要永远的记住这些痛。,,,,,,,,
9,没有日本人支持哪来的日本鬼子？,,,,,,,,
6,片中只讲了松井主张攻打南京，并没有直接关联到屠杀的事。不过最大的锅的确是他的，因为事情是他搞出来的，事情发生后没有，或者说没能力采取补救措施也有他的份。以下内容摘自百度百科，如有不满，不要找我：十二月七日，他召集参谋人员，下达了《南京城攻略要领》。该要领大致内容如下：“一、若南京守城司令或市政当局留守城中，则劝其开城以和平占领，尔后，各师团分别由经过挑选的一个步兵大队（9日改为三个大队）为基干，率先进城，分区对城内进行扫荡；二、若敌之残兵仍凭借城墙负隅抵抗，则以抵达战场之所有炮兵实施炮击，以夺占城墙。尔后，各师团以一个步兵联队为基干进城扫荡。……”。“一、应特别严肃部队之军纪风纪，使中国军民敬仰归服皇军之威武，期不至出现苟如毁我名誉之行为；二、严禁接近外国之权益特别是外交机关。在外交使团提议设立而为我军拒绝之中立地带，除必要外，应禁止入内，并应在重要地点设立岗哨。又，禁止进入城外之中山陵等**志士之陵墓及明孝陵。……”。同时，松井又训令他的部队：“南京乃中国之首都，攻克之乃世界性事件。故须认真研究，愈益发挥日本之名誉，增强中国民众之信赖。虽为敌军，然已丧失抗战意志者及一般官民，应予以宣抚爱护，持宽容慈悲之态度。”以上是战斗前他的计划，下面是大屠杀进行时的一段此时，日军的暴行正处于高峰。对于日军的暴行，身为日军最高指挥官的松井石根不可能不清楚。因为，在“慰灵祭”快要结束之时，他突然流着泪，对部下训斥说：“你们奋力苦战，使皇威增辉，然某些士兵之暴行，又使皇威一举扫地”。松井作出如此之训斥，表明他完全知道南京城内发生的日军“暴行”，并似乎要下决心整肃军纪。可事态的发展并非如此。这里有三点可供说明：(全复制过来有点长，概括一下)（1）谷寿夫师团是在大屠杀中最为卖力的部队。（2）在攻占南京之前，整个日军配备的宪兵只有102名。（3）12月19日松井在南京视察时看到被屠杀的尸体后熟视无睹，没有采取任何措施，匆匆返回了上海。,,,,,,,,
6,老子就一句话:日杂赶紧滚去你本子爹那去舔腚 浪费国家粮食的废物们！ 587L的精彩评论:“看淡了 不过才30W而已也就那么回事！ ” 老子把你🐴来2刀！    杂种 请当场去世,,,,,,,,
6,铭记历史  为国家富强努力奋斗  铭记历史 不是为了复仇 而是以此告诫后人 现在安定的生活 是老人们用生命换来的 我们要继承这强大的国家  让他变得更强  以此去庇护我们的子孙。,,,,,,,,
6,可惜那些战犯只判决了12个，还有许多支持战争的右翼分子没处理。,,,,,,,,
6,用指甲刀杀他,,,,,,,,
6,"每次看到这种视频我都不用点开就知道还有人撕逼<img alt=""[小电视_汗]"" src=""//i0.hdslb.com/bfs/emote/5c150cec77eae1b05d5ca46526450ff3beeb44d2.png@100w_100h.webp""/>",,,,,,,,
6,致**的睿智们，屁股决定脑袋，世界不以你意志为中心，那是刻在骨里，用你们先辈你自己身上流淌的血篆下的仇难呐，最后可以勉强原谅，但不可以忘记，更加不能谄媚!!!!!,,,,,,,,
6,他们可以拜鬼，中国人宣传愤怒情绪就不行？关系这么紧张才对嘛…………难道一个个像乖宝宝似的就好了？像以前那样继续民可使由之，不可使知之？有人反对才正常，总有人用忠言逆耳，up主你承担的起来威胁，可笑，人家发视频，说话，表达点历史民族感情，就来质问，怕友邦惊诧？坚决支持主播。,,,,,,,,
6,松井石根背了锅，朝香宫鸠彦却逃了,,,,,,,,
6,凌迟处死 35万刀 叫这个日本恶魔尝尝滋味,,,,,,,,
6,首犯是日本皇室，退出来的是替罪羊，都该死，但是首犯在逍遥法外,,,,,,,,
8,恨不得灭其族，屠其苗裔！,,,,,,,,
10,竟然有人说日本人是无辜的？我求求你们了 滚回你们的国家去 日本的历史注定了他们就要去侵略别的国家 以扶持他们本国,,,,,,,,
10,我为国家做不了贡献，能做贡献的人也大都不去做贡献！这就是中国，表面上都是爱国的忠烈之士，人口一句国家兴亡匹夫有责！心却在想：又没杀我关我屁事！我知道我发这句话一定会被喷，说我不爱国这那的，我不是不爱国，只是不爱这个国家的领导人！不说全部，百分之九十吧！,,,,,,,,
5,元首自尽，墨索里尼伏诛，唯独跑了裕仁,,,,,,,,
5,果然，看这类东西不能看评论,,,,,,,,
5,。。。。。http://m.kdnet.net/topic-9709758.html南京馆长早在13年就说了没有日本人出资，55楼维基百科看的日本南京介绍吧，维基百科人人能改不要随便相信啊啊啊 日本想淡化历史污点，对于错误不承认不承担后果不反思很不对。,,,,,,,,
5,战争真的很痛苦，作为一个平民如果自己国家不强大就要被折磨杀死，但是有些人还是希望战争干掉恨的国家，这样和平不好吗，发生一次，世界陷入混乱，还会有第二次，战争最惨的是人民,,,,,,,,
5,快点快点，有没有更多的喷子，还有粪青，在多喷点这视频就可以举报引战了，到时候汉奸还是粪青都换个地吧，别污染评论区,,,,,,,,
5,说原谅他们的，真是服了，你有什么资格替别人原谅别人？,,,,,,,,
5,说这种没用的，弱了就要被欺辱，本来就是个弱肉强食的世界,,,,,,,,
5,"对于日精，日杂，还有一些对日""圣母""们。我想说这里，是中国...这里!   是伤亡两千七百多万的中国!这里!   是噩梦的开始!是埋着我30多万的先祖同胞的地方，南京......我承认，对，我不善良!  甚至在你们眼中，我叫""愤青""叫""土鳖""叫""庸人""叫着许许多多被打上记号名字......但是你们知道吗，我也曾善良...我读过三字经道德经! 我学过论语! 我知道什么是君子! 什么是礼仪之邦! 我也知道什么，是人...我曾以为，我能原谅他们...直到我读到""当雪崩的时候，没有一片雪花是无辜的!""我曾以为，我能原谅他们...直到我不知姓不知名也不知数的祖辈，那些浑身赤裸的女子! 那些满身伤痕的女子! 那些将要当母亲的女子! 她们说:""我们是慰安妇!  我们是""病人(活体)""! 我们是! 母亲...""我曾以为，我曾原谅他们...直到我到了旅顺! 到了东北! 到了南县厂窖! 到了凤阳城! 到了湖南! 到了南京! 到了!  中国...我曾以为，我能原凉他们...直到我那千千万万的先辈哭着，喊着，咆哮着，咬着牙，拖着他们那残缺的身子，用着仅剩的血泪，写下  ""中国不会亡!""   ""中国不会忘!""   ""我们是勇士是战士!""  ""我们! 真的，不甘心...""知道吗? 我没有什么大才大德，没有你们所说的英明神武。但我知道... 我是人!  是那些千千万万死在日寇铁蹄下人民的后代! 是喝着这个伟大国度的奶水长大了的，中国人!我不想再去给现在的日本两颗苹果核，但是如果要我去给当年的日寇送去两颗原子弹，我会毫不犹豫的按下按钮!诽谤，谩骂，欺辱，暴力，责备?那又怎样，知道吗？我! 并不是一个人! 我的身后站着千千万万不屈的英魂! 站着的是现在千千万万和我一般的中国人! 站着的的是有着真正良知的，人!    ""有些人活着，但他已经死了 ""    ""有些人死了，他还活着 ""                                                                ——臧克家",,,,,,,,
7,真的不是我要喷！南京大屠杀这种事情，你居然盯着用sens的音乐来当BGM，是你无知还是有意？你不会以为故宫三部曲是sens的曲子就把sens当中国的了吧？这样的话我还可以理解。,,,,,,,,
7,up主发这个视频是告诉我们铭记历史，不要让历史重演，不是给某些人瞎放屁的→_→,,,,,,,,
7,你们讲的大道理太深奥了，咱不懂，我只知道一句杀人偿命，欠债还钱而已。,,,,,,,,
7,应该让他折腾十分钟然后拉上来缓一缓，然后再放下去，快不行了，再拉上来缓一缓……玩6个星期(╯°口°)╯(┴—┴,,,,,,,,
7,这种人绞刑比枪毙好的多，枪毙的话来不及感到疼痛就挂了，绞刑能让他感受到什么才是真正的痛苦,,,,,,,,
6,作为一个南京人，不知道说什么,,,,,,,,
6,小时候看大屠杀记录片恨的牙根痒痒，恨的想杀光日本人，长大了在看就没感觉了，可能现实的压力让我没空去胡思乱想。,,,,,,,,
6,很好很好，我在日本等你们杀过来！随便把我房东宰了，这个鬼子太小气了。,,,,,,,,
6,这种视频应该关评论,,,,,,,,
4,报告: 发现587L的一个正宗日杂 有没有暴躁老哥安排一下？,,,,,,,,
4,结果朝香宫鸠彦没事是最气的。,,,,,,,,
4,评论区看见一条洗地就举报一个,,,,,,,,
4,应当百倍奉还,,,,,,,,
4,松井某程度上背了锅，真正要死的是朝香宫鸠彦，这个人最该死，可惜美国人放过他一条狗命,,,,,,,,
4,黑太阳南京大屠杀，建议🇯🇵杂们看一下,,,,,,,,
4,确实是个军事人才，就是人性沦落,,,,,,,,
4,净扯淡，幕后策划者是日本天皇，弄死个走狗有啥用?,,,,,,,,
4,能有人举报55楼吗，让他拿出证据证明纪念馆是日本修的他说百度不是真实一会又说百度。。。。(〜￣△￣)〜,,,,,,,,
4,为什么不把秦汉时期所有的酷刑在一年之内每天对他用一个呢，12分30秒真的能缓解中国历史上的这段沉痛吗？,,,,,,,,
4,我离评论区还有一个屏幕都闻得到撕逼的香气           (´･_･`),,,,,,,,
