链接,标题,播放数量,弹幕数量,发布日期,点赞数量,硬币数量,收藏数量,转发数量,评论数量
https://www.bilibili.com/video/BV1TZ4y1K7Q9?from=search&seid=1750330274017779470,日本投降75周年！南京大屠杀幸存者撞和平钟：目睹杀戮和投降,143000.0,407.0,20200815.0,16000.0,1585.0,1484.0,204.0,520.0
评论点赞数,评论内容,,,,,,,,
3120,国行公祭，法立典章。铸兹宝鼎，祀我国殇 。,,,,,,,,
8371,我们年轻人没有资格放弃仇恨，没有资格原谅日本人。先辈受的苦难，受的委屈，一定要有个说法。血脉传承，让我们不能原谅背叛历史的人。,,,,,,,,
2638,我敢说，如果再给日本机会，日本还会干出当年那些事情。,,,,,,,,
1940,"靖国神社还在呢，怎么精日能那么多？人德国跪下道歉了，你小日本还试图篡改这段历史呢，精日是看不见吗？一味宣扬忘记仇恨，倒是大方，南京三十万冤魂给精日来点个赞好不好啊<img alt=""[笑]"" class=""small"" src=""//i0.hdslb.com/bfs/emote/81edf17314cea3b48674312b4364df44d5c01f17.png@100w_100h.webp""/>仇恨忘的到挺快，他娘的记吃不记打，绝了<img alt=""[呲牙]"" class=""small"" src=""//i0.hdslb.com/bfs/emote/b5a5898491944a4268360f2e7a84623149672eb6.png@100w_100h.webp""/>",,,,,,,,
1780,我奶奶说，当初日本宣布投降，被缴械以后，我们这里老百姓冲上去扇那些日本兵的耳光，有的直接点汽油烧他们，那种恨，真的是无法用言语形容。,,,,,,,,
1848,他们的土地他们的血，我永远不会原谅日本人，即使我也看日本的一些东西，如果中国需要打仗日本的话我愿意去,,,,,,,,
735,日本右翼现在就等着这些人死去，这样就死无对证了,,,,,,,,
915,我们永远没有任何资格替先人原谅这罪恶滔天的罪行！！！,,,,,,,,
558,日本只记得自己被美国人打的那一段了，永远不记自己侵略过别的国家，干过无数伤天害理的事,,,,,,,,
563,我记得又一个视频，讲我们中国人对日本人有好感的站45%，日本人对中国人有好感的只有19%,,,,,,,,
822,大刀向鬼子头，砍去，,,,,,,,,
435,永远不要放松对日本的警惕，日本人能隐忍，一旦比你强，就贼狠，弄死你。可谓贼心不死，狼子野心。,,,,,,,,
487,精日派去死吧，崇洋媚外去死吧,,,,,,,,
303,"事实一：南京大屠杀确实存在事实二：日本人并没有道歉事实三：德国似乎对自己在二战的行径公开道歉了呢结论：德国比日本强<img alt=""[热词系列_skr]"" src=""//i0.hdslb.com/bfs/emote/bd285ff94db16ad52557c3effe930d64663e8375.png@100w_100h.webp""/>",,,,,,,,
704,最后老爷爷说的太好了，记住历史不要记住仇恨,,,,,,,,
123,一个连承认历史都不敢的国家不配得到尊敬，而且还把那些把不是人干的事当成光荣真是让人恶心至极，我敢信如果我们中国还给他们机会他们肯定还会这么干，毕竟狗改不了吃屎，哦不对，他们可能连畜生都不如，虽然有好的但我也不会完全认可毕竟日本人都阴阳怪气你永远都猜不透他们心里住着一个怎样肮脏的东西，而且我爷爷就死在他们侵略的时候，要不是我爷爷护着我怀着身孕的奶奶藏在一个隐秘的地窖没被发现我现在不可能活在这个世上,,,,,,,,
129,这个公众号怎么还在,,,,,,,,
113,梨视频你个孙子——,,,,,,,,
112,梨视频好意思说鬼子吗？？？,,,,,,,,
77,没有人可以代替死去的先烈去原谅任何人,,,,,,,,
90,精日的给我出去，打了那么多年仗，杀了多少你同胞，你说理智对待。我们中华民族永忘不了小日本的所做所为，他们在侵华战争的很多行为亳无人性可言，强奸，机枪扫射，把我们中国人杀，抢，甚至烧，所到之处尸骨遍地，我们中国人应该从不精日，应该铭记历史，没有一个中国人会为侵华行为抱以原谅！！！,,,,,,,,
78,精日废物,,,,,,,,
87,精日个个都是大圣人，说什么别记仇。记仇又不意味着要复仇，如果有它们敢来下一次就可以把仇报了。,,,,,,,,
68,每到这种沉重的视频前，就有一群精日护主狺狺狂吠，基本都是群祖国的罂粟花。,,,,,,,,
68,我老婆婆就是南京人，据说她在大屠杀前逃了出来，我老婆婆在我高二的时候去世了，我现在已经大二了，我老婆婆以前是一个大小姐的丫鬟，普通话非常好，真的非常好,,,,,,,,
66,就算他们道歉，也不会原谅，这是原则问题。如果道歉，只能证明那个人知道了错误，原谅是不可能。,,,,,,,,
58,日本人大部分还是觉得自己没错所以还是毁灭吧,,,,,,,,
50,我真不知道国内是怎么想的，咋啥都想舔，请公知们记住啊你们在跪舔的是敌人，是杀了你先祖的敌人！,,,,,,,,
76,"日本妄图用动漫来麻痹全世界，试图蒙混自己的历史，肯定有人会中招的，不过只要有人没忘记历史这就不可能发生。这可不是真诚忏悔就原谅的事。终有一天，这笔账我们会加倍奉还，他们也有感受痛苦的权利啊。<img alt=""[呲牙]"" class=""small"" src=""//i0.hdslb.com/bfs/emote/b5a5898491944a4268360f2e7a84623149672eb6.png@100w_100h.webp""/>",,,,,,,,
45,日本狗,,,,,,,,
31,评论区hhhhhh能笑死我，做调查中国人对日本抱有好感的有近50%，而日本对中国抱有好感只有15%甚至更低，别人在那边各种看不起还有酸中国的，你某些人在评论区疯狂舔，拜托你拉好感拉给谁看？,,,,,,,,
32,鬼子永远是鬼子，是一个不变的事实,,,,,,,,
38,现在的我们有什么脸去原谅日本,,,,,,,,
70,"铭记历史是要珍视和平努力发展，不是让某些人天天像个傻子似的以爱国为名散播极端民族主义言论<img alt=""[无语]"" class=""small"" src=""//i0.hdslb.com/bfs/emote/44667b7d9349957e903b1b62cb91fb9b13720f04.png@100w_100h.webp""/>",,,,,,,,
26,我喜欢看日本动画和玩日本游戏没错，但日本人对我中华民族的伤害，我永远不会忘，不单是我，我的子子孙孙也都不能忘，此仇刻于心，刻于灵魂，除非心不存在，灵魂也消散，不然日本人对中华民族的血债永远我都不会忘。,,,,,,,,
33,"你们这些人别妨碍人家驪视频的发财路<img alt=""[偷笑]"" class=""small"" src=""//i0.hdslb.com/bfs/emote/6c49d226e76c42cd8002abc47b3112bc5a92f66a.png@100w_100h.webp""/>",,,,,,,,
22,垃圾b乎好多刷中日友好和平的,,,,,,,,
26,仇恨要日本道歉，是肯定的，但我们要的是日本，承认过去的错误，而不是把他们全都杀光，给日本人的后代让我们承认错误的机会,,,,,,,,
21,最令人佩服的，就是当初日军投降之后..... 我们中国居然还能接收他们，救济他们。这种胸怀，以及对事不对人的态度......足以证明我们是个伟大民族！,,,,,,,,
28,杀了人撞个钟就算完了？我可不认。,,,,,,,,
18,有些宅男看了几部日漫 就叫嚣着自己多么多么爱日本，这样的人你有良心吗？,,,,,,,,
22,人家还参拜靖国神社了呢……这是不想和平呢,,,,,,,,
17,虽然我也看日本动漫，但我永远不会忘记日寇犯下的罄竹难书的罪行和国仇家恨,,,,,,,,
23,老天爷开开眼啊！赶紧让日本遭报应吧！,,,,,,,,
18,"突然发现评论区好多国民党反动派的后人，都替日本说话<img alt=""[doge]"" class=""small"" src=""//i0.hdslb.com/bfs/emote/bba7c12aa51fed0199c241465560dfc2714c593e.png@100w_100h.webp""/>",,,,,,,,
14,我不相信这个世界上有鬼，如果有的话日本早被南京30万冤魂给活吞了,,,,,,,,
13,但凡有人洗贵子，我必定怼到底。你连鬼连畜生都洗的玩意，我必定怼死你,,,,,,,,
16,我们会接受日本的投降，但不会原谅日本，我们会接受日本的新一代的非右翼日本人，接受日本的文化，但永远会牢记当年的屈辱,,,,,,,,
12,凡是翻到过外网的都知道现在日本有多仇恨中国,,,,,,,,
11,这里举报个精日@Hello我叫霍斯，这么疯狂给日本洗白真的NB，每个评论洗一次小精日敢不敢跟👴出来对线,,,,,,,,
16,"所以说啊，有些入驻b站的日本人真是烦死了<img alt=""[辣眼睛]"" class=""small"" src=""//i0.hdslb.com/bfs/emote/35d62c496d1e4ea9e091243fa812866f5fecc101.png@100w_100h.webp""/>",,,,,,,,
18,"我现在很讨厌日本，包括日漫，就是单纯的讨厌，完全不喜欢，日语听到就头疼<img alt=""[吐]"" class=""small"" src=""//i0.hdslb.com/bfs/emote/06946bfe71ac48a6078a0b662181bb5cad09decc.png@100w_100h.webp""/>",,,,,,,,
10,日本连个道歉都没有，求你们憋在这舔了,,,,,,,,
10,仇恨还是要记住的，但要注意我们要复仇的对象是那些对于战争的狂热分子，而不是部分反战的老百姓,,,,,,,,
9,"日本军国主义再敢复活，我们可以让他们尝尝我们的社会主义铁拳！<img alt=""[生气]"" class=""small"" src=""//i0.hdslb.com/bfs/emote/3195714219c4b582a4fb02033dd1519913d0246d.png@100w_100h.webp""/><img alt=""[生气]"" class=""small"" src=""//i0.hdslb.com/bfs/emote/3195714219c4b582a4fb02033dd1519913d0246d.png@100w_100h.webp""/><img alt=""[生气]"" class=""small"" src=""//i0.hdslb.com/bfs/emote/3195714219c4b582a4fb02033dd1519913d0246d.png@100w_100h.webp""/><img alt=""[生气]"" class=""small"" src=""//i0.hdslb.com/bfs/emote/3195714219c4b582a4fb02033dd1519913d0246d.png@100w_100h.webp""/><img alt=""[生气]"" class=""small"" src=""//i0.hdslb.com/bfs/emote/3195714219c4b582a4fb02033dd1519913d0246d.png@100w_100h.webp""/><img alt=""[生气]"" class=""small"" src=""//i0.hdslb.com/bfs/emote/3195714219c4b582a4fb02033dd1519913d0246d.png@100w_100h.webp""/>",,,,,,,,
11,罪行无法原谅完全没错啊 ，这件事情怎么能放下。这是未来中日要深入发展永远绕不过去的，不否认日本有像宫崎骏，村上春树，手冢治虫等反战文学创作者，但日本右翼掌控舆论情况实在不容乐观,,,,,,,,
8,"冻伤实验】： 在哈尔滨郊外零下二十几度的低温下，（被迫）接受实验的中国妇女被捆绑著，双手裸露在空气中，几个日本兵不停地用瓢舀起冰水，浇在该妇女手上。十几小时後，这双手冻得硬硬的，上面盖了一层冰。回到室内後，日本人命该妇女把手浸泡在温水中，直到双手软软地垂了下来。忽然，一个日本人使劲一捋，把此妇女双手的皮肉象脱手套一样地脱了下来，整个肘部以上的双手顿时变成了只残留极少数肉丝的森森白骨。该妇女（因还是婴儿的孩子已成为实验的牺牲品，她早已半疯半痴了）把双手（如果还称得上是手）的白骨举成戳向半空的姿势，呆呆地看著，忽然撕心裂肺地惨叫起来。　　2：【活体解剖】： 一个中国小乞丐和日本小孩因玩皮球成了好朋友，日本人授意让日本小孩带中国小乞丐进731大院，以食物诱骗等手段让中国小乞丐接受""身体检查""。中国小乞丐在脱光衣服时还露出了童稚的羞涩笑容。上了手术台，麻醉完毕後，日本人熟练地将中国小乞丐开膛破腹，把心脏、肝脏等器官逐一取出，浸入早已准备好的生理盐水。那离开身体的心脏捧在日本人沾满鲜血的手上时还在跳动。""手术""完毕，日本小孩把中国小乞丐的残骸断肢推去焚化。　　3：【低温实验】：日本人让中国受害者把手伸入超低温冰箱（也许零下几十度甚至零下一百多度），进行速冻。完成後，中国受害者取出双手，看起来呈灰白色，上面结了一层霜，完全不像是人类的肢体了。一个日本人用短棍敲打，就象打断冰柱一样，把中国受害者的手指一根一根地打落，发出清脆的声音。中国受害者发出了绝望而恐怖的号叫。　　4：【高压实验】： 中国受害者被赶入高压舱，随著加压，露出极度痛苦的表情，想叫却叫不出声，直至最终眼珠弹出眼眶、肠子等内脏挤破腹腔，流得满地都是．．．．．．　　5：【转换血液】：把中国受害者的血液全部抽干，然後向他身躯裏注入马的血液，史料称由此引起的剧烈的抽搐和痉挛""连几个壮汉也压制不住""．．．．　　6：【器官转换】：日本人仅仅为了取乐，用手术摘除中国受害者的胃和小肠，把食道和大肠直接连接，让该中国受害者不断地吃东西也只能眼睁睁地饿死；也是仅仅为了取乐　　7：【肢体转换】：砍下中国受害者的手和脚，然後用手术把手接在小腿上，把脚接在手臂上，还用""高明的医术""把它们接活；不进行任何麻醉，只是把中国受害者绑在手术台上就活体解剖，中国受害者越是痛苦地挣扎越是引起哄堂大笑．．．．",,,,,,,,
8,谁敢忘记历史，谁就不是中国人,,,,,,,,
8,lj梨视频,,,,,,,,
8,梨视频不配发这个视频,,,,,,,,
7,真不明白精日的想法，烂钱也恰不到，图啥? 皈依者狂热?,,,,,,,,
7,精日出来跟👴对线,,,,,,,,
7,"苏联红军当年真应该入东京<img alt=""[微笑]"" class=""small"" src=""//i0.hdslb.com/bfs/emote/685612eadc33f6bc233776c6241813385844f182.png@100w_100h.webp""/>",,,,,,,,
7,精日跪族们动不动就出来代表“中国人民”理解原谅，我想说它们根本没资格代表任何一个真正的中国人,,,,,,,,
7,我喜欢奥特曼 喜欢源自日本的jk但若中日有战 我必奔赴战场我不会忘记几十万条中国人的生命被无情杀戮！,,,,,,,,
7,日本军国主义就是世界上最大的邪教组织，没有任何一个物种能够干出如此惨无人道之行为。铭记历史吧！歌里唱得好，朋友来了有好酒，敌人来了有猎枪……,,,,,,,,
11,我们这边的人大多数说日本人的时候都是说小日本，连几岁小孩都说小日本而不是日本人，精日狂怒,,,,,,,,
9,不指望现在的日本人道歉，毕竟不是他们干的，但我只求某些人能正视历史,,,,,,,,
6,精日狗生活里是活得有多悲哀，因为看个动漫就为一个曾经深深伤害了我们的国家说话？不好意思呢，某些玩意你们算个什么东西，也配替先烈原谅日本？请问宁们是参过战还是受过伤害？太好笑了。,,,,,,,,
6,"日本，只有从世界消失才能弥补他们的罪孽，一群白眼狼<img alt=""[嫌弃]"" class=""small"" src=""//i0.hdslb.com/bfs/emote/de4c0783aaa60ec03de0a2b90858927bfad7154b.png@100w_100h.webp""/>",,,,,,,,
6,精日狗爬,,,,,,,,
6,精日分子就应该和日本人一起沉到海底,,,,,,,,
6,精日狗出来爬两圈？,,,,,,,,
6,"<img alt=""[OK]"" class=""small"" src=""//i0.hdslb.com/bfs/emote/4683fd9ffc925fa6423110979d7dcac5eda297f4.png@100w_100h.webp""/>日本人是日本人，日本鬼子就是日本鬼子，日本鬼子给爷死<img alt=""[阴险]"" class=""small"" src=""//i0.hdslb.com/bfs/emote/ba8d5f8e7d136d59aab52c40fd3b8a43419eb03c.png@100w_100h.webp""/>",,,,,,,,
6,"注意，今年安倍推特下面他们一些极端民族主义者要求安倍继续拜鬼。人家民众还特别强调：不用考虑中韩感受。欢迎某些精 日来跟我对线。<img alt=""[OK]"" class=""small"" src=""//i0.hdslb.com/bfs/emote/4683fd9ffc925fa6423110979d7dcac5eda297f4.png@100w_100h.webp""/>",,,,,,,,
6,"30w，是血的教训，二战期间日本共杀害我军民1800w人，累计伤亡3500w人！ 日本人素质很高？对！但他们抢了我们多少的财富用来发展知道吗？推荐去看一下《菊与刀》，这本书可以让你更清楚的了解日本。现在的教课书已经将历史美化太多了，当你真正接触那一段血与泪的历史时就会发现--日本真的罪无可恕！  日本人文质彬彬的外表下藏着一把染红鲜血的利刃。<img alt=""[黑洞]"" class=""small"" src=""//i0.hdslb.com/bfs/emote/e90ec4c799010f25391179118ccd9f66b3b279ba.png@100w_100h.webp""/>",,,,,,,,
8,日本鬼子=【右翼，二战日军 东条英鸡】日本人=【日本中立 安培晋三】日本友人=【鸠山由纪夫】不要片面的把日本人都当做禽兽，人是复杂的，理智爱国,,,,,,,,
9,营销号？？？,,,,,,,,
5,"先tm把精日弄死，不配做中国人<img alt=""[呲牙]"" class=""small"" src=""//i0.hdslb.com/bfs/emote/b5a5898491944a4268360f2e7a84623149672eb6.png@100w_100h.webp""/>",,,,,,,,
5,中学的历史老师告诉我们全班他总结的一个道理，对待日本人你打他，就得把他打服，就像当年朱棣打蒙古一样，仅仅打退了，他一样找机会卷土重来，美国不就打服他们了？现在哪敢叫板,,,,,,,,
5,我觉得我并没有资格挺先辈原谅日本人，但现在是和平时代，和平来之不易，寻求合作是必需的，仇恨是没有必要的，但也不会忘记他们做过的事情。,,,,,,,,
5,铭记历史，铭记仇恨。不是让某些人在这边当键盘侠，说什么中日有战争我一定要去参加的蠢话，你很牛逼是不是？到时候怎么死的都不知道,,,,,,,,
5,日本人民自己都不反军国主义分子，还把他们供起来了，日本网民黑中国的时候，除了一些中国留学生，几乎看不到真正的和中国人民站在一起的“日本人民”。网络上流传的“中国人民和日本人民站在一起，共同的敌人是日本军国主义”这句话其实有点可笑。,,,,,,,,
5,"仔细想想如果中国现在没有那么强大，日本人会怎么样？<img alt=""[笑]"" class=""small"" src=""//i0.hdslb.com/bfs/emote/81edf17314cea3b48674312b4364df44d5c01f17.png@100w_100h.webp""/>",,,,,,,,
5,铭记历史，记住之前我们遭受侵略的耻辱历史，忘记暂时的仇恨。日本至今不承认，不道歉，还要加入五眼联盟。而评论区一些圣母要求我们不要仇恨，和平友好。要不是现在中国强大了，这些圣母圣父都是日本人刀下鬼它们成分也不清楚，可能是跪舔日本的台独和二鬼子吧以战求和，才有和平，不忘历史,,,,,,,,
5,无法原谅，无权原谅,,,,,,,,
5,不多说什么，对日本人就那样了，记住历史不记住仇恨。但如果真的开打，那就要把仇恨算上加倍奉还,,,,,,,,
5,"某些人的评论给我看吐了，勿忘国耻，希望舔日本的人有事<img alt=""[保佑]"" class=""small"" src=""//i0.hdslb.com/bfs/emote/fafe8d3de0dc139ebe995491d2dac458a865fb30.png@100w_100h.webp""/>",,,,,,,,
5,"等日本的爹不行了 就会过来跪舔的 我相信有那一天 而且是有生之年<img alt=""[微笑]"" class=""small"" src=""//i0.hdslb.com/bfs/emote/685612eadc33f6bc233776c6241813385844f182.png@100w_100h.webp""/>",,,,,,,,
5,逝者安息 勿忘国耻 牢记历史我们没有资格去向先人原谅日本人,,,,,,,,
5,只要靖国神社还存在一天，仇恨就不会消失。同志们，前进！！,,,,,,,,
5,向中国伟大先驱者们致敬……,,,,,,,,
7,中国弱小，日本就是贼；中国强大，日本就是妾,,,,,,,,
9,评论区也是离谱，一个个只会记仇恨，个个口气都是看见个日本人都巴不得杀了，好家伙，这品德跟当年的日本人有什么区别，中国向来都是以德服人，到你们这里就已经开始开启网络战争了？爱国没错，但是无脑爱国反而会成为一种错误，还有那些开地图炮的，喜欢日本这个国家就是精日？就是不爱国？那宁们管的可真宽,,,,,,,,
4,"我喜欢看日本的动漫，但这并不代表我不想让日本鬼子死啊!<img alt=""[阴险]"" class=""small"" src=""//i0.hdslb.com/bfs/emote/ba8d5f8e7d136d59aab52c40fd3b8a43419eb03c.png@100w_100h.webp""/>---转自b站某用户评论",,,,,,,,
4,和平？那也是打服他们以后才会有和平，原谅他们是已逝之人的事，我的任务就是送他们去见已逝之人,,,,,,,,
5,谁能体会痛苦与绝望，做实验 肢解 强奸 屠杀 眼看着自己爹娘被杀害侮辱，是有多痛。求求别被国外的圣母思想洗脑了，豺狼终究是豺狼 老豺狼死了，小豺狼长大了而已,,,,,,,,
4,我不恨现在的日本人，但我恨日本鬼子，我没资格替他们原谅过去的鬼子，如果说现在的日本人要重蹈覆辙，那么原谅他们那是上帝的事情，我只负责送他们去见上帝,,,,,,,,
4,该干啥还是干啥，游戏 动漫 文化照样，别忘本就行,,,,,,,,
4,"如果那些幸存的老人们都走了，我都害怕，还有没有人记得这段历史？<img alt=""[大哭]"" class=""small"" src=""//i0.hdslb.com/bfs/emote/2caafee2e5db4db72104650d87810cc2c123fc86.png@100w_100h.webp""/><img alt=""[大哭]"" class=""small"" src=""//i0.hdslb.com/bfs/emote/2caafee2e5db4db72104650d87810cc2c123fc86.png@100w_100h.webp""/>",,,,,,,,
4,日本叫太平洋战争，不叫侵华战争，用中国人民生活的水深火热，我们要去拯救他们，共建大东亚共荣圈的口号发起的侵略，中间死了很多人。我们没有资格去原谅他们，如果你上了战场，你的孩子被打死，你的女儿被侮辱，你能说出原谅的话？南京大屠杀，黑太阳731细菌实验，千人斩的报道，这你都能原谅？为什么二战德国会发起战争？因为德国一站失败了，他们的领土被割让了，希特勒还是个纯种族主义者，日耳曼血统天下第一，德国人员事业，赔付土地，赔付金钱，他要复仇，拉起了战旗，第二次世界大战开始了。我们不能原谅，哪怕日本人正视历史我们也不能，因为我们没资格，能有原谅资格的都在地下埋着，我们会希望和平，但和平被打破，只能保卫国家，血刃敌人。我们可以喜欢日本的动漫，游戏，文化，但当战争来临时，国家是第一目标，即使他再烂，也总比伊朗被美国经济制裁，叙利亚天天打仗，索马里自由国度要好吧？少精日精外，古朝为上朝，后期闭关锁国导致工业革命晚了被打了，可咱们脊梁骨不能弯了，血性要有。明星少上脑子，女明星看表演听歌曲就完了，男的一样，你追的那么勤，他是给你上床还是给你结婚？没有用。,,,,,,,,
4,如果重开东京国际军事法庭对原先战犯和一些本应判甲级战争罪行的某些逃脱了罪犯彻底从社会意义上死亡。该多好。,,,,,,,,
6,日本想要赎罪，靖国神社可以不拆，但里面的战犯灵位必须毁掉，日本必须要正视历史，日本赔偿战争损失，中国有权不要，但日本必须赔偿，日本领导人必须亲自来中国，为自己祖先所犯下的滔天罪行参拜赎罪,,,,,,,,
5,我也想站在四岛上喝着鬼子的血,,,,,,,,
3,老人在等日本道歉，日本在等老人死去,,,,,,,,
3,既然我们没资格替先辈原谅，那日本人又凭什么替他们的先辈受罚？很可惜，虽然国家和有识之士一再警告，但很多人只是记住了这段仇恨，所以他们现在很想去杀日本人，砸日本车，烧日本店，有一些人更是已经付诸实践。        我不是洗日本，我只想问问你们看这种视频是为了什么？如果你们误入歧途了，那我来提醒你们一下。政府从来没说过，勿忘历史是为了侵略日本。勿忘历史是为了自强不息，不是让你们在这里口嗨的。,,,,,,,,
3,先把抗日神剧给禁了，误导了多少人。每年多放几遍意大利炮不好吗。,,,,,,,,
3,老大爷您是好人，但日本人不配,,,,,,,,
3,我们渴望和平，不代表我们忘记历史，我们只是知道这和平难以获得，所以选择先好好生活，但不代表我们会去选择原谅！有些事情，不是时间可以洗去！不是自我欺骗就可以过去！希望那些小日子过的不错的日本人和那些精日分子别再触碰底线！,,,,,,,,
3,牢记历史，珍惜来之不易和平，我们现在的和平生活都建立在千及百万的尸骨和无数冤魂之上，现在是现在以前是以前了，人的思想总不可能永远活在过去，就像老人说的，历史是用来记录的，不是用来仇恨的，仇恨是丑陋的。,,,,,,,,
3,像我们这个年代的人想象不到 但是那个年代真的是一枪就扫死一个人，然后拿中国人的尸体去拼刺刀，那中国俘虏做实验 人体百分之七十都是水 怎么算出来的？！这就是日本人！怎么可能不恨！ 我姥姥还经历过日本鬼子扫荡！不恨？不可能！,,,,,,,,
3,日本鬼子不代表日本平民，日本鬼子是该死的,,,,,,,,
3,"小日本<img alt=""[笑]"" class=""small"" src=""//i0.hdslb.com/bfs/emote/81edf17314cea3b48674312b4364df44d5c01f17.png@100w_100h.webp""/>",,,,,,,,
3,"刚刚看完《八佰》，看完最大的一个感受就是：我们这代人真的没资格去原谅，而那一代日本人也不配被原谅<img alt=""[热词系列_锤]"" src=""//i0.hdslb.com/bfs/emote/35668cc12ae25b9545420e4a85bf21a0bfc03e5d.png@100w_100h.webp""/><img alt=""[热词系列_锤]"" src=""//i0.hdslb.com/bfs/emote/35668cc12ae25b9545420e4a85bf21a0bfc03e5d.png@100w_100h.webp""/><img alt=""[热词系列_锤]"" src=""//i0.hdslb.com/bfs/emote/35668cc12ae25b9545420e4a85bf21a0bfc03e5d.png@100w_100h.webp""/><img alt=""[生气]"" class=""small"" src=""//i0.hdslb.com/bfs/emote/3195714219c4b582a4fb02033dd1519913d0246d.png@100w_100h.webp""/><img alt=""[生气]"" class=""small"" src=""//i0.hdslb.com/bfs/emote/3195714219c4b582a4fb02033dd1519913d0246d.png@100w_100h.webp""/><img alt=""[生气]"" class=""small"" src=""//i0.hdslb.com/bfs/emote/3195714219c4b582a4fb02033dd1519913d0246d.png@100w_100h.webp""/>",,,,,,,,
3,从某种程度上看，当年原子弹让日本人一瞬间灰飞烟灭相比那些大屠杀被虐杀死的民众，还是便宜他们了。。。,,,,,,,,
