链接,标题,播放数量,弹幕数量,发布日期,点赞数量,硬币数量,收藏数量,转发数量,评论数量
https://www.bilibili.com/video/BV16V411h7Yj?from=search&seid=1750330274017779470,铭记历史 开创未来——日本疫情下的纪念南京大屠杀83周年集会,167000.0,458.0,20201214.0,18000.0,1892.0,2672.0,352.0,380.0
评论点赞数,评论内容,,,,,,,,
10814,这些人才是少数，事实上日本新闻13号提都没提,,,,,,,,
6396,可惜这些人太少了，那些真正的元凶还在拼命篡改历史。,,,,,,,,
3835,最近看到一部日剧叫《暗杀教师的方程式》，里面主角说：加害者伤害了受害者，受害者会一直记得，加害者为了逃避责任不承认自己所犯的罪，他所犯的罪就会消失吗？不会的。很难想象这是日剧里的词儿，毕竟日本明明一直以来对自己的罪行都是逃避和掩盖，为了逃避罪行甚至颠倒黑白。之前和一些精日对线，他们的理由就是现在的日本人不知道过去的日本人犯过的错，所以现在的日本人没什么错，我觉得很荒唐。,,,,,,,,
2897,里面没有年轻人，日本历史教科书都改了，前事不忘，后事之师，不容易做到啊！做为日本少数，各位辛苦！,,,,,,,,
1338,"虽然说道义上日本人悔过反思是本分 但实际上这些有良知的人是顶着本国的压力来做这些事 值得我们的尊敬和肯定 评论区那些不屑和嘲讽的人只是恰好生在了这个国家 论人品还比不过这些日本人<img alt=""[无语]"" class=""small"" src=""//i0.hdslb.com/bfs/emote/44667b7d9349957e903b1b62cb91fb9b13720f04.png@100w_100h.webp""/>",,,,,,,,
2260,年轻人根本不知道战争的惨烈，现在日本年轻人基本活在第三世界,,,,,,,,
1278,日本教学书本里面根本就没提到过南京大屠杀这个事！,,,,,,,,
4405,"视频里基本都是中老年人了，他们这些老年人也许经历过美军的轰炸，知道战争的残酷，所以才会正视南京大屠杀的存在。感谢这些有良知的日本人，但是这些人也只会越来越少。<img alt=""[无语]"" class=""small"" src=""//i0.hdslb.com/bfs/emote/44667b7d9349957e903b1b62cb91fb9b13720f04.png@100w_100h.webp""/>",,,,,,,,
497,试想一下这些人不在了之后，还有几个日本人会承认？,,,,,,,,
1136,血海深仇大恨我永远不忘！,,,,,,,,
491,希望一定要告诉日本青年人，希望传承下去！,,,,,,,,
975,"希望中国人记得。""杀了那么多人，一句对不起就完了吗？""",,,,,,,,
479,日本屠的不止南京，还有很多地方，不止是这三十万。但是这个十字架应该更是让人警醒，例如美洲的印第安人，澳洲的土著，印度非洲任何被殖民过的地方。了解一下五眼联盟！！！,,,,,,,,
307,台湾也是，香港也是，都是老人，只有他们见过，所以他们忘不掉……,,,,,,,,
226,"曰敏感词ben正急吼吼地等着这些有良知的老者离去呢<img alt=""[微笑]"" class=""small"" src=""//i0.hdslb.com/bfs/emote/685612eadc33f6bc233776c6241813385844f182.png@100w_100h.webp""/>（再吞再发）",,,,,,,,
149,标题改改，纪念的不是大屠杀而是遇难同胞日,,,,,,,,
112,害，他们的年轻人会去吗？？,,,,,,,,
122,不用感谢日本的道歉，因为这是他们应该做的，是最起码的,,,,,,,,
80,南京大屠杀遇难者纪念日，不是纪念南京大屠杀！,,,,,,,,
63,坏消息是这样的人太少，好消息是有这样的人,,,,,,,,
107,什么叫做感谢这些人，致敬这些人。这些事是他们必须做的。说句难听的，他们把我们的祖宗杀了，现在能铭记历史犯下的错是他们应该去承受，去认可这就是历史，这就是事实。,,,,,,,,
61,日本人分几种，有死不认错的，也有深刻反省的，有些知识分子是真的挺真诚，纯粹，但也有很欠揍的,,,,,,,,
37,勿忘国耻，勿忘的不应该是敌人的残忍，因为指望敌人仁慈本来就很可笑，要勿忘的是自己弱小，勿忘弱小会引发的一系列后果。当自己成为最强时，其他国家自然会好好想起自己做过的一切，并且认真且真诚进行深深忏悔。,,,,,,,,
38,有时候我在想，漂亮国当初扔原子弹是不是已经算到了今天。。中日一日不和，亚太利益永远就有他的蛋糕。,,,,,,,,
28,现在日本年轻人的态度更多是关我什么事，又不是我干的。看到这些案例既没有快意，也没有什么负罪感，完全是漠不关心的态度。日本的民族主义在逐渐流失。也不知道对中国还有日本是好是坏。。。,,,,,,,,
28,虽然都是老人，但还是有些欣慰，还有人没有否定那三十万的英灵！,,,,,,,,
26,"有良知的人已经老了...年轻的却在拼命篡改历史<img alt=""[捂脸]"" class=""small"" src=""//i0.hdslb.com/bfs/emote/6921bb43f0c634870b92f4a8ad41dada94a5296d.png@100w_100h.webp""/>",,,,,,,,
24,都是老人,,,,,,,,
21,不必感谢，但值得肯定和尊敬,,,,,,,,
21,"感谢全世界为了正义与和平奔走的人们<img alt=""[支持]"" class=""small"" src=""//i0.hdslb.com/bfs/emote/3c210366a5585706c09d4c686a9d942b39feeb50.png@100w_100h.webp""/>",,,,,,,,
23,有的人是不是有问题？动不动就致敬，就感谢，这难道不是他们应该做的吗？虽然在日本那种大环境下这么做有一定难度，但也不至于某些弹幕去致敬吧？这就是日本平常表现太差劲，只要有一点这种向好的报道，就有人感恩戴德，真可笑，再说一遍，这是他们应该做的,,,,,,,,
15,毛主席在论持久战中说过，这些支持和平反对战争和军国主义日本民众也是十分重要的，日本民众一天不知道真相，右翼分子迟早还会卷土重来,,,,,,,,
15,"爱国应该是让自己的国家变得更好，认清错误，承认错误，改正错误，而不是盲目维护自己的国家。这才是正常人类该做的w祝日本人早日让周围的日本鬼子看清事实，美国的狗真挺恶心，看样子日本也没有什么国家主权啊<img alt=""[吃瓜]"" class=""small"" src=""//i0.hdslb.com/bfs/emote/4191ce3c44c2b3df8fd97c33f85d3ab15f4f3c84.png@100w_100h.webp""/>右翼政党恶心心，祝真正的左翼崛起",,,,,,,,
15,去推特看部分日本右翼说南京大屠杀是假的就来气,,,,,,,,
15,日本人就在慢慢的等 拖死他们以后就再也没自己人讲南京大屠杀了,,,,,,,,
15,勿忘历史，吾辈自强！,,,,,,,,
14,感谢啥，这不都是应该的吗？,,,,,,,,
18,"致敬个p勒，还谢谢你们？？<img alt=""[疑惑]"" class=""small"" src=""//i0.hdslb.com/bfs/emote/b7840db4b1f9f4726b7cb23c0972720c1698d661.png@100w_100h.webp""/>这骨子里是有多卑微？就算是不能成为脊梁，那也不要这么容易就骨质酥松好嘛？<img alt=""[辣眼睛]"" class=""small"" src=""//i0.hdslb.com/bfs/emote/35d62c496d1e4ea9e091243fa812866f5fecc101.png@100w_100h.webp""/>",,,,,,,,
15,估计是仅存的日共,,,,,,,,
15,打倒帝国主义！世界人民大团结万岁！,,,,,,,,
14,敢于直面并尊重、铭记历史的日本友人，我也很尊重他们，为和平奔走、宣传历史的人们的存在还是必要的,,,,,,,,
10,凡是人民大众，不论素质高低，都是团结的对象 凡是人民大众中觉悟较高的，不论是否理所应当，都是赞扬的对象,,,,,,,,
12,这是义务 弹幕一个个泪目的一个个感谢的 没必要,,,,,,,,
9,为什么要感谢？理所应当罢了。,,,,,,,,
17,谢个屁啊，这是他们为之前的犯下的罪行应该做的,,,,,,,,
17,"我们不会感谢<img alt=""[笑]"" class=""small"" src=""//i0.hdslb.com/bfs/emote/81edf17314cea3b48674312b4364df44d5c01f17.png@100w_100h.webp""/>",,,,,,,,
15,"评论的民族主义者爬吧 没了你们世界和平推进一大步 又想发动战争吗？<img alt=""[阴险]"" class=""small"" src=""//i0.hdslb.com/bfs/emote/ba8d5f8e7d136d59aab52c40fd3b8a43419eb03c.png@100w_100h.webp""/>",,,,,,,,
8,"弹幕上刷“致敬”的是个什么鬼？<img alt=""[疑惑]"" class=""small"" src=""//i0.hdslb.com/bfs/emote/b7840db4b1f9f4726b7cb23c0972720c1698d661.png@100w_100h.webp""/><img alt=""[疑惑]"" class=""small"" src=""//i0.hdslb.com/bfs/emote/b7840db4b1f9f4726b7cb23c0972720c1698d661.png@100w_100h.webp""/><img alt=""[疑惑]"" class=""small"" src=""//i0.hdslb.com/bfs/emote/b7840db4b1f9f4726b7cb23c0972720c1698d661.png@100w_100h.webp""/>",,,,,,,,
8,对华侵略分为两部分，一部分是侵略战争，另一部分已经不是战争了，以人为畜，以人为食，以虐杀残杀手无寸铁的老人、孩子为乐，甚至“竞赛”，这难道不应该受到全世界任何有良知的人的强烈谴责吗？,,,,,,,,
22,日本从来不反战，他们只是反战败罢了,,,,,,,,
7,"应该的事，没必要谢<img alt=""[呆]"" class=""small"" src=""//i0.hdslb.com/bfs/emote/33ad6000d9f9f168a0976bc60937786f239e5d8c.png@100w_100h.webp""/>",,,,,,,,
7,啊？竟然还有知道这件历史的日本人吗？？嗯……为什么都是老人呢，年轻人在哪里呢？承认历史有这么难吗？？,,,,,,,,
7,正确的价值不需要感谢，而需要传承,,,,,,,,
6,被称为日本卖国贼的左翼...挺不容易的，要顶住很大的社会压力，还可能遭报复，是有案例的,,,,,,,,
6,其实这些人很勇敢啊 不知道大家有没有看过纪录片 有一个公开支持中国的日本女性就经常被威胁,,,,,,,,
6,为何感谢？不能因为其他日本人都是不承认历史的蠢货而把守本分的人奉为上宾。他们只是做了他们该做的事情。,,,,,,,,
6,为珍视和平的人点赞,,,,,,,,
5,接受道歉，但不会原谅，因为我没经历过，我没资格替死难同胞们原谅,,,,,,,,
5,作为在弹幕中发表感谢的人之一，我想说下，日本如今的军备复苏已经显而易见，包括这个视频，也排除不了利用中美对立左右逢源的嫌疑。但在全国右转弯的时刻，依然有人做着应该做的事情，我觉得这是种逆行。所谓高尚，不正是无论身在什么样的地方，都继续做着人该做的事么？感谢他们在浊浪中的逆行，更是警醒我们自己人，不要再只做键盘侠！让别人尊敬，首先要自己强大。也不要像日本人一样在强大中迷失，我们只是在回归自己正常的状态。强者不欺侮弱者，因为没有意义。狮子从来不会去抓老鼠，我们有更重要的事情做,,,,,,,,
5,鬼子最害怕我们的崛起，因为它们知道它们原来对我们做过什么而且还知道我们一直没有忘!!   最后祝3700万遇难同胞新年快乐!!   不能忘!   不敢忘!  不配忘!,,,,,,,,
5,为什么要感谢？这是他们应该做的,,,,,,,,
5,最新调查，日本9成人反中，创历史新高,,,,,,,,
5,道歉是他们该做的，原不原谅不是我辈能给予的,,,,,,,,
5,这是日本现代本应该的方向。。,,,,,,,,
5,谢啥啊,,,,,,,,
5,团结一切可以团结的力量，真相才不会随时间流逝而消亡，我记得早几十年还有敢于揭露真相的日本左翼导演，从九一八到南屠那点破事全给拍出来了，现在就不知道还有多少了,,,,,,,,
5,"<img class=""jump-img"" src=""https://i0.hdslb.com/bfs/activity-plat/static/20201110/4c8b2dbaded282e67c9a31daa4297c3c/AeQJlYP7e.png""/><a class=""comment-jump-url"" data-report=""0"" href=""//www.bilibili.com/video/BV13y4y1y7Hi"" target=""_blank"">日本共产党的血泪史【思维实验室】</a>  大家看下这个链接，也是讲日本有识之士的。",,,,,,,,
5,"这些人还得被多数日本人戳着脊梁骂<img alt=""[无语]"" class=""small"" src=""//i0.hdslb.com/bfs/emote/44667b7d9349957e903b1b62cb91fb9b13720f04.png@100w_100h.webp""/>",,,,,,,,
5,虽然可能看上去有点怪。但是感谢的话，并不是只能对做了份外之事的人说的。做好份内之事的人，也值得感谢。,,,,,,,,
5,千万不要忽视这个事件我感觉人们都已经麻木了只关心那些杂七杂八的新闻炒作的或者骂战,,,,,,,,
32,怕报复呗！能有几个有良知的？,,,,,,,,
8,"等着吧，等我们超过灯塔国，会让每个日本人都给我们认错<img alt=""[加油]"" class=""small"" src=""//i0.hdslb.com/bfs/emote/c7aaeacb21e107292d3bb053e5abde4a4459ed30.png@100w_100h.webp""/>",,,,,,,,
4,纪念的不是大屠杀!!!是大屠杀遇难同胞!!!,,,,,,,,
4,没几个年轻人了都,,,,,,,,
4,"能真正反省历史的日本有识之士太少了<img alt=""[疑惑]"" class=""small"" src=""//i0.hdslb.com/bfs/emote/b7840db4b1f9f4726b7cb23c0972720c1698d661.png@100w_100h.webp""/>",,,,,,,,
4,这些才是有历史认识的🇯🇵人，比🇯🇵的军阀好很多了,,,,,,,,
4,希望他们能把这种精神推广出去，他们这种只有一少部分日本人反思战争是常态了吧，一直肯定常态有什么意义？还是说如果我们不肯定的话，连这一点仅存的常态也会不存在了呢？,,,,,,,,
4,"日本还能有人有良知，真的感觉挺好的了。毕竟现在日本的年轻人不是不知道历史，就是歪曲历史史实，也是受教科书影响。<img alt=""[无语]"" class=""small"" src=""//i0.hdslb.com/bfs/emote/44667b7d9349957e903b1b62cb91fb9b13720f04.png@100w_100h.webp""/>",,,,,,,,
4,如果小日本有一半，不，三分之一这样正视历史的人，我们也不至于如此愤慨,,,,,,,,
4,好多老一辈人啊…ご健康を祈ります。我没资格替前辈原谅你们，但是我还是会祝福这些日本少有的人🙏,,,,,,,,
4,我们其实在等一群没有良知或者无知的人谢罪，但毫无办法，只有中国真正强大了才会迫使他们正视这个问题。,,,,,,,,
4,日本，韩国，都是老美用战犯，卖国贼，扶持出来的傀儡国,,,,,,,,
4,这不是应该的吗，有什么可谢的,,,,,,,,
4,不管你道不道歉，，我们应该永远警惕：日本右翼一直在虎视眈眈,,,,,,,,
6,这本就是他们该做的 刷致敬是何居心?,,,,,,,,
10,一提到侵华日军的暴行，很多人立马就变成了愤青，张口闭口就干他小日本，永世和日本人不共戴天啥的。创造敌意并不能解决任何问题，和平和发展才是本世代的主题。放下仇恨不代表忘记历史，应该坚决反抗的应该是那些日本极右翼分子和沉浸在军国主义幻想里的人，而不是直接敌对全体日本人，一昧的制造地区紧张，只会让美帝坐收渔翁之利。要认清楚什么才是真正的敌人。,,,,,,,,
5,尊敬他们可以，谢谢就免了。有的人真的本末倒置。,,,,,,,,
5,虽然以武力迫使日本道歉并不可取，但我们一定会通过合情合理的方式，令世界能够正视这段历史。,,,,,,,,
3,致敬！但不感谢！这是你们应该做的！,,,,,,,,
3,"感谢？<img alt=""[疑惑]"" class=""small"" src=""//i0.hdslb.com/bfs/emote/b7840db4b1f9f4726b7cb23c0972720c1698d661.png@100w_100h.webp""/>这不是应该的吗？",,,,,,,,
3,这些日本人至少还有那么一点点良知吧,,,,,,,,
3,落后就要挨打。永远铭记在心。为中华只崛起而读书。,,,,,,,,
3,记住，无论如何，我们都没有原谅的权利和资格。,,,,,,,,
3,无语了弹幕全是谢谢，感谢。这难道不是日本要承担的义务和责任吗？德国人下跪道歉犹太人要说谢谢吗？ 真的不可思议你们这帮人的脑回路,,,,,,,,
3,这才是真正的人，日本政客和西方媒体不配为人,,,,,,,,
3,能正视历史的算少数，但这精神很令我感动|•'-'•)و✧,,,,,,,,
3,"都是老人家<img alt=""[捂脸]"" class=""small"" src=""//i0.hdslb.com/bfs/emote/6921bb43f0c634870b92f4a8ad41dada94a5296d.png@100w_100h.webp""/>，唉……",,,,,,,,
3,这样的日本人很少啊，日本还是少数人对华友好啊，大多数人仇华啊，希望他们能传播出去，但他们的上层还是日本右翼站台。我对当初反对侵华战争的日共还是致敬的。,,,,,,,,
3,他们年龄都很大了啊，可能他们看到过战败的惨烈才会更爱和平。,,,,,,,,
3,值得尊敬和肯定。但是绝对不值得感谢和原谅。,,,,,,,,
3,我觉得知错能改不值得肯定么？那么多人为什么觉得别人这么做是本分？人家是什么环境也不想想。,,,,,,,,
3,这种人太少了，屈指可数。要铭记历史！,,,,,,,,
3,这样的人在日本占0.01%,,,,,,,,
3,他们记不记无所谓，我们一定要记住，不管他们忘没忘，总有一天我们会让他们全都想起来。,,,,,,,,
3,感谢张纯如女士,,,,,,,,
3,行了行了，不管怎么样总比硬说日本没错的好一点，记住我们自己的历史做好一个中国人就行了管他们干啥？又不能给祖国带来一分钱,,,,,,,,
3,樱花国就一整个缝合郭嘉，能有这种人不容易,,,,,,,,
3,我们不是仇视日本人，我们是对邪恶的法西斯行为感到憎恶，侵略者的卑鄙行为对手无寸铁的南京市民展开了禽兽的掠杀，铭记历史，勿忘国耻。,,,,,,,,
3,希望日方正视历史，不要一味无脑的反战，好好思索一下原子弹为什么会落到自己头上。,,,,,,,,
6,日本为数不多的人类的聚会,,,,,,,,
6,这本来就是日本人应该做的,,,,,,,,
6,南京大屠杀根本没什么好纪念的！应该纪念的，是那些因为屠杀而死去的人民，是饱受战争涂炭的中国百姓与日本反战人士，他们才是值得纪念的！,,,,,,,,
6,日本这个国家从排放核废料开始，公知们就别说日本人素质高了,,,,,,,,
4,承认了，改悔了，道歉了，我们就不会死咬着不放,,,,,,,,
4,疫情来了才知道？平时干啥去了？,,,,,,,,
4,基本都是老年人了。。可见日本用课本把年轻人洗脑的多么好。,,,,,,,,
4,理性看待历史 铭记历史 宣传历史  以史为鉴 日本也有共产党 也在二战时期抗日 也被日本军政府屠戮过  现在的日本政府要掩盖这一事实 行为是卑劣的  曲解跟掩盖历史的行为其心可诛 ，作为中国年轻一代 我们要铭记历史 要搞清楚我国历史 我国文化 不是为了仇恨什么狗东西 或者要什么“道歉”  而是为了让悲剧不再发生 冤有头债有主 我们无害人心但要有防人意 ，日本政府和媒体之所以掩盖历史 是因为有利于他们本国的利益 ，而我们要做的事就是让日本政府意识到 ’为历史道歉 符合他们国家的利益 ‘ 这需要我们这代人的努力  让国家强大 强大到他们要让他们尊重我们 尊重我们的文化 人民 情感！加油吧少年郎,,,,,,,,
4,没什么好说的，血债血还，这是对日本这个民族最大的回击...,,,,,,,,
2,为什么要感谢？这是他们应该的,,,,,,,,
2,基本都是老人,,,,,,,,
2,"日本为什么不承认，不道歉。我觉得郑强教授讲的很好<img class=""jump-img"" src=""https://i0.hdslb.com/bfs/activity-plat/static/20201110/4c8b2dbaded282e67c9a31daa4297c3c/AeQJlYP7e.png""/><a class=""comment-jump-url"" data-report=""1"" href=""https://b23.tv/BV1mh411R74c"" target=""_blank"">郑强：有人说日本人傻，傻吗？郑教授给学生们的灵魂拷问！</a>",,,,,,,,
2,感谢你们，铭记历史的人永远有好报,,,,,,,,
2,这才是我们的友人，而且还是少数。,,,,,,,,
2,都是白发老人了，他们应该是真正遭受过战争的苦难的,,,,,,,,
3,看到弹幕有人说：“感谢什么？这不是应该的吗？”我想说的是，对于在日本政府美化战争之下还可以看清历史真相站出来，我们应该感谢的是这少部分人的良知与慧眼。,,,,,,,,
2,"你们微博上的账号少特么带节奏。<img alt=""[阴险]"" class=""small"" src=""//i0.hdslb.com/bfs/emote/ba8d5f8e7d136d59aab52c40fd3b8a43419eb03c.png@100w_100h.webp""/>",,,,,,,,
2,如果有一天我们会拿着枪杀回去，那么  就有一个问题 日本现在的自卫队28万人      全部杀完也没法给南京逝去的人报仇     难道要屠杀平民吗？,,,,,,,,
2,想知道真相的人很少，想把真相说出来的人很少( ´･･)ﾉ(._.`),,,,,,,,
2,可惜有良心的还是少数，不过在这种情况下还有日本人正义直言，支持,,,,,,,,
2,咱们要变强，强到他们全都承认,,,,,,,,
2,得到日本人的道歉前，我们自己也要重视这一切，不能只说外国人要咋咋咋的表示歉意，我们自己也要铭记，不能靠别人道歉来铭记。现在有些年轻人对这些事不上心，这是很危险的,,,,,,,,
2,估计是仅存的日共,,,,,,,,
2,日本曾经有过一批国际共产主义战士，可惜。。。都过去了，如果当年他们成功了，或许会是全新的可能,,,,,,,,
2,"我们没有资格去替死难者们原谅他们<img alt=""[微笑]"" class=""small"" src=""//i0.hdslb.com/bfs/emote/685612eadc33f6bc233776c6241813385844f182.png@100w_100h.webp""/>",,,,,,,,
2,想起了东史郎先生，还有高峰圭二先生。。,,,,,,,,
2,里面有很多日本左翼吧，六十年代那批年轻人都老啦,,,,,,,,
2,"日本70年代后共运进入低潮，左派战斗力急剧下降，能有这样的集会实属不易<img alt=""[呆]"" class=""small"" src=""//i0.hdslb.com/bfs/emote/33ad6000d9f9f168a0976bc60937786f239e5d8c.png@100w_100h.webp""/>",,,,,,,,
2,"都是老人<img alt=""[无语]"" class=""small"" src=""//i0.hdslb.com/bfs/emote/44667b7d9349957e903b1b62cb91fb9b13720f04.png@100w_100h.webp""/>",,,,,,,,
2,"在日本社会主流态度一直都是淡化遗忘或者篡改，举行这种集会估计会受到舆论抨击吧，什么忘却对马岛屠杀的精中日奸帽子一扣再科普一波元朝两次入侵日本，谁还没搞过屠杀，参加集会的都是日共妄想举行集会扰乱公众秩序危害国家安全巴拉巴拉巴拉阿拉。不仅把加害者受害者强行拉平淡化责任，还顺便宣扬了古日本民众抗击元寇的功绩，打压左翼分子。根本不会有媒体去正面报道的吧。<img alt=""[蛆音娘_无语]"" src=""//i0.hdslb.com/bfs/emote/b6c763c6484ce2e48299ceb21861e46318868871.png@100w_100h.webp""/><img alt=""[蛆音娘_无语]"" src=""//i0.hdslb.com/bfs/emote/b6c763c6484ce2e48299ceb21861e46318868871.png@100w_100h.webp""/><img alt=""[蛆音娘_无语]"" src=""//i0.hdslb.com/bfs/emote/b6c763c6484ce2e48299ceb21861e46318868871.png@100w_100h.webp""/>",,,,,,,,
2,都是老年人啊，他们会不会也是那场战争的受害者，这帮人再死了真的日本就没有人还记得了，年轻一代全被洗脑了。,,,,,,,,
2,对正视历史的人们致敬,,,,,,,,
2,只要有人记得，或许就可以往下传递，这记忆一定要代代传下去，不能绝,,,,,,,,
2,看到没有，没有几个人，都是那些老人经历过被美国轰炸后才会知道战争带来的伤害和当年日本人的残忍！,,,,,,,,
2,日本的垃圾右翼政府和背后的支持者不消失，对这个国家的警惕性就越不能减少,,,,,,,,
5,不值得感谢倒不至于，老人老师的话可以通过言传身教告知真相，他们不干这事谁干?你去?,,,,,,,,
5,奥特曼是我对日本最后的好感。每次被日本ex 到，我就去看看奥特曼，以此来告诉自己，日本岛上还是有人类存在的,,,,,,,,
3,这不是他们的义务，很多人是作为一般的老百姓为国家赎罪，国家打仗的时候收他们的税，国家不承认错误的时候他们来擦屁股，老百姓来承认那群狗东西的错误，我们要的是那群狗东西公开承认自己的暴行并道歉。然而就道歉这种事根本就不承认，连态度都没有，再拖下去当年的老人们都走完了，他们有生之年甚至都看不到那狗东西的道歉了,,,,,,,,
3,这些人值得致敬,,,,,,,,
1,总有正式看这件事的人,,,,,,,,
1,但太少了,,,,,,,,
1,我们不想让你们做什么弥补，只想让你们记住这段历史,,,,,,,,
1,极少极少数的人，不能代表日本。,,,,,,,,
1,勿忘国耻,,,,,,,,
1,不应该感谢，但是在日本那样的大环境下，还能有正确的历史观，应该致敬！,,,,,,,,
1,知道就好,,,,,,,,
1,致敬有识之士,,,,,,,,
1,加害者疯狂篡改历史疯狂掩盖犯下的罪行，为了逃避责任是不会承认的，而被伤害了的受害者却会一直记得,,,,,,,,
1,不是纪念南京大屠杀,,,,,,,,
1,日本最终只会自己毁灭自己,,,,,,,,
1,这些都是有良知的日本人,,,,,,,,
1,这辈人走了，只有咱自己记得了,,,,,,,,
1,把德仁拉来道歉,,,,,,,,
1,都是老一辈了 痛心,,,,,,,,
1,能开下来真是奇迹,,,,,,,,
1,说谢谢大可不必，我们没有资格代表我们逝去的同胞说谢谢，这是反人类的恶性，任何东西任何事都无法偿还和原谅，缅怀同胞，铭记历史，勿忘国耻，这才是我们该做的,,,,,,,,
1,单纯从铭记历史正视历史的行为来看，这些人是值得尊敬的,,,,,,,,
1,希望能坚持下去，让日本很多人能认清现实，别活在自己梦里,,,,,,,,
1,"对于颠倒黑白的，我<img alt=""[天蝎座_画圈圈]"" src=""//i0.hdslb.com/bfs/emote/6bd823b120bd589d26499338884d76b8d68da8f7.png@100w_100h.webp""/>诅咒它们",,,,,,,,
1,之前在p战首页见过推送的宣传海报...,,,,,,,,
