链接,标题,播放数量,弹幕数量,发布日期,点赞数量,硬币数量,收藏数量,转发数量,评论数量
19,看到评论区说日漫和爱国话题，我也来插个嘴。          我个人觉得，大家喜欢看日漫，是因为它好看我们才看，我们应该学习他人长处，避免他人短处，也就是常讲的“取其精华去其糟粕”，日漫的优点，我们应该学过来，用在自己国家的发展上。日漫毕竟是日本的，传递的自然也是偏向日本社会的价值观，所以更要我们好好读书，能辩是非。什么能学，什么不能学，我们应该有个清醒的认识。,,,,,,,,
19,到现在日本民间旭日旗还在到处乱飘可笑政府都不愿正视历史就不该指望国民能有多正的三观,,,,,,,,
22,说得好，但我还是想灭了日本,,,,,,,,
25,虽然说不能因为仇恨蒙蔽双眼，但是一想到那些曾经侵略过中国虐杀过中国老百姓的日本兵还没死他们的政府还没承认也没有道歉，说不定还在捂着嘴笑的时候我就**本人都死绝了该多好🙂🙂🙂🙂🙂,,,,,,,,
25,日本是有罪 这句话没错 而且现在的日本也没有正视历史 甚至扭曲 让人很恨 心寒 对日本这个国家没有好感 但是评论里说什么收藏是日漫的 难道看日本的文化就是日杂了 那是不是喜欢其他国家的一些事物就不是爱国 我们恨 讨厌的是这个国家的人 那些扭曲事实 装聋作哑的人 而不是这个国家的所有不是抵制日本,,,,,,,,
18,经我们血染的山河，一定永久为我们所有。民族的生存和荣誉，只有靠自己民族的头颅和鲜血才可保持。这次我看见各位将士塞上的生活，已认识了我们民族复兴的奇葩，正孕育在枯草黄沙的堡垒中等候怒放。我深信各位不久更可以使世界认识我们中华男儿还是狮子，并非绵羊。我们全国同胞的热血，都愿意奔放到塞外的战壕里，助各位消灭寒威，激荡忠愤。我现在筹俸国币一千元，本欲供各位杀敌前一醉，但是想起这是长期斗争，并非一次的慷慨赴难，所以愿将这些小的款项，改为医药卫生设备之用，备各位壮士裹伤再战。现在整个民族的命运，抓在我们手里，我们大家都无所逃于天地之间。只有我们血染过的山河，更值得我们和后世讴歌和爱护……——《告绥远将士书》,,,,,,,,
17,"<a data-usercard-mid=""105491279"" href=""//space.bilibili.com/105491279"" target=""_blank"">@日本国驻华大使馆 </a>",,,,,,,,
17,高中有日本学生，从来从来从来不愿意听我们的关于侵华历史课，有时候真的恨得刻骨，他们却毫不在意；看看对日本人的街访，因为个别中国游客的素质不高，他们毫不掩饰对我们的反感，表示新闻里从来没有说过我们好话，甚至直白地告诉我们是政治敌人，而中国人口嗨骂几句日本鬼子就要有无数顶极端爱国贼的扣上来，想想真没意思( ´_ゝ｀),,,,,,,,
20,b站的日精们！好好看看你们爹干的好事！,,,,,,,,
20,日本人民有罪吗？有罪。日本有好人吗？当然有。不知道你们记不记得 ，曾经日本网名设计了一个动漫角色起名叫鬼子，目的是为了掩盖历史，试图掩饰“日本鬼子”这个称号.。你去日本雅虎搜“日本鬼子”出现的不是他们的罪行，而是一个动漫女孩。可见日本人的贱确实是贱到骨子里了。希望诸位可以记住，日本是敌人，韩国是小人这句话。,,,,,,,,
16,莫名的反感日本，有人说需要向日本学习，我一边学习一边反感也可以吧？,,,,,,,,
16,日本一直没有承认侵略历史，还在不停的美化现存的侵略历史证据，举个例子吧，你在百度图片上搜索“日本鬼 子”都是抗战时期的侵华日军形象，再到谷歌搜索你会发现几乎都是萌萌的卡通人物，因为日本之前曾做过一个卡通人物就叫“日本鬼 子”，妄图美化侵略历史，到现在日本雅虎上搜索全都是动漫形象，可以说日本绝对不会承认曾经的侵略历史的，我们不要对他们承认错误抱有希冀，要将这段历史口口相传下去，勿忘国耻，才能振兴中华！,,,,,,,,
16,我们没有资格代祖先原谅日本，更何况日本也不曾有过道歉。,,,,,,,,
16,我们没有资格代替死去的人原谅日本:),,,,,,,,
16,谁给你们资格替死难者原谅那些畜生？,,,,,,,,
16,日本右翼可是很多的 超过了左翼，右翼政府执政了这么长时间 日本的主流思想肯定是偏右的 不用替日本说什么好话，因为他们大多数人都不喜欢你，更不喜欢中国（￣▽￣）,,,,,,,,
16,给日本洗白的，日本什么时候是受害者了？它们死的那些人还不够给中国受日本残杀的人陪葬的。就是原子弹和轰炸炸死的，我们中国可是被虐杀，生化武器知道不？南京大屠杀知道不？慰安妇知道不？罪行太多了。双手占满中国人民鲜血的叫受害者？,,,,,,,,
16,没有参加过抗日战争的人是没有任何权利代表参加过抗日战争的人甚至是死在抗日战争里的人去原谅日本的,,,,,,,,
16,发现评论很多人转移话题，视频是日本罪行的！他们就在评论说什么键盘侠 ，爱国者，看什么日漫就是日杂，这么明显的引战！明明说的是日本，他们就偏偏移到键盘侠和爱国者！,,,,,,,,
16,日本不仅有罪，还不认罪,,,,,,,,
16,这种视频真的不敢点开看，但这就是几十年前国人和其他民族受害者所经历的。这种事情绝对不会再次降临在国人身上，精/日除外(;¬_¬),,,,,,,,
16,每次看到有为日本民众洗白的小朋友就难受。还以为自己多了解日本一样，一个劲儿为日本人洗白，说着什么现在日本人都很爱中国人，这才是真正被日漫迷惑了的。,,,,,,,,
16,"想了解东方战场国军主力，还有中流砥柱的历史真实形象、地位、意义及必然<a data-view=""26390893"" href=""//www.bilibili.com/video/av26390893/"" target=""_blank"">av26390893</a>,<a data-view=""29818224"" href=""//www.bilibili.com/video/av29818224/"" target=""_blank"">av29818224</a>,<a data-view=""27816628"" href=""//www.bilibili.com/video/av27816628/"" target=""_blank"">av27816628</a>,<a data-view=""26249635"" href=""//www.bilibili.com/video/av26249635/"" target=""_blank"">av26249635</a>,<a data-view=""26251381"" href=""//www.bilibili.com/video/av26251381/"" target=""_blank"">av26251381</a>,<a data-view=""26250583"" href=""//www.bilibili.com/video/av26250583/"" target=""_blank"">av26250583</a>,<a data-view=""26245949"" href=""//www.bilibili.com/video/av26245949/"" target=""_blank"">av26245949</a>,<a data-view=""26246941"" href=""//www.bilibili.com/video/av26246941/"" target=""_blank"">av26246941</a>,<a data-view=""26248808"" href=""//www.bilibili.com/video/av26248808/"" target=""_blank"">av26248808</a>,<a data-view=""26344986"" href=""//www.bilibili.com/video/av26344986/"" target=""_blank"">av26344986</a>,<a data-view=""28308100"" href=""//www.bilibili.com/video/av28308100/"" target=""_blank"">av28308100</a>,<a data-view=""28308452"" href=""//www.bilibili.com/video/av28308452/"" target=""_blank"">av28308452</a>,<a data-view=""26148503"" href=""//www.bilibili.com/video/av26148503/"" target=""_blank"">av26148503</a>,<a data-view=""29819771"" href=""//www.bilibili.com/video/av29819771/"" target=""_blank"">av29819771</a>, <a data-view=""28458750"" href=""//www.bilibili.com/video/av28458750/"" target=""_blank"">av28458750</a>,<a data-view=""28476602"" href=""//www.bilibili.com/video/av28476602/"" target=""_blank"">av28476602</a>,<a data-view=""27660016"" href=""//www.bilibili.com/video/av27660016/"" target=""_blank"">av27660016</a>,<a data-view=""26320837"" href=""//www.bilibili.com/video/av26320837/"" target=""_blank"">av26320837</a>,<a data-view=""28308428"" href=""//www.bilibili.com/video/av28308428/"" target=""_blank"">av28308428</a>,<a data-view=""27830020"" href=""//www.bilibili.com/video/av27830020/"" target=""_blank"">av27830020</a>之外，B站搜索“东方战场—抗倭”“千古决战”、“特殊追忆”、“老兵不死—只是凋零”还有“倭寇克星”  强烈推荐！对抗战尚有不确定认识的还可参考以下<a data-view=""29821211"" href=""//www.bilibili.com/video/av29821211/"" target=""_blank"">av29821211</a>、<a data-view=""29818604"" href=""//www.bilibili.com/video/av29818604/"" target=""_blank"">av29818604</a><a data-view=""29819771"" href=""//www.bilibili.com/video/av29819771/"" target=""_blank"">av29819771</a>、<a data-view=""29818224"" href=""//www.bilibili.com/video/av29818224/"" target=""_blank"">av29818224</a><a data-view=""29816922"" href=""//www.bilibili.com/video/av29816922/"" target=""_blank"">av29816922</a>、<a data-view=""28307994"" href=""//www.bilibili.com/video/av28307994/"" target=""_blank"">av28307994</a><a data-view=""28307857"" href=""//www.bilibili.com/video/av28307857/"" target=""_blank"">av28307857</a>、<a data-view=""28476515"" href=""//www.bilibili.com/video/av28476515/"" target=""_blank"">av28476515</a><a data-view=""28476172"" href=""//www.bilibili.com/video/av28476172/"" target=""_blank"">av28476172</a>、<a data-view=""26308405"" href=""//www.bilibili.com/video/av26308405/"" target=""_blank"">av26308405</a>当然，这也都只是一家之言对日本投降内幕也可以参考<a data-view=""26346375"" href=""//www.bilibili.com/video/av26346375/"" target=""_blank"">av26346375</a>一家之言嘛！至此，再以一首<a data-view=""26228931"" href=""//www.bilibili.com/video/av26228931/"" target=""_blank"">av26228931</a>及<a data-view=""26393826"" href=""//www.bilibili.com/video/av26393826/"" target=""_blank"">av26393826</a>以纪念千千万万民族英烈们永垂不朽！谢谢！",,,,,,,,
19,给大家准备好刀了，一人一把，别抢 ∝╬▅▆▅▆▅▆▅▆▅▆▅▆▇◤ ∝╬▅▆▅▆▅▆▅▆▅▆▅▆▇◤ ∝╬▅▆▅▆▅▆▅▆▅▆▅▆▇◤ ∝╬▅▆▅▆▅▆▅▆▅▆▅▆▇◤ ∝╬▅▆▅▆▅▆▅▆▅▆▅▆▇◤ ∝╬▅▆▅▆▅▆▅▆▅▆▅▆▇◤ ∝╬▅▆▅▆▅▆▅▆▅▆▅▆▇◤ ∝╬▅▆▅▆▅▆▅▆▅▆▅▆▇◤ ∝╬▅▆▅▆▅▆▅▆▅▆▅▆▇◤ ∝╬▅▆▅▆▅▆▅▆▅▆▅▆▇◤ ∝╬▅▆▅▆▅▆▅▆▅▆▅▆▇◤ ∝╬▅▆▅▆▅▆▅▆▅▆▅▆▇◤∝╬▅▆▅▆▅▆▅▆▅▆▅▆▇◤ ∝╬▅▆▅▆▅▆▅▆▅▆▅▆▇◤ ∝╬▅▆▅▆▅▆▅▆▅▆▅▆▇◤ ∝╬▅▆▅▆▅▆▅▆▅▆▅▆▇◤ ∝╬▅▆▅▆▅▆▅▆▅▆▅▆▇◤ ∝╬▅▆▅▆▅▆▅▆▅▆▅▆▇◤ ∝╬▅▆▅▆▅▆▅▆▅▆▅▆▇◤ ∝╬▅▆▅▆▅▆▅▆▅▆▅▆▇◤ ∝╬▅▆▅▆▅▆▅▆▅▆▅▆▇◤ ∝╬▅▆▅▆▅▆▅▆▅▆▅▆▇◤ ∝╬▅▆▅▆▅▆▅▆▅▆▅▆▇◤ ∝╬▅▆▅▆▅▆▅▆▅▆▅▆▇◤∝╬▅▆▅▆▅▆▅▆▅▆▅▆▇◤ ∝╬▅▆▅▆▅▆▅▆▅▆▅▆▇◤ ∝╬▅▆▅▆▅▆▅▆▅▆▅▆▇◤ ∝╬▅▆▅▆▅▆▅▆▅▆▅▆▇◤ ∝╬▅▆▅▆▅▆▅▆▅▆▅▆▇◤ ∝╬▅▆▅▆▅▆▅▆▅▆▅▆▇◤ ∝╬▅▆▅▆▅▆▅▆▅▆▅▆▇◤ ∝╬▅▆▅▆▅▆▅▆▅▆▅▆▇◤ ∝╬▅▆▅▆▅▆▅▆▅▆▅▆▇◤ ∝╬▅▆▅▆▅▆▅▆▅▆▅▆▇◤ ∝╬▅▆▅▆▅▆▅▆▅▆▅▆▇◤ ∝╬▅▆▅▆▅▆▅▆▅▆▅▆▇◤拿好了，大家，上，准备砍死日杂，对日杂别客气！！！,,,,,,,,
19,所有为日本说话的人，你们不配生之为人，不配生之为中国人。看到这样惨痛的历史，这样屈辱的历史，还张口只是部分日本人有罪的，我只能说，在你们为所谓善良高素质的日本人辩护时，你们已经失去了民族基本立场，日本有罪，整个大和民族都有罪，中国现在除非把它打趴下，打到泥土里，没有任何办法与这个屠杀了中国至少5000万同胞的国家和睦相处。你们可能觉得我偏激，但请正视历史，美国丢了两颗原子弹之后，你看到过日本敢跟美国狂吠一声吗？而中国作为战胜国，受害国的大度宽容换来了什么？安倍的上位，钓鱼岛事件，，醒醒吧，日本人并不是日漫里热血正义的化身！有空翻翻中国近代百年屈辱史，别高中没毕业就来b站发zznc评论！,,,,,,,,
15,我记得一个肥宅说过，如果发生战争他和他喜爱的岛国漫画作者相遇，他会杀死作者，然后缅怀他画过的作品,,,,,,,,
15,中日要想友好相处，先拆了靖国神厕,,,,,,,,
15,中国人去帮着洗地才是无力，有的人在后悔成为中国人，中国也很后悔让你们出生啊，我们能怎么办，我们也很绝望啊，求你们不要有事没事拉出中国怎么怎么样了，有本事你们回到娘胎重新投胎啊!,,,,,,,,
15,然而有些中国人真的忘了本，详细可以搜索一些关于日本地名的贴吧，还有几天前在一视频评论下遇到一个反战圣母，口口声声说日本侵略中国也是身不由己，还有当代的日本人不需要对他们父辈人的行为道歉。我只能说对于这种人，网络暴力还是可取的。,,,,,,,,
15,怎么说，这视频下面我没看到几个激进爱国者，反倒是无脑教育激进爱国者的人多，日杂摇身一变成理客中了？团团的文章给了你遮羞布？你看到这种视频第一反不应该是恼怒，哀伤？我是真看不懂这帮苟日的上去第一反应去教育其他人？,,,,,,,,
15,不要说什么血腥慎入。这种惨无人道的暴行就应该让世人在光天化日之下清楚的看到，才能避免悲剧再次发生。,,,,,,,,
15,说实话，我们现在是完全可以怀着和平，友好（最起码表面上）的态度去对待日本这个国家，毕竟现在最重要的发展而不是复仇，但是这段历史真的太近了，在我很小的时候在爷爷奶奶面前说过一下“那些都是历史了，现在不应该这么仇视”或者“不能说所有日本人都是坏的”之类的话，但长大到十一二岁才知道我爷爷的亲大伯，二十三岁就死在了抗日战场上，还是队伍里出了叛徒才导致作战失败的死掉的。留下一个遗腹子，怀着孩子实在过不下去了改了嫁。他的一个活下来的战友趁着夜里给他的尸体背回家，家里连埋都不敢大大方方的埋啊，连个坟头都没有整了个平头的坟，完了当年他还是地主家长工出身，在地主家里借了枪去打仗的，枪没回来，地主家里还逼着要枪，家里卖了地才赔上。那个时候家里一群女眷和孩子，过的得多艰难呐……想到这些就再也不忍心在他们面前说“不要仇视”的话了……,,,,,,,,
15,日本历史教科书上甚至不愿意承认铁证如山的南京大屠杀可悲……,,,,,,,,
15,就说一句，日本军费逐年上涨，到现在为止还在参拜靖国神社，不承认历史，甚至不断挣脱狗链子，给日本洗地和洗日本平民无辜的中国人，在我看来有一个就死一个。,,,,,,,,
15,"那个在公祭日""买个日货压压惊""的智障女人被开除了大快人心，不过这种人还有很多很多",,,,,,,,
15,现今的慰安妇在等日。本。政。府一个真诚的道歉，而日。本。政。府却在等她们老死,,,,,,,,
21,天天错的是日本右翼，普通百姓冤枉的，日本整体是好的！咋日本右翼多少年了，还不都是你们口中的普通百姓选出去的？日本为了突破自己岛国弊端来侵略中国，站在所有日本人的角度来看都是正确的好不好，中国当年被日本打成那样，死那么多人的，受那么多侮辱现在说句日本有罪还能被喷？告诉你们这些精，日，日本不光有罪，血债还得血偿复制的我觉的很有道理,,,,,,,,
18,说什么日本人们无罪的我真心恶心,,,,,,,,
18,放下仇恨？他们认错了吗？原谅一个诚心认错的，没毛病。原谅一个死不认错的？那不是善良，是贱！铭记历史，也要铭记仇恨，努力前行，用包括战争（最后底线）在内的一切手段，总有一天要让这头死不认错的畜生当着百万亡魂的面跪下来磕头认错！,,,,,,,,
18,每当有人刺痛了我们的神经时，我们才会感到愤怒，这让我想起了那个日本APA酒店老板说的话“他们总会忘记的，而我们则会收获更多的知名度。”我们不是原谅了，而是忘记了，在我们事不关己和各扫门前雪的态度中忘记了，在我们安逸的生活和灯红酒绿中忘记了，在糖衣炮弹和敌人的迷惑中忘记了，南京大屠杀结束才不过区区80年，全忘啦？！谁先忘记，谁就可能是刽子手里下一批待宰的羔羊，谁先忘记谁就是让中国再次变为东方睡狮的人！,,,,,,,,
20,日本动漫，漫画也有不少恶心的，肆意的向世界输出一些邪恶的丑陋的东西，潜移默化的影响着一些人。日本把各种丑恶思想发扬光大了，死宅们尤其需要注意。,,,,,,,,
14,我们哪有资格替他们去原谅。,,,,,,,,
14,曾看过CCTV的日本对中国的细菌战——实验，将近6个小时的纪录片，大量的黑白图片，认认真真仔仔细细看完，我泪点很高，平常根本不哭，从看了2个小时左右泪止不住，但是不是歇斯底里，就是面无表情地流泪，对我影响很深，里面有句台词被反复提起数十万的人用生命为了能有更多人活下来为了人民为了祖国，眼泪瞬间溢出完全看不清屏幕，有那么多人就是为了我这么个人活在当下付出艰苦卓绝的努力以及满腔热血而又不甘的生命，就觉得心灵软骨，自找慰藉地活下去不成，虽然有时也迷茫人整体与国家局部的关系，不过抱着信念，一定会走出自己的道路，沧浪暖阳，能发挥一点暖能量一定就会有不可思议的连锁反应，好的坏的都超出想象，带来意外，祝幸免于每一场不幸♥,,,,,,,,
14,庆幸在那个年代有了照相机和录像机 要不然历史只能用单一的文字来表达了,,,,,,,,
14,(´･_･`)想不通某些人代替受害者说什么原谅 怎么能说得出口的呢 慨他人之慷,,,,,,,,
17,虽然我有时候也看日漫，但是只要哪部动漫有一点儿宣扬他们的三观的，我就会恶心，直接弃。,,,,,,,,
13,消除仇恨的最好方法就是消灭仇恨对象。,,,,,,,,
13,学历史的时候，我特反感近代史，但近代史又是我印象中最深刻的一段历史。铭记历史，决不再犯第二次错误,,,,,,,,
13,我们没有资格，替那些遇难的人来原谅我们的敌人。,,,,,,,,
13,我倒是要看看日杂怎么在共青团这里皮,,,,,,,,
13,现代战争大多数起因都和民族问题有关，发生在现代的骇人听闻的大屠杀，也是和民族有关，比如土耳其人对亚美尼亚人的种族清洗，纳粹对犹太人的种族清洗，非洲卢旺达大屠杀，都是两个民族的矛盾激化的产物。南京大屠杀不是，中日南京大屠杀之前没有什么民族仇恨，日本只是和其他列强一样的侵略者。虽然他们在旅顺屠杀过一次，但是很遗憾，那个时候中国民族意识还比较薄弱，加上资讯传播的限制，所以并没有形成对日本刻骨铭心的仇恨，你看后来孙大炮还妄想抱日本**腿来**呢。南京大屠杀算是彻底确立了民族仇恨，所以南京大屠杀本身不是民族仇恨的结果，南京大屠杀的主要目的是瓦解中国人抵抗的决心，同时鼓舞日军已经受挫的士气——日本开战之初的宣传说要三个月灭亡中国，结果光淞沪就打了三个月，之前的宣传开始出现反作用。它通过一场屠杀，来告诉日本的军人，民众，“中国人是下等人，中国人只配被优秀的大和民族这样屠戮”，这就是它的目的。但是这个大屠杀，并没有起到日本人预想中的效果，因为这个时候中国人的民族意识已经觉醒，又本身处在救亡图存的整体氛围中，南京大屠杀反而激起了强烈的仇恨，直到现在这种仇恨都没有消弭。所以民族矛盾和仇恨，是现代战争的导火索，而现代国家都是建立在民族主义的基础上的，民族主义是现代国家凝聚力的基础——除了中美和已经不在了的苏联。来自月面微信公众号,,,,,,,,
13,我来说说我的想法，有人认为我们这种“爱国贼”严重破坏中日关系，认为这段仇恨可以放下有些则认为我们太激进要理智爱国，以上的其实我们这些小粉红都可以做到但是请问你要让我们原谅日本是不是要让他们先道歉？怎么做错了事不付出代价连道歉都没有你以为你是谁？我可比你们这些所谓理智派和精，日派清醒多了，我们只要一个正式的道歉，如果没有那么抱歉改骂的我依然骂,,,,,,,,
13,没人说你们二次元看日漫就不爱国，你们爱不爱国没人care好吗？别在那给自己加戏了。不管是日精还是愤青，极端都是我讨厌的。,,,,,,,,
13,"看了热评再看看下面的复评大概总结了下大意：好战必亡，忘战必危。铭记历史在社会中就应该成为一种常态 而不是一时的澎湃哇<img alt=""[小电视_赞]"" src=""//i0.hdslb.com/bfs/emote/86ccf6d0b5480169bf80f3582fae09d7ed455c06.png@100w_100h.webp""/>)",,,,,,,,
13,教育出来的。德军对犹太人残忍，毒气室，工厂化屠杀。土耳其人对亚美尼亚人残忍，可谓无恶不作，和日军做法近似。今天的恐怖分子对他们认为的异端残忍，动不动就砍头，酷刑。他们共同点是接受了教育：虐杀对象不是人。日本人把中国人看作动物，动物嘛，老实就役使，不老实就杀掉。土耳其人和恐怖分子把亚美尼亚人和异教徒看作病菌，他们的存在就是病源，服用阿斯匹林需要考虑细菌的感受嘛，不存在的。德国人把犹太人看作带病菌的动物，更加必须清除干净。所以这个问题的重点是，为什么日军对这种非人化教育接受度这么高？非人化教育土壤要么是宗教（土耳其人，恐怖分子，部分程度的德国人），要么是文明有明显代差（欧洲人对待印第安人），要么是有历史仇视背景的假想敌(德国人对待犹太人)。日本人就特殊在这三者都不是。日本宗教文化和中国接近，文明有优势但还不至于代差，历史上也没有太深的芥蒂。那么就是另一种情况，封建遗留。日本封建时代，武士杀本国平民都是很正常的，更不要说杀敌国平民。近代化后，没有洗刷这一点，反而演绎为民族精神正面宣扬。造成杀敌国平民或者战俘是武勇象征的正激励得到强化。到了战场，那些在老家种地祖祖辈辈被武士杀的平民子弟自然变本加厉的用杀人来证明自己已升级为武士，这种自我阶级提升的幻觉加上鼓吹精神原子弹鼓励军人用屠刀证明自己勇气的二战日军文化造就了日军以暴行为荣的结果。而如果军队已经形成杀平民证明武勇的氛围，再去约束比杀人次一级的诸如**，劫掠等犯罪显然是难以实现的。其他二战参战国，总的来说多少是收到过近代化洗礼，不论实际纪律如何，军人思想上至少有杀平民“不光彩”的意识（德军对待所谓低等民族如前述另有成因）。当然也有分化，文明化程度高的，表现体面一点，近代化差的，在占领区暴行也严重。中国另有原因，中国首先自古就有“杀俘不祥”的文化背景（倒不是多么文明，是悠久国战历史总结出来的兵法，避免杀俘造成敌国死战拒降增加战胜难度），不鼓励杀战俘。其次，近代中国正经打到敌国领土的（英属缅甸是盟友区）就解放军。解放军既没有封建遗留，也不是以极端民族主义为精神指导。解放军讲的是全世界无产阶级大团结，越南人绝大多数当然属于无产阶级，理论上是要团结的，他们实在不肯团结最多就不团结了，非自卫下的屠杀肯定是不行的。,,,,,,,,
13,日本:道歉是不可能道歉的，这辈子都不可能道歉的，只能等那些历史见证者老死改改教科书这样子,,,,,,,,
13,我好烦弹幕成片成片的刷屏挡画面，看这么沉重的纪录片竟然还有人能成片成片的发弹幕，连弹幕礼仪都不懂指望这些人干什么。,,,,,,,,
13,我们要做的是铭记历史！不要忘掉这段历史！小日本现在就想掩埋这段历史！她们在等日本人道歉，日本人在等她们死！可能她们等不到这句话了，但是！！！还有我们！我们的后代！我们要一直记住她们，要让日本右翼承认错误！承认这段历史！这个和平的年代是祖辈们用鲜血和生命换回来的！我们能给他们的回报就让他们的历史流传下去！让日本人承认！承认他们的所做所为！,,,,,,,,
